"masp";"admissao";"nome_servidor";"cpf";"dt_nasc";"situacao_funcional";"sigla";"setor";"carreira";"categoria_profissional";"nivel";"grau";"dt_admissao";"data_inicio";"data_fim_prevista"
12421038;3;"ABEL JULIANO DE MACEDO";"04482546623";"16/05/1979";"CONTRATO TEMPORARIO";"HJK";"COORDENACAO DE INTERNACAO - ADULTO";"PENF";"ENFERMEIRO";"IV";"A";"02/02/2022";"2022/02/02 00:00:00";"2023/02/01 00:00:00"
10862910;3;"ABIGAIL LAMBERT COUTINHO GROSSI";"94262985687";"26/09/1962";"CONTRATO TEMPORARIO";"HGB-JA";"COORDENACAO DE ENFERMAGEM E EQUIPE MULTIDISCIPLINAR";"AGAS";"PSICOLOGO";"I";"A";"01/02/2022";"2022/02/01 00:00:00";"2023/01/31 00:00:00"
14755532;3;"ABIQUEILA DA SILVA CONCEICAO";"01081385502";"15/05/1982";"CONTRATO TEMPORARIO";"HAC";"COORDENACAO DO AMBULATORIO";"MED";"MEDICO ONCOLOGISTA";"III";"A";"07/06/2022";"2022/06/07 00:00:00";"2023/06/06 00:00:00"
14892590;2;"ACACIA D ALMEIDA SILVA";"01530042666";"17/01/1983";"CONTRATO TEMPORARIO";"HRJP";"COORDENACAO DAS UNIDADES CRITICAS";"PENF";"ENFERMEIRO";"IV";"A";"15/02/2022";"2022/02/15 00:00:00";"2023/02/14 00:00:00"
13209564;3;"ADALBERTO JOSE RICARDO";"22128590663";"16/07/1954";"CONTRATO TEMPORARIO";"HAC";"GERENCIA DE GESTAO DA INFORMACAO";"MED";"MEDICO CLINICO";"III";"A";"22/02/2022";"2022/02/22 00:00:00";"2023/02/21 00:00:00"
12939666;2;"ADALBERTO PICOLI CARDOSO";"07220712723";"22/02/1977";"CONTRATO TEMPORARIO";"HRJP";"COORDENACAO DAS UNIDADES CRITICAS";"AGAS";"FISIOTERAPEUTA RESPIRATORIA";"III";"A";"0000-00-00";"2022/05/18 00:00:00";"2023/05/17 00:00:00"
14925960;1;"ADALIZA FURTADO ARAUJO";"11612393675";NA;"CONTRATO TEMPORARIO";"HRJP";NA;"MEDRE";"MEDICO";"I";"A";NA;"2021/03/01 00:00:00";"2023/02/28 00:00:00"
15275795;1;"ADAO PEREIRA DE ALMEIDA";"60417307691";"10/01/1966";"CONTRATO TEMPORARIO";"JXXIII";"COORDENACAO DE SAUDE E SEGURANCA DO TRABALHADOR";"TOS";"TECNICO DE SEGURANCA DO TRABALHO";"II";"A";"01/07/2022";"2022/07/01 00:00:00";"2022/12/27 00:00:00"
14900294;2;"ADELAINE SOARES DE OLIVEIRA TOLEDO";"81909144649";"28/08/1972";"CONTRATO TEMPORARIO";"HJK";"COORDENACAO DO SERVIÇO DE NUTRICAO E DIETETICA";"AGAS";"NUTRICIONISTA";"I";"A";"11/01/2022";"2022/01/11 00:00:00";"2023/01/10 00:00:00"
14700553;1;"ADELZA JANUARIA DA SILVA DUARTE";"90816552649";"27/10/1971";"CONTRATO TEMPORARIO";"HJK";"COORDENACAO DE INTERNACAO - ADULTO";"PENF";"TECNICO DE ENFERMAGEM";"II";"A";"01/02/2022";"2022/02/01 00:00:00";"2023/01/31 00:00:00"
14716096;2;"ADEMAR GOMES DE OLIVEIRA";"71372580697";"28/04/1969";"CONTRATO TEMPORARIO";"JXXIII";"COORDENACAO DE DIAGNOSTICO POR IMAGEM";"TOS";"TECNICO EM RADIOLOGIA";"II";"A";"01/02/2022";"2022/02/01 00:00:00";"2023/01/31 00:00:00"
14581060;2;"ADEMILSON VICENTE MIRANDA";"09879391659";"10/10/1986";"CONTRATO TEMPORARIO";"HGB-JA";"COORDENACAO DA UNIDADE DE URGENCIA E EMERGENCIA";"PENF";"TECNICO DE ENFERMAGEM";"II";"A";"22/03/2022";"2022/03/22 00:00:00";"2023/03/21 00:00:00"
13802319;2;"ADENISIA SOARES CAFROS DE ARAUJO ZANETTI";"79584233653";"23/01/1970";"CONTRATO TEMPORARIO";"HGB-JA";"COORDENACAO DA UNIDADE DE URGENCIA E EMERGENCIA";"PENF";"TECNICO DE ENFERMAGEM";"II";"A";"02/02/2022";"2022/02/02 00:00:00";"2023/02/01 00:00:00"
14691224;2;"ADEVAL LOPES SILVA";"03361078628";"27/06/1977";"CONTRATO TEMPORARIO";"HJK";"COORDENACAO MEDICA DA URGENCIA E EMERGENCIA";"PENF";"TECNICO DE ENFERMAGEM";"II";"A";"22/02/2022";"2022/02/22 00:00:00";"2023/02/21 00:00:00"
14970727;1;"ADIL VALENTE LISBOA";"11126848670";"26/06/1990";"CONTRATO TEMPORARIO";"HGB-JA";"COORDENACAO DE APOIO DIAGNOSTICO E TERAPEUTICO";"MED";"MEDICO EM RADIOLOG.E DIAGNOST.POR IMAGEM";"III";"A";"23/06/2021";"2021/06/23 00:00:00";"2023/06/22 00:00:00"
13411962;3;"ADINEIA ALVES DO NASCIMENTO";"57415188268";"03/04/1970";"CONTRATO TEMPORARIO";"HJK";"COORDENACAO DA EQUIPE MULTIDISCIPLINAR";"AGAS";"ASSISTENTE SOCIAL";"I";"A";"02/08/2021";"2021/08/02 00:00:00";"2023/06/30 00:00:00"
13017934;2;"ADRIANA APARECIDA DA SILVA";"04466921660";"18/01/1979";"CONTRATO TEMPORARIO";"HRJP";"COORDENACAO DAS UNIDADES DE INTERNACAO";"PENF";"TECNICO DE ENFERMAGEM";"II";"A";"02/07/2022";"2022/07/02 00:00:00";"2023/07/01 00:00:00"
15067861;1;"ADRIANA APARECIDA SOARES NASCIMENTO";"04218718652";"26/12/1978";"CONTRATO TEMPORARIO";"CSSI";"COORDENACAO DA UNIDADE DE PACIENTES EXTERNOS";"PENF";"TECNICO DE ENFERMAGEM";"II";"A";"01/02/2022";"2022/02/01 00:00:00";"2023/01/31 00:00:00"
14540132;2;"ADRIANA DA SILVA LEITE";"76990621672";"03/09/1970";"CONTRATO TEMPORARIO";"JXXIII";"COORDENACAO DO CENTRO DE TRATAMENTO DE QUEIMADOS";"PENF";"TECNICO DE ENFERMAGEM";"II";"A";"06/10/2022";"2022/10/06 00:00:00";"2023/10/05 00:00:00"
12940474;3;"ADRIANA DO CARMO MARCELINO";"07151388632";"18/02/1982";"CONTRATO TEMPORARIO";"HGB-JA";"COORDENACAO DA UNIDADE DE URGENCIA E EMERGENCIA";"PENF";"TECNICO DE ENFERMAGEM";"II";"A";"30/06/2021";"2021/06/30 00:00:00";"2023/06/29 00:00:00"
12423851;3;"ADRIANA KELLER DA FONSECA";"08606378674";"07/04/1987";"CONTRATO TEMPORARIO";"HRJP";"COORDENACAO DAS UNIDADES DE INTERNACAO";"PENF";"ENFERMEIRO";"IV";"A";"09/12/2021";"2021/12/09 00:00:00";"2023/06/30 00:00:00"
14774616;1;"ADRIANA LOPES FERREIRA";"07340286608";"08/12/1985";"CONTRATO TEMPORARIO";"HRAD";"COORDENACAO DE APOIO DIAGNOSTICO E TERAPEUTICO";"AGAS";"BIOQUIMICO";"I";"A";"0000-00-00";"2022/02/05 00:00:00";"2023/02/04 00:00:00"
13011838;3;"ADRIANA MAGALHAES PINTO SARUBBI";"06695321698";"18/12/1983";"CONTRATO TEMPORARIO";"HJK";"COORDENACAO DA MATERNIDADE";"MED";"MEDICO GINECOLOGISTA";"III";"A";"01/02/2022";"2022/02/07 00:00:00";"2023/02/06 00:00:00"
12108577;4;"ADRIANA MARA DE OLIVEIRA NESIO";"01498254632";"13/07/1982";"CONTRATO TEMPORARIO";"HIJPII";"COORDENACAO DAS UNIDADES DE INTERNACAO PEDIATRICA";"AGAS";"ASSISTENTE SOCIAL";"I";"A";"01/02/2022";"2022/02/01 00:00:00";"2023/01/31 00:00:00"
14759526;1;"ADRIANA MARIA CAMPOS DE MELO FIGUEIREDO";"10260381624";NA;"CONTRATO TEMPORARIO";"IRS";NA;"MEDRE";"MEDICO";"I";"A";NA;"2022/03/01 00:00:00";"2023/02/28 00:00:00"
14709752;2;"ADRIANA MARQUES DE SOUZA";"10709099630";"13/07/1990";"CONTRATO TEMPORARIO";"HJK";"COORDENACAO DE INTERNACAO - ADULTO";"PENF";"ENFERMEIRO";"IV";"A";"06/02/2022";"2022/02/06 00:00:00";"2023/01/05 00:00:00"
14834840;1;"ADRIANA MENDES MESMER COELHO";"01617132624";"09/09/1988";"CONTRATO TEMPORARIO";"HJK";"COORDENACAO MEDICA DA URGENCIA E EMERGENCIA";"PENF";"TECNICO DE ENFERMAGEM";"II";"A";"14/03/2022";"2022/03/14 00:00:00";"2023/03/13 00:00:00"
12703609;4;"ADRIANA MIRANDA SANTIAGO";"00832925608";"07/02/1976";"CONTRATO TEMPORARIO";"HAC";"COORDENACAO DO AMBULATORIO";"MED";"MEDICO CLINICO";"III";"A";"04/02/2022";"2022/02/04 00:00:00";"2023/02/03 00:00:00"
14329759;1;"ADRIANA MOREIRA DO AMARAL SOUSA";"06502972616";"13/08/1985";"CONTRATO TEMPORARIO";"HRAD";"COORDENACAO DA MATERNIDADE";"PENF";"ENFERMEIRO OBSTETRICO";"VI";"A";"0000-00-00";"2022/02/01 00:00:00";"2023/01/31 00:00:00"
14329759;2;"ADRIANA MOREIRA DO AMARAL SOUSA";"06502972616";NA;"CONTRATO TEMPORARIO";"HRAD";NA;"PENF";"ENFERMEIRO";"IV";"A";NA;"2022/06/26 00:00:00";"2022/12/22 00:00:00"
12714325;3;"ADRIANA REGINA CAMPOLINA CENACHI";"04466997640";"12/05/1980";"CONTRATO TEMPORARIO";"HEM";"COORDENACAO DA UNIDADE DE PACIENTES EXTERNOS";"MED";"MEDICO INFECTOLOGISTA";"III";"A";"01/02/2022";"2022/02/01 00:00:00";"2023/01/31 00:00:00"
14581102;3;"ADRIANA ROBERTO PEREIRA DA COSTA";"03858984604";"04/01/1976";"CONTRATO TEMPORARIO";"JXXIII";"COORDENACAO DE ASSISTENCIA FARMACEUTICA";"TOS";"TECNICO EM FARMACIA";"II";"A";"01/02/2022";"2022/02/01 00:00:00";"2023/01/31 00:00:00"
13802459;2;"ADRIANA ROSEMARY PRESOTI";"04757267665";"05/05/1980";"CONTRATO TEMPORARIO";"CHPB";"COORDENACAO DE ASSISTENCIA FARMACEUTICA";"AGAS";"FARMACEUTICO";"III";"A";"01/05/2021";"2021/05/01 00:00:00";"2023/04/30 00:00:00"
15287162;1;"ADRIANA SANTOS PEREIRA";"04953737610";"23/04/1980";"CONTRATO TEMPORARIO";"HRAD";"COORDENACAO DAS UNIDADES DE INTERNACAO";"PENF";"TECNICO DE ENFERMAGEM";"II";"A";"0000-00-00";"2022/07/05 00:00:00";"2023/07/04 00:00:00"
10910214;2;"ADRIANA SERAFIM DE OLIVEIRA BORGES";"03897552655";"26/10/1974";"CONTRATO TEMPORARIO";"HRAD";"COORDENACAO DAS UNIDADES DE INTERNACAO";"PENF";"TECNICO DE ENFERMAGEM";"II";"A";"0000-00-00";"2022/02/02 00:00:00";"2023/02/01 00:00:00"
13433362;3;"ADRIANA SOARES CERQUEIRA";"00019204647";"23/07/1973";"CONTRATO TEMPORARIO";"DPGF";"(DESAT.)COORDENACAO DE FROTA E TRANSPORTE";"TOS";"AUXILIAR ADMINISTRATIVO";"I";"A";"16/05/2022";"2022/05/16 00:00:00";"2023/05/15 00:00:00"
15074404;1;"ADRIANA SOUZA DE OLIVEIRA";"03897527626";"19/05/1972";"CONTRATO TEMPORARIO";"HRJP";"COORDENACAO DAS UNIDADES CRITICAS";"PENF";"TECNICO DE ENFERMAGEM";"II";"A";"01/02/2022";"2022/02/01 00:00:00";"2023/01/31 00:00:00"
14566285;1;"ADRIANE OLIVEIRA JARDIM";"92397174634";"03/04/1973";"CONTRATO TEMPORARIO";"HJK";"COORDENACAO DO LABORATORIO";"TOS";"TECNICO EM PATOLOGIA CLINICA";"II";"A";"04/02/2022";"2022/02/04 00:00:00";"2023/02/03 00:00:00"
14970750;1;"ADRIANO DINIZ SAMPAIO CURADO";"69040087334";"16/03/1976";"CONTRATO TEMPORARIO";"JXXIII";"COORDENACAO DAS UNIDADES DE INTERNACAO ADULTO";"PENF";"TECNICO DE ENFERMAGEM";"II";"A";"04/06/2021";"2021/06/04 00:00:00";"2023/06/03 00:00:00"
12700696;5;"ADRIANO SILVA SOARES GUIMARAES";"07987320676";"25/05/1987";"CONTRATO TEMPORARIO";"HRAD";"COORDENACAO DA UNIDADE CIRURGICA";"MED";"MEDICO CIRURGIAO GERAL";"III";"A";"17/11/2021";"2021/11/17 00:00:00";"2023/06/30 00:00:00"
15288608;1;"AGATHA JENNIFFER SILVEIRA SOUSA";"09834671610";"28/04/1990";"CONTRATO TEMPORARIO";"HEM";"COORDENACAO DAS UNIDADES DE INTERNACAO";"MED";"MEDICO CIRURGIAO TORACICO";"III";"A";"08/07/2022";"2022/07/06 00:00:00";"2023/07/05 00:00:00"
11837689;5;"AGUINALDO BARBOSA NERI";"06131245614";"14/04/1984";"CONTRATO TEMPORARIO";"HJK";"COORDENACAO DE INTERNACAO - ADULTO";"PENF";"TECNICO DE ENFERMAGEM";"II";"A";"20/02/2022";"2022/02/20 00:00:00";"2023/02/19 00:00:00"
13802509;3;"AGUINALDO NATALINO DO NASCIMENTO";"04427727697";"25/12/1978";"CONTRATO TEMPORARIO";"CHPB";"COORDENACAO DE SAUDE MENTAL";"PENF";"TECNICO DE ENFERMAGEM";"II";"A";"22/03/2022";"2022/03/22 00:00:00";"2023/03/21 00:00:00"
13991443;4;"AIESKA KELLEN DANTAS DOS SANTOS";"08654198680";"21/09/1988";"CONTRATO TEMPORARIO";"JXXIII";"COORDENACAO DE URGENCIA E EMERGENCIA ADULTO";"MED";"MEDICO NEUROCIRURGIAO";"III";"A";"05/03/2022";"2022/03/05 00:00:00";"2023/03/04 00:00:00"
13840962;2;"ALAIR DOS SANTOS DA SILVA";"01467224693";"28/07/1978";"CONTRATO TEMPORARIO";"HGB-JA";"COORDENACAO DE SAUDE MENTAL";"PENF";"TECNICO DE ENFERMAGEM";"II";"A";"01/02/2022";"2022/02/01 00:00:00";"2023/01/31 00:00:00"
15067028;1;"ALAN GUSTAVO COSTA ASSIS";"11774120631";"26/05/1992";"CONTRATO TEMPORARIO";"HIJPII";"COORDENACAO DE URGENCIA E EMERGENCIA ADULTO";"PENF";"ENFERMEIRO";"IV";"A";"02/02/2022";"2022/02/02 00:00:00";"2023/02/01 00:00:00"
14905772;2;"ALANA CELINA DE ASSIS";"11561861618";"03/12/1993";"CONTRATO TEMPORARIO";"HGB-JA";"COORDENACAO DA UNIDADE DE CLINICA MEDICA";"PENF";"TECNICO DE ENFERMAGEM";"II";"A";"07/02/2022";"2022/02/07 00:00:00";"2023/02/06 00:00:00"
15141799;1;"ALANA DOS SANTOS";"04802592167";NA;"CONTRATO TEMPORARIO";"HRAD";NA;"MEDRE";"MEDICO";"I";"A";NA;"2022/03/01 00:00:00";"2023/02/28 00:00:00"
14722037;3;"ALANA RODRIGUES DURAES SILVA";"14224761629";"01/07/1999";"CONTRATO TEMPORARIO";"HEM";"COORDENACAO DAS UNIDADES DE INTERNACAO";"TOS";"AUXILIAR ADMINISTRATIVO";"I";"A";"25/04/2022";"2022/04/25 00:00:00";"2023/04/24 00:00:00"
14126916;5;"ALANDER CRISTIANO DA SILVEIRA";"09711877627";"17/01/1989";"CONTRATO TEMPORARIO";"JXXIII";"COORDENACAO DE URGENCIA E EMERGENCIA ADULTO";"MED";"MEDICO CLINICO";"III";"A";"01/02/2022";"2022/02/01 00:00:00";"2023/01/31 00:00:00"
14790513;4;"ALANNA SIMAO GOMES SATURNINO";"09386309629";"23/04/1990";"CONTRATO TEMPORARIO";"HRAD";"COORDENACAO DA UNIDADE DE PACIENTES EXTERNOS";"MED";"MEDICO CLINICO";"III";"A";"0000-00-00";"2021/04/19 00:00:00";"2023/04/18 00:00:00"
14880413;1;"ALBA LARISSA DOS SANTOS ESPERIDIAO";"10593346661";NA;"CONTRATO TEMPORARIO";"MOV";NA;"MEDRE";"MEDICO";"I";"A";NA;"2020/03/01 00:00:00";"2023/02/28 00:00:00"
13187430;1;"ALEANDRO HENRIQUE REINK";"03449735659";"15/09/1974";"CONTRATO TEMPORARIO";"HRJP";"COORDENACAO DE COMPRAS E LOGISTICA";"TOS";"AUXILIAR ADMINISTRATIVO";"I";"A";"01/02/2022";"2022/02/01 00:00:00";"2023/01/31 00:00:00"
15104193;1;"ALECILIA DE OLIVEIRA GAMA BRITO";"09843030656";"10/12/1988";"CONTRATO TEMPORARIO";"HAC";"COORDENACAO DE ASSISTENCIA FARMACEUTICA";"TOS";"AUXILIAR ADMINISTRATIVO";"I";"A";"24/02/2022";"2022/02/24 00:00:00";"2023/02/23 00:00:00"
15196769;1;"ALENILSON DE SOUZA XAVIER";"04790433617";"27/02/1980";"CONTRATO TEMPORARIO";"HEM";"COORDENACAO DE GESTAO DA INFORMACAO";"TOS";"AUXILIAR ADMINISTRATIVO";"I";"A";"19/04/2022";"2022/04/19 00:00:00";"2023/04/18 00:00:00"
13803945;5;"ALESSANDRA ANTUNES DE MELO";"07173535670";"07/07/1986";"CONTRATO TEMPORARIO";"HGB-JA";"COORDENACAO DA UNIDADE DE URGENCIA E EMERGENCIA";"PENF";"TECNICO DE ENFERMAGEM";"II";"A";"23/12/2021";"2021/12/23 00:00:00";"2023/06/30 00:00:00"
14904015;2;"ALESSANDRA CAMPOS BARBOSA";"06764446601";"20/02/1986";"CONTRATO TEMPORARIO";"MOV";"COORDENACAO DA UNIDADE CIRURGICA";"PENF";"TECNICO DE ENFERMAGEM";"II";"A";"01/02/2022";"2022/02/01 00:00:00";"2023/01/31 00:00:00"
14874309;1;"ALESSANDRA CANDIDA TRINDADE LISBOA";"86379623604";"14/03/1974";"CONTRATO TEMPORARIO";"HJK";"COORDENACAO MEDICA DA TERAPIA INTENSIVA NEONATAL";"AGAS";"ASSISTENTE SOCIAL";"I";"A";"01/02/2022";"2022/02/01 00:00:00";"2023/01/31 00:00:00"
14566483;2;"ALESSANDRA CRISTINA VAZ";"72803703653";"13/02/1974";"CONTRATO TEMPORARIO";"JXXIII";"COORDENACAO DA UNIDADE DE TERAPIA INTENSIVA PEDIATRICA";"PENF";"ENFERMEIRO";"IV";"A";"03/02/2022";"2022/02/03 00:00:00";"2023/02/02 00:00:00"
13704655;3;"ALESSANDRA DONIZETTI ROMAO";"00015287696";"10/03/1975";"CONTRATO TEMPORARIO";"JXXIII";"COORDENACAO DA UNIDADE DE TERAPIA INTENSIVA ADULTO";"PENF";"TECNICO DE ENFERMAGEM";"II";"A";"04/07/2022";"2022/07/04 00:00:00";"2023/07/03 00:00:00"
10860815;2;"ALESSANDRA FELIX DE LIMA HENRIQUES";"02623833656";"15/08/1972";"CONTRATO TEMPORARIO";"HJK";"COORDENACAO DO LABORATORIO";"AGAS";"FARMACEUTICO";"I";"A";"01/02/2022";"2022/02/01 00:00:00";"2023/01/31 00:00:00"
13312087;2;"ALESSANDRA MAIA SILVA SALES";"03487704641";"25/05/1977";"CONTRATO TEMPORARIO";"JXXIII";"COORDENACAO DE URGENCIA E EMERGENCIA ADULTO";"PENF";"ENFERMEIRO";"IV";"A";"03/07/2022";"2022/07/03 00:00:00";"2023/07/02 00:00:00"
15119209;2;"ALESSANDRA NORONHA DA SILVA";"12174199696";"06/07/1995";"CONTRATO TEMPORARIO";"HIJPII";"COORDENACAO DE URGENCIA E EMERGENCIA PEDIATRICA";"MED";"MEDICO GENERALISTA";"I";"A";"01/07/2022";"2022/07/01 00:00:00";"2022/12/27 00:00:00"
15119209;1;"ALESSANDRA NORONHA DA SILVA";"12174199696";NA;"CONTRATO TEMPORARIO";"HIJPII";NA;"MEDRE";"MEDICO";"I";"A";NA;"2022/03/01 00:00:00";"2023/02/28 00:00:00"
11591807;3;"ALESSANDRA VARGAS GOMES";"91442125691";"28/03/1972";"CONTRATO TEMPORARIO";"CSSFA";"COORDENACAO DA UNIDADE DE INTERNACAO E PACIENTES EXTERNOS";"PENF";"TECNICO DE ENFERMAGEM";"II";"A";"07/03/2022";"2022/03/07 00:00:00";"2023/03/06 00:00:00"
14555882;2;"ALESSIA LOPES PAIVA";"90351819649";"29/08/1970";"CONTRATO TEMPORARIO";"JXXIII";"COORDENACAO DE URGENCIA E EMERGENCIA ADULTO";"MED";"MEDICO GENERALISTA";"I";"A";"01/07/2022";"2022/07/01 00:00:00";"2022/12/27 00:00:00"
14590384;3;"ALEX BORGES GOMES";"02924389666";"26/09/1974";"CONTRATO TEMPORARIO";"HAC";"COORDENACAO DE ASSISTENCIA FARMACEUTICA";"TOS";"AUXILIAR ADMINISTRATIVO";"I";"A";"01/07/2022";"2022/07/01 00:00:00";"2023/06/30 00:00:00"
14841225;2;"ALEX FROEDE SILVA";"09202752656";"17/11/1986";"CONTRATO TEMPORARIO";"HEM";"COORDENACAO DAS UNIDADES CRITICAS";"MED";"MEDICO EM MEDICINA INTENSIVA";"III";"A";"24/11/2019";"2021/02/01 00:00:00";"2023/01/31 00:00:00"
15289390;1;"ALEX JUNIOR DA SILVA";"12807103650";"18/09/1993";"CONTRATO TEMPORARIO";"HEM";"COORDENACAO DAS UNIDADES CRITICAS";"PENF";"TECNICO DE ENFERMAGEM";"II";"A";"03/07/2022";"2022/07/03 00:00:00";"2023/07/02 00:00:00"
11553542;4;"ALEXANDER NUNES RODRIGUES";"00963807641";"03/11/1977";"CONTRATO TEMPORARIO";"HEM";"COORDENACAO DAS UNIDADES CRITICAS";"PENF";"TECNICO DE ENFERMAGEM";"II";"A";"01/07/2022";"2022/07/01 00:00:00";"2023/06/30 00:00:00"
15180953;1;"ALEXANDRA DE PAULA SANTOS CASTRO";"01194724655";"04/09/1977";"CONTRATO TEMPORARIO";"HEM";"COORDENACAO DAS UNIDADES DE INTERNACAO";"AGAS";"NUTRICIONISTA";"I";"A";"07/03/2022";"2022/03/04 00:00:00";"2023/03/03 00:00:00"
15072499;1;"ALEXANDRA MARCELA DA COSTA";"99057859653";"14/07/1975";"CONTRATO TEMPORARIO";"HMAL";"COORDENACAO DAS UNIDADES DE INTERNACAO CIRURGICA DE RETAGUARDA";"PENF";"TECNICO DE ENFERMAGEM";"II";"A";"03/02/2022";"2022/02/03 00:00:00";"2023/02/02 00:00:00"
15189210;1;"ALEXANDRE ANDRADE OLIVEIRA";"03641683238";NA;"CONTRATO TEMPORARIO";"JXXIII";NA;"MEDRE";"MEDICO";"I";"A";NA;"2022/03/01 00:00:00";"2023/02/28 00:00:00"
14137947;4;"ALEXANDRE BARBOSA DE OLIVEIRA";"08753173678";"11/06/1986";"CONTRATO TEMPORARIO";"JXXIII";"COORDENACAO DE URGENCIA E EMERGENCIA ADULTO";"MED";"MEDICO ORTOPEDISTA E TRAUMATOLOGISTA";"III";"A";"03/03/2022";"2022/03/08 00:00:00";"2023/03/07 00:00:00"
14354922;2;"ALEXANDRE CARVALHO RIBEIRO";"06289726609";"09/04/1985";"CONTRATO TEMPORARIO";"JXXIII";"COORDENACAO DA UNIDADE DE TERAPIA INTENSIVA ADULTO";"AGAS";"FISIOTERAPEUTA RESPIRATORIA";"III";"A";"01/02/2022";"2022/02/01 00:00:00";"2023/01/31 00:00:00"
14952154;1;"ALEXANDRE DE ALMEIDA PARISI FILHO";"01245765671";NA;"CONTRATO TEMPORARIO";"JXXIII";NA;"MEDRE";"MEDICO";"I";"A";NA;"2021/03/01 00:00:00";"2023/02/28 00:00:00"
14555908;1;"ALEXANDRE ENOQUE MOTA";"73197653653";"17/10/1971";"CONTRATO TEMPORARIO";"AJUR";"(DESAT.)NUCLEO DE CONTENCIOSO";"AGAS";"ADVOGADO";"I";"A";"31/03/2021";"2021/03/31 00:00:00";"2023/03/30 00:00:00"
15072424;1;"ALEXANDRE GOMES ALVARES";"87839342604";"14/04/1973";"CONTRATO TEMPORARIO";"JXXIII";"COORDENACAO DE DIAGNOSTICO POR IMAGEM";"TOS";"TECNICO EM RADIOLOGIA";"II";"A";"01/02/2022";"2022/02/01 00:00:00";"2023/01/31 00:00:00"
12414025;1;"ALEXANDRE HENRIQUE PEREIRA DE CASTRO";"80551262672";"13/07/1972";"CONTRATO TEMPORARIO";"HGB-JA";"COORDENACAO DE APOIO DIAGNOSTICO E TERAPEUTICO";"TOS";"TECNICO EM RADIOLOGIA";"II";"A";"02/06/2022";"2022/06/02 00:00:00";"2023/06/01 00:00:00"
14512479;2;"ALEXANDRE LOMBARDO";"04020590699";NA;"CONTRATO TEMPORARIO";"CMT";NA;"PENF";"TECNICO DE ENFERMAGEM";"II";"A";NA;"2022/11/09 00:00:00";"2023/11/08 00:00:00"
14612832;5;"ALEXANDRE MAURICIO CASTRO BRAGATO";"05764803632";"25/02/1982";"CONTRATO TEMPORARIO";"HEM";"COORDENACAO DAS UNIDADES CRITICAS";"MED";"MEDICO INFECTOLOGISTA";"III";"A";"01/02/2022";"2022/02/01 00:00:00";"2023/01/31 00:00:00"
14612832;4;"ALEXANDRE MAURICIO CASTRO BRAGATO";"05764803632";NA;"CONTRATO TEMPORARIO";"HEM";NA;"MED";"MEDICO INFECTOLOGISTA";"III";"A";NA;"2021/11/04 00:00:00";"2023/06/30 00:00:00"
11648870;5;"ALEXANDRE MAXIMO NICOMEDES";"99562936600";"19/11/1974";"CONTRATO TEMPORARIO";"HJK";"COORDENACAO DA EQUIPE MULTIDISCIPLINAR";"AGAS";"FISIOTERAPEUTA RESPIRATORIA";"III";"A";"01/04/2022";"2022/04/01 00:00:00";"2023/03/31 00:00:00"
12017299;3;"ALEXANDRE MEIRELES GOMES";"06001087679";"16/09/1983";"CONTRATO TEMPORARIO";"HGB-JA";"COORDENACAO DE SAUDE MENTAL";"PENF";"TECNICO DE ENFERMAGEM";"II";"A";"02/02/2022";"2022/02/02 00:00:00";"2023/02/01 00:00:00"
13111174;2;"ALEXANDRO DA SILVA SANTOS";"05430725684";"04/12/1981";"CONTRATO TEMPORARIO";"HRJP";"COORDENACAO DE ASSISTENCIA FARMACEUTICA";"TOS";"TECNICO EM FARMACIA";"II";"A";"01/02/2022";"2022/02/01 00:00:00";"2023/01/31 00:00:00"
10915619;5;"ALEXANDRO RODRIGUES VIEIRA";"00053419650";"14/09/1974";"CONTRATO TEMPORARIO";"HAC";"COORDENACAO DO SERVICO DE DIAGNOSTICO POR IMAGEM";"MED";"MEDICO CARDIOLOGISTA";"III";"A";"10/02/2022";"2022/02/08 00:00:00";"2023/02/07 00:00:00"
10915619;3;"ALEXANDRO RODRIGUES VIEIRA";"00053419650";"14/09/1974";"CONTRATO TEMPORARIO";"HJK";"COORDENACAO DO SERVICO DE DIAGNOSTICO POR IMAGEM";"MED";"MEDICO CARDIOLOGISTA";"III";"A";"04/02/2022";"2022/02/04 00:00:00";"2023/02/03 00:00:00"
14916381;2;"ALEXIA FERNANDA NEPOMUCENO";"06203383694";"06/01/1985";"CONTRATO TEMPORARIO";"HJK";"COORDENACAO DE INTERNACAO - ADULTO";"PENF";"TECNICO DE ENFERMAGEM";"II";"A";"05/07/2022";"2022/07/05 00:00:00";"2023/07/04 00:00:00"
15062771;1;"ALEXSANDRA APOLINARIO ROBERTO";"06025508666";"25/09/1983";"CONTRATO TEMPORARIO";"JXXIII";"COORDENACAO DE REGISTRO E INTERNACAO";"TOS";"AUXILIAR ADMINISTRATIVO";"I";"A";"07/12/2021";"2021/12/07 00:00:00";"2023/06/30 00:00:00"
10475283;5;"ALFREDO JESUS MITIO NAKAO";"07063085816";"03/10/1965";"CONTRATO TEMPORARIO";"HRAD";"COORDENACAO DA UNIDADE DE PACIENTES EXTERNOS";"MED";"MEDICO CIRURGIAO GERAL";"III";"A";"0000-00-00";"2022/02/01 00:00:00";"2023/01/31 00:00:00"
14666721;1;"ALFREDO JULIO DE OLIVEIRA";"04248249650";"03/03/1980";"CONTRATO TEMPORARIO";"CSPD";"COORDENACAO DA UNIDADE DE CUIDADO AO ADULTO";"PENF";"TECNICO DE ENFERMAGEM";"II";"A";"31/07/2018";"2022/02/01 00:00:00";"2023/01/31 00:00:00"
14937676;2;"ALICE BERNARDES OLIVEIRA";"10805711678";"17/06/1995";"CONTRATO TEMPORARIO";"JXXIII";"COORDENACAO DE URGENCIA E EMERGENCIA ADULTO";"MED";"MEDICO GENERALISTA";"I";"A";"01/07/2022";"2022/07/01 00:00:00";"2022/12/27 00:00:00"
14937676;1;"ALICE BERNARDES OLIVEIRA";"10805711678";NA;"CONTRATO TEMPORARIO";"JXXIII";NA;"MEDRE";"MEDICO";"I";"A";NA;"2021/03/01 00:00:00";"2023/02/28 00:00:00"
14637391;1;"ALICE DA SILVA GUILLARDUCCI";"03364757640";"13/02/1976";"CONTRATO TEMPORARIO";"HGB-JA";"COORDENACAO DA UNIDADE DE PACIENTES CRITICOS";"TOS";"AUXILIAR ADMINISTRATIVO";"I";"A";"01/02/2022";"2022/02/01 00:00:00";"2023/01/31 00:00:00"
15074107;1;"ALICE SILVA COSTA BASTOS";"11082699667";"17/08/1990";"CONTRATO TEMPORARIO";"MOV";"COORDENACAO DA UNIDADE DE NEONATOLOGIA";"PENF";"ENFERMEIRO";"VI";"A";"02/02/2022";"2022/02/02 00:00:00";"2023/02/01 00:00:00"
14900096;2;"ALICI SMULLER DE OLIVEIRA JOHANY";"12740790635";"09/12/1995";"CONTRATO TEMPORARIO";"HRJP";"COORDENACAO DAS UNIDADES DE INTERNACAO";"PENF";"TECNICO DE ENFERMAGEM";"II";"A";"14/09/2022";"2022/09/14 00:00:00";"2023/03/12 00:00:00"
14612774;1;"ALINE APARECIDA DE FATIMA SIMPLICIO";"09023083601";"21/04/1987";"CONTRATO TEMPORARIO";"CHPB";"COORDENACAO DE SAUDE MENTAL";"PENF";"TECNICO DE ENFERMAGEM";"II";"A";"08/03/2022";"2022/03/08 00:00:00";"2023/03/07 00:00:00"
13642400;2;"ALINE APARECIDA MEDEIROS";"08793407629";"08/02/1986";"CONTRATO TEMPORARIO";"HRJP";"COORDENACAO DAS UNIDADES DE INTERNACAO";"PENF";"TECNICO DE ENFERMAGEM";"II";"A";"02/07/2022";"2022/07/02 00:00:00";"2023/07/01 00:00:00"
14899876;2;"ALINE APARECIDA RIBEIRO MENDES";"08493174602";"01/07/1985";"CONTRATO TEMPORARIO";"HGB-JA";"COORDENACAO DA UNIDADE DE CUIDADOS CONTINUADOS INTEGRADOS";"PENF";"TECNICO DE ENFERMAGEM";"II";"A";"01/02/2022";"2022/02/01 00:00:00";"2023/01/31 00:00:00"
13006028;2;"ALINE CAIXETA RIBEIRO";"08682931648";"27/11/1987";"CONTRATO TEMPORARIO";"HRAD";"COORDENACAO DA UNIDADE DE PACIENTES EXTERNOS";"MED";"MEDICO GINECOLOGISTA";"III";"A";"0000-00-00";"2022/02/01 00:00:00";"2023/01/31 00:00:00"
15070394;1;"ALINE CANDIDA COSTA";"11247782689";"20/08/1991";"CONTRATO TEMPORARIO";"JXXIII";"COORDENACAO DO BLOCO CIRURGICO";"PENF";"TECNICO DE ENFERMAGEM";"II";"A";"01/02/2022";"2022/02/01 00:00:00";"2023/01/31 00:00:00"
15071244;1;"ALINE CRISTINA DE ALMEIDA BRAGANCA";"14235598600";"08/10/1997";"CONTRATO TEMPORARIO";"HJK";"COORDENACAO DE COMPRAS E CONTRATOS";"TOS";"AUXILIAR ADMINISTRATIVO";"I";"A";"01/02/2022";"2022/02/01 00:00:00";"2023/01/31 00:00:00"
13802699;2;"ALINE CRISTINA DOS ANJOS PEREIRA BERNARD";"06175285603";"04/04/1985";"CONTRATO TEMPORARIO";"HGB-JA";"COORDENACAO DA UNIDADE DE URGENCIA E EMERGENCIA";"PENF";"ENFERMEIRO";"IV";"A";"01/02/2022";"2022/02/01 00:00:00";"2023/01/31 00:00:00"
15100050;1;"ALINE CRISTINA RODRIGUES VIOLETE SILVA";"08726600609";"14/06/1983";"CONTRATO TEMPORARIO";"HGB-JA";"COORDENACAO DA UNIDADE DE URGENCIA E EMERGENCIA";"PENF";"ENFERMEIRO";"IV";"A";"01/02/2022";"2022/02/01 00:00:00";"2023/01/31 00:00:00"
12845970;4;"ALINE DA SILVA PATRICIO";"07829155666";"29/08/1985";"CONTRATO TEMPORARIO";"HEM";"COORDENACAO DE HOTELARIA";"TOS";"AUXILIAR ADMINISTRATIVO";"I";"A";"06/01/2022";"2022/01/06 00:00:00";"2023/01/05 00:00:00"
14888762;3;"ALINE DA SILVA REIS";"99749670663";"24/09/1973";"CONTRATO TEMPORARIO";"HJK";"COORDENACAO DE INTERNACAO - ADULTO";"PENF";"ENFERMEIRO";"IV";"A";"01/05/2021";"2021/05/01 00:00:00";"2023/04/30 00:00:00"
14956676;2;"ALINE DE FATIMA DE PAULA";"07003824612";"23/10/1985";"CONTRATO TEMPORARIO";"HRJP";"COORDENACAO DA MATERNIDADE";"PENF";"TECNICO DE ENFERMAGEM";"II";"A";"02/07/2022";"2022/07/02 00:00:00";"2023/07/01 00:00:00"
13648860;2;"ALINE DE FREITAS PARENTE";"08587832662";"10/04/1990";"CONTRATO TEMPORARIO";"HJK";"COORDENACAO DA MATERNIDADE";"PENF";"TECNICO DE ENFERMAGEM";"II";"A";"08/02/2022";"2022/02/08 00:00:00";"2023/01/07 00:00:00"
15067838;1;"ALINE DE OLIVEIRA ANDRADE";"05397141607";"02/08/1982";"CONTRATO TEMPORARIO";"CSSI";"COORDENACAO DE APOIO DIAGNOSTICO E TERAPEUTICO";"TOS";"TECNICO EM FARMACIA";"II";"A";"01/02/2022";"2022/02/01 00:00:00";"2023/01/31 00:00:00"
15118920;1;"ALINE GABRIELLE SOUSA NUNES";"10080826601";NA;"CONTRATO TEMPORARIO";"HJK";NA;"MEDRE";"MEDICO";"I";"A";NA;"2022/03/01 00:00:00";"2023/02/28 00:00:00"
14892731;2;"ALINE JEUNON FERREIRA MARINHO";"11760131652";"26/11/1992";"CONTRATO TEMPORARIO";"HJK";"COORDENACAO DO LABORATORIO";"MED";"MEDICO CLINICO";"III";"A";"13/06/2022";"2022/06/13 00:00:00";"2023/06/12 00:00:00"
14912935;4;"ALINE JULIA ALVARENGA";"05463582688";"12/08/1980";"CONTRATO TEMPORARIO";"HEM";"COORDENACAO DAS UNIDADES DE INTERNACAO";"PENF";"TECNICO DE ENFERMAGEM";"II";"A";"03/07/2022";"2022/07/03 00:00:00";"2023/07/02 00:00:00"
14912935;3;"ALINE JULIA ALVARENGA";"05463582688";"12/08/1980";"CONTRATO TEMPORARIO";"HEM";"COORDENACAO DAS UNIDADES CRITICAS";"PENF";"TECNICO DE ENFERMAGEM";"II";"A";"01/02/2022";"2022/02/01 00:00:00";"2023/01/31 00:00:00"
14255103;2;"ALINE PATRICIA RODRIGUES DA SILVA";"04867699683";"18/12/1979";"CONTRATO TEMPORARIO";"JXXIII";"COORDENACAO DAS UNIDADES DE INTERNACAO ADULTO";"PENF";"ENFERMEIRO";"IV";"A";"02/02/2022";"2022/02/02 00:00:00";"2023/02/01 00:00:00"
15287204;1;"ALINE PEREIRA NUNES TIBURCIO";"11168214602";"10/06/1991";"CONTRATO TEMPORARIO";"HRAD";"COORDENACAO DAS UNIDADES DE INTERNACAO";"PENF";"ENFERMEIRO";"IV";"A";"0000-00-00";"2022/07/04 00:00:00";"2023/07/03 00:00:00"
14581433;5;"ALINE RODRIGUES FRANCA";"00021055602";"27/09/1974";"CONTRATO TEMPORARIO";"HEM";"COORDENACAO DE APOIO DIAGNOSTICO E TERAPEUTICO";"TOS";"TECNICO EM PATOLOGIA CLINICA";"II";"A";"14/03/2022";"2022/03/14 00:00:00";"2023/03/13 00:00:00"
14581433;4;"ALINE RODRIGUES FRANCA";"00021055602";"27/09/1974";"CONTRATO TEMPORARIO";"JXXIII";"COORDENACAO DE LABORATORIO E AGENCIA TRANSFUSIONAL";"TOS";"TECNICO EM PATOLOGIA CLINICA";"II";"A";"03/03/2022";"2022/03/03 00:00:00";"2023/03/02 00:00:00"
13802848;2;"ALINE TRINDADE ROCHA";"05131439639";"07/01/1983";"CONTRATO TEMPORARIO";"CHPB";"COORDENACAO DE ENFERMAGEM E EQUIPE MULTIDISCIPLINAR";"AGAS";"FISIOTERAPEUTA RESPIRATORIA";"III";"A";"17/04/2021";"2021/04/17 00:00:00";"2023/04/16 00:00:00"
14831127;2;"ALINE VANESSA DA SILVA NASCIMENTO";"12254999680";"07/03/1991";"CONTRATO TEMPORARIO";"HGB-JA";"COORDENACAO DA UNIDADE DE CLINICA MEDICA";"PENF";"TECNICO DE ENFERMAGEM";"II";"A";"22/11/2021";"2021/11/22 00:00:00";"2023/06/30 00:00:00"
13194097;2;"ALINE VITAL DE ARAUJO";"05975402689";"18/07/1982";"CONTRATO TEMPORARIO";"HRJP";"COORDENACAO DAS UNIDADES CRITICAS";"AGAS";"FISIOTERAPEUTA RESPIRATORIA";"III";"A";"20/08/2021";"2021/08/20 00:00:00";"2023/06/30 00:00:00"
14354930;1;"ALINY KELLY DA CUNHA";"05115160617";"01/10/1980";"CONTRATO TEMPORARIO";"CEPAI";"COORDENACAO DE INTERNACAO E AMBULATORIO";"PENF";"ENFERMEIRO";"IV";"A";"01/02/2022";"2022/02/01 00:00:00";"2023/01/31 00:00:00"
14963540;1;"ALISSON ALEXANDRE SEVERO DE ARAUJO";"06698721646";"26/04/1986";"CONTRATO TEMPORARIO";"HRAD";"COORDENACAO DA UNIDADE DE PACIENTES EXTERNOS";"MED";"MEDICO ORTOPEDISTA E TRAUMATOLOGISTA";"III";"A";"0000-00-00";"2021/05/28 00:00:00";"2023/05/27 00:00:00"
14897110;3;"ALISSON NUNES RESENDE CARVALHO";"07804291680";"19/10/1986";"CONTRATO TEMPORARIO";"HJK";"COORDENACAO MEDICA DA URGENCIA E EMERGENCIA";"AGAS";"FISIOTERAPEUTA";"III";"A";"05/07/2022";"2022/07/05 00:00:00";"2023/07/04 00:00:00"
14897110;2;"ALISSON NUNES RESENDE CARVALHO";"07804291680";"19/10/1986";"CONTRATO TEMPORARIO";"HEM";"COORDENACAO DAS UNIDADES CRITICAS";"AGAS";"FISIOTERAPEUTA";"III";"A";"27/04/2022";"2022/04/27 00:00:00";"2023/04/26 00:00:00"
14580021;2;"ALLINE MOTA DE FARIA";"09749271637";"27/08/1990";"CONTRATO TEMPORARIO";"MOV";"COORDENACAO DA UNIDADE DE NEONATOLOGIA";"AGAS";"FISIOTERAPEUTA RESPIRATORIA";"III";"A";"08/02/2021";"2021/02/08 00:00:00";"2023/02/07 00:00:00"
14901581;2;"ALLISON RENATO SANTOS";"37875333890";"03/11/1989";"CONTRATO TEMPORARIO";"HEM";"COORDENACAO DAS UNIDADES DE INTERNACAO";"AGAS";"FISIOTERAPEUTA RESPIRATORIA";"III";"A";"17/05/2022";"2022/05/17 00:00:00";"2023/05/16 00:00:00"
15062797;1;"ALLYNE MARCHIONI JUSTE";"10765533626";"27/08/1992";"CONTRATO TEMPORARIO";"HRJP";"COORDENACAO DA MATERNIDADE";"MED";"MEDICO PEDIATRA";"III";"A";"10/12/2021";"2021/12/10 00:00:00";"2023/06/30 00:00:00"
14774475;2;"ALMIR ANDRADE COSTA JUNIOR";"08889179619";"19/02/1990";"CONTRATO TEMPORARIO";"HGB-JA";"COORDENACAO DA UNIDADE DE CUIDADOS CONTINUADOS INTEGRADOS";"PENF";"TECNICO DE ENFERMAGEM";"II";"A";"09/12/2021";"2021/12/09 00:00:00";"2023/06/30 00:00:00"
15070956;1;"ALOIZA DA SILVA SANTOS";"05430990671";"24/07/1978";"CONTRATO TEMPORARIO";"HJK";"COORDENACAO MEDICA DA URGENCIA E EMERGENCIA";"PENF";"TECNICO DE ENFERMAGEM";"II";"A";"03/02/2022";"2022/02/03 00:00:00";"2023/02/02 00:00:00"
14722482;2;"ALVARO LINHARES BANDEIRA";"64112039387";"10/03/1986";"CONTRATO TEMPORARIO";"HRAD";"COORDENACAO DA UNIDADE DE PACIENTES EXTERNOS";"MED";"MEDICO CLINICO";"III";"A";"11/12/2018";"2021/02/01 00:00:00";"2023/01/31 00:00:00"
14722482;1;"ALVARO LINHARES BANDEIRA";"64112039387";"10/03/1986";"CONTRATO TEMPORARIO";"HRAD";"COORDENACAO DA UNIDADE DE PACIENTES EXTERNOS";"MED";"MEDICO CLINICO";"III";"A";"11/12/2018";"2021/02/01 00:00:00";"2023/01/31 00:00:00"
14904122;2;"AMANA MONTE RASO FREIRE MAIA DE REZENDE";"12327853699";NA;"CONTRATO TEMPORARIO";"MOV";NA;"AGAS";"FARMACEUTICO";"I";"A";NA;"2022/07/01 00:00:00";"2022/12/27 00:00:00"
14052583;3;"AMANDA BARRETO MOREIRA";"01459407644";"10/08/1981";"CONTRATO TEMPORARIO";"IRS";"COORDENACAO DO CENTRO DE EDUCACAO INFANTIL";"TOS";"PROFESSOR RECREADOR";"II";"A";"12/01/2022";"2022/01/12 00:00:00";"2023/01/11 00:00:00"
13640107;3;"AMANDA BERNARDES LOURENCO BARBOSA";"06931320602";"29/07/1984";"CONTRATO TEMPORARIO";"MOV";"COORDENACAO DA GINECOLOGIA E OBSTETRICIA";"MED";"MEDICO ANESTESIOLOGISTA";"III";"A";"02/02/2022";"2022/02/02 00:00:00";"2023/02/01 00:00:00"
14010326;2;"AMANDA BRUNO PAULINELLI";"07771527620";"25/02/1986";"CONTRATO TEMPORARIO";"";"(DESAT.)GERENCIA DE APOIO DIAGNOSTICO E TERAPEUTICO";"AGAS";"FARMACEUTICO BIOQUIMICO";"I";"A";"11/11/2021";"2021/11/11 00:00:00";"2023/06/30 00:00:00"
14904155;1;"AMANDA CAMPOS BERGAMASQUINI";"12030259632";NA;"CONTRATO TEMPORARIO";"HGB-JA";NA;"AGAS";"ASSISTENTE SOCIAL";"I";"A";NA;"2022/07/01 00:00:00";"2022/12/27 00:00:00"
14716138;1;"AMANDA COTA BARCELOS";"10432164642";"18/03/1996";"CONTRATO TEMPORARIO";"HRAD";"GERENCIA ASSISTENCIAL";"TOS";"AUXILIAR ADMINISTRATIVO";"I";"A";"0000-00-00";"2022/02/01 00:00:00";"2023/01/31 00:00:00"
14759591;2;"AMANDA DE FREITAS FROES";"09682709644";"12/10/1989";"CONTRATO TEMPORARIO";"JXXIII";"COORDENACAO DE URGENCIA E EMERGENCIA ADULTO";"MED";"MEDICO";"III";"A";"20/12/2020";"2021/02/01 00:00:00";"2023/01/31 00:00:00"
14637367;3;"AMANDA HERMINIO DOS SANTOS";"08494101692";"27/05/1989";"CONTRATO TEMPORARIO";"HAC";"COORDENACAO DE SUPRIMENTO E LOGISTICA";"TOS";"AUXILIAR ADMINISTRATIVO";"I";"A";"29/03/2022";"2022/03/29 00:00:00";"2023/03/28 00:00:00"
14755060;4;"AMANDA LUISA PIRES FIGUEIREDO";"07262459686";"01/01/1992";"CONTRATO TEMPORARIO";"HAC";"COORDENACAO DO AMBULATORIO";"MED";"MEDICO GENERALISTA";"I";"A";"18/09/2021";"2021/09/18 00:00:00";"2023/06/30 00:00:00"
14909337;2;"AMANDA MENDES DOS SANTOS";"11231118636";"16/04/1992";"CONTRATO TEMPORARIO";"CEPAI";"DIRETORIA GERAL";"TOS";"AUXILIAR ADMINISTRATIVO";"I";"A";"04/03/2022";"2022/03/04 00:00:00";"2023/03/03 00:00:00"
14755383;4;"AMANDA MOREIRA MACHADO";"10183257600";"10/08/1990";"CONTRATO TEMPORARIO";"MOV";"COORDENACAO DA UNIDADE DE NEONATOLOGIA";"MED";"MEDICO PEDIATRA";"III";"A";"15/04/2021";"2021/04/15 00:00:00";"2023/04/14 00:00:00"
14755383;3;"AMANDA MOREIRA MACHADO";"10183257600";NA;"CONTRATO TEMPORARIO";"MOV";NA;"MED";"MEDICO PEDIATRA";"III";"A";NA;"2021/02/01 00:00:00";"2023/01/31 00:00:00"
14755342;2;"AMANDA NATALIA SALVO DE OLIVEIRA";"08631270610";"25/07/1988";"CONTRATO TEMPORARIO";"HAC";"COORDENACAO DO AMBULATORIO";"MED";"MEDICO CLINICO";"III";"A";"04/02/2022";"2022/02/04 00:00:00";"2023/02/03 00:00:00"
14130231;3;"AMANDA PEDROSA COSTA";"10640346677";"10/03/1990";"CONTRATO TEMPORARIO";"JXXIII";"COORDENACAO DA UNIDADE DE TERAPIA INTENSIVA ADULTO";"MED";"MEDICO CLINICO";"III";"A";"08/02/2022";"2022/02/08 00:00:00";"2023/02/07 00:00:00"
14130231;4;"AMANDA PEDROSA COSTA";"10640346677";"10/03/1990";"CONTRATO TEMPORARIO";"JXXIII";"COORDENACAO DAS UNIDADES DE INTERNACAO ADULTO";"MED";"MEDICO CLINICO";"III";"A";"03/02/2022";"2022/02/03 00:00:00";"2023/02/02 00:00:00"
14812846;1;"AMANDA PRISCILA DE OLIVEIRA MOTA";"09533480670";NA;"CONTRATO TEMPORARIO";"MOV";NA;"PENF";"ENFERMEIRO";"VI";"A";NA;"2022/07/01 00:00:00";"2022/12/27 00:00:00"
14812846;2;"AMANDA PRISCILA DE OLIVEIRA MOTA";"09533480670";"27/09/1989";"CONTRATO TEMPORARIO";"HJK";"COORDENACAO DE INTERNACAO - ADULTO";"PENF";"ENFERMEIRO";"IV";"A";"27/09/2022";"2022/09/27 00:00:00";"2023/09/26 00:00:00"
14566913;3;"AMANDA THAIS DE SOUZA VIEIRA";"09748192636";"23/06/1987";"CONTRATO TEMPORARIO";"HAC";"COORDENACAO CIRURGICA";"PENF";"ENFERMEIRO";"IV";"A";"13/05/2022";"2022/05/13 00:00:00";"2023/05/12 00:00:00"
14540314;3;"ANA AMELIA RAMALHO CLAUDINO E BATISTA";"06841885627";NA;"CONTRATO TEMPORARIO";"JXXIII";NA;"MED";"MEDICO ANESTESIOLOGISTA";"III";"A";NA;"2022/02/09 00:00:00";"2023/02/08 00:00:00"
12155057;2;"ANA ANGELICA CARVALHO SANTOS CAMPOS";"97471810610";"05/02/1968";"CONTRATO TEMPORARIO";"HRJP";"COORDENACAO DAS UNIDADES DE INTERNACAO";"PENF";"TECNICO DE ENFERMAGEM";"II";"A";"02/07/2022";"2022/07/02 00:00:00";"2023/07/01 00:00:00"
13802194;3;"ANA AUGUSTA DE ANDRADE";"06104286674";"29/07/1982";"CONTRATO TEMPORARIO";"HGB-JA";"COORDENACAO DA UNIDADE DE URGENCIA E EMERGENCIA";"PENF";"TECNICO DE ENFERMAGEM";"II";"A";"25/11/2021";"2021/11/25 00:00:00";"2023/06/30 00:00:00"
14801534;1;"ANA AURORA GUIMARAES TEIXEIRA";"05537567610";"26/10/1983";"CONTRATO TEMPORARIO";"HJK";"COORDENACAO DO SERVIÇO DE NUTRICAO E DIETETICA";"AGAS";"NUTRICIONISTA";"I";"A";"01/02/2022";"2022/02/01 00:00:00";"2023/01/31 00:00:00"
14956809;2;"ANA BEATRIZ JUNQUEIRA DE CASTRO";"10765200651";"02/03/1992";"CONTRATO TEMPORARIO";"JXXIII";"COORDENACAO DE URGENCIA E EMERGENCIA ADULTO";"MED";"MEDICO CLINICO";"III";"A";"01/07/2022";"2022/07/01 00:00:00";"2023/06/30 00:00:00"
14956809;1;"ANA BEATRIZ JUNQUEIRA DE CASTRO";"10765200651";"02/03/1992";"CONTRATO TEMPORARIO";"JXXIII";"COORDENACAO DE URGENCIA E EMERGENCIA ADULTO";"MED";"MEDICO CLINICO";"III";"A";"01/07/2022";"2022/07/01 00:00:00";"2023/06/30 00:00:00"
13797709;2;"ANA CAROLINA AMARAL ARAUJO";"08429968695";"20/08/1988";"CONTRATO TEMPORARIO";"HRJP";"COORDENACAO DE APOIO DIAGNOSTICO E TERAPEUTICO";"TOS";"TECNICO EM PATOLOGIA CLINICA";"II";"A";"01/07/2022";"2022/07/01 00:00:00";"2023/06/30 00:00:00"
14963557;1;"ANA CAROLINA ARAUJO";"06651604619";"28/12/1994";"CONTRATO TEMPORARIO";"MOV";"ASSESSORIA DE GESTAO ESTRATEGICA E QUALIDADE";"TOS";"AUXILIAR ADMINISTRATIVO";"I";"A";"04/07/2022";"2022/07/04 00:00:00";"2023/07/03 00:00:00"
14716120;2;"ANA CAROLINA COUTO PEREIRA";"01526942690";"07/09/1986";"CONTRATO TEMPORARIO";"CSSFE";"COORDENACAO DA UNIDADE DE CUIDADO AO ADULTO";"MED";"MEDICO CLINICO";"III";"A";"23/05/2022";"2022/05/23 00:00:00";"2023/05/22 00:00:00"
14879043;3;"ANA CAROLINA DE ALMEIDA MILAGRES";"11235912612";"12/07/1990";"CONTRATO TEMPORARIO";"HEM";"COORDENACAO DAS UNIDADES CRITICAS";"MED";"MEDICO GENERALISTA";"I";"A";"11/01/2023";"2022/07/05 00:00:00";"2022/12/31 00:00:00"
14879043;1;"ANA CAROLINA DE ALMEIDA MILAGRES";"11235912612";NA;"CONTRATO TEMPORARIO";"HEM";NA;"MEDRE";"MEDICO";"I";"A";NA;"2020/03/01 00:00:00";"2023/02/28 00:00:00"
15077407;1;"ANA CAROLINA DE SOUSA";"11315309696";"26/02/1993";"CONTRATO TEMPORARIO";"HIJPII";"COORDENACAO DE GESTAO DE PESSOAS";"TOS";"AUXILIAR ADMINISTRATIVO";"I";"A";"01/02/2022";"2022/02/01 00:00:00";"2023/01/31 00:00:00"
15157332;1;"ANA CAROLINA GARCIA DE OLIVEIRA";"12824809604";NA;"CONTRATO TEMPORARIO";"HJK";NA;"MEDRE";"MEDICO";"I";"A";NA;"2022/03/15 00:00:00";"2023/03/14 00:00:00"
15189319;1;"ANA CAROLINA GREGORIO CUSTODIO";"11273099605";NA;"CONTRATO TEMPORARIO";"JXXIII";NA;"MEDRE";"MEDICO";"I";"A";NA;"2022/03/01 00:00:00";"2023/02/28 00:00:00"
14722003;3;"ANA CAROLINA MARTINS GOMES";"06573054644";"15/09/1983";"CONTRATO TEMPORARIO";"JXXIII";"COORDENACAO DO BLOCO CIRURGICO";"MED";"MEDICO ANESTESIOLOGISTA";"III";"A";"25/02/2022";"2022/02/25 00:00:00";"2023/02/24 00:00:00"
11589371;3;"ANA CAROLINA METZKER VIANA";"01505989639";"24/02/1983";NA;"HJK";"COORDENACAO MEDICA DA URGENCIA E EMERGENCIA";NA;"ENFERMEIRO";NA;NA;"07/12/2022";NA;NA
12652616;2;"ANA CAROLINA NEVES RODRIGUES";"05463766657";"26/05/1982";"CONTRATO TEMPORARIO";"MOV";"COORDENACAO DA UNIDADE DE NEONATOLOGIA";"PENF";"ENFERMEIRO";"IV";"A";"17/05/2021";"2021/05/17 00:00:00";"2023/05/16 00:00:00"
14901995;2;"ANA CAROLINA OLIVEIRA DE SOUZA";"11956812679";"28/09/1995";"CONTRATO TEMPORARIO";"HJK";"COORDENACAO DE INTERNACAO - ADULTO";"PENF";"TECNICO DE ENFERMAGEM";"II";"A";"30/12/2020";"2020/12/30 00:00:00";"2023/06/30 00:00:00"
12767695;3;"ANA CAROLINA OTONI RUSSO";"07502315640";"20/03/1987";"CONTRATO TEMPORARIO";"HJK";"COORDENACAO DA MATERNIDADE";"MED";"MEDICO GINECOLOGISTA";"III";"A";"07/02/2022";"2022/02/04 00:00:00";"2023/01/03 00:00:00"
14660971;1;"ANA CAROLINA RESENDE CAMPOS DE SOUZA";"10886394619";"23/05/1992";"CONTRATO TEMPORARIO";"HJK";"COORDENACAO DE ASSISTENCIA FARMACEUTICA";"TOS";"TECNICO EM FARMACIA";"II";"A";"04/03/2022";"2022/03/04 00:00:00";"2023/03/03 00:00:00"
14812911;2;"ANA CAROLINA SANTOS GONCALVES LUPP";"07295966641";"03/09/1984";"CONTRATO TEMPORARIO";"HJK";"COORDENACAO DO LABORATORIO";"TOS";"TECNICO EM PATOLOGIA CLINICA";"II";"A";"02/02/2022";"2022/02/02 00:00:00";"2023/02/01 00:00:00"
15067598;1;"ANA CAROLINA TECILA PIMENTA";"07889831641";"14/08/1987";"CONTRATO TEMPORARIO";"CMT";"DIRETORIA GERAL";"AGAS";"BIBLIOTECARIO";"I";"A";"01/02/2022";"2022/02/01 00:00:00";"2023/01/31 00:00:00"
13699756;3;"ANA CAROLINA VILAS BOAS GUIMARAES RIBEIR";"05431169645";"10/02/1982";"CONTRATO TEMPORARIO";"MOV";"COORDENACAO DA UNIDADE DE NEONATOLOGIA";"AGAS";"FISIOTERAPEUTA RESPIRATORIA";"III";"A";"02/02/2022";"2022/02/02 00:00:00";"2023/02/01 00:00:00"
14273460;1;"ANA CAROLINE PEREIRA FIORINO";"06412663673";"16/01/1985";"CONTRATO TEMPORARIO";"HGB-JA";"COORDENACAO DE APOIO DIAGNOSTICO E TERAPEUTICO";"AGAS";"FARMACEUTICO";"I";"A";"17/06/2016";"2022/02/01 00:00:00";"2023/01/31 00:00:00"
14834832;1;"ANA CAROLINE SILVA BRANDAO";"06964527664";"01/04/1990";"CONTRATO TEMPORARIO";"HJK";"COORDENACAO DE INTERNACAO - ADULTO";"PENF";"ENFERMEIRO";"IV";"A";"17/02/2022";"2022/02/17 00:00:00";"2023/02/16 00:00:00"
14624563;4;"ANA CECILIA CAMPOS CAIXETA";"09909447606";"08/07/1993";"CONTRATO TEMPORARIO";"HRAD";"COORDENACAO DA UNIDADE CIRURGICA";"MED";"MEDICO ANESTESIOLOGISTA";"III";"A";"0000-00-00";"2021/12/28 00:00:00";"2023/06/30 00:00:00"
13487541;2;"ANA CECILIA SANTOS CARVALHO GOMES";"01404927638";"23/07/1981";"CONTRATO TEMPORARIO";"HJK";"COORDENACAO DO SERVIÇO DE NUTRICAO E DIETETICA";"MED";"MEDICO NUTROLOGISTA";"III";"A";"03/02/2022";"2022/02/03 00:00:00";"2023/02/02 00:00:00"
14878649;1;"ANA CLARA CANDIA GAMA";"11197493603";NA;"CONTRATO TEMPORARIO";"HRJP";NA;"MEDRE";"MEDICO";"I";"A";NA;"2020/03/01 00:00:00";"2023/02/28 00:00:00"
14878664;1;"ANA CLARA RIBEIRO DE BARROS PEREIRA";"08639684650";NA;"CONTRATO TEMPORARIO";"HRJP";NA;"MEDRE";"MEDICO";"I";"A";NA;"2020/03/01 00:00:00";"2023/02/28 00:00:00"
14612352;2;"ANA CLARA RODRIGUES LUZ";"11573020680";"30/03/1992";"CONTRATO TEMPORARIO";"MOV";"COORDENACAO DA GINECOLOGIA E OBSTETRICIA";"MED";"MEDICO GINECOLOGISTA";"III";"A";"01/07/2022";"2022/07/01 00:00:00";"2022/12/27 00:00:00"
14612733;2;"ANA CLAUDIA DA CUNHA";"01834816661";"16/08/1995";"CONTRATO TEMPORARIO";"JXXIII";"COORDENACAO DAS UNIDADES DE INTERNACAO ADULTO";"PENF";"TECNICO DE ENFERMAGEM";"II";"A";"02/07/2022";"2022/07/02 00:00:00";"2023/07/01 00:00:00"
14612733;3;"ANA CLAUDIA DA CUNHA";"01834816661";NA;"CONTRATO TEMPORARIO";"JXXIII";NA;"PENF";"TECNICO DE ENFERMAGEM";"II";"A";NA;"2022/03/01 00:00:00";"2023/02/28 00:00:00"
13850102;4;"ANA CLAUDIA DE ASSIS CAPANEMA BRAGA";"36788251843";"24/06/1987";"CONTRATO TEMPORARIO";"MOV";"COORDENACAO DA GINECOLOGIA E OBSTETRICIA";"MED";"MEDICO OBSTETRA";"III";"A";"26/01/2022";"2022/01/26 00:00:00";"2023/01/25 00:00:00"
15192230;1;"ANA CLAUDIA DE OLIVEIRA DO CARMO PEREIRA";"10034674667";NA;"CONTRATO TEMPORARIO";"JXXIII";NA;"MEDRE";"MEDICO";"I";"A";NA;"2022/03/01 00:00:00";"2023/02/28 00:00:00"
14934392;1;"ANA CLAUDIA DOS SANTOS";"09889217660";NA;"CONTRATO TEMPORARIO";"HJK";NA;"MEDRE";"MEDICO";"I";"A";NA;"2021/03/01 00:00:00";"2023/02/28 00:00:00"
14909394;2;"ANA CONCEICAO NORBIM PRADO CUNHA";"01459750616";"09/08/1985";"CONTRATO TEMPORARIO";"HAC";"COORDENACAO DO AMBULATORIO";"MED";"MEDICO CLINICO";"III";"A";"24/02/2022";"2022/02/24 00:00:00";"2023/02/23 00:00:00"
14580013;2;"ANA CRISTINA ALVES DA SILVA LEITE";"05481514664";"22/03/1983";"CONTRATO TEMPORARIO";"MOV";"COORDENACAO DA GINECOLOGIA E OBSTETRICIA";"PENF";"ENFERMEIRO OBSTETRICO";"VI";"A";"23/12/2021";"2021/12/23 00:00:00";"2023/06/30 00:00:00"
14575690;2;"ANA CRISTINA BENFICA";"01218803622";"11/08/1980";"CONTRATO TEMPORARIO";"JXXIII";"COORDENACAO DAS UNIDADES DE INTERNACAO ADULTO";"TOS";"AUXILIAR ADMINISTRATIVO";"I";"A";"01/02/2022";"2022/02/01 00:00:00";"2023/01/31 00:00:00"
11244415;2;"ANA CRISTINA DA SILVA";"53913779604";"08/04/1962";"CONTRATO TEMPORARIO";"CSSFA";"COORDENACAO DA UNIDADE DE INTERNACAO E PACIENTES EXTERNOS";"PENF";"TECNICO DE ENFERMAGEM";"II";"A";"0000-00-00";"2022/06/24 00:00:00";"2023/06/23 00:00:00"
14660948;4;"ANA CRISTINA DE SOUZA BENTO";"98893947668";"20/10/1970";"CONTRATO TEMPORARIO";"HIJPII";"COORDENACAO DE URGENCIA E EMERGENCIA PEDIATRICA";"PENF";"TECNICO DE ENFERMAGEM";"II";"A";"21/06/2022";"2022/06/21 00:00:00";"2023/06/19 00:00:00"
14660948;2;"ANA CRISTINA DE SOUZA BENTO";"98893947668";"20/10/1970";"CONTRATO TEMPORARIO";"HMAL";"COORDENACAO DA CENTRAL DE MATERIAL E ESTERILIZACAO";"PENF";"TECNICO DE ENFERMAGEM";"II";"A";"22/06/2022";"2022/06/22 00:00:00";"2023/06/21 00:00:00"
14962724;1;"ANA CRISTINA DIAS";"08070653663";"12/09/1986";"CONTRATO TEMPORARIO";"CMT";"GERENCIA ASSISTENCIAL";"AGAS";"ASSISTENTE SOCIAL";"I";"A";"17/05/2021";"2021/05/17 00:00:00";"2023/05/16 00:00:00"
14932461;1;"ANA CRISTINA NASCIMENTO DIAS CARNEIRO";"08945774688";NA;"CONTRATO TEMPORARIO";"HIJPII";NA;"MEDRE";"MEDICO";"I";"A";NA;"2021/03/01 00:00:00";"2023/02/28 00:00:00"
14053490;2;"ANA CRISTINA PEREIRA PEIXOTO";"96085843615";"16/09/1975";"CONTRATO TEMPORARIO";"IRS";"COORDENACAO DAS UNIDADES DE INTERNACAO";"PENF";"TECNICO DE ENFERMAGEM";"II";"A";"17/01/2022";"2022/01/17 00:00:00";"2023/01/16 00:00:00"
14666770;1;"ANA ELAINE RIBEIRO";"84707194672";"09/11/1971";"CONTRATO TEMPORARIO";"AJUR";"(DESAT.)PROCURADORIA";"TOS";"TECNICO DE CONTABILIDADE";"II";"A";"01/02/2022";"2022/02/01 00:00:00";"2023/01/31 00:00:00"
14887319;1;"ANA FARIA ULHOA";"06858255664";NA;"CONTRATO TEMPORARIO";"HRAD";NA;"MEDRE";"MEDICO";"I";"A";NA;"2020/03/02 00:00:00";"2023/03/01 00:00:00"
14905053;3;"ANA FLAVIA DA MOTA";"03944259602";"26/09/1980";"CONTRATO TEMPORARIO";"HJK";"COORDENACAO DA UNIDADE DE TERAPIA INTENSIVA NEONATAL";"PENF";"TECNICO DE ENFERMAGEM";"II";"A";"05/04/2022";"2022/04/05 00:00:00";"2023/04/04 00:00:00"
15122393;1;"ANA GABRIELA PETINELLI VIEIRA COUTINHO M";"03330609117";NA;"CONTRATO TEMPORARIO";"IRS";NA;"MEDRE";"MEDICO";"I";"A";NA;"2022/03/01 00:00:00";"2023/02/28 00:00:00"
14882070;1;"ANA JULIA BATISTA PERDIGAO MENDES";"05713107701";NA;"CONTRATO TEMPORARIO";"HEM";NA;"MEDRE";"MEDICO";"I";"A";NA;"2020/03/01 00:00:00";"2023/02/28 00:00:00"
15070071;1;"ANA JULIA DO CARMO LACERDA E SOUZA";"08971334630";"24/10/1987";"CONTRATO TEMPORARIO";"HRAD";"COORDENACAO DAS UNIDADES DE INTERNACAO";"AGAS";"ASSISTENTE SOCIAL";"I";"A";"0000-00-00";"2022/02/02 00:00:00";"2023/02/01 00:00:00"
15117724;1;"ANA JULIA FARIA CAMARGOS";"13609175605";NA;"CONTRATO TEMPORARIO";"HJK";NA;"MEDRE";"MEDICO";"I";"A";NA;"2022/03/01 00:00:00";"2023/02/28 00:00:00"
14590244;2;"ANA LAURA GUIMARAES SALEM";"01927013631";"25/06/1995";"CONTRATO TEMPORARIO";"HMAL";"COORDENACAO DE FATURAMENTO";"TOS";"AUXILIAR ADMINISTRATIVO";"I";"A";"01/02/2022";"2022/02/01 00:00:00";"2023/01/31 00:00:00"
15226251;1;"ANA LAURA RABELO SOARES PEREIRA";"08063236637";"07/10/1991";"CONTRATO TEMPORARIO";"CMT";"GERENCIA ASSISTENCIAL";"MED";"MEDICO CLINICO";"III";"A";"13/05/2022";"2022/05/13 00:00:00";"2023/05/12 00:00:00"
13237151;2;"ANA LUCIA CANSZESKY";"03525060670";"26/10/1979";"CONTRATO TEMPORARIO";"HJK";"COORDENACAO MEDICA DA URGENCIA E EMERGENCIA";"PENF";"TECNICO DE ENFERMAGEM";"II";"A";"01/02/2022";"2022/02/01 00:00:00";"2023/01/31 00:00:00"
12969218;2;"ANA LUCIA DA CONCEICAO SANTOS";"04612020693";"08/02/1978";"CONTRATO TEMPORARIO";"HRAD";"COORDENACAO DE APOIO DIAGNOSTICO E TERAPEUTICO";"TOS";"TECNICO EM RADIOLOGIA";"II";"A";"0000-00-00";"2022/02/04 00:00:00";"2023/02/03 00:00:00"
12946679;1;"ANA LUCIA SILVA CANDIDO";"06928583690";"03/10/1982";NA;"HJXXIII";"GERENCIA DA EQUIPE MULTIDISCIPLINAR";NA;"ASSISTENTE SOCIAL";NA;NA;"21/09/2022";NA;NA
13794417;2;"ANA LUISA COSTA OLIVEIRA LOUZADA";"11024609669";"06/12/1993";"CONTRATO TEMPORARIO";"JXXIII";"COORDENACAO DE LABORATORIO E AGENCIA TRANSFUSIONAL";"AGAS";"FARMACEUTICO";"I";"A";"03/03/2022";"2022/03/03 00:00:00";"2023/03/02 00:00:00"
14425912;4;"ANA LUISA EULALIO DE CASTRO";"10655968636";"17/02/1992";"CONTRATO TEMPORARIO";"CEPAI";"COORDENACAO DA UNIDADE DE URGENCIA";"MED";"MEDICO PSIQUIATRA";"III";"A";"01/02/2022";"2022/02/01 00:00:00";"2023/01/31 00:00:00"
14934160;1;"ANA LUISA MELGACO ALMEIDA";"12877103609";NA;"CONTRATO TEMPORARIO";"HJK";NA;"MEDRE";"MEDICO";"I";"A";NA;"2021/03/01 00:00:00";"2023/02/28 00:00:00"
15348998;1;"ANA LUISA SANTOS ATAHIDES";"11912773643";NA;"CONTRATO TEMPORARIO";"JXXIII";NA;"PENF";"TECNICO DE ENFERMAGEM";"II";"A";NA;"2022/11/01 00:00:00";"2023/10/31 00:00:00"
90019619;9;"ANA LUISA SANTOS ATAHIDES";"11912773643";"0000-00-00";NA;"HJXXIII";"COORDENACAO DO CENTRO DE TRATAMENTO DE QUEIMADOS";NA;"";NA;NA;"01/11/2022";NA;NA
14880652;1;"ANA LUISA SOARES NEVES DA COSTA";"09613202650";NA;"CONTRATO TEMPORARIO";"IRS";NA;"MEDRE";"MEDICO";"I";"A";NA;"2020/03/01 00:00:00";"2023/02/28 00:00:00"
14934319;1;"ANA LUIZA AVELAR SILVESTRE";"13594767680";NA;"CONTRATO TEMPORARIO";"HJK";NA;"MEDRE";"MEDICO";"I";"A";NA;"2021/03/01 00:00:00";"2023/02/28 00:00:00"
14801351;1;"ANA LUIZA BAHIA ALVES SCOTTON";"10016644697";"19/06/1990";"CONTRATO TEMPORARIO";"HRAD";"COORDENACAO DAS UNIDADES CRITICAS";"MED";"MEDICO CLINICO";"III";"A";"29/07/2019";"2021/02/01 00:00:00";"2023/01/31 00:00:00"
14879068;3;"ANA LUIZA BARBOSA DE SOUZA";"11119648661";NA;"CONTRATO TEMPORARIO";"HEM";NA;"MED";"MEDICO GENERALISTA";"I";"A";NA;"2022/06/29 00:00:00";"2022/12/25 00:00:00"
14879068;1;"ANA LUIZA BARBOSA DE SOUZA";"11119648661";NA;"CONTRATO TEMPORARIO";"HEM";NA;"MEDRE";"MEDICO";"I";"A";NA;"2020/03/01 00:00:00";"2023/02/28 00:00:00"
14576813;2;"ANA LUIZA CARVALHO ARAUJO";"06728811605";"07/03/1984";"CONTRATO TEMPORARIO";"DIGEPE";"(DESAT.)GERENCIA DE SAUDE E SEGURANCA DO TRABALHADOR";"PENF";"ENFERMEIRO DO TRABALHO";"VI";"A";"12/04/2021";"2021/04/06 00:00:00";"2023/04/05 00:00:00"
14884357;1;"ANA LUIZA DE CASTRO SANTOS";"11400866693";NA;"CONTRATO TEMPORARIO";"HJK";NA;"MEDRE";"MEDICO";"I";"A";NA;"2020/03/01 00:00:00";"2023/02/28 00:00:00"
13803291;3;"ANA LUIZA DE MELO TOLOMELLI";"11733852662";"27/01/1992";"CONTRATO TEMPORARIO";"HGB-JA";"COORDENACAO DE ASSISTENCIA FARMACEUTICA";"TOS";"TECNICO EM FARMACIA";"II";"A";"06/01/2022";"2022/01/06 00:00:00";"2023/01/05 00:00:00"
15086598;1;"ANA LUIZA DE SOUZA SILVA";"70136628605";"10/08/2001";"CONTRATO TEMPORARIO";"HRAD";"COORDENACAO DE APOIO DIAGNOSTICO E TERAPEUTICO";"TOS";"AUXILIAR ADMINISTRATIVO";"I";"A";"0000-00-00";"2022/02/01 00:00:00";"2023/01/31 00:00:00"
14882153;1;"ANA LUIZA MELO LIMA COSTA";"03529173509";NA;"CONTRATO TEMPORARIO";"MOV";NA;"MEDRE";"MEDICO";"I";"A";NA;"2020/03/01 00:00:00";"2023/02/28 00:00:00"
15119233;1;"ANA LUIZA NUNES MARTINS";"12753906688";NA;"CONTRATO TEMPORARIO";"HIJPII";NA;"MEDRE";"MEDICO";"I";"A";NA;"2022/03/01 00:00:00";"2023/02/28 00:00:00"
15074867;1;"ANA LUIZA RIBEIRO SALES";"11501295659";"16/04/1991";"CONTRATO TEMPORARIO";"HAC";"COORDENACAO DA EQUIPE MULTIDISCIPLINAR";"AGAS";"FISIOTERAPEUTA";"I";"A";"03/02/2022";"2022/02/03 00:00:00";"2023/02/02 00:00:00"
14882856;4;"ANA LUIZA VALADAO ARRUDA";"06312848698";"09/08/1991";"CONTRATO TEMPORARIO";"JXXIII";"COORDENACAO DE URGENCIA E EMERGENCIA ADULTO";"MED";"MEDICO CLINICO";"III";"A";"07/07/2022";"2022/07/07 00:00:00";"2023/07/06 00:00:00"
12826921;1;"ANA MARIA OLIVEIRA DE FARIA";"29666155672";"29/01/1958";"CONTRATO TEMPORARIO";"DPGF";"(DESAT.)COORDENACAO DE CONTABILIDADE GOVERNAMENTAL";"TOS";"AUXILIAR ADMINISTRATIVO";"I";"A";"01/02/2022";"2022/02/01 00:00:00";"2023/01/31 00:00:00"
13310198;5;"ANA MARIA VAZ DE OLIVEIRA FALEIRO";"05678185608";"21/05/1983";"CONTRATO TEMPORARIO";"HJK";"COORDENACAO DO SERVIÇO DE NUTRICAO E DIETETICA";"MED";"MEDICO CLINICO";"III";"A";"01/02/2021";"2021/02/01 00:00:00";"2023/01/31 00:00:00"
13310198;3;"ANA MARIA VAZ DE OLIVEIRA FALEIRO";"05678185608";"21/05/1983";"CONTRATO TEMPORARIO";"MGT";"DIRETORIA GERAL";"MED";"MEDICO";"III";"A";"16/10/2018";"2022/02/01 00:00:00";"2023/01/31 00:00:00"
14540413;1;"ANA PAULA ALMEIDA VIEIRA OLIVEIRA";"03029065685";"22/07/1973";"CONTRATO TEMPORARIO";"IRS";"COORDENACAO DO CENTRO DE EDUCACAO INFANTIL";"TOS";"PROFESSOR RECREADOR";"II";"A";"01/02/2022";"2022/02/01 00:00:00";"2023/01/31 00:00:00"
14946925;1;"ANA PAULA AZEVEDO DIAS";"01377646696";"31/05/1981";"CONTRATO TEMPORARIO";"HIJPII";"COORDENACAO DE URGENCIA E EMERGENCIA ADULTO";"MED";"MEDICO GENERALISTA";"I";"A";"01/07/2022";"2022/07/01 00:00:00";"2022/12/27 00:00:00"
14156541;3;"ANA PAULA BAETA DE MELO";"03560855624";"05/10/1978";"CONTRATO TEMPORARIO";"HEM";"COORDENACAO DAS UNIDADES DE INTERNACAO";"MED";"MEDICO INFECTOLOGISTA";"III";"A";"01/02/2022";"2022/02/01 00:00:00";"2023/01/31 00:00:00"
14370829;2;"ANA PAULA BISPO DOS SANTOS";"04546433654";"11/07/1978";"CONTRATO TEMPORARIO";"HEM";"COORDENACAO DAS UNIDADES DE INTERNACAO";"PENF";"TECNICO DE ENFERMAGEM";"II";"A";"12/03/2021";"2021/03/12 00:00:00";"2023/03/11 00:00:00"
14963573;1;"ANA PAULA CHAVES DE MIRANDA";"04352859630";"28/04/1981";"CONTRATO TEMPORARIO";"HMAL";"GERENCIA DA EQUIPE MULTIDISCIPLINAR";"AGAS";"ASSISTENTE SOCIAL";"I";"A";"26/05/2021";"2021/05/26 00:00:00";"2023/05/25 00:00:00"
14911671;3;"ANA PAULA CLEMENTINO";"09009716651";"05/03/1988";"CONTRATO TEMPORARIO";"JXXIII";"COORDENACAO DA UNIDADE DE TERAPIA INTENSIVA ADULTO";"PENF";"TECNICO DE ENFERMAGEM";"II";"A";"07/04/2022";"2022/04/07 00:00:00";"2023/04/06 00:00:00"
12696589;3;"ANA PAULA DA SILVA";"01602968624";NA;"CONTRATO TEMPORARIO";"HEM";NA;"TOS";"TECNICO EM FARMACIA";"II";"A";NA;"2022/07/04 00:00:00";"2022/12/30 00:00:00"
13800180;4;"ANA PAULA DE ANDRADE ACERBI";"05296233662";"17/12/1982";"CONTRATO TEMPORARIO";"HGB-JA";"COORDENACAO DA UNIDADE DE CUIDADOS CONTINUADOS INTEGRADOS";"PENF";"TECNICO DE ENFERMAGEM";"II";"A";"02/02/2022";"2022/02/02 00:00:00";"2023/02/01 00:00:00"
13800180;3;"ANA PAULA DE ANDRADE ACERBI";"05296233662";"17/12/1982";"CONTRATO TEMPORARIO";"CHPB";"COORDENACAO DE SAUDE MENTAL";"PENF";"TECNICO DE ENFERMAGEM";"II";"A";"13/03/2021";"2021/03/13 00:00:00";"2023/03/12 00:00:00"
14540454;3;"ANA PAULA DE OLIVEIRA RIBEIRO SILVA";"09128357612";"19/12/1989";"CONTRATO TEMPORARIO";"HRJP";"COORDENACAO DAS UNIDADES DE INTERNACAO";"PENF";"TECNICO DE ENFERMAGEM";"II";"A";"07/09/2022";"2022/09/07 00:00:00";"2023/03/05 00:00:00"
14540454;2;"ANA PAULA DE OLIVEIRA RIBEIRO SILVA";"09128357612";"19/12/1989";"CONTRATO TEMPORARIO";"HRJP";"COORDENACAO DAS UNIDADES CRITICAS";"PENF";"TECNICO DE ENFERMAGEM";"II";"A";"02/07/2022";"2022/07/02 00:00:00";"2023/07/01 00:00:00"
14912836;3;"ANA PAULA DE OLIVEIRA SOARES";"01463213670";"27/03/1984";"CONTRATO TEMPORARIO";"JXXIII";"COORDENACAO DAS UNIDADES DE INTERNACAO PEDIATRICA";"PENF";"ENFERMEIRO";"IV";"A";"26/05/2022";"2022/05/26 00:00:00";"2023/05/25 00:00:00"
14649362;2;"ANA PAULA DE SOUZA SANTOS LACERDA";"06716327606";"10/10/1985";"CONTRATO TEMPORARIO";"JXXIII";"COORDENACAO DE DIAGNOSTICO POR IMAGEM";"TOS";"TECNICO EM RADIOLOGIA";"II";"A";"07/12/2021";"2021/12/07 00:00:00";"2023/06/30 00:00:00"
14963870;1;"ANA PAULA DIAS DE SOUZA NASCIMENTO";"05922601601";"29/07/1980";"CONTRATO TEMPORARIO";"HEM";"COORDENACAO DAS UNIDADES DE INTERNACAO";"PENF";"TECNICO DE ENFERMAGEM";"II";"A";"17/05/2021";"2021/05/17 00:00:00";"2023/05/16 00:00:00"
14539365;4;"ANA PAULA DINIZ GOMES";"06711440650";"19/01/1983";"CONTRATO TEMPORARIO";"HJK";"COORDENACAO MEDICA DA TERAPIA INTENSIVA NEONATAL";"MED";"MEDICO PEDIATRA";"III";"A";"01/02/2022";"2022/02/01 00:00:00";"2023/01/31 00:00:00"
14539365;2;"ANA PAULA DINIZ GOMES";"06711440650";"19/01/1983";"CONTRATO TEMPORARIO";"HJK";"COORDENACAO MEDICA DA TERAPIA INTENSIVA NEONATAL";"MED";"MEDICO PEDIATRA";"III";"A";"01/02/2022";"2022/02/01 00:00:00";"2023/01/31 00:00:00"
14722045;3;"ANA PAULA EDITE RIBEIRO DOS SANTOS";"07081819613";"13/09/1984";"CONTRATO TEMPORARIO";"JXXIII";"COORDENACAO DE FATURAMENTO";"TOS";"AUXILIAR ADMINISTRATIVO";"I";"A";"28/04/2022";"2022/04/28 00:00:00";"2023/04/27 00:00:00"
11433604;3;"ANA PAULA FERREIRA DE OLIVEIRA";"06425951605";"02/04/1982";"CONTRATO TEMPORARIO";"HGB-JA";"COORDENACAO DA UNIDADE DE URGENCIA E EMERGENCIA";"PENF";"TECNICO DE ENFERMAGEM";"II";"A";"01/02/2022";"2022/02/01 00:00:00";"2023/01/31 00:00:00"
11251568;5;"ANA PAULA MACHADO XAVIER";"00649056671";"02/08/1974";"CONTRATO TEMPORARIO";"HEM";"COORDENACAO DAS UNIDADES CRITICAS";"PENF";"TECNICO DE ENFERMAGEM";"II";"A";"01/02/2022";"2022/02/01 00:00:00";"2023/01/31 00:00:00"
14956668;1;"ANA PAULA MARTINS VIEIRA FREITAS SOUZA";"06244264673";"06/03/1981";"CONTRATO TEMPORARIO";"CSSFA";"COORDENACAO DA UNIDADE DE INTERNACAO E PACIENTES EXTERNOS";"AGAS";"NUTRICIONISTA";"I";"A";"03/05/2021";"2021/05/03 00:00:00";"2023/05/30 00:00:00"
12125068;3;"ANA PAULA NARCISA DE SIQUEIRA LOPES";"05807914678";"06/01/1982";"CONTRATO TEMPORARIO";"HJK";"COORDENACAO MEDICA DA URGENCIA E EMERGENCIA";"PENF";"TECNICO DE ENFERMAGEM";"II";"A";"03/02/2022";"2022/02/03 00:00:00";"2023/02/02 00:00:00"
15350796;1;"ANA PAULA NASCIMENTO S RODRIGUES DA COST";"05268951602";"05/03/1982";"CONTRATO TEMPORARIO";"HGB-JA";"COORDENACAO DE APOIO DIAGNOSTICO E TERAPEUTICO";"TOS";"TECNICO EM PATOLOGIA CLINICA";"II";"A";"01/12/2022";"2022/12/01 00:00:00";"2023/11/30 00:00:00"
15289812;1;"ANA PAULA PEDRO DA SILVA";"08777161610";"02/07/1989";"CONTRATO TEMPORARIO";"HRJP";"COORDENACAO DAS UNIDADES DE INTERNACAO";"PENF";"TECNICO DE ENFERMAGEM";"II";"A";"01/07/2022";"2022/07/02 00:00:00";"2023/07/01 00:00:00"
14939243;1;"ANA PAULA PEREIRA GUIMARAES";"10153361670";NA;"CONTRATO TEMPORARIO";"HRAD";NA;"MEDRE";"MEDICO";"I";"A";NA;"2021/03/01 00:00:00";"2023/02/28 00:00:00"
15070154;1;"ANA PAULA SILVA DE ASSIS";"00847746658";"20/12/1974";"CONTRATO TEMPORARIO";"HGB-JA";"COORDENACAO DE ASSISTENCIA FARMACEUTICA";"TOS";"AUXILIAR ADMINISTRATIVO";"I";"A";"02/02/2022";"2022/02/02 00:00:00";"2023/02/01 00:00:00"
14478630;2;"ANA PAULA SIMOES PEDROSA";"06562559600";"07/06/1984";"CONTRATO TEMPORARIO";"HIJPII";"COORDENACAO DO CUIDAR E ATENCAO DOMICILIAR";"PENF";"TECNICO DE ENFERMAGEM";"II";"A";"11/03/2022";"2022/03/11 00:00:00";"2023/03/10 00:00:00"
14478630;1;"ANA PAULA SIMOES PEDROSA";"06562559600";"07/06/1984";"CONTRATO TEMPORARIO";"HCM";"COORDENACAO TECNICA DE ENFERMAGEM";"PENF";"TECNICO DE ENFERMAGEM";"II";"A";"01/07/2022";"2022/06/30 00:00:00";"2023/06/29 00:00:00"
14900526;2;"ANA PAULA TEIXEIRA DA CRUZ MACHADO";"00230434665";"17/10/1977";"CONTRATO TEMPORARIO";"HJK";"COORDENACAO DE INTERNACAO - ADULTO";"PENF";"TECNICO DE ENFERMAGEM";"II";"A";"02/02/2022";"2022/02/02 00:00:00";"2023/02/01 00:00:00"
14900526;3;"ANA PAULA TEIXEIRA DA CRUZ MACHADO";"00230434665";"17/10/1977";"CONTRATO TEMPORARIO";"HJK";"COORDENACAO MEDICA DA URGENCIA E EMERGENCIA";"PENF";"TECNICO DE ENFERMAGEM";"II";"A";"03/02/2022";"2022/02/03 00:00:00";"2023/02/02 00:00:00"
10915221;3;"ANA PAULA YOLE AGRIZZI";"67183760600";NA;"CONTRATO TEMPORARIO";"JXXIII";NA;"PENF";"ENFERMEIRO";"IV";"A";NA;"2021/12/28 00:00:00";"2022/12/27 00:00:00"
11859006;3;"ANA RACHEL MAIA SIQUEIRA";"03313052673";"28/07/1979";"CONTRATO TEMPORARIO";"HGB-JA";"COORDENACAO DA UNIDADE DE CLINICA MEDICA";"MED";"MEDICO GENERALISTA";"I";"A";"29/06/2022";"2022/06/29 00:00:00";"2023/06/28 00:00:00"
14625800;2;"ANA TEREZA MEDRADO CORREIA";"07886778618";"26/11/1987";"CONTRATO TEMPORARIO";"CMT";"GERENCIA ASSISTENCIAL";"PENF";"ENFERMEIRO";"IV";"A";"01/02/2022";"2022/02/01 00:00:00";"2023/01/31 00:00:00"
13843693;2;"ANA TEREZINHA DA SILVA";"06577559660";"26/07/1981";"CONTRATO TEMPORARIO";"CHPB";"COORDENACAO DE SAUDE MENTAL";"PENF";"TECNICO DE ENFERMAGEM";"II";"A";"02/02/2022";"2022/02/02 00:00:00";"2023/02/01 00:00:00"
14947220;1;"ANA VITORIA GUSSEN BASTO";"10939799685";NA;"CONTRATO TEMPORARIO";"HMAL";NA;"MEDRE";"MEDICO";"I";"A";NA;"2021/03/31 00:00:00";"2023/03/30 00:00:00"
15071152;1;"ANABEL EMANUELLE FERREIRA LIMA";"07882059609";"11/08/1985";"CONTRATO TEMPORARIO";"HJK";"COORDENACAO DE FINANCAS";"TOS";"AUXILIAR ADMINISTRATIVO";"I";"A";"01/02/2022";"2022/02/01 00:00:00";"2023/01/31 00:00:00"
13162524;5;"ANABELLE LOTTI DO CARMO FIORAVANTE";"02384154656";"28/05/1975";"CONTRATO TEMPORARIO";"MOV";"COORDENACAO DA UNIDADE DE TERAPIA INTENSIVA";"MED";"MEDICO EM MEDICINA INTENSIVA REGULADOR C";"III";"A";"29/09/2021";"2021/09/29 00:00:00";"2023/06/30 00:00:00"
14612691;1;"ANATAN FERREIRA SILVA";"65369130604";"30/01/1970";"CONTRATO TEMPORARIO";"HJK";"GERENCIA DE GESTAO DE PESSOAS";"TOS";"AUXILIAR ADMINISTRATIVO";"I";"A";"08/07/2022";"2022/07/08 00:00:00";"2023/07/07 00:00:00"
14893028;1;"ANDERSON GONCALVES";"79590403620";"24/05/1970";"CONTRATO TEMPORARIO";"HRJP";"COORDENACAO DAS UNIDADES DE INTERNACAO";"PENF";"TECNICO DE ENFERMAGEM";"II";"A";"14/09/2022";"2022/09/14 00:00:00";"2023/03/12 00:00:00"
14625826;2;"ANDERSON LEANDRO MONTE PINTO";"05196362606";"25/10/1980";"CONTRATO TEMPORARIO";"HRJP";"COORDENACAO DAS UNIDADES DE INTERNACAO";"PENF";"ENFERMEIRO";"IV";"A";"03/01/2022";"2022/01/03 00:00:00";"2023/01/02 00:00:00"
14666739;2;"ANDERSON MARCO DE SOUZA ALIANI";"94692394668";"08/08/1972";"CONTRATO TEMPORARIO";"HRJP";"COORDENACAO DAS UNIDADES DE INTERNACAO";"PENF";"TECNICO DE ENFERMAGEM";"II";"A";"02/07/2022";"2022/07/02 00:00:00";"2023/07/01 00:00:00"
15173297;1;"ANDERSON MARSUBARA";"07968189918";"21/03/1990";"CONTRATO TEMPORARIO";"JXXIII";"COORDENACAO DE URGENCIA E EMERGENCIA ADULTO";"MED";"MEDICO NEUROCIRURGIAO";"III";"A";"19/03/2022";"2022/03/19 00:00:00";"2023/03/18 00:00:00"
14883169;2;"ANDRE ANDRADE GUEDES DOS SANTOS";"08884467640";"05/08/1991";"CONTRATO TEMPORARIO";"JXXIII";"COORDENACAO DE URGENCIA E EMERGENCIA PEDIATRICA";"MED";"MEDICO GENERALISTA";"I";"A";"01/07/2022";"2022/07/01 00:00:00";"2022/12/27 00:00:00"
14883169;1;"ANDRE ANDRADE GUEDES DOS SANTOS";"08884467640";NA;"CONTRATO TEMPORARIO";"HIJPII";NA;"MEDRE";"MEDICO";"I";"A";NA;"2020/03/01 00:00:00";"2023/02/28 00:00:00"
11217767;6;"ANDRE BATISTA MOREIRA";"03258271682";"12/03/1977";"CONTRATO TEMPORARIO";"JXXIII";"COORDENACAO DE URGENCIA E EMERGENCIA ADULTO";"MED";"MEDICO ORTOPEDISTA E TRAUMATOLOGISTA";"III";"A";"03/03/2022";"2022/03/03 00:00:00";"2023/03/02 00:00:00"
11814480;4;"ANDRE BRASIL TOLLENDAL";"05035489604";"07/07/1982";"CONTRATO TEMPORARIO";"HGB-JA";"COORDENACAO DA UNIDADE DE CLINICA MEDICA";"MED";"MEDICO NEUROLOGISTA";"III";"A";"05/07/2021";"2021/07/05 00:00:00";"2023/06/30 00:00:00"
15289457;1;"ANDRE CUNHA REIS";"03344567381";NA;"CONTRATO TEMPORARIO";"HEM";NA;"AGAS";"FARMACEUTICO BIOQUIMICO";"I";"A";NA;"2022/07/01 00:00:00";"2022/12/27 00:00:00"
14762256;2;"ANDRE DELLARETI BARRETO MARTINS";"11063709610";"01/10/1990";"CONTRATO TEMPORARIO";"JXXIII";"COORDENACAO DE URGENCIA E EMERGENCIA ADULTO";"MED";"MEDICO CIRURGIAO GERAL";"III";"A";"04/07/2022";"2022/07/04 00:00:00";"2023/07/03 00:00:00"
13891585;2;"ANDRE DINIZ CORREA";"05694754654";"28/07/1983";"CONTRATO TEMPORARIO";"JXXIII";"COORDENACAO DE URGENCIA E EMERGENCIA ADULTO";"MED";"MEDICO ORTOPEDISTA E TRAUMATOLOGISTA";"III";"A";"21/05/2021";"2021/05/21 00:00:00";"2023/05/20 00:00:00"
15245327;1;"ANDRE IGLESIAS BRANDAO";"11801482667";"22/02/1994";"CONTRATO TEMPORARIO";"HGB-JA";"COORDENACAO DA UNIDADE DE CLINICA MEDICA";"MED";"MEDICO NEUROLOGISTA";"III";"A";"03/06/2022";"2022/06/03 00:00:00";"2023/06/02 00:00:00"
14755672;2;"ANDRE LANA PIMENTA";"11033250600";"19/09/1991";"CONTRATO TEMPORARIO";"JXXIII";"COORDENACAO DE URGENCIA E EMERGENCIA ADULTO";"MED";"MEDICO CIRURGIAO GERAL";"III";"A";"04/07/2022";"2022/07/04 00:00:00";"2022/12/30 00:00:00"
15336811;1;"ANDRE LUIS BRITO";"06770793628";"29/09/1982";"CONTRATO TEMPORARIO";"HJK";"COORDENACAO DE INTERNACAO - ADULTO";"PENF";"TECNICO DE ENFERMAGEM";"II";"A";"11/10/2022";"2022/10/11 00:00:00";"2023/10/10 00:00:00"
12760195;3;"ANDRE MAIA SOARES";"07576662646";"25/02/1986";"CONTRATO TEMPORARIO";"IRS";"GERENCIA ASSISTENCIAL";"MED";"MEDICO PSIQUIATRA";"III";"A";"14/05/2021";"2021/05/14 00:00:00";"2023/05/13 00:00:00"
15067168;1;"ANDRE MARTINEZ AMORIM PROSDOCIMI";"07870980609";"01/11/1986";"CONTRATO TEMPORARIO";"HEM";"COORDENACAO DA UNIDADE DE PACIENTES EXTERNOS";"MED";"MEDICO ORTOPEDISTA E TRAUMATOLOGISTA";"III";"A";"01/02/2022";"2022/02/01 00:00:00";"2023/01/31 00:00:00"
10840379;4;"ANDRE MEDINA DE OLIVEIRA";"04979467695";"28/08/1981";"CONTRATO TEMPORARIO";"HIJPII";"COORDENACAO DAS UNIDADES DE INTERNACAO PEDIATRICA";"AGAS";"ASSISTENTE SOCIAL";"I";"A";"01/02/2022";"2022/02/01 00:00:00";"2023/01/31 00:00:00"
12087979;3;"ANDRE MOREIRA CARVALHO";"89347323691";"06/01/1972";"CONTRATO TEMPORARIO";"JXXIII";"COORDENACAO DA UNIDADE DE TERAPIA INTENSIVA ADULTO";"PENF";"TECNICO DE ENFERMAGEM";"II";"A";"02/02/2022";"2022/02/02 00:00:00";"2023/02/01 00:00:00"
15264138;1;"ANDRE ROQUE";"04994129665";"02/12/1980";"CONTRATO TEMPORARIO";"HRJP";"COORDENACAO DAS UNIDADES CRITICAS";"PENF";"TECNICO DE ENFERMAGEM";"II";"A";"01/07/2022";"2022/07/04 00:00:00";"2023/07/03 00:00:00"
14412779;2;"ANDRE SILVA CAMPOS DO AMARAL";"01644284618";"29/09/1990";"CONTRATO TEMPORARIO";"IRS";"COORDENACAO DA UNIDADE DE PACIENTES EXTERNOS";"MED";"MEDICO PSIQUIATRA";"III";"A";"10/05/2021";"2021/05/10 00:00:00";"2023/05/09 00:00:00"
13804695;3;"ANDREA APARECIDA RODRIGUES";"04397173613";"14/10/1979";"CONTRATO TEMPORARIO";"HGB-JA";"COORDENACAO DA UNIDADE DE URGENCIA E EMERGENCIA";"PENF";"ENFERMEIRO";"IV";"A";"01/02/2022";"2022/02/01 00:00:00";"2023/01/31 00:00:00"
15123631;1;"ANDREI PINHEIRO MOURA";"09474491674";NA;"CONTRATO TEMPORARIO";"HEM";NA;"MEDRE";"MEDICO";"I";"A";NA;"2022/03/01 00:00:00";"2023/02/28 00:00:00"
14625743;1;"ANDREIA CARIELO FREIRE REBELO";"04640697694";"27/09/1979";"CONTRATO TEMPORARIO";"HJK";"COORDENACAO DA MATERNIDADE";"PENF";"ENFERMEIRO";"IV";"A";"14/03/2022";"2022/03/14 00:00:00";"2023/03/13 00:00:00"
10906790;2;"ANDREIA CRISTINA DE PAIVA";"04030730655";"09/04/1980";"CONTRATO TEMPORARIO";"HJK";"COORDENACAO DA MATERNIDADE";"PENF";"ENFERMEIRO";"IV";"A";"04/02/2022";"2022/02/04 00:00:00";"2023/02/03 00:00:00"
15200488;1;"ANDREIA GONCALVES DA MATA";"07232036604";"05/06/1986";"CONTRATO TEMPORARIO";"CSSI";"COORDENACAO DE APOIO DIAGNOSTICO E TERAPEUTICO";"TOS";"TECNICO EM FARMACIA";"II";"A";"0000-00-00";"2022/04/27 00:00:00";"2023/04/26 00:00:00"
14963888;2;"ANDREIA JAQUELINE GUIMARAES DOS SANTOS";"97213438620";"29/04/1975";"CONTRATO TEMPORARIO";"HEM";"COORDENACAO DA UNIDADE DE PACIENTES EXTERNOS";"AGAS";"ASSISTENTE SOCIAL";"I";"A";"01/02/2022";"2022/02/01 00:00:00";"2023/01/31 00:00:00"
11863479;4;"ANDREIA MARQUES SOMMER";"85193925634";"26/11/1970";"CONTRATO TEMPORARIO";"HEM";"COORDENACAO DE APOIO DIAGNOSTICO E TERAPEUTICO";"TOS";"TECNICO EM PATOLOGIA CLINICA";"II";"A";"0000-00-00";"2022/04/11 00:00:00";"2023/04/10 00:00:00"
14512693;2;"ANDREIA RODRIGUES MARTINS";"90201094649";"27/07/1972";"CONTRATO TEMPORARIO";"HEM";"COORDENACAO DAS UNIDADES DE INTERNACAO";"PENF";"TECNICO DE ENFERMAGEM";"II";"A";"02/07/2022";"2022/07/02 00:00:00";"2023/07/01 00:00:00"
13613526;3;"ANDREIA SOUTO DA MOTTA";"07728897675";"09/07/1986";"CONTRATO TEMPORARIO";"JXXIII";"COORDENACAO DE URGENCIA E EMERGENCIA ADULTO";"MED";"MEDICO CIRURGIAO PLASTICO";"III";"A";"04/06/2021";"2021/06/04 00:00:00";"2023/06/03 00:00:00"
15070097;1;"ANDRESA SILVA VIEIRA PRATES";"05888432610";"05/03/1982";"CONTRATO TEMPORARIO";"DIGEPE";"(DESAT.)COORDENACAO DE CONTRATOS E CONVENIOS";"TOS";"AUXILIAR ADMINISTRATIVO";"I";"A";"01/02/2022";"2022/02/01 00:00:00";"2023/01/31 00:00:00"
14939235;1;"ANDRESSA CAROLINA SILVA";"01551411121";NA;"CONTRATO TEMPORARIO";"HRAD";NA;"MEDRE";"MEDICO";"I";"A";NA;"2021/03/01 00:00:00";"2023/02/28 00:00:00"
14051767;1;"ANDREZA DE MIRANDA PEREIRA";"11867037688";"18/04/1995";"CONTRATO TEMPORARIO";"HGB-JA";"COORDENACAO DE ASSISTENCIA FARMACEUTICA";"TOS";"TECNICO EM FARMACIA";"II";"A";"02/02/2022";"2022/02/02 00:00:00";"2023/02/01 00:00:00"
14041727;3;"ANDREZA GONCALVES LIMA";"04640727607";"31/07/1979";"CONTRATO TEMPORARIO";"JXXIII";"COORDENACAO DAS UNIDADES DE INTERNACAO CIRURGICA";"TOS";"AUXILIAR ADMINISTRATIVO";"I";"A";"01/02/2022";"2022/02/01 00:00:00";"2023/01/31 00:00:00"
10095115;2;"ANDREZA MARTINS BITTENCOURT";"03435845651";"15/03/1977";"CONTRATO TEMPORARIO";"DIGEPE";"(DESAT.)COORDENACAO DE PROVIMENTOS E CARREIRAS";"TOS";"AUXILIAR ADMINISTRATIVO";"I";"A";"01/02/2022";"2022/02/01 00:00:00";"2023/01/31 00:00:00"
14612915;1;"ANELISE NOVAIS GAVIOLI";"09627821659";NA;"CONTRATO TEMPORARIO";"HRJP";NA;"MED";"MEDICO PEDIATRA";"III";"A";NA;"2021/02/01 00:00:00";"2023/01/31 00:00:00"
14934327;1;"ANELISE OLIVEIRA DE MORAIS";"11062225635";NA;"CONTRATO TEMPORARIO";"HJK";NA;"MEDRE";"MEDICO";"I";"A";NA;"2021/03/02 00:00:00";"2023/03/01 00:00:00"
14888341;1;"ANELISE ROCHA";"77123700600";"24/05/1968";"CONTRATO TEMPORARIO";"HEM";"COORDENACAO DE COMPRAS E LOGISTICA";"TOS";"AUXILIAR ADMINISTRATIVO";"I";"A";"05/07/2022";"2022/07/05 00:00:00";"2023/07/04 00:00:00"
15130842;1;"ANETE MARIA VIEIRA";"62551949653";"29/07/1962";"CONTRATO TEMPORARIO";"JXXIII";"COORDENACAO DE URGENCIA E EMERGENCIA ADULTO";"PENF";"TECNICO DE ENFERMAGEM";"II";"A";"03/03/2022";"2022/03/03 00:00:00";"2023/03/02 00:00:00"
14666309;3;"ANGELA ANTONIA MALACCO";"00522851622";"27/10/1973";"CONTRATO TEMPORARIO";"HIJPII";"COORDENACAO DAS UNIDADES DE INTERNACAO PEDIATRICA";"TOS";"PROFESSOR RECREADOR";"II";"A";"08/11/2021";"2021/11/08 00:00:00";"2023/06/30 00:00:00"
13800198;3;"ANGELA APARECIDA PEREIRA";"61250120691";"02/08/1962";"CONTRATO TEMPORARIO";"HGB-JA";"COORDENACAO DA UNIDADE CIRURGICA";"PENF";"TECNICO DE ENFERMAGEM";"II";"A";"22/11/2021";"2021/11/22 00:00:00";"2023/06/30 00:00:00"
14915078;1;"ANGELA DE ALCANTARA MAGNANI BEZERRA";"03279378150";"02/04/1990";"CONTRATO TEMPORARIO";"JXXIII";"COORDENACAO DO BLOCO CIRURGICO";"MED";"MEDICO ANESTESIOLOGISTA";"III";"A";"28/11/2020";"2021/02/01 00:00:00";"2023/03/02 00:00:00"
10427177;5;"ANGELA DEISE SOARES SILLUZIO";"84255803668";"16/08/1969";"CONTRATO TEMPORARIO";"HAC";"COORDENACAO DO AMBULATORIO";"MED";"MEDICO CLINICO";"III";"A";"22/09/2021";"2021/09/22 00:00:00";"2023/06/30 00:00:00"
12698429;4;"ANGELA FERREIRA ALBERTINO ALVES";"04434270621";"15/06/1981";"CONTRATO TEMPORARIO";"JXXIII";"COORDENACAO DE URGENCIA E EMERGENCIA ADULTO";"PENF";"TECNICO DE ENFERMAGEM";"II";"A";"04/07/2022";"2022/07/04 00:00:00";"2023/07/03 00:00:00"
3408614;3;"ANGELA MARIA ALVES";"25734350672";"22/02/1955";"CONTRATO TEMPORARIO";"DIGEPE";"(DESAT.)COORDENACAO DE SAUDE DO TRABALHADOR";"MED";"MEDICO DO TRABALHO";"III";"A";"07/07/2022";"2022/07/07 00:00:00";"2023/07/06 00:00:00"
10873131;5;"ANGELA MARIA DA SILVA SANTOS";"82353379672";"19/05/1965";"CONTRATO TEMPORARIO";"JXXIII";"COORDENACAO DA UNIDADE DE TERAPIA INTENSIVA PEDIATRICA";"PENF";"ENFERMEIRO";"IV";"A";"21/03/2022";"2022/03/21 00:00:00";"2023/03/20 00:00:00"
13804901;2;"ANGELA MARIA DE SOUZA BRAGA";"02618569601";"21/06/1969";"CONTRATO TEMPORARIO";"HGB-JA";"COORDENACAO DE APOIO DIAGNOSTICO E TERAPEUTICO";"TOS";"TECNICO EM PATOLOGIA CLINICA";"II";"A";"02/02/2022";"2022/02/02 00:00:00";"2023/02/01 00:00:00"
10890051;5;"ANGELA MARIA MEIRELES ROCHA";"00136135617";"03/08/1974";"CONTRATO TEMPORARIO";"HEM";"COORDENACAO DAS UNIDADES DE INTERNACAO";"PENF";"ENFERMEIRO";"IV";"A";"22/11/2022";"2022/11/22 00:00:00";"2023/11/21 00:00:00"
10890051;4;"ANGELA MARIA MEIRELES ROCHA";"00136135617";"03/08/1974";"CONTRATO TEMPORARIO";"HEM";"COORDENACAO DAS UNIDADES CRITICAS";"PENF";"ENFERMEIRO";"IV";"A";"30/10/2022";"2022/10/30 00:00:00";"2023/10/29 00:00:00"
13764071;2;"ANGELA MARIA NASCIMENTO ARAUJO";"03941948610";"22/12/1976";"CONTRATO TEMPORARIO";"JXXIII";"COORDENACAO DE DIAGNOSTICO POR IMAGEM";"PENF";"TECNICO DE ENFERMAGEM";"II";"A";"05/07/2022";"2022/07/05 00:00:00";"2023/07/04 00:00:00"
10897445;2;"ANGELA MARIA TEREZA";"51926105672";"01/10/1967";"CONTRATO TEMPORARIO";"JXXIII";"COORDENACAO DAS UNIDADES DE INTERNACAO ADULTO";"PENF";"TECNICO DE ENFERMAGEM";"II";"A";"03/07/2022";"2022/07/03 00:00:00";"2023/07/02 00:00:00"
10899771;5;"ANGELA MARTINS COELHO";"00232570671";"25/08/1964";"CONTRATO TEMPORARIO";"HEM";"COORDENACAO DAS UNIDADES DE INTERNACAO";"PENF";"ENFERMEIRO";"IV";"A";"01/02/2021";"2021/02/01 00:00:00";"2023/01/31 00:00:00"
10899771;4;"ANGELA MARTINS COELHO";"00232570671";"25/08/1964";"CONTRATO TEMPORARIO";"HEM";"COORDENACAO DAS UNIDADES DE INTERNACAO";"PENF";"ENFERMEIRO";"IV";"A";"03/06/2022";"2022/06/03 00:00:00";"2023/06/02 00:00:00"
14540579;3;"ANGELA OLIVEIRA DE MATOS GUSMAO";"06853575628";"07/02/1981";"CONTRATO TEMPORARIO";"MOV";"COORDENACAO DA UNIDADE DE NEONATOLOGIA";"PENF";"TECNICO DE ENFERMAGEM";"II";"A";"04/02/2022";"2022/02/04 00:00:00";"2023/02/03 00:00:00"
15275464;1;"ANGELA SILVA DOS SANTOS";"00050107640";"27/09/1976";"CONTRATO TEMPORARIO";"HJK";"COORDENACAO MEDICA DA URGENCIA E EMERGENCIA";"PENF";"ENFERMEIRO";"IV";"A";"06/07/2022";"2022/07/06 00:00:00";"2023/07/05 00:00:00"
10917474;3;"ANGELICA AUXILIADORA DOS REIS";"76482626653";"17/01/1971";"CONTRATO TEMPORARIO";"HJK";"COORDENACAO DE INTERNACAO - ADULTO";"PENF";"TECNICO DE ENFERMAGEM";"II";"A";"10/02/2022";"2022/02/10 00:00:00";"2023/01/09 00:00:00"
10917474;2;"ANGELICA AUXILIADORA DOS REIS";"76482626653";"17/01/1971";"CONTRATO TEMPORARIO";"HJK";"COORDENACAO MEDICA DA URGENCIA E EMERGENCIA";"PENF";"TECNICO DE ENFERMAGEM";"II";"A";"08/10/2022";"2022/10/08 00:00:00";"2023/10/07 00:00:00"
14823181;3;"ANGELICA DE FATIMA NETO DOS SANTOS";"01295382644";"09/05/1982";"CONTRATO TEMPORARIO";"HIJPII";"COORDENACAO DAS UNIDADES DE INTERNACAO PEDIATRICA";"PENF";"TECNICO DE ENFERMAGEM";"II";"A";"02/02/2022";"2022/02/02 00:00:00";"2023/02/01 00:00:00"
14879241;1;"ANGELICA FERNANDES TEIXEIRA";"03623497118";NA;"CONTRATO TEMPORARIO";"HEM";NA;"MEDRE";"MEDICO";"I";"A";NA;"2020/03/01 00:00:00";"2023/02/28 00:00:00"
14625693;1;"ANGELICA MARIA DA SILVA JULIAO DONIZETE";"09204292628";"17/11/1986";"CONTRATO TEMPORARIO";"HJK";"COORDENACAO DA MATERNIDADE";"PENF";"TECNICO DE ENFERMAGEM";"II";"A";"0000-00-00";"2022/02/24 00:00:00";"2023/02/23 00:00:00"
13953948;2;"ANIBAL TADEU MACHADO";"40101711620";"02/05/1961";"CONTRATO TEMPORARIO";"JXXIII";"COORDENACAO DE LABORATORIO E AGENCIA TRANSFUSIONAL";"AGAS";"FARMACEUTICO";"I";"A";"01/03/2022";"2022/03/01 00:00:00";"2023/02/28 00:00:00"
15030802;1;"ANNA CAROLINA RODRIGUES JACOME";"05144348645";"09/08/1981";"CONTRATO TEMPORARIO";"JXXIII";"COORDENACAO DO BLOCO CIRURGICO";"MED";"MEDICO ANESTESIOLOGISTA";"III";"A";"15/10/2021";"2021/10/15 00:00:00";"2023/06/30 00:00:00"
14649420;1;"ANNA CHRISTINA DA SILVA FERREIRA";"05057466623";"14/03/1983";"CONTRATO TEMPORARIO";"HJK";"COORDENACAO DA EQUIPE MULTIDISCIPLINAR";"AGAS";"ASSISTENTE SOCIAL";"I";"A";"01/02/2022";"2022/02/01 00:00:00";"2023/01/31 00:00:00"
14953814;1;"ANNA FLAVIA SILVEIRA SOUZA";"06650524646";NA;"CONTRATO TEMPORARIO";"JXXIII";NA;"MEDRE";"MEDICO";"I";"A";NA;"2021/03/01 00:00:00";"2023/02/28 00:00:00"
15119365;2;"ANNA LUIZA DE ALBUQUERQUE MARTINS";"01973263661";"18/09/1996";"CONTRATO TEMPORARIO";"HIJPII";"COORDENACAO DE URGENCIA E EMERGENCIA PEDIATRICA";"MED";"MEDICO GENERALISTA";"I";"A";"01/07/2022";"2022/07/01 00:00:00";"2022/12/27 00:00:00"
15119365;1;"ANNA LUIZA DE ALBUQUERQUE MARTINS";"01973263661";NA;"CONTRATO TEMPORARIO";"HIJPII";NA;"MEDRE";"MEDICO";"I";"A";NA;"2022/03/01 00:00:00";"2023/02/28 00:00:00"
14937692;2;"ANNA LUIZA GARCIAS MELO";"11080296638";"19/04/1993";"CONTRATO TEMPORARIO";"JXXIII";"COORDENACAO DE URGENCIA E EMERGENCIA ADULTO";"MED";"MEDICO GENERALISTA";"I";"A";"01/07/2022";"2022/07/01 00:00:00";"2022/12/27 00:00:00"
14937692;1;"ANNA LUIZA GARCIAS MELO";"11080296638";NA;"CONTRATO TEMPORARIO";"JXXIII";NA;"MEDRE";"MEDICO";"I";"A";NA;"2021/03/01 00:00:00";"2023/02/28 00:00:00"
15286826;1;"ANNA MARIA PEREIRA MEIRELES NICOLIELLO";"07843872655";"22/09/1997";"CONTRATO TEMPORARIO";"HAC";"COORDENACAO DO AMBULATORIO";"MED";"MEDICO GENERALISTA";"I";"A";"03/07/2022";"2022/07/03 00:00:00";"2023/07/02 00:00:00"
14774582;3;"ANNELYSE DE ABREU PEIXOTO";"07465578680";"27/04/1987";"CONTRATO TEMPORARIO";"JXXIII";"COORDENACAO DO BLOCO CIRURGICO";"MED";"MEDICO ANESTESIOLOGISTA";"III";"A";"01/03/2022";"2022/03/01 00:00:00";"2023/02/28 00:00:00"
15125388;1;"ANNIE CHINEYE UZOMA AREDA OSHAI";"00373096259";NA;"CONTRATO TEMPORARIO";"JXXIII";NA;"MEDRE";"MEDICO";"I";"A";NA;"2022/03/01 00:00:00";"2023/02/28 00:00:00"
15264799;1;"ANTONELA SILVERIO DA SILVA";"09417595636";"20/09/1989";"CONTRATO TEMPORARIO";"CSSFE";"COORDENACAO DE HOTELARIA";"TOS";"TECNICO EM NUTRICAO E DIETETICA";"II";"A";"01/07/2022";"2022/07/01 00:00:00";"2023/06/30 00:00:00"
14666366;3;"ANTONIA FLOR DE MAIO DE SOUSA E SILVA";"87183153649";"18/03/1971";"CONTRATO TEMPORARIO";"JXXIII";"COORDENACAO DE LABORATORIO E AGENCIA TRANSFUSIONAL";"TOS";"TECNICO EM PATOLOGIA CLINICA";"II";"A";"27/07/2021";"2021/07/27 00:00:00";"2023/06/30 00:00:00"
13445317;2;"ANTONIO ALVES GONAIS";"08175751622";"13/01/1988";"CONTRATO TEMPORARIO";"DPGF";"(DESAT.)GERENCIA DE LICITACOES E CONTRATOS";"TOS";"AUXILIAR ADMINISTRATIVO";"I";"A";"01/02/2022";"2022/02/01 00:00:00";"2023/01/31 00:00:00"
14881320;1;"ANTONIO AUGUSTO ROCHA MELO VIEIRA";"10166667641";NA;"CONTRATO TEMPORARIO";"CHPB";NA;"MEDRE";"MEDICO";"I";"A";NA;"2020/03/02 00:00:00";"2023/02/28 00:00:00"
11081841;5;"ANTONIO AUGUSTO TEODORO DA ROCHA";"03588065695";"10/06/1978";"CONTRATO TEMPORARIO";"JXXIII";"COORDENACAO DE URGENCIA E EMERGENCIA ADULTO";"MED";"MEDICO NEUROCIRURGIAO";"III";"A";"08/10/2020";"2021/02/01 00:00:00";"2023/01/31 00:00:00"
11272895;6;"ANTONIO CARLOS BASTOS CORREA";"00843302798";"04/04/1970";"CONTRATO TEMPORARIO";"HGB-JA";"COORDENACAO DA UNIDADE CIRURGICA";"MED";"MEDICO ORTOPEDISTA E TRAUMATOLOGISTA";"III";"A";"22/04/2022";"2022/04/25 00:00:00";"2023/04/24 00:00:00"
15067796;1;"ANTONIO CARLOS PEREIRA";"09468225658";"02/02/1988";"CONTRATO TEMPORARIO";"CSSI";"COORDENACAO DA UNIDADE DE CUIDADO AO ADULTO";"PENF";"TECNICO DE ENFERMAGEM";"II";"A";"01/02/2022";"2022/02/01 00:00:00";"2023/01/31 00:00:00"
14937700;1;"ANTONIO DE PAUDA PEPPE NETO";"04289627188";NA;"CONTRATO TEMPORARIO";"JXXIII";NA;"MEDRE";"MEDICO";"I";"A";NA;"2021/03/01 00:00:00";"2023/02/28 00:00:00"
15264245;1;"ANTONIO EUSTAQUIO DO CARMO NETO";"09535245660";"27/12/1989";"CONTRATO TEMPORARIO";"HRAD";"COORDENACAO DE APOIO DIAGNOSTICO E TERAPEUTICO";"TOS";"TECNICO EM PATOLOGIA CLINICA";"II";"A";"13/06/2022";"2022/06/13 00:00:00";"2023/06/12 00:00:00"
14915359;1;"ANTONIO FELIPE DA SILVA SOUTO";"14083074647";"31/03/1999";"CONTRATO TEMPORARIO";"";"(DESAT.)GERENCIA DE SUPRIMENTOS, LOGISTICA E PATRIMONIO";"TOS";"AUXILIAR ADMINISTRATIVO";"I";"A";"30/05/2022";"2022/05/30 00:00:00";"2023/05/29 00:00:00"
14581045;2;"ANTONIO JOSE DE OLIVEIRA JEHA";"09017318627";"18/06/1988";"CONTRATO TEMPORARIO";"HRAD";"COORDENACAO DA UNIDADE DE PACIENTES EXTERNOS";"MED";"MEDICO ORTOPEDISTA E TRAUMATOLOGISTA";"III";"A";"0000-00-00";"2022/02/07 00:00:00";"2023/02/06 00:00:00"
14612329;4;"ANTONIO LEONARDO DA FONSECA PINTO COELHO";"05946933655";"17/11/1981";"CONTRATO TEMPORARIO";"JXXIII";"COORDENACAO DO BLOCO CIRURGICO";"MED";"MEDICO ANESTESIOLOGISTA";"III";"A";"10/03/2022";"2022/03/10 00:00:00";"2023/03/09 00:00:00"
14612329;3;"ANTONIO LEONARDO DA FONSECA PINTO COELHO";"05946933655";"17/11/1981";"CONTRATO TEMPORARIO";"MOV";"COORDENACAO DA GINECOLOGIA E OBSTETRICIA";"MED";"MEDICO ANESTESIOLOGISTA";"III";"A";"14/04/2021";"2021/04/14 00:00:00";"2023/04/13 00:00:00"
11618691;4;"ANTONIO MARCOS DE JESUS";"94192480620";"02/04/1977";"CONTRATO TEMPORARIO";"HJK";"COORDENACAO DE INTERNACAO - ADULTO";"PENF";"TECNICO DE ENFERMAGEM";"II";"A";"25/11/2022";"2022/11/25 00:00:00";"2023/11/24 00:00:00"
15127939;1;"ANTONIO MENDES SILVA NETO";"02523421194";NA;"CONTRATO TEMPORARIO";"CEPAI";NA;"MEDRE";"MEDICO";"I";"A";NA;"2022/03/03 00:00:00";"2023/03/02 00:00:00"
13295761;2;"APARECIDA BEATRIZ ALVES TEIXEIRA";"02865066614";"16/08/1974";"CONTRATO TEMPORARIO";"HEM";"COORDENACAO DAS UNIDADES CRITICAS";"PENF";"TECNICO DE ENFERMAGEM";"II";"A";"04/07/2022";"2022/07/04 00:00:00";"2023/07/03 00:00:00"
15233372;1;"APARECIDA DE JESUS DOS SANTOS";"03926005602";"19/05/1970";"CONTRATO TEMPORARIO";"IRS";"COORDENACAO DE HOTELARIA";"TOS";"TECNICO EM NUTRICAO E DIETETICA";"II";"A";"24/05/2022";"2022/05/24 00:00:00";"2023/05/23 00:00:00"
15175672;1;"APARECIDA DE LOURDES PASTOR";"02676998676";"23/01/1973";"CONTRATO TEMPORARIO";"MOV";"COORDENACAO DE GESTAO DA INFORMACAO";"TOS";"AUXILIAR ADMINISTRATIVO";"I";"A";"24/03/2022";"2022/03/24 00:00:00";"2023/03/23 00:00:00"
10892107;3;"APARECIDA DE OLIVEIRA BATISTA";"62055011634";"07/11/1963";"CONTRATO TEMPORARIO";"HCM";"COORDENACAO TECNICA DE ENFERMAGEM";"PENF";"TECNICO DE ENFERMAGEM";"II";"A";"01/02/2022";"2022/02/01 00:00:00";"2023/01/31 00:00:00"
14649396;2;"APARECIDA REGIANE GIRON";"01485499690";"23/11/1982";"CONTRATO TEMPORARIO";"HRJP";"COORDENACAO TECNICA DE ENFERMAGEM";"PENF";"ENFERMEIRO";"IV";"A";"01/04/2022";"2022/04/01 00:00:00";"2023/03/28 00:00:00"
11048717;2;"APOLITANA FERNANDA GONCALVES";"00508820669";"16/04/1973";"CONTRATO TEMPORARIO";"HJK";"COORDENACAO MEDICA DA URGENCIA E EMERGENCIA";"PENF";"TECNICO DE ENFERMAGEM";"II";"A";"17/02/2022";"2022/02/17 00:00:00";"2023/02/16 00:00:00"
14660690;2;"ARIANE CARVALHO SOARES";"11461281695";"17/03/1992";"CONTRATO TEMPORARIO";"JXXIII";"COORDENACAO DAS UNIDADES DE INTERNACAO ADULTO";"PENF";"TECNICO DE ENFERMAGEM";"II";"A";"07/10/2022";"2022/10/07 00:00:00";"2023/10/06 00:00:00"
15122302;1;"ARIANE CHEVTCHOUK JURNO";"10713769696";NA;"CONTRATO TEMPORARIO";"HGB-JA";NA;"MEDRE";"MEDICO";"I";"A";NA;"2022/03/08 00:00:00";"2023/03/07 00:00:00"
14887756;1;"ARIANE MARTINS MEIRELLES";"07322114680";"06/01/1985";"CONTRATO TEMPORARIO";"CSSFE";"COORDENACAO DE APOIO DIAGNOSTICO E TERAPEUTICO";"AGAS";"FARMACEUTICO";"III";"A";"01/02/2022";"2022/02/01 00:00:00";"2023/01/31 00:00:00"
14354963;3;"ARIANNE DE ASSIS ALVES";"07352022651";"20/02/1985";"CONTRATO TEMPORARIO";"IRS";"COORDENACAO DE ASSISTENCIA FARMACEUTICA";"AGAS";"FARMACEUTICO";"I";"A";"09/05/2022";"2022/05/09 00:00:00";"2023/05/08 00:00:00"
14569404;2;"ARIANY AMARAL LEAO";"10283827661";"07/07/1990";"CONTRATO TEMPORARIO";"HEM";"COORDENACAO DE ASSISTENCIA FARMACEUTICA";"AGAS";"FARMACEUTICO";"I";"A";"14/05/2022";"2022/05/14 00:00:00";"2023/05/13 00:00:00"
12081899;2;"ARICELIO DOS SANTOS";"03577223618";"03/07/1975";"CONTRATO TEMPORARIO";"MOV";"COORDENACAO DA UNIDADE DE TERAPIA INTENSIVA";"PENF";"TECNICO DE ENFERMAGEM";"II";"A";"01/02/2022";"2022/02/01 00:00:00";"2023/01/31 00:00:00"
14911234;2;"ARIEL RAMOS DE MORAIS NAVARRO";"10503993662";"09/04/1992";"CONTRATO TEMPORARIO";"JXXIII";"COORDENACAO DA UNIDADE DE TERAPIA INTENSIVA ADULTO";"MED";"MEDICO CLINICO";"III";"A";"24/06/2021";"2021/06/24 00:00:00";"2023/06/23 00:00:00"
14911234;3;"ARIEL RAMOS DE MORAIS NAVARRO";"10503993662";"09/04/1992";"CONTRATO TEMPORARIO";"JXXIII";"COORDENACAO DA UNIDADE DE TERAPIA INTENSIVA ADULTO";"MED";"MEDICO CLINICO";"III";"A";"29/07/2021";"2021/07/29 00:00:00";"2023/06/30 00:00:00"
14909071;3;"ARISTARCO DE PINHO FERREIRA JUNIOR";"01576087603";NA;"CONTRATO TEMPORARIO";"HEM";NA;"MEDRE";"MEDICO";"I";"A";NA;"2022/03/07 00:00:00";"2023/03/06 00:00:00"
14850101;1;"ARISVALDO SOUZA COELHO";"05035780619";"13/12/1980";"CONTRATO TEMPORARIO";"CSSI";"COORDENACAO DE GESTAO DA INFORMACAO E FINANCAS";"TOS";"TECNICO EM INFORMATICA";"II";"A";"01/02/2022";"2022/02/01 00:00:00";"2023/01/31 00:00:00"
15291354;1;"ARLEN ANTONIO GOMES";"01201774632";"24/04/1978";"CONTRATO TEMPORARIO";"CMT";"GERENCIA ASSISTENCIAL";"AGAS";"FARMACEUTICO";"I";"A";"11/07/2022";"2022/07/11 00:00:00";"2023/01/06 00:00:00"
11589900;2;"ARLETE AMANCIO DE REZENDE";"05834995624";"28/12/1971";"CONTRATO TEMPORARIO";"CSSFA";"COORDENACAO DA UNIDADE DE INTERNACAO E PACIENTES EXTERNOS";"PENF";"TECNICO DE ENFERMAGEM";"II";"A";"10/10/2016";"2022/02/01 00:00:00";"2023/01/31 00:00:00"
15349962;1;"ARLETE LUCIA DA SILVA";"04954649617";"16/01/1981";"CONTRATO TEMPORARIO";"HJK";"COORDENACAO MEDICA DA URGENCIA E EMERGENCIA";"PENF";"TECNICO DE ENFERMAGEM";"II";"A";"03/11/2022";"2022/10/26 00:00:00";"2023/10/25 00:00:00"
14909329;2;"ARTHUR GONCALVES DOS SANTOS";"01895246695";"10/02/1998";"CONTRATO TEMPORARIO";"HRJP";"COORDENACAO DAS UNIDADES DE INTERNACAO";"PENF";"TECNICO DE ENFERMAGEM";"II";"A";"07/09/2022";"2022/09/07 00:00:00";"2023/03/05 00:00:00"
14929541;1;"ARTHUR GUILHERME LOBATO DE CASTRO";"08777361628";NA;"CONTRATO TEMPORARIO";"CHPB";NA;"MEDRE";"MEDICO";"I";"A";NA;"2021/03/01 00:00:00";"2023/02/28 00:00:00"
14540652;1;"ARTHUR VASCONCELOS DA SILVA";"11452562601";"04/09/1993";"CONTRATO TEMPORARIO";"HJK";"COORDENACAO DE INTERNACAO - ADULTO";"PENF";"TECNICO DE ENFERMAGEM";"II";"A";"04/02/2022";"2022/02/04 00:00:00";"2023/02/03 00:00:00"
14882815;3;"ARTUR DE PAULA SANTOS";"11819232638";"17/03/1995";"CONTRATO TEMPORARIO";"JXXIII";"COORDENACAO DE URGENCIA E EMERGENCIA ADULTO";"MED";"MEDICO GENERALISTA";"I";"A";"03/06/2021";"2021/06/03 00:00:00";"2023/06/02 00:00:00"
14934061;1;"ATHOS MARTINS CORREA";"07769775639";NA;"CONTRATO TEMPORARIO";"HAC";NA;"MEDRE";"MEDICO";"I";"A";NA;"2021/03/01 00:00:00";"2023/02/28 00:00:00"
14678817;2;"AUGUSTO CAIXETA D ALCANTARA";"01697016626";"15/11/1988";"CONTRATO TEMPORARIO";"HRAD";"COORDENACAO DA UNIDADE CIRURGICA";"MED";"MEDICO ORTOPEDISTA E TRAUMATOLOGISTA";"III";"A";"0000-00-00";"2022/02/04 00:00:00";"2023/02/03 00:00:00"
11837697;4;"AUGUSTO CESAR DE JESUS SANTOS";"96268697553";"23/06/1980";"CONTRATO TEMPORARIO";"JXXIII";"COORDENACAO DE URGENCIA E EMERGENCIA ADULTO";"MED";"MEDICO NEUROCIRURGIAO";"III";"A";"26/05/2021";"2021/05/26 00:00:00";"2023/05/25 00:00:00"
14624027;2;"AUGUSTO RODRIGO SILVA";"05276998612";"09/09/1982";"CONTRATO TEMPORARIO";"HIJPII";"COORDENACAO DO SERVICO DE ARQUIVO MEDICO E ESTATISTICA";"TOS";"AUXILIAR ADMINISTRATIVO";"I";"A";"01/02/2022";"2022/02/01 00:00:00";"2023/01/31 00:00:00"
14624597;2;"AUGUSTO VIEGAS";"09809489676";"28/12/1990";"CONTRATO TEMPORARIO";"HGB-JA";"COORDENACAO DA UNIDADE DE CLINICA MEDICA";"MED";"MEDICO CLINICO";"III";"A";"03/06/2022";"2022/06/03 00:00:00";"2023/06/02 00:00:00"
15102254;1;"AURELIA FERNANDES COSTA";"07232593643";"17/10/1984";"CONTRATO TEMPORARIO";"HRJP";"COORDENACAO DA UNIDADE CIRURGICA";"MED";"MEDICO ANESTESIOLOGISTA";"III";"A";"19/02/2022";"2022/02/19 00:00:00";"2023/02/18 00:00:00"
15085624;1;"AURENICE PINHEIRO DOS SANTOS SOUSA";"33330271272";"26/06/1967";"CONTRATO TEMPORARIO";"JXXIII";"COORDENACAO DO CENTRO DE TRATAMENTO DE QUEIMADOS";"PENF";"TECNICO DE ENFERMAGEM";"II";"A";"04/02/2022";"2022/02/03 00:00:00";"2023/02/02 00:00:00"
14913438;1;"AUREO FONSECA LEITE";"95086072620";"19/08/1974";"CONTRATO TEMPORARIO";"DPGF";"(DESAT.)GERENCIA DE INFRAESTRUTURA PREDIAL";"AGAS";"ENGENHEIRO";"I";"A";"01/02/2022";"2022/02/01 00:00:00";"2023/01/31 00:00:00"
14556369;1;"AURIVAN ESSADO DANTAS";"02709206170";"13/03/1987";"CONTRATO TEMPORARIO";"MOV";"COORDENACAO DA UNIDADE DE TERAPIA INTENSIVA";"MED";"MEDICO CLINICO";"III";"A";"03/02/2022";"2022/02/03 00:00:00";"2023/02/02 00:00:00"
14905806;3;"AUZILEA MARIA DA SILVA";"03550209630";"24/02/1978";"CONTRATO TEMPORARIO";"HGB-JA";"COORDENACAO DA UNIDADE DE PACIENTES CRITICOS";"PENF";"TECNICO DE ENFERMAGEM";"II";"A";"16/12/2021";"2021/12/16 00:00:00";"2023/06/30 00:00:00"
15291248;1;"AYESKA ANDRADE LIMA";"10311088660";"10/04/1990";"CONTRATO TEMPORARIO";"HIJPII";"COORDENACAO DE URGENCIA E EMERGENCIA ADULTO";"MED";"MEDICO PEDIATRA";"III";"A";"01/07/2022";"2022/07/01 00:00:00";"2023/06/30 00:00:00"
13871348;4;"BARBARA AMELIA DA MOTA MARQUES COELHO";"01585508624";"03/10/1987";"CONTRATO TEMPORARIO";"JXXIII";"COORDENACAO DA UNIDADE DE TERAPIA INTENSIVA PEDIATRICA";"MED";"MEDICO EM MEDICINA INTENSIVA REGULADOR C";"III";"A";"03/03/2022";"2022/03/03 00:00:00";"2023/03/02 00:00:00"
12428280;1;"BARBARA ARAUJO MARQUES";"07976530666";"30/08/1985";NA;"HIJPII";"COORDENACAO DE GESTAO DE PESSOAS";NA;"MEDICO";NA;NA;"03/04/2013";NA;NA
14644090;1;"BARBARA BEATRIZ VIEIRA GALIZA";"12434888674";"11/04/1995";"CONTRATO TEMPORARIO";"HJK";"COORDENACAO DA ENGENHARIA CLINICA";"TOS";"AUXILIAR ADMINISTRATIVO";"I";"A";"14/02/2022";"2022/02/14 00:00:00";"2023/02/13 00:00:00"
13655436;2;"BARBARA BIANCA PAIXAO DE SA";"11220500623";"03/02/1993";"CONTRATO TEMPORARIO";"HJK";"COORDENACAO MEDICA DA URGENCIA E EMERGENCIA";"TOS";"AUXILIAR ADMINISTRATIVO";"I";"A";"04/01/2018";"2021/02/01 00:00:00";"2023/01/31 00:00:00"
14948913;1;"BARBARA CAROLINE CAMPOS DO NASCIMENTO";"10689055650";"07/11/2000";"CONTRATO TEMPORARIO";"HGB-JA";"COORDENACAO DA UNIDADE CIRURGICA";"PENF";"TECNICO DE ENFERMAGEM";"II";"A";"01/04/2021";"2021/04/01 00:00:00";"2023/03/31 00:00:00"
15018450;1;"BARBARA COSTA MOREIRA";"13032295602";"05/01/1996";"CONTRATO TEMPORARIO";"HIJPII";"COORDENACAO DAS UNIDADES DE INTERNACAO PEDIATRICA";"PENF";"ENFERMEIRO";"IV";"A";"28/09/2021";"2021/09/28 00:00:00";"2023/06/30 00:00:00"
11250289;4;"BARBARA DE CARVALHO MOREIRA";"88221652687";"23/03/1972";"CONTRATO TEMPORARIO";"HJK";"COORDENACAO DA EQUIPE MULTIDISCIPLINAR";"AGAS";"FISIOTERAPEUTA RESPIRATORIA";"III";"A";"01/02/2022";"2022/02/01 00:00:00";"2023/01/31 00:00:00"
14141147;5;"BARBARA FURQUIM WERNECK CAMPOS VALADAO";"10420879625";"06/02/1990";"CONTRATO TEMPORARIO";"HIJPII";"COORDENACAO DO AMBULATORIO ADULTO";"MED";"MEDICO PEDIATRA";"III";"A";"13/04/2022";"2022/04/13 00:00:00";"2023/04/12 00:00:00"
14755698;2;"BARBARA LENOIR RABELO";"09941001677";"28/05/1992";"CONTRATO TEMPORARIO";"HEM";"COORDENACAO DAS UNIDADES CRITICAS";"MED";"MEDICO INFECTOLOGISTA";"III";"A";"08/06/2022";"2022/06/08 00:00:00";"2023/06/07 00:00:00"
15118789;1;"BARBARA LOPES DO CARMO";"11465769609";NA;"CONTRATO TEMPORARIO";"HJK";NA;"MEDRE";"MEDICO";"I";"A";NA;"2022/03/08 00:00:00";"2023/03/07 00:00:00"
14884076;1;"BARBARA MARIA ASSI RABELO";"10793621690";NA;"CONTRATO TEMPORARIO";"HJK";NA;"MEDRE";"MEDICO";"I";"A";NA;"2020/03/01 00:00:00";"2023/02/28 00:00:00"
14612840;2;"BARBARA MENDES PINTO";"08312040609";"11/03/1988";"CONTRATO TEMPORARIO";"MOV";"COORDENACAO DA GINECOLOGIA E OBSTETRICIA";"MED";"MEDICO GINECOLOGISTA";"III";"A";"17/04/2022";"2022/04/17 00:00:00";"2023/04/16 00:00:00"
15285257;1;"BARBARA MENEZES SOUSA";"09988429665";NA;"CONTRATO TEMPORARIO";"JXXIII";NA;"MED";"MEDICO CLINICO";"III";"A";NA;"2022/07/01 00:00:00";"2023/06/30 00:00:00"
15118482;1;"BARBARA PAULA DE BARROS CARVALHO PINTO";"08767582605";NA;"CONTRATO TEMPORARIO";"HJK";NA;"MEDRE";"MEDICO";"I";"A";NA;"2022/03/01 00:00:00";"2023/02/28 00:00:00"
14896344;2;"BARBARA RITA MACIEL";"12139285670";"23/07/1994";"CONTRATO TEMPORARIO";"HGB-JA";"COORDENACAO DE SAUDE MENTAL";"PENF";"TECNICO DE ENFERMAGEM";"II";"A";"10/02/2022";"2022/02/10 00:00:00";"2023/02/09 00:00:00"
13441613;1;"BARBARA SILVA SANTOS";"08526308670";"22/01/1990";"CONTRATO TEMPORARIO";"MOV";"COORDENACAO DE COMPRAS E LOGISTICA";"TOS";"AUXILIAR ADMINISTRATIVO";"I";"A";"01/02/2022";"2022/02/01 00:00:00";"2023/01/31 00:00:00"
15122856;1;"BARBARA SOARES";"09921340646";NA;"CONTRATO TEMPORARIO";"HRJP";NA;"MEDRE";"MEDICO";"I";"A";NA;"2022/03/01 00:00:00";"2023/02/28 00:00:00"
14590442;1;"BARBARA SOUZA DE CASTRO";"03926085614";"14/11/1979";"CONTRATO TEMPORARIO";"HRJP";"COORDENACAO DAS UNIDADES DE INTERNACAO";"PENF";"TECNICO DE ENFERMAGEM";"II";"A";"01/02/2022";"2022/02/01 00:00:00";"2023/01/31 00:00:00"
15198690;1;"BARBARA VICTORIA DOS SANTOS NASCIMENTO";"07144346636";"20/08/1984";"CONTRATO TEMPORARIO";"MOV";"COORDENACAO DA UNIDADE DE TERAPIA INTENSIVA";"MED";"MEDICO GENERALISTA";"I";"A";"22/04/2022";"2022/04/22 00:00:00";"2023/04/21 00:00:00"
14963896;1;"BEATRIZ SILVEIRA ROSA HIPOLITO";"05412770657";"08/12/1982";"CONTRATO TEMPORARIO";"HEM";"COORDENACAO DE HOTELARIA";"AGAS";"NUTRICIONISTA";"I";"A";"17/05/2021";"2021/05/17 00:00:00";"2023/05/16 00:00:00"
12993267;3;"BEATRIZ UBALDO FELICIO";"05045575643";"25/02/1982";"CONTRATO TEMPORARIO";"MOV";"COORDENACAO DA UNIDADE DE TERAPIA INTENSIVA";"MED";"MEDICO CARDIOLOGISTA";"III";"A";"17/04/2021";"2021/04/17 00:00:00";"2023/04/16 00:00:00"
14413512;4;"BERENICE CALEGAR CAMARINHA";"08069455675";"02/04/1991";"CONTRATO TEMPORARIO";"HAC";"COORDENACAO CIRURGICA";"MED";"MEDICO CIRURGIAO GERAL";"III";"A";"21/07/2019";"2021/02/01 00:00:00";"2023/01/31 00:00:00"
15112063;2;"BERNARDO CASTORINO DE FARIA";"07644373640";"18/09/1991";"CONTRATO TEMPORARIO";"HEM";"COORDENACAO DA UNIDADE DE PACIENTES EXTERNOS";"MED";"MEDICO GENERALISTA";"I";"A";"10/01/2023";"2022/07/06 00:00:00";"2023/01/01 00:00:00"
11961950;5;"BERNARDO NASCENTES BRUNO";"04830397640";NA;"CONTRATO TEMPORARIO";"HRAD";NA;"MEDRE";"MEDICO";"I";"A";NA;"2022/03/01 00:00:00";"2023/02/28 00:00:00"
10907327;6;"BERTA LUCIANA SILVA";"00942025679";"31/10/1973";"CONTRATO TEMPORARIO";"HJK";"COORDENACAO MEDICA DA URGENCIA E EMERGENCIA";"PENF";"TECNICO DE ENFERMAGEM";"II";"A";"06/07/2022";"2022/07/06 00:00:00";"2023/07/05 00:00:00"
15174089;1;"BIA DRUMOND PAIVA";"11987988663";NA;"CONTRATO TEMPORARIO";"HIJPII";NA;"MEDRE";"MEDICO";"I";"A";NA;"2022/03/08 00:00:00";"2023/03/07 00:00:00"
14934046;1;"BIANCA CASTRO ZEBRAL";"08212434621";NA;"CONTRATO TEMPORARIO";"HGB-JA";NA;"MEDRE";"MEDICO";"I";"A";NA;"2021/03/01 00:00:00";"2023/02/28 00:00:00"
14755706;4;"BIANCA DUARTE ARAUJO SANTOS";"11336202645";"03/09/1994";"CONTRATO TEMPORARIO";"JXXIII";"COORDENACAO DA UNIDADE DE TERAPIA INTENSIVA ADULTO";"MED";"MEDICO CLINICO";"III";"A";"30/07/2021";"2021/07/30 00:00:00";"2023/06/30 00:00:00"
14755706;3;"BIANCA DUARTE ARAUJO SANTOS";"11336202645";"03/09/1994";"CONTRATO TEMPORARIO";"JXXIII";"COORDENACAO DE URGENCIA E EMERGENCIA ADULTO";"MED";"MEDICO CLINICO";"III";"A";"17/05/2021";"2021/05/17 00:00:00";"2023/05/16 00:00:00"
14964092;1;"BIANCA MEDEIROS DE ALMEIDA MATEUS";"03251830589";NA;"CONTRATO TEMPORARIO";"JXXIII";NA;"AGAS";"FONOAUDIOLOGO";"I";"A";NA;"2021/06/01 00:00:00";"2023/05/31 00:00:00"
14666861;1;"BIANCA MENEZES MILITAO";"12478879603";"07/06/1995";"CONTRATO TEMPORARIO";"JXXIII";"COORDENACAO DE LABORATORIO E AGENCIA TRANSFUSIONAL";"AGAS";"FARMACEUTICO";"I";"A";"10/02/2022";"2022/02/10 00:00:00";"2023/02/09 00:00:00"
14985105;1;"BRENDA CALIXTO DA SILVA PEREIRA";"07837943635";"03/03/1984";"CONTRATO TEMPORARIO";"HJK";"COORDENACAO MEDICA DA URGENCIA E EMERGENCIA";"PENF";"TECNICO DE ENFERMAGEM";"II";"A";"23/07/2021";"2021/07/23 00:00:00";"2023/06/30 00:00:00"
14883094;2;"BRENO AFONSO COUTO SOARES";"10581527690";"25/10/1991";"CONTRATO TEMPORARIO";"JXXIII";"COORDENACAO DA UNIDADE DE TERAPIA INTENSIVA ADULTO";"MED";"MEDICO CLINICO";"III";"A";"01/07/2022";"2022/07/01 00:00:00";"2023/06/30 00:00:00"
14582985;2;"BRENO HENRIQUE ALMEIDA TEOFILO";"12738679633";"27/06/1995";"CONTRATO TEMPORARIO";"CEPAI";"COORDENACAO DE HOTELARIA";"TOS";"AUXILIAR ADMINISTRATIVO";"I";"A";"31/05/2022";"2022/05/31 00:00:00";"2023/05/30 00:00:00"
15275951;1;"BRENO MANSUR DA SILVA";"08770815658";"04/11/1988";"CONTRATO TEMPORARIO";"JXXIII";"COORDENACAO DE URGENCIA E EMERGENCIA ADULTO";"MED";"MEDICO CLINICO";"III";"A";"01/07/2022";"2022/07/01 00:00:00";"2023/06/30 00:00:00"
14691240;3;"BRENO TEIXEIRA MORENO";"05432854643";"21/09/1983";"CONTRATO TEMPORARIO";"JXXIII";"COORDENACAO DE URGENCIA E EMERGENCIA ADULTO";"MED";"MEDICO ORTOPEDISTA E TRAUMATOLOGISTA";"III";"A";"03/03/2022";"2022/03/03 00:00:00";"2023/03/02 00:00:00"
14885016;1;"BRIGIDA MARTINS LIMA";"10948829680";NA;"CONTRATO TEMPORARIO";"HIJPII";NA;"MEDRE";"MEDICO";"I";"A";NA;"2020/03/01 00:00:00";"2023/02/28 00:00:00"
14709810;3;"BRISA COSTA BOTELHO";"08898674619";"21/02/1989";"CONTRATO TEMPORARIO";"JXXIII";"COORDENACAO DO CENTRO DE TRATAMENTO DE QUEIMADOS";"PENF";"ENFERMEIRO";"IV";"A";"30/12/2021";"2021/12/30 00:00:00";"2023/06/30 00:00:00"
14626279;6;"BRISA ELLEN DE MIRANDA GUERRA";"07004614697";"01/04/1986";"CONTRATO TEMPORARIO";"HJK";"COORDENACAO MEDICA DA URGENCIA E EMERGENCIA";"PENF";"TECNICO DE ENFERMAGEM";"II";"A";"04/02/2022";"2022/02/04 00:00:00";"2023/02/03 00:00:00"
14626279;5;"BRISA ELLEN DE MIRANDA GUERRA";"07004614697";"01/04/1986";"CONTRATO TEMPORARIO";"HAC";"COORDENACAO CIRURGICA";"PENF";"TECNICO DE ENFERMAGEM";"II";"A";"04/02/2021";"2022/02/04 00:00:00";"2023/02/03 00:00:00"
15118813;1;"BRUNA AMARAL BRASIL";"08242758611";NA;"CONTRATO TEMPORARIO";"HJK";NA;"MEDRE";"MEDICO";"I";"A";NA;"2022/03/01 00:00:00";"2023/02/28 00:00:00"
14955496;1;"BRUNA APARECIDA NUNES MARRA";"12911504631";NA;"CONTRATO TEMPORARIO";"HRAD";NA;"MEDRE";"MEDICO";"I";"A";NA;"2021/03/29 00:00:00";"2023/03/22 00:00:00"
14956346;2;"BRUNA APARECIDA POLICARPO";"08431681616";"03/03/1989";"CONTRATO TEMPORARIO";"JXXIII";"COORDENACAO DE LABORATORIO E AGENCIA TRANSFUSIONAL";"TOS";"TECNICO EM PATOLOGIA CLINICA";"II";"A";"03/02/2022";"2022/02/03 00:00:00";"2023/02/02 00:00:00"
15122989;1;"BRUNA ATHAYDE SANTOS DE CARVALHO";"14395616640";NA;"CONTRATO TEMPORARIO";"JXXIII";NA;"MEDRE";"MEDICO";"I";"A";NA;"2022/03/01 00:00:00";"2023/02/28 00:00:00"
14220081;2;"BRUNA BARBOSA COIMBRA CORLAITE";"10080265650";"30/12/1988";"CONTRATO TEMPORARIO";"HJK";"COORDENACAO DA MATERNIDADE";"MED";"MEDICO GINECOLOGISTA";"III";"A";"09/07/2021";"2021/07/09 00:00:00";"2023/06/30 00:00:00"
15123888;1;"BRUNA BOECHAT RIDOLFI";"15968486775";NA;"CONTRATO TEMPORARIO";"HEM";NA;"MEDRE";"MEDICO";"I";"A";NA;"2022/03/01 00:00:00";"2023/02/28 00:00:00"
14883185;2;"BRUNA CAMPOS CARDOSO VILELA";"11438602685";"24/11/1993";"CONTRATO TEMPORARIO";"HIJPII";"COORDENACAO DE URGENCIA E EMERGENCIA PEDIATRICA";"MED";"MEDICO GENERALISTA";"I";"A";"01/07/2022";"2022/07/01 00:00:00";"2022/12/27 00:00:00"
14883185;1;"BRUNA CAMPOS CARDOSO VILELA";"11438602685";NA;"CONTRATO TEMPORARIO";"HIJPII";NA;"MEDRE";"MEDICO";"I";"A";NA;"2020/03/01 00:00:00";"2023/02/28 00:00:00"
14901557;3;"BRUNA CAROLINE RIBEIRO DA SILVA";"08817390658";"18/03/1989";"CONTRATO TEMPORARIO";"HAC";"COORDENACAO DE INTERNACAO - ONCOLOGICA";"PENF";"TECNICO DE ENFERMAGEM";"II";"A";"02/02/2022";"2022/02/02 00:00:00";"2023/02/01 00:00:00"
14901557;2;"BRUNA CAROLINE RIBEIRO DA SILVA";"08817390658";"18/03/1989";"CONTRATO TEMPORARIO";"JXXIII";"COORDENACAO DA UNIDADE DE TERAPIA INTENSIVA PEDIATRICA";"PENF";"TECNICO DE ENFERMAGEM";"II";"A";"03/02/2022";"2022/02/03 00:00:00";"2023/02/02 00:00:00"
14624720;4;"BRUNA CAROLLINE PESSOA OLIVEIRA";"10205435661";"29/03/1993";"CONTRATO TEMPORARIO";"HRAD";"COORDENACAO DA UNIDADE CIRURGICA";"MED";"MEDICO ANESTESIOLOGISTA";"III";"A";"0000-00-00";"2021/11/25 00:00:00";"2023/06/30 00:00:00"
14624720;3;"BRUNA CAROLLINE PESSOA OLIVEIRA";"10205435661";"29/03/1993";"CONTRATO TEMPORARIO";"HRAD";"COORDENACAO DA UNIDADE CIRURGICA";"MED";"MEDICO ANESTESIOLOGISTA";"III";"A";"0000-00-00";"2021/04/17 00:00:00";"2023/04/16 00:00:00"
14612873;3;"BRUNA COSTA DE MATOS";"09494527690";NA;"CONTRATO TEMPORARIO";"HIJPII";NA;"MED";"MEDICO PEDIATRA";"III";"A";NA;"2022/03/03 00:00:00";"2023/03/02 00:00:00"
15274293;1;"BRUNA FERNANDA DEICKE MENDES";"08016329608";"16/06/1997";"CONTRATO TEMPORARIO";"HIJPII";"COORDENACAO DE URGENCIA E EMERGENCIA PEDIATRICA";"MED";"MEDICO GENERALISTA";"I";"A";"01/07/2022";"2022/07/01 00:00:00";"2022/12/27 00:00:00"
15105430;2;"BRUNA FERRAZ LIMA";"11186509643";NA;"CONTRATO TEMPORARIO";"IRS";NA;"MEDRE";"MEDICO";"I";"A";NA;"2022/03/01 00:00:00";"2023/02/28 00:00:00"
15085715;1;"BRUNA KEROLINE DUARTE LEITE";"13107857670";"12/09/1996";"CONTRATO TEMPORARIO";"JXXIII";"COORDENACAO DE ASSISTENCIA FARMACEUTICA";"TOS";"TECNICO EM FARMACIA";"II";"A";"01/02/2022";"2022/02/01 00:00:00";"2023/01/31 00:00:00"
14709885;2;"BRUNA LAIZA SILVA PACHECO MAGALHAES";"12154126650";"14/06/1995";"CONTRATO TEMPORARIO";"HCM";"DIRETORIA GERAL";"TOS";"AUXILIAR ADMINISTRATIVO";"I";"A";"01/02/2022";"2022/02/01 00:00:00";"2023/01/31 00:00:00"
14963904;1;"BRUNA MARI DE ARAUJO BASTITELE";"05464760660";"20/04/1983";"CONTRATO TEMPORARIO";"HEM";"NUCLEO DE RISCO";"PENF";"ENFERMEIRO";"IV";"A";"01/06/2021";"2021/06/01 00:00:00";"2023/05/31 00:00:00"
15279169;1;"BRUNA MARIANA DE BARROS LEONCIO LIMA";"06676171678";"13/09/1984";"CONTRATO TEMPORARIO";"HJK";"COORDENACAO DE INTERNACAO - ADULTO";"PENF";"ENFERMEIRO";"IV";"A";"06/07/2022";"2022/07/06 00:00:00";"2023/07/05 00:00:00"
14888879;1;"BRUNA MARIANA RIBAS";"06294279682";"26/09/1981";"CONTRATO TEMPORARIO";"HEM";"COORDENACAO DAS UNIDADES CRITICAS";"AGAS";"FISIOTERAPEUTA RESPIRATORIA";"III";"A";"02/05/2022";"2022/05/02 00:00:00";"2023/05/01 00:00:00"
14932503;2;"BRUNA MARTINS NOGUEIRA DA GAMA";"10492361657";"11/06/1994";"CONTRATO TEMPORARIO";"HIJPII";"COORDENACAO DE URGENCIA E EMERGENCIA PEDIATRICA";"MED";"MEDICO GENERALISTA";"I";"A";"01/07/2022";"2022/07/01 00:00:00";"2022/12/27 00:00:00"
14932503;1;"BRUNA MARTINS NOGUEIRA DA GAMA";"10492361657";NA;"CONTRATO TEMPORARIO";"HIJPII";NA;"MEDRE";"MEDICO";"I";"A";NA;"2021/03/01 00:00:00";"2023/02/28 00:00:00"
14880439;1;"BRUNA MATOS GUSMAO";"11158647697";NA;"CONTRATO TEMPORARIO";"MOV";NA;"MEDRE";"MEDICO";"I";"A";NA;"2020/03/01 00:00:00";"2023/02/28 00:00:00"
14114805;3;"BRUNA NASCIMENTO DE CAMPOS";"11642315613";"29/03/1993";"CONTRATO TEMPORARIO";"HGB-JA";"COORDENACAO DE ASSISTENCIA FARMACEUTICA";"TOS";"TECNICO EM FARMACIA";"II";"A";"04/01/2022";"2022/01/04 00:00:00";"2023/01/03 00:00:00"
12991873;4;"BRUNA ROBERTA TINOIS";"05244183656";NA;"CONTRATO TEMPORARIO";"";NA;"MED";"MEDICO";"III";"A";NA;"2022/06/01 00:00:00";"2023/05/31 00:00:00"
14846877;2;"BRUNA STEPHANE DO CARMO NATAL";"11909164607";"23/11/1994";"CONTRATO TEMPORARIO";"HGB-JA";"COORDENACAO DA UNIDADE DE URGENCIA E EMERGENCIA";"PENF";"TECNICO DE ENFERMAGEM";"II";"A";"10/12/2021";"2021/12/10 00:00:00";"2023/06/30 00:00:00"
14662506;2;"BRUNO ADOLFO DA SILVA";"00357283619";"03/01/1971";"CONTRATO TEMPORARIO";"HEM";"COORDENACAO DE APOIO DIAGNOSTICO E TERAPEUTICO";"TOS";"TECNICO EM RADIOLOGIA";"II";"A";"05/07/2018";"2022/02/01 00:00:00";"2023/01/31 00:00:00"
15077787;1;"BRUNO ANTONIO MOREIRA";"08802042659";"14/05/1990";"CONTRATO TEMPORARIO";"HCM";"COORDENACAO DE HOTELARIA";"TOS";"AUXILIAR ADMINISTRATIVO";"I";"A";"01/02/2022";"2022/02/01 00:00:00";"2023/01/31 00:00:00"
15204639;1;"BRUNO AUGUSTO JANNOTTI GUERRA";"11520131658";NA;"CONTRATO TEMPORARIO";"HJK";NA;"MEDRE";"MEDICO";"I";"A";NA;"2022/03/22 00:00:00";"2023/03/21 00:00:00"
14355028;2;"BRUNO BELOTI BARRETO";"08053721648";NA;"CONTRATO TEMPORARIO";"HRJP";NA;"MED";"MEDICO PEDIATRA";"III";"A";NA;"2022/12/01 00:00:00";"2023/11/30 00:00:00"
64544545;2;"BRUNO BELOTI BARRETO II";"08053721648";"15/12/1986";NA;"HRJP";"COORDENACAO DAS UNIDADES CRITICAS";NA;"MEDICO PEDIATRA";NA;NA;"01/12/2022";NA;NA
15354608;1;"BRUNO CESAR MACHADO FURTADO";"13129011609";"20/03/1996";"CONTRATO TEMPORARIO";"HGB-JA";"COORDENACAO DE SAUDE E SEGURANCA DO TRABALHADOR";"TOS";"TECNICO DE SEGURANCA DO TRABALHO";"II";"A";"12/12/2022";"2022/12/12 00:00:00";"2023/12/11 00:00:00"
15125974;1;"BRUNO CESAR PARPINELLI";"10391580647";NA;"CONTRATO TEMPORARIO";"JXXIII";NA;"MEDRE";"MEDICO";"I";"A";NA;"2022/03/01 00:00:00";"2023/02/28 00:00:00"
14928741;2;"BRUNO COSTA PINTO RICARDO";"11924161630";"13/09/1994";"CONTRATO TEMPORARIO";"HGB-JA";"COORDENACAO DA UNIDADE DE URGENCIA E EMERGENCIA";"PENF";"TECNICO DE ENFERMAGEM";"II";"A";"07/12/2021";"2021/12/07 00:00:00";"2023/06/30 00:00:00"
13602347;2;"BRUNO DAMASCENO DE FARIA";"09297075673";"31/03/1989";"CONTRATO TEMPORARIO";"HJK";"COORDENACAO DE INTERNACAO - ADULTO";"MED";"MEDICO PSIQUIATRA";"III";"A";"06/04/2022";"2022/04/06 00:00:00";"2023/04/05 00:00:00"
14933972;1;"BRUNO DE GODOY TOLEDO";"10864744650";NA;"CONTRATO TEMPORARIO";"HGB-JA";NA;"MEDRE";"MEDICO";"I";"A";NA;"2021/03/01 00:00:00";"2023/02/28 00:00:00"
12181186;3;"BRUNO DE MOURA VERGARA";"01362315605";"26/05/1981";"CONTRATO TEMPORARIO";"JXXIII";"COORDENACAO DE URGENCIA E EMERGENCIA ADULTO";"MED";"MEDICO CIRURGIAO GERAL";"III";"A";"14/05/2021";"2021/05/14 00:00:00";"2023/05/13 00:00:00"
13027511;4;"BRUNO MAIA VASCONCELOS";"32988667845";"31/05/1984";"CONTRATO TEMPORARIO";"HEM";"COORDENACAO DAS UNIDADES CRITICAS";"MED";"MEDICO INFECTOLOGISTA";"III";"A";"05/10/2017";"2022/02/01 00:00:00";"2023/01/31 00:00:00"
14612865;2;"BRUNO MARTINI REZENDE";"07300118607";"31/12/1985";"CONTRATO TEMPORARIO";"JXXIII";"COORDENACAO DE URGENCIA E EMERGENCIA ADULTO";"MED";"MEDICO CIRURGIAO DE MAO";"III";"A";"27/05/2022";"2022/05/27 00:00:00";"2023/05/26 00:00:00"
14590467;2;"BRUNO MARTINS BRAGA";"05611618600";"22/05/1983";"CONTRATO TEMPORARIO";"";"(DESAT.)GERENCIA DE SAUDE E SEGURANCA DO TRABALHADOR";"TOS";"AUXILIAR ADMINISTRATIVO";"I";"A";"04/07/2022";"2022/07/04 00:00:00";"2023/07/03 00:00:00"
14801559;1;"BRUNO PIRES SANTOS";"01556047673";"02/03/1994";"CONTRATO TEMPORARIO";"HJK";"COORDENACAO MEDICA DA URGENCIA E EMERGENCIA";"MED";"MEDICO GENERALISTA";"I";"A";"24/06/2022";"2022/06/24 00:00:00";"2023/06/23 00:00:00"
14801559;3;"BRUNO PIRES SANTOS";"01556047673";NA;"CONTRATO TEMPORARIO";"HJK";NA;"MEDRE";"MEDICO";"I";"A";NA;"2021/03/19 00:00:00";"2023/03/18 00:00:00"
14902761;2;"BRUNO RAFAEL SOUZA RAMOS";"03970872685";NA;"CONTRATO TEMPORARIO";"DPGF";NA;"AGAS";"ENGENHEIRO";"I";"A";NA;"2022/02/01 00:00:00";"2023/01/31 00:00:00"
10906196;4;"BRUNO SOARES MAYER";"06152926661";"19/08/1982";"CONTRATO TEMPORARIO";"HJK";"COORDENACAO MEDICA DA URGENCIA E EMERGENCIA";"PENF";"TECNICO DE ENFERMAGEM";"II";"A";"06/04/2022";"2022/06/03 00:00:00";"2023/06/02 00:00:00"
10906196;6;"BRUNO SOARES MAYER";"06152926661";"19/08/1982";"CONTRATO TEMPORARIO";"HJK";"COORDENACAO MEDICA DA URGENCIA E EMERGENCIA";"PENF";"TECNICO DE ENFERMAGEM";"II";"A";"03/06/2022";"2022/04/06 00:00:00";"2023/04/05 00:00:00"
14479042;3;"BRUNO SOUTO FRANCO";"06694922647";"13/11/1985";"CONTRATO TEMPORARIO";"JXXIII";"COORDENACAO DA ORTOPEDIA";"MED";"MEDICO ORTOPEDISTA E TRAUMATOLOGISTA";"III";"A";"01/03/2022";"2022/03/01 00:00:00";"2023/02/28 00:00:00"
15030794;1;"BRUNO VICTOR DA COSTA";"11695172698";"29/03/1992";"CONTRATO TEMPORARIO";"JXXIII";"COORDENACAO DE URGENCIA E EMERGENCIA ADULTO";"MED";"MEDICO NEUROCIRURGIAO";"III";"A";"22/10/2021";"2021/10/22 00:00:00";"2023/06/30 00:00:00"
14458616;2;"BRUNO VINHAS LOPES MANINI";"11218968630";"28/10/1992";"CONTRATO TEMPORARIO";"JXXIII";"COORDENACAO DE COMPRAS E CONTRATOS";"TOS";"AUXILIAR ADMINISTRATIVO";"I";"A";"01/02/2022";"2022/02/01 00:00:00";"2023/01/31 00:00:00"
14929533;1;"BRUNO ZICA DA CUNHA";"10486872602";NA;"CONTRATO TEMPORARIO";"CHPB";NA;"MEDRE";"MEDICO";"I";"A";NA;"2021/03/01 00:00:00";"2023/02/28 00:00:00"
14882377;3;"CAETANO RARO RESENDE BORBA";"07189876677";NA;"CONTRATO TEMPORARIO";"HEM";NA;"MED";"MEDICO CLINICO";"III";"A";NA;"2022/07/03 00:00:00";"2023/07/02 00:00:00"
14889422;1;"CAIO FABIO FREITAS ROCHA";"13710927617";"20/12/1996";"CONTRATO TEMPORARIO";"HRAD";"COORDENACAO DAS UNIDADES DE INTERNACAO";"PENF";"TECNICO DE ENFERMAGEM";"II";"A";"0000-00-00";"2022/07/03 00:00:00";"2023/07/02 00:00:00"
13616289;2;"CAIO FREITAS DE LIMA";"08718835627";"10/05/1989";"CONTRATO TEMPORARIO";"MOV";"COORDENACAO DA GINECOLOGIA E OBSTETRICIA";"MED";"MEDICO GINECOLOGISTA";"III";"A";"05/02/2022";"2022/02/05 00:00:00";"2023/02/04 00:00:00"
15289556;1;"CAIO GONCALVES NOGUEIRA";"08509554676";"11/11/1988";"CONTRATO TEMPORARIO";"JXXIII";"COORDENACAO MEDICA DA UNIDADE DE TOXICOLOGIA";"MED";"MEDICO CLINICO";"III";"A";"04/07/2022";"2022/07/04 00:00:00";"2023/07/03 00:00:00"
15336597;1;"CAIO HENRIQUE MACEDO CAMARGOS DE OLIVEIR";"01827483679";"21/04/1995";"CONTRATO TEMPORARIO";"HIJPII";"COORDENACAO DA CENTRAL DE MATERIAL E ESTERILIZACAO";"PENF";"ENFERMEIRO";"IV";"A";"26/09/2022";"2022/09/26 00:00:00";"2023/09/25 00:00:00"
14626386;1;"CAIO RIBEIRO DA SILVA";"09568991611";"25/01/1996";"CONTRATO TEMPORARIO";"HRJP";"DIRETORIA GERAL";"TOS";"AUXILIAR ADMINISTRATIVO";"I";"A";"01/02/2022";"2022/01/31 00:00:00";"2023/01/30 00:00:00"
14937726;1;"CAIO SEMENSATO BORGES";"06285705976";NA;"CONTRATO TEMPORARIO";"JXXIII";NA;"MEDRE";"MEDICO";"I";"A";NA;"2021/03/01 00:00:00";"2023/02/28 00:00:00"
14624787;2;"CAIO TEIXEIRA LADEIA E SILVA";"07316827696";NA;"CONTRATO TEMPORARIO";"HAC";NA;"MEDRE";"MEDICO";"I";"A";NA;"2020/03/01 00:00:00";"2023/02/28 00:00:00"
14934400;1;"CAIQUE MENEZES DUTRA";"06362609689";NA;"CONTRATO TEMPORARIO";"HJK";NA;"MEDRE";"MEDICO";"I";"A";NA;"2021/03/01 00:00:00";"2023/02/28 00:00:00"
14610026;2;"CAMILA ARAUJO";"10604780648";NA;"CONTRATO TEMPORARIO";"IRS";NA;"MEDRE";"MEDICO";"I";"A";NA;"2020/03/01 00:00:00";"2023/02/28 00:00:00"
15288004;1;"CAMILA AZEVEDO VERSIANI";"10839145616";"04/06/1993";"CONTRATO TEMPORARIO";"CSSI";"COORDENACAO DA UNIDADE DE PACIENTES EXTERNOS";"MED";"MEDICO GENERALISTA";"I";"A";"09/07/2022";"2022/07/05 00:00:00";"2022/12/31 00:00:00"
14987382;2;"CAMILA BARBOSA ARAUJO";"08271698680";"31/12/1989";"CONTRATO TEMPORARIO";"HRAD";"COORDENACAO DE APOIO DIAGNOSTICO E TERAPEUTICO";"AGAS";"BIOQUIMICO";"I";"A";"0000-00-00";"2022/05/23 00:00:00";"2023/05/22 00:00:00"
15082787;1;"CAMILA CECILIA DE OLIVEIRA CORBELLI";"06979817620";"25/10/1989";"CONTRATO TEMPORARIO";"JXXIII";"COORDENACAO DE URGENCIA E EMERGENCIA ADULTO";"MED";"MEDICO CLINICO";"III";"A";"01/07/2022";"2022/07/01 00:00:00";"2023/06/30 00:00:00"
14613103;2;"CAMILA COSTA NAZARETH";"10599573619";"27/02/1990";"CONTRATO TEMPORARIO";"HEM";"COORDENACAO DE ASSISTENCIA FARMACEUTICA";"TOS";"AUXILIAR ADMINISTRATIVO";"I";"A";"26/02/2018";"2022/02/01 00:00:00";"2023/01/31 00:00:00"
15123011;1;"CAMILA DE SANTANA MARINHO";"06229577674";NA;"CONTRATO TEMPORARIO";"HRJP";NA;"MEDRE";"MEDICO";"I";"A";NA;"2022/03/01 00:00:00";"2023/02/28 00:00:00"
14823413;4;"CAMILA DINIZ PIMENTA";"05511173622";"29/01/1982";"CONTRATO TEMPORARIO";"JXXIII";"COORDENACAO DO BLOCO CIRURGICO";"MED";"MEDICO ANESTESIOLOGISTA";"III";"A";"04/07/2022";"2022/07/04 00:00:00";"2023/07/03 00:00:00"
14823413;3;"CAMILA DINIZ PIMENTA";"05511173622";NA;"CONTRATO TEMPORARIO";"JXXIII";NA;"MED";"MEDICO ANESTESIOLOGISTA";"III";"A";NA;"2022/02/25 00:00:00";"2023/02/24 00:00:00"
14637672;1;"CAMILA EMMANUELE PEREIRA CARDOSO";"09398387611";"07/01/1990";"CONTRATO TEMPORARIO";"HJK";"COORDENACAO MEDICA DA TERAPIA INTENSIVA NEONATAL";"PENF";"ENFERMEIRO";"IV";"A";"14/02/2022";"2022/02/14 00:00:00";"2023/02/13 00:00:00"
14338354;1;"CAMILA EUSTAQUIO MENDES";"05498205660";"30/08/1983";"CONTRATO TEMPORARIO";"HJK";"COORDENACAO DE INTERNACAO - ADULTO";"PENF";"ENFERMEIRO";"IV";"A";"03/02/2022";"2022/02/03 00:00:00";"2023/02/02 00:00:00"
15068158;1;"CAMILA FLAVIA CARMO MACHADO PEREIRA";"06581932604";"06/11/1985";"CONTRATO TEMPORARIO";"CSSI";"COORDENACAO DE APOIO DIAGNOSTICO E TERAPEUTICO";"AGAS";"BIOQUIMICO";"I";"A";"01/02/2022";"2022/02/01 00:00:00";"2023/01/31 00:00:00"
14938369;1;"CAMILA GOMES DE PAULA";"10155728636";"20/06/1988";"CONTRATO TEMPORARIO";"MOV";"COORDENACAO DA GINECOLOGIA E OBSTETRICIA";"PENF";"ENFERMEIRO";"IV";"A";"17/03/2021";"2021/03/17 00:00:00";"2023/03/16 00:00:00"
14882336;3;"CAMILA LAGE GUERRA";"09385386670";NA;"CONTRATO TEMPORARIO";"HEM";NA;"MED";"MEDICO CLINICO";"III";"A";NA;"2022/07/06 00:00:00";"2023/01/01 00:00:00"
14950158;1;"CAMILA LANZA DE CASTRO";"10442106645";NA;"CONTRATO TEMPORARIO";"JXXIII";NA;"MEDRE";"MEDICO";"I";"A";NA;"2021/03/01 00:00:00";"2023/02/28 00:00:00"
12801296;2;"CAMILA MACHADO DE OLIVEIRA";"04402675600";"25/05/1978";"CONTRATO TEMPORARIO";"HJK";"COORDENACAO DO LABORATORIO";"PENF";"TECNICO DE ENFERMAGEM";"II";"A";"28/11/2022";"2022/11/28 00:00:00";"2023/11/27 00:00:00"
15279219;1;"CAMILA QUEIROZ DE SOUZA";"05931250611";"10/03/1983";"CONTRATO TEMPORARIO";"HJK";"COORDENACAO DE INTERNACAO - ADULTO";"PENF";"ENFERMEIRO";"IV";"A";"13/07/2022";"2022/07/08 00:00:00";"2023/07/07 00:00:00"
14755763;5;"CAMILA RIBEIRO BORGES";"08903627695";"11/04/1995";"CONTRATO TEMPORARIO";"HRAD";"COORDENACAO DA UNIDADE DE PACIENTES EXTERNOS";"MED";"MEDICO CLINICO";"III";"A";"0000-00-00";"2022/02/07 00:00:00";"2023/02/06 00:00:00"
14755763;3;"CAMILA RIBEIRO BORGES";"08903627695";NA;"CONTRATO TEMPORARIO";"HRAD";NA;"MED";"MEDICO CLINICO";"III";"A";NA;"2022/07/05 00:00:00";"2022/12/31 00:00:00"
14887327;1;"CAMILA RITA DE SOUZA BERTOLONI";"34973215830";NA;"CONTRATO TEMPORARIO";"HRAD";NA;"MEDRE";"MEDICO";"I";"A";NA;"2020/03/02 00:00:00";"2023/03/01 00:00:00"
13898119;2;"CAMILA ROCHA MARTINS";"07572586627";"24/10/1985";"CONTRATO TEMPORARIO";"HJK";"COORDENACAO MEDICA DA TERAPIA INTENSIVA NEONATAL";"MED";"MEDICO PEDIATRA";"III";"A";"02/02/2022";"2022/02/02 00:00:00";"2023/02/01 00:00:00"
13004346;4;"CAMILA SEGALL COUTO";"01196026602";"17/05/1981";"CONTRATO TEMPORARIO";"JXXIII";"COORDENACAO DA UNIDADE DE TERAPIA INTENSIVA PEDIATRICA";"MED";"MEDICO EM MEDICINA INTENSIVA REGULADOR C";"III";"A";"10/02/2022";"2022/02/10 00:00:00";"2023/02/09 00:00:00"
15270291;1;"CAMILA THAISA DA SILVA ARAUJO";"09761645665";"13/07/1989";"CONTRATO TEMPORARIO";"JXXIII";"COORDENACAO DE LABORATORIO E AGENCIA TRANSFUSIONAL";"TOS";"TECNICO EM PATOLOGIA CLINICA";"II";"A";"01/07/2022";"2022/07/01 00:00:00";"2022/12/27 00:00:00"
14899686;3;"CAMILA ZANON DE CASTRO LIMA";"06760267613";"18/11/1986";"CONTRATO TEMPORARIO";"JXXIII";"COORDENACAO MEDICA DA UNIDADE DE TOXICOLOGIA";"MED";"MEDICO CLINICO";"III";"A";"13/02/2022";"2022/02/13 00:00:00";"2023/02/12 00:00:00"
14662589;2;"CARELL PERES MARRA";"10747387648";"13/06/1991";"CONTRATO TEMPORARIO";"HRAD";"COORDENACAO DA UNIDADE DE PACIENTES EXTERNOS";"MED";"MEDICO CIRURGIAO GERAL";"III";"A";"0000-00-00";"2021/12/23 00:00:00";"2023/06/30 00:00:00"
15102312;1;"CARINA BARBOSA DE ALMEIDA ROSA";"05372428643";"12/11/1979";"CONTRATO TEMPORARIO";"JXXIII";"COORDENACAO DA UNIDADE DE TERAPIA INTENSIVA PEDIATRICA";"PENF";"TECNICO DE ENFERMAGEM";"II";"A";"01/02/2022";"2022/02/01 00:00:00";"2023/01/31 00:00:00"
14893358;1;"CARINA DUTRA DE OLIVEIRA";"03955391612";"26/04/1979";"CONTRATO TEMPORARIO";"HJK";"COORDENACAO MEDICA DA URGENCIA E EMERGENCIA";"PENF";"TECNICO DE ENFERMAGEM";"II";"A";"03/02/2022";"2022/02/06 00:00:00";"2023/02/05 00:00:00"
10905388;3;"CARINA MARIA PIMENTA";"05019459623";"18/06/1980";"CONTRATO TEMPORARIO";"MOV";"COORDENACAO DA UNIDADE DE NEONATOLOGIA";"PENF";"ENFERMEIRO";"IV";"A";"09/02/2022";"2022/02/09 00:00:00";"2023/02/08 00:00:00"
14963409;1;"CARINE ALVES DA COSTA MARINHO";"08057299681";"05/07/1988";"CONTRATO TEMPORARIO";"JXXIII";"COORDENACAO DA UNIDADE DE TERAPIA INTENSIVA ADULTO";"PENF";"ENFERMEIRO";"IV";"A";"14/05/2021";"2021/05/17 00:00:00";"2023/06/30 00:00:00"
15072408;1;"CARLA ANGELICA MOURA";"05546181680";"10/11/1980";"CONTRATO TEMPORARIO";"IRS";"COORDENACAO DAS UNIDADES DE INTERNACAO";"PENF";"TECNICO DE ENFERMAGEM";"II";"A";"02/02/2022";"2022/02/02 00:00:00";"2023/02/01 00:00:00"
14566400;1;"CARLA ASSRAUI FERNANDES DA SILVA";"95331042600";"25/01/1975";"CONTRATO TEMPORARIO";"HJK";"COORDENACAO DO LABORATORIO";"TOS";"TECNICO EM PATOLOGIA CLINICA";"II";"A";"02/02/2022";"2022/02/02 00:00:00";"2023/02/01 00:00:00"
13800206;2;"CARLA CRISTINA DA SILVA OLIVEIRA";"04619932604";"20/05/1977";"CONTRATO TEMPORARIO";"HGB-JA";"COORDENACAO DA UNIDADE DE URGENCIA E EMERGENCIA";"PENF";"TECNICO DE ENFERMAGEM";"II";"A";"18/03/2021";"2021/03/18 00:00:00";"2023/03/17 00:00:00"
15210420;1;"CARLA CRISTINA FIRMO";"08738247682";"06/07/1985";"CONTRATO TEMPORARIO";"HRAD";"COORDENACAO DAS UNIDADES DE INTERNACAO";"PENF";"TECNICO DE ENFERMAGEM";"II";"A";"0000-00-00";"2022/05/11 00:00:00";"2023/05/10 00:00:00"
14894232;1;"CARLA FABIANA DE PAULA";"03803925690";"06/09/1977";"CONTRATO TEMPORARIO";"MOV";"COORDENACAO DE INFRAESTRUTURA";"TOS";"AUXILIAR ADMINISTRATIVO";"I";"A";"04/07/2022";"2022/07/04 00:00:00";"2023/07/03 00:00:00"
15189442;1;"CARLA GRAZIELLI SOARES DE ALMEIDA BRANDA";"08978582630";NA;"CONTRATO TEMPORARIO";"JXXIII";NA;"MEDRE";"MEDICO";"I";"A";NA;"2022/03/01 00:00:00";"2023/02/28 00:00:00"
15083173;1;"CARLA MARIA BASTOS DE ARAUJO";"06689182681";"21/08/1981";"CONTRATO TEMPORARIO";"HGB-JA";"COORDENACAO DA UNIDADE DE URGENCIA E EMERGENCIA";"PENF";"TECNICO DE ENFERMAGEM";"II";"A";"02/02/2022";"2022/02/02 00:00:00";"2023/01/01 00:00:00"
15116338;1;"CARLA MARIA SANTOS";"11896595650";"04/08/1994";"CONTRATO TEMPORARIO";"JXXIII";"COORDENACAO DAS UNIDADES DE INTERNACAO CIRURGICA DE RETAGUARDA";"PENF";"TECNICO DE ENFERMAGEM";"II";"A";"03/02/2022";"2022/02/03 00:00:00";"2023/02/02 00:00:00"
14498513;3;"CARLA MEIRE COSTA";"79226760691";"24/10/1969";"CONTRATO TEMPORARIO";"JXXIII";"COORDENACAO DA UNIDADE DE TERAPIA INTENSIVA ADULTO";"PENF";"TECNICO DE ENFERMAGEM";"II";"A";"02/02/2022";"2022/02/02 00:00:00";"2023/02/01 00:00:00"
14850036;2;"CARLA ORNELAS RIBEIRO";"95313060600";"10/09/1973";"CONTRATO TEMPORARIO";"JXXIII";"COORDENACAO DA UNIDADE DE TERAPIA INTENSIVA ADULTO";"PENF";"TECNICO DE ENFERMAGEM";"II";"A";"03/03/2022";"2022/03/03 00:00:00";"2023/03/02 00:00:00"
12533204;1;"CARLA PAULA DUARTE";"04122645603";"15/01/1979";"CONTRATO TEMPORARIO";"CMT";"GERENCIA ASSISTENCIAL";"PENF";"ENFERMEIRO";"IV";"A";"27/06/2022";"2022/06/27 00:00:00";"2023/06/26 00:00:00"
14273718;3;"CARLA ROBERTA SANTOS FERREIRA";"00355693607";"09/09/1975";"CONTRATO TEMPORARIO";"HJK";"COORDENACAO DE INTERNACAO - ADULTO";"PENF";"TECNICO DE ENFERMAGEM";"II";"A";"03/02/2022";"2022/02/03 00:00:00";"2023/02/02 00:00:00"
14590723;3;"CARLINDA NASARE JALES FERREIRA";"00511796609";"20/11/1960";"CONTRATO TEMPORARIO";"JXXIII";"COORDENACAO DE LABORATORIO E AGENCIA TRANSFUSIONAL";"TOS";"TECNICO EM PATOLOGIA CLINICA";"II";"A";"04/03/2022";"2022/03/04 00:00:00";"2023/03/03 00:00:00"
14590707;1;"CARLOS ANTONIO GONCALVES JUNIOR";"05482595692";"08/04/1981";"CONTRATO TEMPORARIO";"JXXIII";"COORDENACAO DO BLOCO CIRURGICO";"TOS";"AUXILIAR ADMINISTRATIVO";"I";"A";"01/02/2022";"2022/02/01 00:00:00";"2023/01/31 00:00:00"
10889301;2;"CARLOS EDUARDO B R MARQUES";"03272986693";"21/03/1977";"CONTRATO TEMPORARIO";"HEM";"COORDENACAO DAS UNIDADES DE INTERNACAO";"PENF";"ENFERMEIRO";"IV";"A";"28/11/2022";"2022/11/28 00:00:00";"2023/11/27 00:00:00"
2925733;3;"CARLOS EDUARDO COELHO SEIXAS";"34490973691";"25/07/1957";"CONTRATO TEMPORARIO";"HAC";"COORDENACAO DE SAUDE DO TRABALHADOR";"MED";"MEDICO CLINICO";"III";"A";"07/02/2022";"2022/02/07 00:00:00";"2023/02/06 00:00:00"
12424768;3;"CARLOS EDUARDO LAGES BELEM";"07257616604";"10/05/1984";"CONTRATO TEMPORARIO";"CEPAI";"COORDENACAO DE INTERNACAO E AMBULATORIO";"MED";"MEDICO PSIQUIATRA";"III";"A";"01/02/2022";"2022/02/01 00:00:00";"2023/01/31 00:00:00"
12968988;1;"CARLOS EDUARDO MATOS PEREIRA";"01077728689";"06/08/1973";"CONTRATO TEMPORARIO";"CMT";"GERENCIA ADMINISTRATIVA";"TOS";"AUXILIAR ADMINISTRATIVO";"I";"A";"04/07/2022";"2022/07/04 00:00:00";"2023/07/03 00:00:00"
14575740;2;"CARLOS GABRIEL NEVES SANTANA DE BRITO";"08426789641";"08/04/1988";"CONTRATO TEMPORARIO";"JXXIII";"COORDENACAO DE URGENCIA E EMERGENCIA ADULTO";"PENF";"ENFERMEIRO";"IV";"A";"11/03/2022";"2022/03/11 00:00:00";"2023/03/10 00:00:00"
11771185;5;"CARLOS VIEIRA LOPES";"45293392620";"27/12/1961";"CONTRATO TEMPORARIO";"JXXIII";"COORDENACAO DO BLOCO CIRURGICO";"MED";"MEDICO ANESTESIOLOGISTA";"III";"A";"24/01/2022";"2022/01/24 00:00:00";"2023/01/23 00:00:00"
11385564;6;"CARMEM ROSE GENEROSO DA ROCHA";"93566964620";"03/05/1973";"CONTRATO TEMPORARIO";"HAC";"COORDENACAO DE INTERNACAO - ONCOLOGICA";"PENF";"TECNICO DE ENFERMAGEM";"II";"A";"10/02/2022";"2022/02/10 00:00:00";"2023/02/09 00:00:00"
15173958;1;"CAROLINA BELFORT RESENDE FONSECA";"06778363681";NA;"CONTRATO TEMPORARIO";"HEM";NA;"MEDRE";"MEDICO";"I";"A";NA;"2022/03/07 00:00:00";"2023/03/06 00:00:00"
14899603;4;"CAROLINA BERZOINI ALBUQUERQUE";"11706142641";"03/02/1992";"CONTRATO TEMPORARIO";"HRJP";"COORDENACAO DAS UNIDADES CRITICAS";"MED";"MEDICO NEONATOLOGISTA";"III";"A";"15/12/2021";"2021/12/15 00:00:00";"2023/06/30 00:00:00"
14899603;3;"CAROLINA BERZOINI ALBUQUERQUE";"11706142641";"03/02/1992";"CONTRATO TEMPORARIO";"HRJP";"COORDENACAO DAS UNIDADES CRITICAS";"MED";"MEDICO PEDIATRA";"III";"A";"10/05/2021";"2021/05/07 00:00:00";"2023/05/06 00:00:00"
11909439;4;"CAROLINA BORGES RODRIGUES";"06174831671";"13/01/1984";"CONTRATO TEMPORARIO";"HGB-JA";"COORDENACAO DA UNIDADE DE URGENCIA E EMERGENCIA";"PENF";"ENFERMEIRO";"IV";"A";"01/09/2021";"2021/09/01 00:00:00";"2023/06/30 00:00:00"
14979769;2;"CAROLINA CAMPOS TABOADA NEVES";"01495180646";NA;"CONTRATO TEMPORARIO";"JXXIII";NA;"PENF";"TECNICO DE ENFERMAGEM";"II";"A";NA;"2022/03/09 00:00:00";"2023/03/08 00:00:00"
11304060;3;"CAROLINA CASTIGLIONI DE SA";"09091260700";"14/04/1980";"CONTRATO TEMPORARIO";"HJK";"COORDENACAO DA MATERNIDADE";"MED";"MEDICO GINECOLOGISTA";"III";"A";"23/04/2021";"2021/04/23 00:00:00";"2023/04/22 00:00:00"
13857461;4;"CAROLINA CUNHA CEZARIO";"08247443651";"31/03/1989";"CONTRATO TEMPORARIO";"MOV";"COORDENACAO DA UNIDADE DE NEONATOLOGIA";"MED";"MEDICO NEONATOLOGISTA";"III";"A";"01/10/2021";"2021/10/01 00:00:00";"2023/06/30 00:00:00"
14666945;2;"CAROLINA DE SOUZA BERNUCCI";"08985882600";"20/10/1986";"CONTRATO TEMPORARIO";"MOV";"COORDENACAO DE APOIO DIAGNOSTICO E TERAPEUTICO";"TOS";"AUXILIAR ADMINISTRATIVO";"I";"A";"28/01/2022";"2022/01/28 00:00:00";"2023/01/27 00:00:00"
14963912;2;"CAROLINA FERREIRA MOTA";"08322387679";"04/04/1986";"CONTRATO TEMPORARIO";"HJK";"COORDENACAO MEDICA DA URGENCIA E EMERGENCIA";"PENF";"TECNICO DE ENFERMAGEM";"II";"A";"23/02/2022";"2022/02/23 00:00:00";"2023/02/22 00:00:00"
15117526;1;"CAROLINA GUIMARAES CAETANO";"10905801695";NA;"CONTRATO TEMPORARIO";"HJK";NA;"MEDRE";"MEDICO";"I";"A";NA;"2022/03/01 00:00:00";"2023/02/28 00:00:00"
14142111;3;"CAROLINA LOPES DE MELO";"06551006604";"07/04/1985";"CONTRATO TEMPORARIO";"JXXIII";"COORDENACAO DAS UNIDADES DE INTERNACAO PEDIATRICA";"MED";"MEDICO PEDIATRA";"III";"A";"06/03/2022";"2022/03/07 00:00:00";"2023/03/06 00:00:00"
14755888;4;"CAROLINA MARQUES RAMOS";"04033355154";"28/10/1993";"CONTRATO TEMPORARIO";"HJK";"COORDENACAO DA UNIDADE DE TERAPIA INTENSIVA ADULTO";"MED";"MEDICO CLINICO";"III";"A";"05/08/2021";"2021/08/05 00:00:00";"2023/06/30 00:00:00"
14883193;2;"CAROLINA MARTINELLI MASCARENHAS DE LUCEN";"12461592608";"20/08/1994";"CONTRATO TEMPORARIO";"HIJPII";"COORDENACAO DE URGENCIA E EMERGENCIA PEDIATRICA";"MED";"MEDICO GENERALISTA";"I";"A";"01/07/2022";"2022/07/01 00:00:00";"2023/06/30 00:00:00"
14883193;1;"CAROLINA MARTINELLI MASCARENHAS DE LUCEN";"12461592608";NA;"CONTRATO TEMPORARIO";"HIJPII";NA;"MEDRE";"MEDICO";"I";"A";NA;"2020/03/01 00:00:00";"2023/02/28 00:00:00"
14875835;3;"CAROLINA MENDONCA DE GOFFREDO COSTA DOS";"10405484666";"27/08/1990";"CONTRATO TEMPORARIO";"JXXIII";"COORDENACAO DO BLOCO CIRURGICO";"MED";"MEDICO CLINICO";"III";"A";"06/03/2022";"2022/03/06 00:00:00";"2023/03/05 00:00:00"
15124050;1;"CAROLINA NOGUEIRA DE SAO JOSE";"12919740679";NA;"CONTRATO TEMPORARIO";"MOV";NA;"MEDRE";"MEDICO";"I";"A";NA;"2022/03/07 00:00:00";"2023/03/06 00:00:00"
15119449;1;"CAROLINA TRISTAO BOREM";"06476639617";NA;"CONTRATO TEMPORARIO";"HIJPII";NA;"MEDRE";"MEDICO";"I";"A";NA;"2022/03/01 00:00:00";"2023/02/28 00:00:00"
15125644;1;"CAROLINE ALVES NAKAMURA";"10197732607";NA;"CONTRATO TEMPORARIO";"JXXIII";NA;"MEDRE";"MEDICO";"I";"A";NA;"2022/03/01 00:00:00";"2023/02/28 00:00:00"
14950166;2;"CAROLINE DA SILVA FELICIANO";"12885127678";"19/12/1996";"CONTRATO TEMPORARIO";"JXXIII";"COORDENACAO DA UNIDADE DE TERAPIA INTENSIVA ADULTO";"MED";"MEDICO GENERALISTA";"I";"A";"01/07/2022";"2022/07/01 00:00:00";"2023/06/30 00:00:00"
14950166;1;"CAROLINE DA SILVA FELICIANO";"12885127678";NA;"CONTRATO TEMPORARIO";"JXXIII";NA;"MEDRE";"MEDICO";"I";"A";NA;"2021/03/01 00:00:00";"2023/02/28 00:00:00"
15142664;1;"CAROLINE DALVA MAGALHAES MEDEIROS";"12422429610";NA;"CONTRATO TEMPORARIO";"HRAD";NA;"MEDRE";"MEDICO";"I";"A";NA;"2022/03/01 00:00:00";"2023/02/28 00:00:00"
14912992;2;"CAROLINE ROCHA";"07708045606";"09/08/1986";"CONTRATO TEMPORARIO";"MOV";"COORDENACAO DA UNIDADE DE NEONATOLOGIA";"PENF";"ENFERMEIRO";"VI";"A";"21/04/2022";"2022/04/21 00:00:00";"2023/04/20 00:00:00"
13404850;4;"CAROLINE SAN SEVERINO TEIXEIRA";"09197646652";"12/10/1988";"CONTRATO TEMPORARIO";"JXXIII";"COORDENACAO DA UNIDADE DE TERAPIA INTENSIVA ADULTO";"AGAS";"NUTRICIONISTA";"I";"A";"03/03/2022";"2022/03/03 00:00:00";"2023/03/02 00:00:00"
14614390;2;"CAROLINE VIEIRA DE FREITAS";"09502522630";"26/07/1989";"CONTRATO TEMPORARIO";"MOV";"COORDENACAO DA GINECOLOGIA E OBSTETRICIA";"MED";"MEDICO OBSTETRA";"III";"A";"04/02/2022";"2022/02/04 00:00:00";"2023/02/03 00:00:00"
14934228;3;"CAROLINE VIEIRA FIGUEIREDO";"10200631659";"03/05/1991";"CONTRATO TEMPORARIO";"HAC";"COORDENACAO DO AMBULATORIO";"MED";"MEDICO GENERALISTA";"I";"A";"15/09/2021";"2021/09/15 00:00:00";"2023/06/30 00:00:00"
14934228;2;"CAROLINE VIEIRA FIGUEIREDO";"10200631659";NA;"CONTRATO TEMPORARIO";"HJK";NA;"MEDRE";"MEDICO";"I";"A";NA;"2021/03/01 00:00:00";"2023/02/28 00:00:00"
14581797;1;"CASSIA ADRIANA FERREIRA FIRMINO";"97892602615";"21/07/1971";"CONTRATO TEMPORARIO";"";"(DESAT.)GERENCIA DE INFRAESTRUTURA PREDIAL";"TOS";"AUXILIAR ADMINISTRATIVO";"I";"A";"04/02/2022";"2022/02/04 00:00:00";"2023/02/03 00:00:00"
10482131;5;"CASSIA CRISTINA P MENDICINO";"64732819672";"20/07/1970";"CONTRATO TEMPORARIO";"HEM";"COORDENACAO DE APOIO DIAGNOSTICO E TERAPEUTICO";"AGAS";"FARMACEUTICO";"I";"A";"31/05/2021";"2021/05/31 00:00:00";"2023/05/30 00:00:00"
15156359;1;"CASSIO DE PADUA BRAGA";"08881705648";"04/08/1989";"CONTRATO TEMPORARIO";"JXXIII";"COORDENACAO DE URGENCIA E EMERGENCIA ADULTO";"MED";"MEDICO ORTOPEDISTA E TRAUMATOLOGISTA";"III";"A";"03/03/2022";"2022/03/03 00:00:00";"2023/03/02 00:00:00"
14053458;2;"CASSIO EMANUEL FIDELIS";"96160209604";"12/05/1973";"CONTRATO TEMPORARIO";"HEM";"COORDENACAO DA UNIDADE DE PACIENTES EXTERNOS";"PENF";"TECNICO DE ENFERMAGEM";"II";"A";"04/07/2022";"2022/07/01 00:00:00";"2023/06/30 00:00:00"
15068240;1;"CATARINA NUNES DA COSTA";"07573911688";"13/02/1986";"CONTRATO TEMPORARIO";"DIGEPE";"(DESAT.)GERENCIA DE PROVIMENTO E ADMINISTRACAO DE PESSOAL";"TOS";"AUXILIAR ADMINISTRATIVO";"I";"A";"01/02/2022";"2022/02/01 00:00:00";"2023/01/31 00:00:00"
14581128;3;"CATIA CARDOSO DE ARAUJO";"08964776658";"17/05/1988";"CONTRATO TEMPORARIO";"HIJPII";"COORDENACAO DO SERVICO DE NUTRICAO E DIETETICA";"AGAS";"NUTRICIONISTA";"I";"A";"09/02/2022";"2022/02/09 00:00:00";"2023/02/08 00:00:00"
14983704;2;"CATIA MARIA DE ALMEIDA";"06650192627";"21/02/1981";"CONTRATO TEMPORARIO";"HRJP";"COORDENACAO DE APOIO DIAGNOSTICO E TERAPEUTICO";"TOS";"TECNICO EM PATOLOGIA CLINICA";"II";"A";"01/07/2022";"2022/07/01 00:00:00";"2023/06/30 00:00:00"
14879266;3;"CECILIA FARIA WOLKARTT";"06345342629";NA;"CONTRATO TEMPORARIO";"HEM";NA;"MED";"MEDICO GENERALISTA";"I";"A";NA;"2022/07/05 00:00:00";"2022/12/31 00:00:00"
14879266;1;"CECILIA FARIA WOLKARTT";"06345342629";NA;"CONTRATO TEMPORARIO";"HEM";NA;"MEDRE";"MEDICO";"I";"A";NA;"2020/03/01 00:00:00";"2023/02/28 00:00:00"
14700843;1;"CELIA REZENDE SILVEIRA";"36020400620";"10/06/1957";"CONTRATO TEMPORARIO";"DIGEPE";"(DESAT.)GERENCIA DE SAUDE E SEGURANCA DO TRABALHADOR";"MED";"MEDICO DO TRABALHO";"III";"A";"01/02/2022";"2022/02/01 00:00:00";"2023/01/31 00:00:00"
11237302;2;"CELMA DOS SANTOS PILAR OLIVEIRA";"69922780615";"03/03/1965";"CONTRATO TEMPORARIO";"HGB-JA";"COORDENACAO DA UNIDADE CIRURGICA";"PENF";"TECNICO DE ENFERMAGEM";"II";"A";"17/11/2014";"2021/02/01 00:00:00";"2023/06/30 00:00:00"
15066889;2;"CELSO FIANCO";"78438373704";NA;"CONTRATO TEMPORARIO";"HRAD";NA;"MED";"MEDICO NEFROLOGISTA";"III";"A";NA;"2022/07/01 00:00:00";"2022/12/27 00:00:00"
15066889;1;"CELSO FIANCO";"78438373704";"24/02/1958";"CONTRATO TEMPORARIO";"HRAD";"COORDENACAO DA UNIDADE DE PACIENTES EXTERNOS";"MED";"MEDICO NEFROLOGISTA";"III";"A";"0000-00-00";"2022/01/03 00:00:00";"2023/01/02 00:00:00"
14130561;4;"CESAR AUGUSTO NUNES COSTA";"07289415620";"06/08/1990";"CONTRATO TEMPORARIO";"HJK";"COORDENACAO DE INTERNACAO - ADULTO";"MED";"MEDICO CLINICO";"III";"A";"03/08/2018";"2021/02/01 00:00:00";"2023/01/31 00:00:00"
14649792;2;"CESAR ERNESTO MAGALHAES DO AMARAL";"72785160649";"25/08/1966";"CONTRATO TEMPORARIO";"CSSFA";"COORDENACAO DA UNIDADE DE INTERNACAO E PACIENTES EXTERNOS";"MED";"MEDICO GENERALISTA";"I";"A";"03/05/2022";"2022/05/03 00:00:00";"2023/05/02 00:00:00"
14649792;1;"CESAR ERNESTO MAGALHAES DO AMARAL";"72785160649";"25/08/1966";"CONTRATO TEMPORARIO";"CSSFA";"COORDENACAO DA UNIDADE DE INTERNACAO E PACIENTES EXTERNOS";"MED";"MEDICO GENERALISTA";"I";"A";"11/05/2018";"2021/02/01 00:00:00";"2023/01/31 00:00:00"
14661136;3;"CHIRLEI APARECIDA DE SOUSA RODRIGUES";"04444862670";"07/06/1979";"CONTRATO TEMPORARIO";"HIJPII";"COORDENACAO DAS UNIDADES DE INTERNACAO PEDIATRICA";"PENF";"TECNICO DE ENFERMAGEM";"II";"A";"21/06/2022";"2022/06/21 00:00:00";"2023/01/20 00:00:00"
14794192;2;"CHRISTIANE DIVA CAMPOS VENEROSO";"07394272613";"18/05/1984";"CONTRATO TEMPORARIO";"HAC";"COORDENACAO DO AMBULATORIO";"MED";"MEDICO CIRURGIAO GERAL";"III";"A";"06/07/2019";"2021/02/01 00:00:00";"2023/01/31 00:00:00"
14801567;3;"CHRISTIANE PAULINA PINTO";"04547270627";"26/08/1979";"CONTRATO TEMPORARIO";"HJK";"COORDENACAO DO LABORATORIO";"AGAS";"FARMACEUTICO BIOQUIMICO";"I";"A";"09/03/2021";"2021/03/09 00:00:00";"2023/03/08 00:00:00"
4547270;0;"CHRISTIANE PAULINA PINTO";"04547270627";"0000-00-00";NA;"HAC";"COORDENACAO DO LABORATORIO";NA;"";NA;NA;"19/12/2022";NA;NA
14556559;3;"CHRISTIANY FERNANDES";"06469628680";"31/03/1985";"CONTRATO TEMPORARIO";"MOV";"COORDENACAO DA UNIDADE DE NEONATOLOGIA";"AGAS";"FISIOTERAPEUTA RESPIRATORIA";"III";"A";"21/09/2021";"2021/09/21 00:00:00";"2023/06/30 00:00:00"
15262215;1;"CHRISTIANY VITAL CASSIANO";"03550367627";"03/10/1977";"CONTRATO TEMPORARIO";"HRJP";"COORDENACAO DAS UNIDADES CRITICAS";"PENF";"TECNICO DE ENFERMAGEM";"II";"A";"02/07/2022";"2022/07/02 00:00:00";"2023/07/01 00:00:00"
13930714;2;"CHRISTOPHER ANDERSON CHAVES";"95664777672";"17/06/1974";"CONTRATO TEMPORARIO";"CSSFA";"COORDENACAO DA UNIDADE DE INTERNACAO E PACIENTES EXTERNOS";"MED";"MEDICO GENERALISTA";"I";"A";"28/05/2021";"2021/05/28 00:00:00";"2023/05/27 00:00:00"
14880678;1;"CICERO DUFRAYER CHICON";"13010676794";NA;"CONTRATO TEMPORARIO";"IRS";NA;"MEDRE";"MEDICO";"I";"A";NA;"2020/03/01 00:00:00";"2023/02/28 00:00:00"
15067051;1;"CINTHIA APARECIDA MORENO";"72439300691";"14/11/1968";"CONTRATO TEMPORARIO";"HIJPII";"COORDENACAO DA UNIDADE DE TERAPIA INTENSIVA PEDIATRICA";"AGAS";"ASSISTENTE SOCIAL";"I";"A";"01/02/2022";"2022/02/01 00:00:00";"2023/01/31 00:00:00"
15072598;1;"CINTHIA DE FATIMA REIS";"07596458688";"03/01/1984";"CONTRATO TEMPORARIO";"HRJP";"COORDENACAO DAS UNIDADES DE INTERNACAO";"PENF";"TECNICO DE ENFERMAGEM";"II";"A";"01/02/2022";"2022/02/01 00:00:00";"2023/01/31 00:00:00"
11592631;3;"CINTHIA MAYRE ANDRADE ROSA FERREIRA";"01521998612";"11/11/1985";"CONTRATO TEMPORARIO";"MOV";"COORDENACAO DA UNIDADE DE NEONATOLOGIA";"PENF";"ENFERMEIRO";"IV";"A";"02/02/2022";"2022/02/02 00:00:00";"2023/02/01 00:00:00"
14513402;2;"CINTHIA SANTOS";"03543762680";"11/04/1978";"CONTRATO TEMPORARIO";"HGB-JA";"COORDENACAO DE ENFERMAGEM E EQUIPE MULTIDISCIPLINAR";"AGAS";"ASSISTENTE SOCIAL";"I";"A";"07/01/2022";"2022/01/07 00:00:00";"2023/01/06 00:00:00"
15292014;1;"CINTIA ALVARENGA PEREIRA VIEIRA";"05398565680";"19/01/1984";"CONTRATO TEMPORARIO";"HIJPII";"COORDENACAO DO AMBULATORIO DE PEDIATRIA";"MED";"MEDICO NEUROLOGISTA";"III";"A";"01/07/2022";"2022/07/01 00:00:00";"2023/06/30 00:00:00"
13086558;3;"CINTIA APARECIDA GOMES DA SILVA MARTINS";"05662473641";"17/01/1983";"CONTRATO TEMPORARIO";"CEPAI";"COORDENACAO DE INTERNACAO E AMBULATORIO";"PENF";"TECNICO DE ENFERMAGEM";"II";"A";"28/06/2022";"2022/06/28 00:00:00";"2023/06/27 00:00:00"
14951578;2;"CINTIA CONCEICAO ALVES";"05949544609";"28/01/1985";"CONTRATO TEMPORARIO";"HEM";"COORDENACAO DA UNIDADE DE PACIENTES EXTERNOS";"PENF";"TECNICO DE ENFERMAGEM";"II";"A";"04/07/2022";"2022/07/04 00:00:00";"2023/07/03 00:00:00"
14951578;1;"CINTIA CONCEICAO ALVES";"05949544609";"28/01/1985";"CONTRATO TEMPORARIO";"HEM";"COORDENACAO DAS UNIDADES CRITICAS";"PENF";"TECNICO DE ENFERMAGEM";"II";"A";"01/04/2021";"2021/04/01 00:00:00";"2023/03/31 00:00:00"
14925689;1;"CINTIA DE ALMEIDA TOLEDO";"11449019609";NA;"CONTRATO TEMPORARIO";"MOV";NA;"MEDRE";"MEDICO";"I";"A";NA;"2021/03/01 00:00:00";"2023/02/28 00:00:00"
15289440;1;"CINTIA PEREIRA LOPES";"01545593698";NA;"CONTRATO TEMPORARIO";"HEM";NA;"AGAS";"FARMACEUTICO BIOQUIMICO";"I";"A";NA;"2022/07/03 00:00:00";"2022/12/29 00:00:00"
14811111;3;"CINTIA SILVA CARDOSO";"07367182650";"15/04/1985";"CONTRATO TEMPORARIO";"HEM";"COORDENACAO DAS UNIDADES DE INTERNACAO";"MED";"MEDICO INFECTOLOGISTA";"III";"A";"24/05/2021";"2021/05/24 00:00:00";"2023/05/23 00:00:00"
14930424;2;"CIRILO JOSE FERREIRA NETO";"11262973643";NA;"CONTRATO TEMPORARIO";"HEM";NA;"MED";"MEDICO GENERALISTA";"I";"A";NA;"2022/07/01 00:00:00";"2022/12/27 00:00:00"
14930424;1;"CIRILO JOSE FERREIRA NETO";"11262973643";NA;"CONTRATO TEMPORARIO";"HEM";NA;"MEDRE";"MEDICO";"I";"A";NA;"2021/03/01 00:00:00";"2023/02/28 00:00:00"
15119571;1;"CLARA BALMANT LETRO";"13072894604";NA;"CONTRATO TEMPORARIO";"HIJPII";NA;"MEDRE";"MEDICO";"I";"A";NA;"2022/03/01 00:00:00";"2023/02/28 00:00:00"
14613004;2;"CLARA COELHO CECATO";"10829252681";"21/09/1991";"CONTRATO TEMPORARIO";"MOV";"COORDENACAO DA GINECOLOGIA E OBSTETRICIA";"MED";"MEDICO GINECOLOGISTA";"III";"A";"01/07/2022";"2022/07/01 00:00:00";"2022/12/27 00:00:00"
14540967;2;"CLARA DE MEDEIROS RONDAS";"10590408674";"30/07/1989";"CONTRATO TEMPORARIO";"HIJPII";"COORDENACAO DE URGENCIA E EMERGENCIA PEDIATRICA";"PENF";"ENFERMEIRO";"IV";"A";"04/07/2022";"2022/07/04 00:00:00";"2023/06/30 00:00:00"
14939219;1;"CLARA MAGALHAES PRATES CRUZ";"09707790628";NA;"CONTRATO TEMPORARIO";"HRAD";NA;"MEDRE";"MEDICO";"I";"A";NA;"2021/03/01 00:00:00";"2023/02/28 00:00:00"
14925663;1;"CLARA VIEIRA MAGALHAES";"13190384681";NA;"CONTRATO TEMPORARIO";"MOV";NA;"MEDRE";"MEDICO";"I";"A";NA;"2021/03/01 00:00:00";"2023/02/28 00:00:00"
14896856;1;"CLARICE ALVES DOS SANTOS";"86408747604";"27/10/1970";"CONTRATO TEMPORARIO";"HEM";"COORDENACAO DAS UNIDADES CRITICAS";"PENF";"TECNICO DE ENFERMAGEM";"II";"A";"01/07/2022";"2022/07/01 00:00:00";"2023/06/30 00:00:00"
14904023;1;"CLARICE APARECIDA GUADANINI";"09397637614";"10/10/1989";"CONTRATO TEMPORARIO";"HJK";"COORDENACAO DO LABORATORIO";"PENF";"TECNICO DE ENFERMAGEM";"II";"A";"08/02/2022";"2022/02/10 00:00:00";"2023/02/09 00:00:00"
12535308;3;"CLARICE DE JESUS DIAS";"05185703636";"27/03/1982";"CONTRATO TEMPORARIO";"HEM";"COORDENACAO DAS UNIDADES DE INTERNACAO";"PENF";"ENFERMEIRO";"IV";"A";"03/07/2022";"2022/07/03 00:00:00";"2023/07/02 00:00:00"
15126048;1;"CLARINA LOUIS SILVA MEIRA";"03642088210";NA;"CONTRATO TEMPORARIO";"JXXIII";NA;"MEDRE";"MEDICO";"I";"A";NA;"2022/03/01 00:00:00";"2023/02/28 00:00:00"
12397766;3;"CLAUDEMIR CARDOSO BENEDITO MENDES";"01207235652";"28/04/1980";"CONTRATO TEMPORARIO";"HRJP";"COORDENACAO DAS UNIDADES DE INTERNACAO";"PENF";"TECNICO DE ENFERMAGEM";"II";"A";"02/07/2022";"2022/07/02 00:00:00";"2023/07/01 00:00:00"
12397766;2;"CLAUDEMIR CARDOSO BENEDITO MENDES";"01207235652";"28/04/1980";"CONTRATO TEMPORARIO";"HRJP";"COORDENACAO DAS UNIDADES DE INTERNACAO";"PENF";"TECNICO DE ENFERMAGEM";"II";"A";"28/06/2022";"2022/06/28 00:00:00";"2023/06/27 00:00:00"
14051783;2;"CLAUDETE AUGUSTA CARNEIRO";"78622590682";"31/08/1967";"CONTRATO TEMPORARIO";"CSSFE";"COORDENACAO DA UNIDADE DE CUIDADO AO ADULTO";"PENF";"TECNICO DE ENFERMAGEM";"II";"A";"01/07/2021";"2021/07/01 00:00:00";"2023/06/30 00:00:00"
13775747;2;"CLAUDIA APARECIDA DA SILVA";"93318677604";"18/11/1972";"CONTRATO TEMPORARIO";"HJK";"COORDENACAO MEDICA DA URGENCIA E EMERGENCIA";"PENF";"TECNICO DE ENFERMAGEM";"II";"A";"05/07/2022";"2022/07/05 00:00:00";"2023/07/04 00:00:00"
11262375;4;"CLAUDIA APARECIDA MOREIRA";"82968764691";"10/12/1974";"CONTRATO TEMPORARIO";"HGB-JA";"COORDENACAO DA UNIDADE DE URGENCIA E EMERGENCIA";"PENF";"ENFERMEIRO";"IV";"A";"11/06/2022";"2022/06/11 00:00:00";"2023/06/10 00:00:00"
15105836;1;"CLAUDIA APARECIDA PAIVA RAMOS";"05105332644";"29/07/1979";"CONTRATO TEMPORARIO";"MOV";"COORDENACAO DE APOIO DIAGNOSTICO E TERAPEUTICO";"TOS";"TECNICO EM PATOLOGIA CLINICA";"II";"A";"23/02/2022";"2022/02/23 00:00:00";"2023/02/22 00:00:00"
14352421;4;"CLAUDIA BARROS DA SILVA DE OLIVEIRA";"34977720890";"29/08/1986";"CONTRATO TEMPORARIO";"JXXIII";"COORDENACAO DE URGENCIA E EMERGENCIA PEDIATRICA";"AGAS";"ASSISTENTE SOCIAL";"I";"A";"02/02/2022";"2022/02/02 00:00:00";"2023/02/01 00:00:00"
14352421;3;"CLAUDIA BARROS DA SILVA DE OLIVEIRA";"34977720890";"29/08/1986";"CONTRATO TEMPORARIO";"JXXIII";"GERENCIA DA EQUIPE MULTIDISCIPLINAR";"AGAS";"ASSISTENTE SOCIAL";"I";"A";"31/05/2021";"2021/05/31 00:00:00";"2023/05/30 00:00:00"
14678973;3;"CLAUDIA CALDEIRA DE ALMEIDA";"76461726691";"30/07/1969";"CONTRATO TEMPORARIO";"MGT";"GERENCIA ADMINISTRATIVA";"TOS";"AUXILIAR ADMINISTRATIVO";"I";"A";"28/03/2022";"2022/03/28 00:00:00";"2023/03/27 00:00:00"
14179121;4;"CLAUDIA CAROLINE BARBOSA PFANNES";"08961634666";"03/06/1987";"CONTRATO TEMPORARIO";"JXXIII";"COORDENACAO DE URGENCIA E EMERGENCIA ADULTO";"MED";"MEDICO CIRURGIAO CARDIOVASCULAR";"III";"A";"06/03/2022";"2022/03/06 00:00:00";"2023/03/05 00:00:00"
10905404;4;"CLAUDIA ELIZABETH TEIXEIRA FONSECA";"90751418668";"07/11/1974";"CONTRATO TEMPORARIO";"HJK";"COORDENACAO MEDICA DA URGENCIA E EMERGENCIA";"PENF";"ENFERMEIRO";"IV";"A";"02/02/2022";"2022/02/02 00:00:00";"2023/02/01 00:00:00"
15071921;1;"CLAUDIA FERNANDES RODRIGUES";"02626236683";"31/01/1975";"CONTRATO TEMPORARIO";"HRJP";"COORDENACAO DAS UNIDADES CRITICAS";"PENF";"TECNICO DE ENFERMAGEM";"II";"A";"01/02/2022";"2022/02/01 00:00:00";"2023/01/31 00:00:00"
12292983;2;"CLAUDIA GUEDES DE PAULA";"02967997692";NA;"CONTRATO TEMPORARIO";"JXXIII";NA;"TOS";"TECNICO EM PATOLOGIA CLINICA";"II";"A";NA;"2022/02/01 00:00:00";"2023/01/31 00:00:00"
14710081;2;"CLAUDIA LEAO SOARES";"06786454690";"11/06/1983";"CONTRATO TEMPORARIO";"HJK";"COORDENACAO MEDICA DA TERAPIA INTENSIVA NEONATAL";"MED";"MEDICO PEDIATRA";"III";"A";"08/04/2022";"2022/04/08 00:00:00";"2023/04/07 00:00:00"
14946958;1;"CLAUDIA LESSA ANDRADE DA SILVA";"01428570683";NA;"CONTRATO TEMPORARIO";"HJK";NA;"PENF";"TECNICO DE ENFERMAGEM";"II";"A";NA;"2022/02/01 00:00:00";"2023/01/31 00:00:00"
14678924;3;"CLAUDIA MARCIA ALVES ESPIRITO SANTO";"00503543616";"29/08/1972";"CONTRATO TEMPORARIO";"HIJPII";"COORDENACAO DAS UNIDADES DE INTERNACAO PEDIATRICA";"TOS";"PROFESSOR RECREADOR";"II";"A";"01/02/2022";"2022/02/01 00:00:00";"2023/01/31 00:00:00"
11231461;3;"CLAUDIA MARCIA DA SILVA";"85122572615";"15/12/1970";"CONTRATO TEMPORARIO";"";"GERENCIA ASSISTENCIAL";"TOS";"AUXILIAR ADMINISTRATIVO";"I";"A";"01/02/2022";"2022/02/01 00:00:00";"2023/01/31 00:00:00"
11459104;3;"CLAUDIA MARTINS PEREIRA";"92393764615";"19/10/1972";"CONTRATO TEMPORARIO";"HEM";"COORDENACAO DE APOIO DIAGNOSTICO E TERAPEUTICO";"TOS";"TECNICO EM PATOLOGIA CLINICA";"II";"A";"28/03/2022";"2022/03/28 00:00:00";"2023/03/27 00:00:00"
14889109;2;"CLAUDIA MOREIRA DE FREITAS";"00637843606";"21/01/1974";"CONTRATO TEMPORARIO";"HEM";"COORDENACAO DAS UNIDADES CRITICAS";"PENF";"TECNICO DE ENFERMAGEM";"II";"A";"01/07/2022";"2022/07/01 00:00:00";"2023/06/30 00:00:00"
11343985;2;"CLAUDIA PINHEIRO DE AZEVEDO SOUZA";"71639306668";"03/10/1969";"CONTRATO TEMPORARIO";"HIJPII";"COORDENACAO DE COMPRAS E CONTRATOS";"TOS";"AUXILIAR ADMINISTRATIVO";"I";"A";"07/02/2022";"2022/02/07 00:00:00";"2023/02/06 00:00:00"
11738770;5;"CLAUDIA RODRIGUES";"57045798687";"27/10/1966";"CONTRATO TEMPORARIO";"HIJPII";"COORDENACAO DAS UNIDADES DE INTERNACAO PEDIATRICA";"AGAS";"ASSISTENTE SOCIAL";"I";"A";"30/08/2021";"2021/08/30 00:00:00";"2023/06/30 00:00:00"
14904080;2;"CLAUDIA SATURNINA DOS SANTOS SILVA";"05349726676";NA;"CONTRATO TEMPORARIO";"JXXIII";NA;"PENF";"TECNICO DE ENFERMAGEM";"II";"A";NA;"2022/03/10 00:00:00";"2023/03/09 00:00:00"
15101439;1;"CLAUDIANE COELHO ALVES";"11758807601";"05/12/1994";"CONTRATO TEMPORARIO";"HGB-JA";"COORDENACAO DE SAUDE MENTAL";"PENF";"TECNICO DE ENFERMAGEM";"II";"A";"02/02/2022";"2022/02/02 00:00:00";"2023/02/01 00:00:00"
15066871;1;"CLAUDIENE MARIA SOARES";"10946630690";"23/02/1991";"CONTRATO TEMPORARIO";"HRAD";"COORDENACAO DAS UNIDADES DE INTERNACAO";"PENF";"TECNICO DE ENFERMAGEM";"II";"A";"0000-00-00";"2022/02/01 00:00:00";"2023/01/31 00:00:00"
12337267;2;"CLAUDILANE CONCEICAO DE CARVALHO";"66678242653";"17/05/1967";"CONTRATO TEMPORARIO";"HAC";"COORDENACAO DA INFRAESTRUTURA";"TOS";"AUXILIAR ADMINISTRATIVO";"I";"A";"04/02/2022";"2022/02/04 00:00:00";"2023/02/03 00:00:00"
14613442;1;"CLAUDILENE DA SILVA";"98088718600";"09/06/1973";"CONTRATO TEMPORARIO";"IRS";"COORDENACAO DAS UNIDADES DE INTERNACAO";"PENF";"TECNICO DE ENFERMAGEM";"II";"A";"02/02/2022";"2022/02/02 00:00:00";"2023/02/01 00:00:00"
14958540;2;"CLAUDINEI SILVA";"07587592660";"07/06/1985";"CONTRATO TEMPORARIO";"HEM";"COORDENACAO DAS UNIDADES DE INTERNACAO";"PENF";"TECNICO DE ENFERMAGEM";"II";"A";"15/03/2022";"2022/03/15 00:00:00";"2023/03/14 00:00:00"
14637706;2;"CLAUDINEIDE SILVA CARDOSO BARBOSA";"03275210661";"26/11/1974";"CONTRATO TEMPORARIO";"JXXIII";"COORDENACAO DAS UNIDADES DE INTERNACAO ADULTO";"PENF";"TECNICO DE ENFERMAGEM";"II";"A";"03/10/2022";"2022/10/03 00:00:00";"2023/10/02 00:00:00"
2995207;6;"CLEBER PINTO COSTA";"27649784649";"29/10/1957";"CONTRATO TEMPORARIO";"JXXIII";"COORDENACAO DE URGENCIA E EMERGENCIA ADULTO";"MED";"MEDICO CLINICO";"III";"A";"10/02/2022";"2022/02/10 00:00:00";"2023/02/09 00:00:00"
14958896;3;"CLEIDIANE GONCALVES VENANCIO";"07850232674";"02/06/1987";"CONTRATO TEMPORARIO";"HEM";"COORDENACAO DAS UNIDADES CRITICAS";"PENF";"TECNICO DE ENFERMAGEM";"II";"A";"04/07/2022";"2022/06/28 00:00:00";"2023/06/27 00:00:00"
14958896;2;"CLEIDIANE GONCALVES VENANCIO";"07850232674";"02/06/1987";"CONTRATO TEMPORARIO";"HJK";"COORDENACAO MEDICA DA URGENCIA E EMERGENCIA";"PENF";"TECNICO DE ENFERMAGEM";"II";"A";"03/02/2022";"2022/02/03 00:00:00";"2023/02/02 00:00:00"
12557500;3;"CLELIA APARECIDA ROCHA";"65081676691";"11/01/1963";"CONTRATO TEMPORARIO";"HAC";"COORDENACAO DO LABORATORIO";"AGAS";"FARMACEUTICO BIOQUIMICO";"I";"A";"19/08/2021";"2021/08/19 00:00:00";"2023/06/30 00:00:00"
14637599;2;"CLEMILDA DE ALVARENGA COELHO";"45889260634";"25/08/1962";"CONTRATO TEMPORARIO";"JXXIII";"COORDENACAO DE FATURAMENTO";"MED";"MEDICO CLINICO";"III";"A";"23/05/2022";"2022/05/23 00:00:00";"2023/05/22 00:00:00"
14667042;1;"CLENNE DE MACEDO SANTOS";"10025954601";"08/02/1989";"CONTRATO TEMPORARIO";"HRAD";"COORDENACAO DE INFRAESTRUTURA";"AGAS";"ENGENHEIRO";"III";"A";"0000-00-00";"2022/02/01 00:00:00";"2023/01/31 00:00:00"
15289515;1;"CLEONICE APARECIDA JANUARIA";"09811703663";"13/05/1987";"CONTRATO TEMPORARIO";"HEM";"COORDENACAO DAS UNIDADES CRITICAS";"PENF";"TECNICO DE ENFERMAGEM";"II";"A";"01/07/2022";"2022/07/01 00:00:00";"2023/06/30 00:00:00"
12330577;1;"CLEUNISSE DA CRUZ MESSIAS";"02756541680";"02/06/1972";"CONTRATO TEMPORARIO";"HJK";"COORDENACAO DA MATERNIDADE";"PENF";"TECNICO DE ENFERMAGEM";"II";"A";"01/02/2022";"2022/02/01 00:00:00";"2023/01/31 00:00:00"
14053391;2;"CLEUSA VIANA DOS SANTOS";"97054925653";"04/06/1969";"CONTRATO TEMPORARIO";"JXXIII";"COORDENACAO DAS UNIDADES DE INTERNACAO ADULTO";"PENF";"ENFERMEIRO";"IV";"A";"01/02/2022";"2022/02/01 00:00:00";"2023/01/31 00:00:00"
15258361;1;"CLOVIS FERREIRA LIMA";"61157481191";"29/06/1974";"CONTRATO TEMPORARIO";"CSSFA";"COORDENACAO DE GESTAO DA INFORMACAO E FINANCAS";"TOS";"TECNICO EM INFORMATICA";"II";"A";"15/06/2022";"2022/06/15 00:00:00";"2023/06/14 00:00:00"
14934236;1;"CRISELLEN DELOGO SINETE";"09606991636";NA;"CONTRATO TEMPORARIO";"HJK";NA;"MEDRE";"MEDICO";"I";"A";NA;"2021/03/01 00:00:00";"2023/02/28 00:00:00"
15089873;1;"CRISLANE MARIA DE ASSIS";"04722020655";"14/06/1981";"CONTRATO TEMPORARIO";"HGB-JA";"COORDENACAO DE SAUDE MENTAL";"PENF";"TECNICO DE ENFERMAGEM";"II";"A";"02/02/2022";"2022/02/02 00:00:00";"2023/02/01 00:00:00"
14613525;2;"CRISTIANA APARECIDA DE MELO";"03668564647";"15/12/1979";"CONTRATO TEMPORARIO";"JXXIII";"COORDENACAO DE LABORATORIO E AGENCIA TRANSFUSIONAL";"TOS";"TECNICO EM PATOLOGIA CLINICA";"II";"A";"15/03/2022";"2022/03/15 00:00:00";"2023/03/14 00:00:00"
15018468;1;"CRISTIANA APARECIDA NASCIMENTO FRANCA";"01580424686";"12/11/1986";"CONTRATO TEMPORARIO";"JXXIII";"COORDENACAO DA UNIDADE DE TERAPIA INTENSIVA ADULTO";"PENF";"TECNICO DE ENFERMAGEM";"II";"A";"13/09/2021";"2021/09/13 00:00:00";"2023/06/30 00:00:00"
14909170;2;"CRISTIANA DE ALMEIDA LOPES";"04507570646";"16/09/1979";"CONTRATO TEMPORARIO";"JXXIII";"COORDENACAO DA UNIDADE DE TERAPIA INTENSIVA ADULTO";"PENF";"TECNICO DE ENFERMAGEM";"II";"A";"21/05/2021";"2021/05/21 00:00:00";"2023/05/20 00:00:00"
12456745;2;"CRISTIANE ALVES DA SILVA";"01473874696";"21/09/1984";"CONTRATO TEMPORARIO";"JXXIII";"COORDENACAO DAS UNIDADES DE INTERNACAO ADULTO";"PENF";"TECNICO DE ENFERMAGEM";"II";"A";"01/02/2022";"2022/02/01 00:00:00";"2023/01/31 00:00:00"
15090384;1;"CRISTIANE APARECIDA DA SILVA AFONSO";"08529154622";"17/03/1987";"CONTRATO TEMPORARIO";"HGB-JA";"COORDENACAO DA UNIDADE DE URGENCIA E EMERGENCIA";"PENF";"TECNICO DE ENFERMAGEM";"II";"A";"02/02/2022";"2022/02/02 00:00:00";"2023/02/01 00:00:00"
12466553;2;"CRISTIANE ASSUNCAO VIANA FELIX";"05465845600";"28/09/1981";"CONTRATO TEMPORARIO";"HCM";"COORDENACAO DE SUPRIMENTOS E FINANCAS";"TOS";"AUXILIAR ADMINISTRATIVO";"I";"A";"16/12/2021";"2021/12/16 00:00:00";"2023/06/30 00:00:00"
15082795;1;"CRISTIANE CASSIA DIONISIO";"06602652656";"21/09/1984";"CONTRATO TEMPORARIO";"HGB-JA";"COORDENACAO DA UNIDADE DE URGENCIA E EMERGENCIA";"PENF";"TECNICO DE ENFERMAGEM";"II";"A";"01/02/2022";"2022/02/01 00:00:00";"2023/01/31 00:00:00"
14946503;2;"CRISTIANE COELHO ALVES";"11758808683";"11/10/1992";"CONTRATO TEMPORARIO";"HGB-JA";"COORDENACAO DA UNIDADE DE CLINICA MEDICA";"PENF";"TECNICO DE ENFERMAGEM";"II";"A";"24/03/2021";"2022/02/02 00:00:00";"2023/02/01 00:00:00"
14979751;2;"CRISTIANE CORDEIRO DA SILVA ANDRADE";"05937032608";"30/03/1982";"CONTRATO TEMPORARIO";"HJK";"COORDENACAO DE INTERNACAO - ADULTO";"PENF";"TECNICO DE ENFERMAGEM";"II";"A";"21/11/2022";"2022/11/21 00:00:00";"2023/11/20 00:00:00"
14667026;2;"CRISTIANE DE ALMEIDA PINTO";"03952204676";"26/05/1978";"CONTRATO TEMPORARIO";"HIJPII";"COORDENACAO DAS UNIDADES DE INTERNACAO PEDIATRICA";"PENF";"ENFERMEIRO";"IV";"A";"04/02/2022";"2022/02/04 00:00:00";"2023/02/03 00:00:00"
14113997;3;"CRISTIANE DE OLIVEIRA CASARIN";"06268169638";NA;"CONTRATO TEMPORARIO";"JXXIII";NA;"AGAS";"FISIOTERAPEUTA RESPIRATORIA";"III";"A";NA;"2022/02/02 00:00:00";"2023/02/01 00:00:00"
15066863;1;"CRISTIANE DE SOUSA RIBEIRO";"03894872608";"09/02/1978";"CONTRATO TEMPORARIO";"HRAD";"COORDENACAO DE APOIO DIAGNOSTICO E TERAPEUTICO";"TOS";"TECNICO EM RADIOLOGIA";"II";"A";"0000-00-00";"2022/02/04 00:00:00";"2023/02/03 00:00:00"
14338529;1;"CRISTIANE DIAS GUIMARAES";"04088764684";"01/11/1977";"CONTRATO TEMPORARIO";"HJK";"COORDENACAO DO AMBULATORIO";"TOS";"AUXILIAR ADMINISTRATIVO";"I";"A";"01/02/2022";"2022/02/01 00:00:00";"2023/01/31 00:00:00"
13979695;2;"CRISTIANE FERREIRA DE ANDRADE";"05621141652";"18/06/1981";"CONTRATO TEMPORARIO";"HJK";"COORDENACAO DO SERVIÇO DE NUTRICAO E DIETETICA";"AGAS";"NUTRICIONISTA";"I";"A";"01/02/2022";"2022/02/01 00:00:00";"2023/01/31 00:00:00"
11054434;3;"CRISTIANE FONSECA";"04151508686";"20/06/1978";"CONTRATO TEMPORARIO";"HRAD";"COORDENACAO DE ASSISTENCIA FARMACEUTICA";"AGAS";"FARMACEUTICO";"I";"A";"0000-00-00";"2021/06/30 00:00:00";"2023/06/29 00:00:00"
14329940;2;"CRISTIANE GUIMARAES PASSOS";"05465868643";"22/02/1982";"CONTRATO TEMPORARIO";"HEM";"COORDENACAO DE ASSISTENCIA FARMACEUTICA";"AGAS";"FARMACEUTICO";"III";"A";"13/09/2016";"2022/02/01 00:00:00";"2023/01/31 00:00:00"
14889547;3;"CRISTIANE IMACULADA SABINO";"03802278607";"03/02/1979";"CONTRATO TEMPORARIO";"HAC";"COORDENACAO DO SERVICO DE DIAGNOSTICO POR IMAGEM";"PENF";"ENFERMEIRO";"IV";"A";"20/10/2022";"2022/10/20 00:00:00";"2023/10/19 00:00:00"
14661144;2;"CRISTIANE MENDONCA PIMENTA";"80620086653";"20/12/1970";"CONTRATO TEMPORARIO";"HCM";"ASSESSORIA DE GESTAO ESTRATEGICA E QUALIDADE";"TOS";"AUXILIAR ADMINISTRATIVO";"I";"A";"01/02/2022";"2022/02/01 00:00:00";"2023/01/31 00:00:00"
14557128;2;"CRISTIANE PEIL DA SILVA";"95478248053";"25/02/1979";"CONTRATO TEMPORARIO";"JXXIII";"COORDENACAO DO CENTRO DE TRATAMENTO DE QUEIMADOS";"PENF";"ENFERMEIRO";"IV";"A";"07/12/2021";"2021/12/07 00:00:00";"2023/06/30 00:00:00"
12847075;2;"CRISTIANE PEREIRA DOS SANTOS SOARES";"01293225630";"19/07/1979";"CONTRATO TEMPORARIO";"CMT";"GERENCIA ASSISTENCIAL";"PENF";"TECNICO DE ENFERMAGEM";"II";"A";"01/02/2022";"2022/02/01 00:00:00";"2023/01/31 00:00:00"
11877958;5;"CRISTIANE TAVARES FERREIRA";"82722765187";"23/11/1977";"CONTRATO TEMPORARIO";"JXXIII";"COORDENACAO DO BLOCO CIRURGICO";"MED";"MEDICO CIRURGIAO PLASTICO";"III";"A";"02/02/2022";"2022/02/02 00:00:00";"2023/02/01 00:00:00"
15082738;1;"CRISTIANE VIEIRA SILVA CAROLINO";"03848630605";"14/09/1978";"CONTRATO TEMPORARIO";"JXXIII";"COORDENACAO DA UNIDADE DE TERAPIA INTENSIVA ADULTO";"PENF";"TECNICO DE ENFERMAGEM";"II";"A";"12/02/2022";"2022/02/12 00:00:00";"2023/02/11 00:00:00"
15067150;1;"CRISTIANO AFONSO SANTANA E SILVA";"06655721660";"29/11/1985";"CONTRATO TEMPORARIO";"HEM";"COORDENACAO DAS UNIDADES CRITICAS";"PENF";"ENFERMEIRO";"IV";"A";"17/01/2022";"2022/01/17 00:00:00";"2023/01/16 00:00:00"
10906576;5;"CRISTINA ABREU CANTO CONDE";"85133612672";"10/12/1969";"CONTRATO TEMPORARIO";"HIJPII";"COORDENACAO DO AMBULATORIO DE PEDIATRIA";"AGAS";"ASSISTENTE SOCIAL";"III";"A";"07/03/2022";"2022/03/07 00:00:00";"2023/03/06 00:00:00"
13005665;5;"CRISTINA MANGEROTTI GUIMARAES";"08947551619";"25/09/1987";"CONTRATO TEMPORARIO";"HAC";"COORDENACAO DO SERVIÇO DE NUTRICAO E DIETETICA";"AGAS";"NUTRICIONISTA";"I";"A";"06/04/2022";"2022/04/06 00:00:00";"2023/04/05 00:00:00"
12956850;4;"CRISTINA MARTINS VALADARES";"98073893649";"26/12/1975";"CONTRATO TEMPORARIO";"MOV";"COORDENACAO DA GINECOLOGIA E OBSTETRICIA";"PENF";"ENFERMEIRO";"IV";"A";"25/01/2022";"2022/01/25 00:00:00";"2023/01/24 00:00:00"
14624829;2;"CRISTINA RAMOS MELGACO";"06906277693";"08/11/1990";"CONTRATO TEMPORARIO";"JXXIII";"COORDENACAO DO BLOCO CIRURGICO";"MED";"MEDICO ANESTESIOLOGISTA";"III";"A";"27/05/2021";"2021/05/27 00:00:00";"2023/05/26 00:00:00"
15067135;2;"CRISTINA RODRIGUES CHAVES NOGUEIRA";"11164443640";"12/09/1991";"CONTRATO TEMPORARIO";"HIJPII";"COORDENACAO DA UNIDADE DE TERAPIA INTENSIVA PEDIATRICA";"AGAS";"FISIOTERAPEUTA RESPIRATORIA";"III";"A";"11/06/2022";"2022/06/11 00:00:00";"2023/06/10 00:00:00"
15067135;1;"CRISTINA RODRIGUES CHAVES NOGUEIRA";"11164443640";"12/09/1991";"CONTRATO TEMPORARIO";"HIJPII";"COORDENACAO DAS UNIDADES DE INTERNACAO PEDIATRICA";"AGAS";"FISIOTERAPEUTA";"I";"A";"01/02/2022";"2022/02/02 00:00:00";"2023/02/01 00:00:00"
13560644;3;"CYBELLE MAGALHAES PINTO E SILVA";"07150228658";"27/06/1984";"CONTRATO TEMPORARIO";"HAC";"COORDENACAO DA EQUIPE MULTIDISCIPLINAR";"AGAS";"ASSISTENTE SOCIAL";"I";"A";"03/02/2021";"2021/02/03 00:00:00";"2023/02/02 00:00:00"
14479380;2;"CYCERO EDUARDO SILVA";"07625461661";"23/03/1987";"CONTRATO TEMPORARIO";"JXXIII";"COORDENACAO DA UNIDADE DE TERAPIA INTENSIVA ADULTO";"AGAS";"FISIOTERAPEUTA";"III";"A";"01/02/2022";"2022/02/01 00:00:00";"2023/01/31 00:00:00"
14179832;5;"CYNTHIA LETICIA FERREIRA";"07544378683";"24/05/1985";"CONTRATO TEMPORARIO";"JXXIII";"COORDENACAO DE URGENCIA E EMERGENCIA ADULTO";"MED";"MEDICO CLINICO";"III";"A";"07/03/2022";"2022/03/07 00:00:00";"2023/03/06 00:00:00"
14142251;5;"DAANA FARES CALIL ZARUR";"07638305698";"03/01/1986";"CONTRATO TEMPORARIO";"HIJPII";"COORDENACAO DE URGENCIA E EMERGENCIA PEDIATRICA";"MED";"MEDICO PEDIATRA";"III";"A";"03/03/2022";"2022/03/03 00:00:00";"2023/03/02 00:00:00"
13802228;3;"DAIANA APARECIDA SOARES";"08992882602";"02/02/1988";"CONTRATO TEMPORARIO";"HGB-JA";"COORDENACAO DA UNIDADE DE PACIENTES CRITICOS";"PENF";"TECNICO DE ENFERMAGEM";"II";"A";"21/11/2021";"2021/11/21 00:00:00";"2023/06/30 00:00:00"
15100530;1;"DAIANA CRISTIAN DE OLIVEIRA";"10561697612";"21/03/1991";"CONTRATO TEMPORARIO";"HGB-JA";"COORDENACAO DA UNIDADE DE URGENCIA E EMERGENCIA";"PENF";"TECNICO DE ENFERMAGEM";"II";"A";"03/02/2022";"2022/02/01 00:00:00";"2023/01/31 00:00:00"
15087034;1;"DAIANA DAS GRACAS FERREIRA TURQUETI";"11414153643";"15/05/1992";"CONTRATO TEMPORARIO";"HGB-JA";"COORDENACAO DA UNIDADE DE CLINICA MEDICA";"PENF";"TECNICO DE ENFERMAGEM";"II";"A";"02/02/2022";"2022/02/02 00:00:00";"2023/02/01 00:00:00"
15086234;1;"DAIANA EDITE GERMANO RIBEIRO DUARTE";"07879712607";"07/08/1986";"CONTRATO TEMPORARIO";"HAC";"COORDENACAO DO AMBULATORIO";"TOS";"AUXILIAR ADMINISTRATIVO";"I";"A";"01/02/2022";"2022/02/01 00:00:00";"2023/01/31 00:00:00"
14897896;2;"DAIANE APARECIDA LONGUINHO";"02069541665";"25/01/1998";"CONTRATO TEMPORARIO";"HGB-JA";"COORDENACAO DA UNIDADE DE URGENCIA E EMERGENCIA";"PENF";"TECNICO DE ENFERMAGEM";"II";"A";"20/03/2022";"2022/03/21 00:00:00";"2023/03/20 00:00:00"
15146970;1;"DAIANE FERRAZ LUIZ";"12518890696";"27/09/1993";"CONTRATO TEMPORARIO";"HCM";"COORDENACAO TECNICA DE ENFERMAGEM";"PENF";"TECNICO DE ENFERMAGEM";"II";"A";"17/03/2022";"2022/03/17 00:00:00";"2023/03/16 00:00:00"
14637805;1;"DALILLA MAGNA DA SILVA CAMARGOS";"09172464623";"04/02/1989";"CONTRATO TEMPORARIO";"HJK";"COORDENACAO DA UNIDADE DE TERAPIA INTENSIVA ADULTO";"PENF";"TECNICO DE ENFERMAGEM";"II";"A";"06/04/2018";"2021/02/01 00:00:00";"2023/01/31 00:00:00"
14722672;2;"DAMARIS DENISE DO CARMO";"50958194653";"10/08/1962";"CONTRATO TEMPORARIO";"HEM";"COORDENACAO DAS UNIDADES DE INTERNACAO";"PENF";"TECNICO DE ENFERMAGEM";"II";"A";"03/02/2019";"2021/02/01 00:00:00";"2023/01/31 00:00:00"
14722672;1;"DAMARIS DENISE DO CARMO";"50958194653";"10/08/1962";"CONTRATO TEMPORARIO";"HEM";"COORDENACAO DAS UNIDADES CRITICAS";"PENF";"TECNICO DE ENFERMAGEM";"II";"A";"03/07/2022";"2022/07/03 00:00:00";"2023/07/02 00:00:00"
14130629;3;"DANIEL BARBOSA REGAZZI";"06742577665";"07/08/1986";"CONTRATO TEMPORARIO";"HMAL";"COORDENACAO DA ORTOPEDIA";"MED";"MEDICO CIRURGIAO DE MAO";"III";"A";"03/03/2022";"2022/03/03 00:00:00";"2023/03/02 00:00:00"
13703731;2;"DANIEL BARRETO DE ALMEIDA";"08468688657";NA;"CONTRATO TEMPORARIO";"HRJP";NA;"PENF";"ENFERMEIRO";"IV";"A";NA;"2022/02/01 00:00:00";"2023/01/31 00:00:00"
13703731;3;"DANIEL BARRETO DE ALMEIDA II";"08468688657";"0000-00-00";NA;"HRJP";"COORDENACAO DAS UNIDADES CRITICAS";NA;"";NA;NA;"01/02/2022";NA;NA
15261548;1;"DANIEL CORNELIO DOS REIS";"04936190624";"21/02/1981";"CONTRATO TEMPORARIO";"CSSFA";"COORDENACAO DA UNIDADE DE INTERNACAO E PACIENTES EXTERNOS";"PENF";"TECNICO DE ENFERMAGEM";"II";"A";"0000-00-00";"2022/06/29 00:00:00";"2023/06/28 00:00:00"
15115264;1;"DANIEL DA SILVA PIRES";"06602743619";"16/11/1983";"CONTRATO TEMPORARIO";"HIJPII";"COORDENACAO DE DIAGNOSTICO POR IMAGEM";"TOS";"TECNICO EM RADIOLOGIA";"II";"A";"03/02/2022";"2022/02/03 00:00:00";"2023/02/02 00:00:00"
15225774;1;"DANIEL DE LIMA RUAS FERNANDES";"10226321673";NA;"CONTRATO TEMPORARIO";"HAC";NA;"MEDRE";"MEDICO";"I";"A";NA;"2022/03/22 00:00:00";"2023/03/21 00:00:00"
14458715;9;"DANIEL DO ESPIRITO SANTO GOMES";"06924493610";"0000-00-00";NA;"HMAL";"COORDENACAO DAS UNIDADES DE INTERNACAO CIRURGICA DE RETAGUARDA";NA;"";NA;NA;"12/11/2022";NA;NA
14956734;2;"DANIEL MILLAS DE PAULA";"02240429631";"29/08/1998";"CONTRATO TEMPORARIO";"HEM";"COORDENACAO DAS UNIDADES CRITICAS";"PENF";"TECNICO DE ENFERMAGEM";"II";"A";"02/07/2022";"2022/07/02 00:00:00";"2023/07/01 00:00:00"
13605944;2;"DANIEL MIRANDA ALVES PEREIRA";"09744107642";"22/04/1989";"CONTRATO TEMPORARIO";"JXXIII";"COORDENACAO DE URGENCIA E EMERGENCIA ADULTO";"MED";"MEDICO CIRURGIAO PLASTICO";"III";"A";"28/02/2022";"2022/02/28 00:00:00";"2023/02/27 00:00:00"
15072713;1;"DANIEL OLIVEIRA MARCHI";"06741042695";"01/08/1984";"CONTRATO TEMPORARIO";"HRJP";"COORDENACAO DE HOTELARIA";"TOS";"AUXILIAR ADMINISTRATIVO";"I";"A";"01/02/2022";"2022/02/01 00:00:00";"2023/01/31 00:00:00"
14637771;3;"DANIEL OTAVIO MESQUITA DUARTE";"05382199639";"23/08/1981";"CONTRATO TEMPORARIO";"JXXIII";"COORDENACAO DE DIAGNOSTICO POR IMAGEM";"TOS";"TECNICO EM RADIOLOGIA";"II";"A";"12/01/2022";"2022/01/12 00:00:00";"2023/01/11 00:00:00"
14679039;1;"DANIEL SANTOS ARANTES SOARES";"06741582614";"07/08/1984";"CONTRATO TEMPORARIO";"HJK";"COORDENACAO DE INTERNACAO - ADULTO";"MED";"MEDICO OTORRINOLARINGOLOGISTA";"III";"A";"15/02/2022";"2022/02/15 00:00:00";"2023/02/14 00:00:00"
15279367;1;"DANIEL VELASQUEZ QUIROZ";"09921404121";"01/05/1994";"CONTRATO TEMPORARIO";"HJK";"COORDENACAO MEDICA DA URGENCIA E EMERGENCIA";"MED";"MEDICO GENERALISTA";"I";"A";"05/07/2022";"2022/07/05 00:00:00";"2023/01/04 00:00:00"
14114169;2;"DANIELA ALICE BENTO DE OLIVEIRA";"03170317679";"07/12/1976";"CONTRATO TEMPORARIO";"HMAL";"COORDENACAO DO SERVICO DE NUTRICAO E DIETETICA";"TOS";"TECNICO EM NUTRICAO E DIETETICA";"II";"A";"03/02/2022";"2022/02/03 00:00:00";"2023/02/02 00:00:00"
14255186;4;"DANIELA APARECIDA FORZAN VIEIRA";"06865660684";NA;"CONTRATO TEMPORARIO";"JXXIII";NA;"AGAS";"FISIOTERAPEUTA RESPIRATORIA";"III";"A";NA;"2022/11/03 00:00:00";"2023/11/02 00:00:00"
9000000;9;"DANIELA APARECIDA FORZAN VIEIRA";"06865660684";"0000-00-00";NA;"HJXXIII";"GERENCIA DA EQUIPE MULTIDISCIPLINAR";NA;"";NA;NA;"03/11/2022";NA;NA
14255186;3;"DANIELA APARECIDA FORZAN VIEIRA III";"06865660684";"13/04/1985";NA;"HJXXIII";"COORDENACAO DA UNIDADE DE TERAPIA INTENSIVA PEDIATRICA";NA;"FISIOTERAPEUTA RESPIRATORIA";NA;NA;"02/02/2022";NA;NA
15108087;1;"DANIELA APARECIDA VIANA COUTINHO";"06081684679";"05/10/1984";"CONTRATO TEMPORARIO";"HGB-JA";"COORDENACAO DA UNIDADE DE URGENCIA E EMERGENCIA";"PENF";"TECNICO DE ENFERMAGEM";"II";"A";"01/02/2022";"2022/02/01 00:00:00";"2023/01/31 00:00:00"
14567598;2;"DANIELA ARAUJO COSTA";"08143659658";"23/03/1986";"CONTRATO TEMPORARIO";"HIJPII";"COORDENACAO DO CUIDAR E ATENCAO DOMICILIAR";"AGAS";"FISIOTERAPEUTA RESPIRATORIA";"III";"A";"01/02/2022";"2022/02/01 00:00:00";"2023/01/31 00:00:00"
14052765;1;"DANIELA CRISTINA GARCIA";"07933165613";"10/05/1986";"CONTRATO TEMPORARIO";"HGB-JA";"COORDENACAO DE ASSISTENCIA FARMACEUTICA";"TOS";"TECNICO EM FARMACIA";"II";"A";"10/02/2022";"2022/02/10 00:00:00";"2023/02/09 00:00:00"
14894166;2;"DANIELA CRISTINA PETTERSEN";"02963224664";"13/10/1977";"CONTRATO TEMPORARIO";"JXXIII";"COORDENACAO DAS UNIDADES DE INTERNACAO ADULTO";"PENF";"TECNICO DE ENFERMAGEM";"II";"A";"25/09/2022";"2022/09/25 00:00:00";"2023/09/24 00:00:00"
13890876;2;"DANIELA ELIANETE SOARES";"08815793607";"15/12/1988";"CONTRATO TEMPORARIO";"HRAD";"COORDENACAO DA UNIDADE DE PACIENTES EXTERNOS";"MED";"MEDICO GINECOLOGISTA";"III";"A";"0000-00-00";"2021/04/17 00:00:00";"2023/04/16 00:00:00"
15269442;1;"DANIELA FERNANDA DA SILVA";"10818917695";"17/01/1990";"CONTRATO TEMPORARIO";"HGB-JA";"COORDENACAO DE APOIO DIAGNOSTICO E TERAPEUTICO";"TOS";"TECNICO EM PATOLOGIA CLINICA";"II";"A";"30/06/2022";"2022/06/30 00:00:00";"2023/06/29 00:00:00"
14834741;1;"DANIELA LOPES DOS SANTOS";"02774799597";"14/03/1987";"CONTRATO TEMPORARIO";"HJK";"COORDENACAO DO LABORATORIO";"PENF";"TECNICO DE ENFERMAGEM";"II";"A";"02/02/2022";"2022/02/07 00:00:00";"2023/02/06 00:00:00"
15123128;1;"DANIELA NOGUEIRA DA SILVA MELO";"08734095667";NA;"CONTRATO TEMPORARIO";"HRJP";NA;"MEDRE";"MEDICO";"I";"A";NA;"2022/03/01 00:00:00";"2023/02/28 00:00:00"
14756001;3;"DANIELA OTONI RUSSO";"11692009664";"10/09/1991";"CONTRATO TEMPORARIO";"HIJPII";"COORDENACAO DE URGENCIA E EMERGENCIA PEDIATRICA";"MED";"MEDICO PEDIATRA";"III";"A";"29/04/2022";"2022/04/29 00:00:00";"2023/04/28 00:00:00"
13237755;3;"DANIELA PATRICIA SANTOS SILVA";"03456298684";"18/11/1976";"CONTRATO TEMPORARIO";"JXXIII";"COORDENACAO DE URGENCIA E EMERGENCIA ADULTO";"AGAS";"ASSISTENTE SOCIAL";"I";"A";"01/02/2022";"2022/02/01 00:00:00";"2023/01/31 00:00:00"
14914642;1;"DANIELA PRISCILA PIO DA SILVA";"07416977690";"20/08/1986";"CONTRATO TEMPORARIO";"HGB-JA";"COORDENACAO DA UNIDADE DE URGENCIA E EMERGENCIA";"PENF";"TECNICO DE ENFERMAGEM";"II";"A";"01/02/2022";"2022/02/01 00:00:00";"2023/01/31 00:00:00"
14722623;2;"DANIELA RODRIGUES DE SOUZA";"10767224663";"05/04/1993";"CONTRATO TEMPORARIO";"JXXIII";"COORDENACAO DO CENTRO DE TRATAMENTO DE QUEIMADOS";"PENF";"TECNICO DE ENFERMAGEM";"II";"A";"09/03/2022";"2022/03/09 00:00:00";"2023/03/08 00:00:00"
15122518;1;"DANIELA SALIBA COELHO";"08075262662";NA;"CONTRATO TEMPORARIO";"IRS";NA;"MEDRE";"MEDICO";"I";"A";NA;"2022/03/01 00:00:00";"2023/02/28 00:00:00"
14938427;2;"DANIELA TEREZA GONCALVES MANSO";"11759443603";"31/01/1995";"CONTRATO TEMPORARIO";"JXXIII";"COORDENACAO DE URGENCIA E EMERGENCIA ADULTO";"MED";"MEDICO GENERALISTA";"I";"A";"02/07/2022";"2022/07/02 00:00:00";"2022/12/28 00:00:00"
14938427;1;"DANIELA TEREZA GONCALVES MANSO";"11759443603";NA;"CONTRATO TEMPORARIO";"JXXIII";NA;"MEDRE";"MEDICO";"I";"A";NA;"2021/03/01 00:00:00";"2023/02/28 00:00:00"
14901987;3;"DANIELE COLEN DOS SANTOS";"05109516600";"31/12/1978";"CONTRATO TEMPORARIO";"HEM";"COORDENACAO DAS UNIDADES DE INTERNACAO";"PENF";"TECNICO DE ENFERMAGEM";"II";"A";"10/03/2022";"2022/03/10 00:00:00";"2023/03/09 00:00:00"
14959621;2;"DANIELE CRISTINA GOMES FRANCISCO";"11408806673";"04/02/1994";"CONTRATO TEMPORARIO";"HGB-JA";"COORDENACAO DA UNIDADE DE URGENCIA E EMERGENCIA";"PENF";"TECNICO DE ENFERMAGEM";"II";"A";"01/02/2022";"2022/02/01 00:00:00";"2023/01/31 00:00:00"
14053250;2;"DANIELE FERREIRA DOS SANTOS NICOMEDES";"00012558605";"12/12/1975";"CONTRATO TEMPORARIO";"HJK";"COORDENACAO DE INTERNACAO - ADULTO";"PENF";"ENFERMEIRO";"IV";"A";"07/07/2022";"2022/07/07 00:00:00";"2023/07/06 00:00:00"
14792329;3;"DANIELE RAMALHO DA SILVA";"09602555670";"11/08/1990";"CONTRATO TEMPORARIO";"JXXIII";"COORDENACAO DAS UNIDADES DE INTERNACAO ADULTO";"PENF";"TECNICO DE ENFERMAGEM";"II";"A";"02/02/2022";"2022/02/02 00:00:00";"2023/02/01 00:00:00"
12139028;4;"DANIELLA CARLA CONDE";"04032944601";"29/10/1979";"CONTRATO TEMPORARIO";"CHPB";"COORDENACAO DE SAUDE MENTAL";"PENF";"TECNICO DE ENFERMAGEM";"II";"A";"03/03/2021";"2021/03/03 00:00:00";"2023/03/02 00:00:00"
13194600;2;"DANIELLE ANASTACIO OLIVEIRA";"01479670669";"20/07/1983";"CONTRATO TEMPORARIO";"JXXIII";"COORDENACAO DO AMBULATORIO DE PEDIATRIA";"PENF";"TECNICO DE ENFERMAGEM";"II";"A";"17/05/2021";"2021/05/17 00:00:00";"2023/05/16 00:00:00"
14590806;2;"DANIELLE CASTRO PEREIRA";"10039207641";"05/10/1989";"CONTRATO TEMPORARIO";"HIJPII";"COORDENACAO DAS UNIDADES DE INTERNACAO PEDIATRICA";"TOS";"AUXILIAR ADMINISTRATIVO";"I";"A";"16/01/2018";"2021/02/01 00:00:00";"2023/01/31 00:00:00"
14649818;1;"DANIELLE CRISTINA CORREA MARTINS";"03041833697";"25/02/1976";"CONTRATO TEMPORARIO";"JXXIII";"COORDENACAO DA UNIDADE DE TERAPIA INTENSIVA ADULTO";"PENF";"ENFERMEIRO";"IV";"A";"01/02/2022";"2022/02/01 00:00:00";"2023/01/31 00:00:00"
14637789;1;"DANIELLE CRISTINA E SILVA";"12762084644";"19/07/1996";"CONTRATO TEMPORARIO";"HEM";"COORDENACAO DAS UNIDADES CRITICAS";"PENF";"TECNICO DE ENFERMAGEM";"II";"A";"03/07/2022";"2022/07/03 00:00:00";"2023/07/02 00:00:00"
14987549;1;"DANIELLE DOS SANTOS LIMA";"14893892703";"31/10/1994";"CONTRATO TEMPORARIO";"HGB-JA";"COORDENACAO DE ASSISTENCIA FARMACEUTICA";"AGAS";"FARMACEUTICO";"I";"A";"10/08/2021";"2021/08/10 00:00:00";"2023/06/30 00:00:00"
15107006;1;"DANIELLE LOURENCO SANTOS";"06993237628";"07/05/1984";"CONTRATO TEMPORARIO";"JXXIII";"COORDENACAO DA UNIDADE DE TERAPIA INTENSIVA PEDIATRICA";"PENF";"TECNICO DE ENFERMAGEM";"II";"A";"02/02/2022";"2022/02/02 00:00:00";"2023/02/01 00:00:00"
12885984;3;"DANIELLE RODRIGUES CAMPOS";"07323171695";"10/09/1985";"CONTRATO TEMPORARIO";"HGB-JA";"COORDENACAO DA UNIDADE DE CUIDADOS CONTINUADOS INTEGRADOS";"PENF";"TECNICO DE ENFERMAGEM";"II";"A";"15/02/2022";"2022/02/15 00:00:00";"2023/02/14 00:00:00"
15081771;2;"DANIELLE RODRIGUES MARIANO";"08938631656";"22/12/1989";"CONTRATO TEMPORARIO";"JXXIII";"COORDENACAO DE URGENCIA E EMERGENCIA ADULTO";"PENF";"ENFERMEIRO";"IV";"A";"07/04/2022";"2022/04/07 00:00:00";"2023/04/06 00:00:00"
14709927;2;"DANIELLE SIMONE DE SOUZA SANTOS";"03391373636";"08/12/1976";"CONTRATO TEMPORARIO";"MOV";"COORDENACAO DA UNIDADE AMBULATORIAL";"TOS";"AUXILIAR ADMINISTRATIVO";"I";"A";"01/02/2022";"2022/02/01 00:00:00";"2023/01/31 00:00:00"
14970743;2;"DANIELLY ALMEIDA PEREIRA";"11682926621";"09/10/1990";"CONTRATO TEMPORARIO";"HIJPII";"COORDENACAO DAS UNIDADES DE INTERNACAO PEDIATRICA";"PENF";"TECNICO DE ENFERMAGEM";"II";"A";"03/03/2022";"2022/03/03 00:00:00";"2023/03/02 00:00:00"
14970743;1;"DANIELLY ALMEIDA PEREIRA";"11682926621";"09/10/1990";"CONTRATO TEMPORARIO";"JXXIII";"COORDENACAO DAS UNIDADES DE INTERNACAO CIRURGICA";"PENF";"TECNICO DE ENFERMAGEM";"II";"A";"15/06/2021";"2021/06/15 00:00:00";"2023/06/14 00:00:00"
15122641;1;"DANIELY KAROLINE DA SILVA";"10013276670";NA;"CONTRATO TEMPORARIO";"IRS";NA;"MEDRE";"MEDICO";"I";"A";NA;"2022/03/01 00:00:00";"2023/02/28 00:00:00"
15276207;1;"DANILO BASTOS BISPO FERREIRA";"07685366428";NA;"CONTRATO TEMPORARIO";"CMT";NA;"MED";"MEDICO PSIQUIATRA";"III";"A";NA;"2022/07/04 00:00:00";"2022/12/30 00:00:00"
15251713;1;"DANILO JORGE DA SILVA";"01474358624";"30/11/1985";"CONTRATO TEMPORARIO";"HGB-JA";"COORDENACAO DA UNIDADE DE CLINICA MEDICA";"MED";"MEDICO NEUROLOGISTA";"III";"A";"04/06/2022";"2022/06/04 00:00:00";"2023/06/03 00:00:00"
14437289;3;"DANILY CANGUSSUDE ARAUJO LIMA";"04408569658";"27/08/1980";"CONTRATO TEMPORARIO";"HGB-JA";"COORDENACAO DA UNIDADE CIRURGICA";"MED";"MEDICO ANESTESIOLOGISTA";"III";"A";"29/11/2021";"2021/11/29 00:00:00";"2023/06/30 00:00:00"
14437289;2;"DANILY CANGUSSUDE ARAUJO LIMA";"04408569658";"27/08/1980";"CONTRATO TEMPORARIO";"HGB-JA";"COORDENACAO DA UNIDADE CIRURGICA";"MED";"MEDICO ANESTESIOLOGISTA";"III";"A";"06/05/2022";"2022/05/06 00:00:00";"2023/05/05 00:00:00"
13913553;2;"DANUBIA CAMPOS FRIZZONE";"07666216696";"30/06/1986";"CONTRATO TEMPORARIO";"MOV";"COORDENACAO DA GINECOLOGIA E OBSTETRICIA";"MED";"MEDICO ANESTESIOLOGISTA";"III";"A";"01/02/2022";"2022/02/01 00:00:00";"2023/01/31 00:00:00"
13248869;4;"DANUBIA OZIVA CAMARGOS";"01361532670";"17/04/1981";"CONTRATO TEMPORARIO";"HJK";"COORDENACAO DO LABORATORIO";"PENF";"TECNICO DE ENFERMAGEM";"II";"A";"04/02/2022";"2022/02/06 00:00:00";"2023/02/05 00:00:00"
14437321;2;"DARLI DO CARMO SOUSA";"88408221604";"16/12/1975";"CONTRATO TEMPORARIO";"JXXIII";"COORDENACAO DE REGISTRO E INTERNACAO";"TOS";"AUXILIAR ADMINISTRATIVO";"I";"A";"01/02/2022";"2022/02/01 00:00:00";"2023/01/31 00:00:00"
14846851;2;"DAVID BARBOSA BRANDAO";"36585876873";"21/04/1987";"CONTRATO TEMPORARIO";"HGB-JA";"COORDENACAO DA UNIDADE CIRURGICA";"MED";"MEDICO ANESTESIOLOGISTA";"III";"A";"01/02/2022";"2022/02/01 00:00:00";"2023/01/31 00:00:00"
15058811;2;"DAVID INACIO DE SOUZA";"04456100699";"19/05/1981";"CONTRATO TEMPORARIO";"MOV";"COORDENACAO DE APOIO DIAGNOSTICO E TERAPEUTICO";"TOS";"TECNICO EM PATOLOGIA CLINICA";"II";"A";"02/02/2022";"2022/02/02 00:00:00";"2023/02/01 00:00:00"
14661177;3;"DAVIDSON AGUIAR FORTES";"08234691660";"26/02/1987";NA;"ADC";"(DESAT.)GERENCIA DE FATURAMENTO E CONTRATUALIZACAO";NA;"AUXILIAR ADMINISTRATIVO";NA;NA;"01/12/2021";NA;NA
14904627;3;"DAVIDSON PALHARES OLIVEIRA";"01558806679";"08/03/1987";"CONTRATO TEMPORARIO";"HEM";"COORDENACAO DAS UNIDADES CRITICAS";"PENF";"TECNICO DE ENFERMAGEM";"II";"A";"02/07/2022";"2022/07/02 00:00:00";"2023/07/01 00:00:00"
14904627;2;"DAVIDSON PALHARES OLIVEIRA";"01558806679";"08/03/1987";"CONTRATO TEMPORARIO";"HEM";"COORDENACAO DAS UNIDADES DE INTERNACAO";"PENF";"TECNICO DE ENFERMAGEM";"II";"A";"25/05/2022";"2022/05/26 00:00:00";"2023/05/25 00:00:00"
14679088;2;"DAVIDSON SAYDE DOS SANTOS";"09049315607";"19/12/1989";"CONTRATO TEMPORARIO";"JXXIII";"COORDENACAO DAS UNIDADES DE INTERNACAO ADULTO";"PENF";"TECNICO DE ENFERMAGEM";"II";"A";"20/05/2021";"2021/05/20 00:00:00";"2023/05/19 00:00:00"
14679229;1;"DAYANE DE FATIMA ROCHA";"01764348605";"27/08/1991";"CONTRATO TEMPORARIO";"HGB-JA";"COORDENACAO DE ENFERMAGEM E EQUIPE MULTIDISCIPLINAR";"TOS";"AUXILIAR ADMINISTRATIVO";"I";"A";"01/02/2022";"2022/02/01 00:00:00";"2023/01/31 00:00:00"
13187422;2;"DAYANE FRANCESCA FERREIRA";"09377625637";"23/01/1990";"CONTRATO TEMPORARIO";"JXXIII";"GERENCIA DA EQUIPE MULTIDISCIPLINAR";"AGAS";"ASSISTENTE SOCIAL";"I";"A";"04/07/2022";"2022/07/04 00:00:00";"2023/07/03 00:00:00"
14894653;2;"DAYANNA TALITA PEDROSA";"07719058666";"19/07/1988";"CONTRATO TEMPORARIO";"HJK";"COORDENACAO DE ASSISTENCIA FARMACEUTICA";"AGAS";"FARMACEUTICO";"I";"A";"11/04/2022";"2022/04/11 00:00:00";"2023/04/10 00:00:00"
14909436;1;"DAYENE JUNIA DE SOUZA BARROSO";"09827872605";"07/08/1989";"CONTRATO TEMPORARIO";"HJK";"COORDENACAO DA EQUIPE MULTIDISCIPLINAR";"AGAS";"PSICOLOGO";"I";"A";"10/02/2022";"2022/02/10 00:00:00";"2023/02/09 00:00:00"
14878680;1;"DAYRA APARECIDA DE ALMEIDA PINHEIRO";"15527451716";NA;"CONTRATO TEMPORARIO";"HRJP";NA;"MEDRE";"MEDICO";"I";"A";NA;"2020/03/01 00:00:00";"2023/02/28 00:00:00"
14679146;3;"DEBORA ALMEIDA ROCHA";"04490004605";"28/08/1979";"CONTRATO TEMPORARIO";"JXXIII";"COORDENACAO DO SERVICO DE NUTRICAO E DIETETICA";"AGAS";"NUTRICIONISTA";"I";"A";"04/03/2022";"2022/03/04 00:00:00";"2023/03/03 00:00:00"
14889554;1;"DEBORA ALVES DE JESUS";"05531928688";"05/05/1973";"CONTRATO TEMPORARIO";"HEM";"COORDENACAO DAS UNIDADES DE INTERNACAO";"PENF";"TECNICO DE ENFERMAGEM";"II";"A";"16/06/2022";"2022/06/16 00:00:00";"2023/06/15 00:00:00"
13552252;2;"DEBORA BEATRIZ ALMEIDA VELOSO";"04250976688";"08/02/1980";"CONTRATO TEMPORARIO";"HEM";"COORDENACAO DA UNIDADE DE PACIENTES EXTERNOS";"AGAS";"PSICOLOGO";"I";"A";"25/05/2022";"2022/05/25 00:00:00";"2023/05/24 00:00:00"
14883219;2;"DEBORA BRITO TANA";"11532169655";"07/04/1995";"CONTRATO TEMPORARIO";"HIJPII";"COORDENACAO DE URGENCIA E EMERGENCIA PEDIATRICA";"MED";"MEDICO GENERALISTA";"I";"A";"02/07/2022";"2022/07/02 00:00:00";"2022/12/28 00:00:00"
14883219;1;"DEBORA BRITO TANA";"11532169655";NA;"CONTRATO TEMPORARIO";"HIJPII";NA;"MEDRE";"MEDICO";"I";"A";NA;"2020/03/01 00:00:00";"2023/02/28 00:00:00"
14661169;3;"DEBORA COSTA DE SOUZA";"08245174661";"18/04/1986";"CONTRATO TEMPORARIO";"DIEST";"(DESAT.)GERENCIA DE SAUDE E SEGURANCA DO TRABALHADOR";"TOS";"AUXILIAR ADMINISTRATIVO";"I";"A";"03/03/2022";"2022/03/03 00:00:00";"2023/03/02 00:00:00"
14918866;1;"DEBORA CRISTINA JANUARIO";"11103871641";"29/10/1993";"CONTRATO TEMPORARIO";"HJK";"COORDENACAO MEDICA DA URGENCIA E EMERGENCIA";"PENF";"TECNICO DE ENFERMAGEM";"II";"A";"07/07/2022";"2022/07/07 00:00:00";"2023/07/06 00:00:00"
14761977;2;"DEBORA CRISTOFORIDIS TEIXEIRA";"09008147645";"15/05/1987";"CONTRATO TEMPORARIO";"HJK";"COORDENACAO DE INTERNACAO - ADULTO";"MED";"MEDICO PNEUMOLOGISTA";"III";"A";"01/02/2022";"2022/02/02 00:00:00";"2023/02/01 00:00:00"
14761977;3;"DEBORA CRISTOFORIDIS TEIXEIRA";"09008147645";"15/05/1987";"CONTRATO TEMPORARIO";"HJK";"COORDENACAO MEDICA DA URGENCIA E EMERGENCIA";"MED";"MEDICO CLINICO";"III";"A";"07/08/2021";"2021/08/07 00:00:00";"2023/06/30 00:00:00"
15155930;1;"DEBORA CRYSTINA REIS";"34835994876";"31/07/1997";"CONTRATO TEMPORARIO";"JXXIII";"NUCLEO DE ENSINO E PESQUISA";"AGAS";"BIBLIOTECARIO";"I";"A";"22/02/2022";"2022/02/22 00:00:00";"2023/02/21 00:00:00"
12504270;3;"DEBORA DE FREITAS SANTIAGO";"06562195640";"04/09/1982";"CONTRATO TEMPORARIO";"HJK";"COORDENACAO DE INTERNACAO - ADULTO";"PENF";"ENFERMEIRO";"IV";"A";"28/03/2022";"2022/03/28 00:00:00";"2023/03/27 00:00:00"
14613475;2;"DEBORA DUMONT CRUZ NUNES";"07081845614";"19/09/1988";"CONTRATO TEMPORARIO";"HEM";"COORDENACAO DA UNIDADE DE PACIENTES EXTERNOS";"MED";"MEDICO DERMATOLOGISTA";"III";"A";"06/07/2022";"2022/07/06 00:00:00";"2023/07/05 00:00:00"
15170921;1;"DEBORA LELIS PEREIRA LOPES";"08778423619";"10/12/1986";"CONTRATO TEMPORARIO";"HCM";"COORDENACAO TECNICA DE ENFERMAGEM";"PENF";"TECNICO DE ENFERMAGEM";"II";"A";"10/04/2022";"2022/04/10 00:00:00";"2023/04/09 00:00:00"
14888895;2;"DEBORA LOPES RODRIGUES DOMINGUES";"07044986692";"20/03/1986";"CONTRATO TEMPORARIO";"JXXIII";"COORDENACAO DE DIAGNOSTICO POR IMAGEM";"TOS";"TECNICO EM RADIOLOGIA";"II";"A";"04/02/2022";"2022/02/04 00:00:00";"2023/02/03 00:00:00"
14661151;2;"DEBORA NASCIMENTO SOUZA";"04668615676";"12/06/1978";"CONTRATO TEMPORARIO";"JXXIII";"COORDENACAO DE URGENCIA E EMERGENCIA ADULTO";"PENF";"TECNICO DE ENFERMAGEM";"II";"A";"12/03/2022";"2022/03/12 00:00:00";"2023/03/11 00:00:00"
14888903;2;"DEBORA RODRIGUES MARTINS";"01268816698";"17/11/1978";"CONTRATO TEMPORARIO";"HJK";"COORDENACAO DE INTERNACAO - ADULTO";"PENF";"TECNICO DE ENFERMAGEM";"II";"A";"06/03/2022";"2022/03/06 00:00:00";"2023/03/05 00:00:00"
12818472;3;"DEBORA SANTOS LEAL CARDOSO";"06108691670";"23/07/1984";"CONTRATO TEMPORARIO";"JXXIII";"COORDENACAO DA UNIDADE DE TERAPIA INTENSIVA PEDIATRICA";"PENF";"TECNICO DE ENFERMAGEM";"II";"A";"06/10/2022";"2022/10/06 00:00:00";"2023/10/05 00:00:00"
14700850;2;"DEBORA VAZ DE MELO TRINDADE";"07759270666";NA;"CONTRATO TEMPORARIO";"HEM";NA;"AGAS";"FARMACEUTICO BIOQUIMICO";"I";"A";NA;"2022/07/05 00:00:00";"2022/12/31 00:00:00"
15171127;1;"DEBORAH ALINE PEREIRA DE SOUZA";"08800399657";"23/12/1994";"CONTRATO TEMPORARIO";"HRAD";"COORDENACAO DAS UNIDADES CRITICAS";"PENF";"ENFERMEIRO";"IV";"A";"0000-00-00";"2022/04/01 00:00:00";"2023/03/31 00:00:00"
15165285;1;"DEBORAH DANIELLY VIEIRA GALIZA";"14206487642";"20/03/2000";"CONTRATO TEMPORARIO";"HJK";"COORDENACAO DE HOTELARIA";"TOS";"AUXILIAR ADMINISTRATIVO";"I";"A";"30/03/2022";"2022/03/30 00:00:00";"2023/03/29 00:00:00"
13615067;3;"DEBORAH DOS REIS ESTRELLA";"07196963644";"20/01/1989";"CONTRATO TEMPORARIO";"HJK";"COORDENACAO DE INTERNACAO - ADULTO";"MED";"MEDICO CLINICO";"III";"A";"14/02/2022";"2022/02/14 00:00:00";"2023/02/13 00:00:00"
15119639;1;"DEBORAH FRANCO LOURENCO";"08107704665";NA;"CONTRATO TEMPORARIO";"HIJPII";NA;"MEDRE";"MEDICO";"I";"A";NA;"2022/03/01 00:00:00";"2023/02/28 00:00:00"
14807598;2;"DEBORAH MOREIRA GONCALVES";"06555898640";"08/01/1983";"CONTRATO TEMPORARIO";"HJK";"COORDENACAO MEDICA DA URGENCIA E EMERGENCIA";"PENF";"ENFERMEIRO";"IV";"A";"06/04/2021";"2021/04/06 00:00:00";"2023/04/05 00:00:00"
14580047;3;"DEGIANE ARAUJO MACHADO";"01262495636";"08/09/1982";"CONTRATO TEMPORARIO";"HIJPII";"DIRETORIA GERAL";"TOS";"AUXILIAR ADMINISTRATIVO";"I";"A";"01/02/2022";"2022/02/01 00:00:00";"2023/01/31 00:00:00"
14590814;2;"DEILZE EDILAINE DA SILVA";"03985179670";"09/12/1977";"CONTRATO TEMPORARIO";"JXXIII";"COORDENACAO DAS UNIDADES DE INTERNACAO ADULTO";"PENF";"TECNICO DE ENFERMAGEM";"II";"A";"05/10/2022";"2022/10/05 00:00:00";"2023/10/04 00:00:00"
15072028;1;"DEJNANE DA CRUZ VIDAL";"95866949687";"29/10/1971";"CONTRATO TEMPORARIO";"HRJP";"COORDENACAO DAS UNIDADES CRITICAS";"PENF";"TECNICO DE ENFERMAGEM";"II";"A";"01/02/2022";"2022/02/01 00:00:00";"2023/01/31 00:00:00"
14905566;2;"DELIANE MARILIA LEBRELON";"11689813601";"07/11/1991";"CONTRATO TEMPORARIO";"HEM";"COORDENACAO DAS UNIDADES CRITICAS";"AGAS";"FISIOTERAPEUTA";"III";"A";"27/04/2022";"2022/04/27 00:00:00";"2023/04/26 00:00:00"
14051841;2;"DELMA DA SILVEIRA";"91413362672";"06/08/1971";"CONTRATO TEMPORARIO";"CSSFE";"COORDENACAO DA UNIDADE DE CUIDADO AO ADULTO";"PENF";"TECNICO DE ENFERMAGEM";"II";"A";"01/06/2021";"2021/06/01 00:00:00";"2023/05/31 00:00:00"
10905974;5;"DELMA GONCALVES FONSECA RIBEIRO";"00708412688";"18/12/1972";"CONTRATO TEMPORARIO";"HRAD";"COORDENACAO DA UNIDADE DE PACIENTES EXTERNOS";"AGAS";"ASSISTENTE SOCIAL";"I";"A";"0000-00-00";"2021/11/23 00:00:00";"2023/06/30 00:00:00"
10874543;3;"DELVAIR MARIA OLIVEIRA FREITAS";"57569282604";"22/08/1964";"CONTRATO TEMPORARIO";"JXXIII";"COORDENACAO DE URGENCIA E EMERGENCIA ADULTO";"PENF";"TECNICO DE ENFERMAGEM";"II";"A";"08/02/2022";"2022/02/03 00:00:00";"2023/02/02 00:00:00"
12866364;2;"DENISE AMARAL FERREIRA";"01480705667";"24/01/1983";"CONTRATO TEMPORARIO";"HEM";"COORDENACAO DAS UNIDADES CRITICAS";"PENF";"TECNICO DE ENFERMAGEM";"II";"A";"01/07/2022";"2022/07/04 00:00:00";"2023/07/03 00:00:00"
12416665;2;"DENISE BARBOSA GOMES";"05617853686";"05/05/1980";"CONTRATO TEMPORARIO";"";"(DESAT.)COORDENACAO DE CONTROLE DE PAGAMENTO E TAXACAO";"TOS";"AUXILIAR ADMINISTRATIVO";"I";"A";"01/02/2022";"2022/02/01 00:00:00";"2023/01/31 00:00:00"
10916500;2;"DENISE CRISTINA IGNACIO";"03196980685";"25/02/1976";"CONTRATO TEMPORARIO";"HJK";"COORDENACAO DE INTERNACAO - ADULTO";"PENF";"TECNICO DE ENFERMAGEM";"II";"A";"07/02/2022";"2022/02/09 00:00:00";"2023/02/08 00:00:00"
11228749;3;"DENISE DE FATIMA GOMES COSTA";"00268532648";"09/09/1971";"CONTRATO TEMPORARIO";"CHPB";"COORDENACAO DE SAUDE MENTAL";"PENF";"TECNICO DE ENFERMAGEM";"II";"A";"01/02/2022";"2022/02/01 00:00:00";"2023/01/31 00:00:00"
11996642;5;"DENISE DOS SANTOS LOURENCO";"04151745629";"19/03/1979";"CONTRATO TEMPORARIO";"JXXIII";"COORDENACAO DE URGENCIA E EMERGENCIA ADULTO";"PENF";"ENFERMEIRO";"IV";"A";"01/02/2022";"2022/02/01 00:00:00";"2023/01/31 00:00:00"
14679104;1;"DENISE FAUSTA CESAR";"58126457600";"01/01/1968";"CONTRATO TEMPORARIO";"HRJP";"COORDENACAO DE APOIO DIAGNOSTICO E TERAPEUTICO";"AGAS";"FARMACEUTICO";"I";"A";"01/02/2022";"2022/02/01 00:00:00";"2023/01/31 00:00:00"
12080933;9;"DENISE KARLA DE ABREU SILVA";"04445545643";"0000-00-00";NA;"HJXXIII";"COORDENACAO DA CENTRAL DE MATERIAL E ESTERILIZACAO";NA;"";NA;NA;"14/11/2022";NA;NA
14700876;3;"DENISE LUCIA CORREIA TOSCANO";"81834586615";"26/02/1975";"CONTRATO TEMPORARIO";"JXXIII";"COORDENACAO DAS UNIDADES DE INTERNACAO ADULTO";"PENF";"TECNICO DE ENFERMAGEM";"II";"A";"31/03/2022";"2022/03/31 00:00:00";"2023/02/28 00:00:00"
13649298;2;"DENISE SILVA DOS SANTOS";"05483912624";"06/05/1980";"CONTRATO TEMPORARIO";"HJK";"COORDENACAO MEDICA DA URGENCIA E EMERGENCIA";"PENF";"TECNICO DE ENFERMAGEM";"II";"A";"24/02/2022";"2022/02/24 00:00:00";"2023/02/23 00:00:00"
15073836;1;"DEYSIELE DA SILVA FRANCA";"13750845697";"03/06/1996";"CONTRATO TEMPORARIO";"MOV";"COORDENACAO DA UNIDADE DE NEONATOLOGIA";"PENF";"TECNICO DE ENFERMAGEM";"II";"A";"02/02/2022";"2022/02/02 00:00:00";"2023/02/01 00:00:00"
14888911;2;"DIANA ALVES VIANA";"03836575639";"21/09/1977";"CONTRATO TEMPORARIO";"JXXIII";"COORDENACAO DO CENTRO DE TRATAMENTO DE QUEIMADOS";"PENF";"TECNICO DE ENFERMAGEM";"II";"A";"05/07/2022";"2022/07/05 00:00:00";"2023/07/04 00:00:00"
14888911;3;"DIANA ALVES VIANA";"03836575639";"21/09/1977";"CONTRATO TEMPORARIO";"JXXIII";"COORDENACAO DAS UNIDADES DE INTERNACAO CIRURGICA";"PENF";"TECNICO DE ENFERMAGEM";"II";"A";"03/02/2022";"2022/02/03 00:00:00";"2023/02/02 00:00:00"
14613566;2;"DIANA SOARES";"01523125608";"28/04/1983";"CONTRATO TEMPORARIO";"CSPD";"COORDENACAO DE APOIO DIAGNOSTICO E TERAPEUTICO";"TOS";"AUXILIAR ADMINISTRATIVO";"I";"A";"05/03/2018";"2022/02/01 00:00:00";"2023/01/31 00:00:00"
14902720;2;"DIANE LOURENCO DA PAIXAO SANTOS";"06200062692";"28/05/1983";"CONTRATO TEMPORARIO";"HJK";"COORDENACAO DE INTERNACAO - ADULTO";"PENF";"TECNICO DE ENFERMAGEM";"II";"A";"08/03/2022";"2022/03/08 00:00:00";"2023/03/07 00:00:00"
15124118;1;"DIEGO ALCANTARA SANTOS";"12143932685";NA;"CONTRATO TEMPORARIO";"HEM";NA;"MEDRE";"MEDICO";"I";"A";NA;"2022/03/01 00:00:00";"2023/02/28 00:00:00"
14580088;1;"DIEGO COSTA DA SILVA";"07977396610";"24/09/1985";"CONTRATO TEMPORARIO";"DIGEPE";"(DESAT.)COORDENACAO DE PROVIMENTOS E CARREIRAS";"TOS";"AUXILIAR ADMINISTRATIVO";"I";"A";"01/02/2022";"2022/02/01 00:00:00";"2023/01/31 00:00:00"
14882575;1;"DIEGO DE SOUSA SILVA";"08465638608";NA;"CONTRATO TEMPORARIO";"JXXIII";NA;"MEDRE";"MEDICO";"I";"A";NA;"2020/03/01 00:00:00";"2023/02/28 00:00:00"
15129620;1;"DIEGO DOS SANTOS SILVA";"12176035658";"03/08/1995";"CONTRATO TEMPORARIO";"JXXIII";"COORDENACAO DE URGENCIA E EMERGENCIA ADULTO";"PENF";"ENFERMEIRO";"IV";"A";"08/03/2022";"2022/03/08 00:00:00";"2023/03/07 00:00:00"
14667109;1;"DIEGO HENRIQUE ALMEIDA SILVA";"01693846675";"01/12/1988";"CONTRATO TEMPORARIO";"JXXIII";"COORDENACAO DE TECNOLOGIA DA INFORMACAO";"TOS";"TECNICO EM INFORMATICA";"II";"A";"03/03/2022";"2022/03/03 00:00:00";"2023/03/02 00:00:00"
14190763;2;"DIEGO MARTINEZ MARQUES LOPES SIQUEIRA";"09613231676";"18/11/1989";"CONTRATO TEMPORARIO";"HGB-JA";"COORDENACAO DA UNIDADE CIRURGICA";"MED";"MEDICO CIRURGIAO GERAL";"III";"A";"12/02/2022";"2022/02/12 00:00:00";"2023/02/11 00:00:00"
13962774;1;"DIEGO MARTINS DA COSTA FERNANDES";"07555764628";NA;"CONTRATO TEMPORARIO";"HIJPII";NA;"AGAS";"FISIOTERAPEUTA";"I";"A";NA;"2022/07/03 00:00:00";"2023/01/02 00:00:00"
12161683;3;"DIEGO MURILO MIRANDA NEVES";"06761419603";"27/08/1983";"CONTRATO TEMPORARIO";"HGB-JA";"COORDENACAO DA UNIDADE DE PACIENTES CRITICOS";"MED";"MEDICO CLINICO";"III";"A";"24/12/2021";"2021/12/24 00:00:00";"2023/06/30 00:00:00"
14784664;1;"DIEGO OLIVEIRA BRITO";"08936605666";"13/03/1989";"CONTRATO TEMPORARIO";"IRS";"COORDENACAO DA UNIDADE DE PACIENTES EXTERNOS";"MED";"MEDICO PSIQUIATRA";"III";"A";"02/02/2022";"2022/02/02 00:00:00";"2023/02/01 00:00:00"
14613517;4;"DIEGO PEREIRA ZILLE";"08377028603";"12/10/1988";"CONTRATO TEMPORARIO";"JXXIII";"COORDENACAO DE URGENCIA E EMERGENCIA ADULTO";"MED";"MEDICO CIRURGIAO GERAL";"III";"A";"03/03/2022";"2022/03/03 00:00:00";"2023/03/02 00:00:00"
15176332;1;"DIEGO SAVIO SILVA DA COSTA";"11453077600";"07/05/1994";"CONTRATO TEMPORARIO";"DIEST";"(DESAT.)GERENCIA DE TECNOLOGIA E GESTAO DA INFORMACAO";"TOS";"TECNICO EM INFORMATICA";"II";"A";"30/03/2022";"2022/03/28 00:00:00";"2023/03/27 00:00:00"
13841242;2;"DIMAS PIRES TEIXEIRA";"05953331681";"23/10/1983";"CONTRATO TEMPORARIO";"HGB-JA";"COORDENACAO DA UNIDADE DE PACIENTES CRITICOS";"MED";"MEDICO";"III";"A";"30/06/2022";"2022/06/30 00:00:00";"2022/12/26 00:00:00"
14239602;3;"DIMITRA JACONI STAMOULIS";"10281848670";"20/10/1989";"CONTRATO TEMPORARIO";"HRAD";"COORDENACAO DA UNIDADE CIRURGICA";"MED";"MEDICO GENERALISTA";"I";"A";"0000-00-00";"2022/07/01 00:00:00";"2022/12/27 00:00:00"
14239602;2;"DIMITRA JACONI STAMOULIS";"10281848670";NA;"CONTRATO TEMPORARIO";"HRAD";NA;"MEDRE";"MEDICO";"I";"A";NA;"2020/03/02 00:00:00";"2023/02/28 00:00:00"
14889562;6;"DINEUSA DOMINGOS DA SILVA MACHADO";"04456299673";"08/01/1978";"CONTRATO TEMPORARIO";"HJK";"COORDENACAO MEDICA DA URGENCIA E EMERGENCIA";"PENF";"TECNICO DE ENFERMAGEM";"II";"A";"07/04/2022";"2022/04/07 00:00:00";"2023/04/06 00:00:00"
14889562;5;"DINEUSA DOMINGOS DA SILVA MACHADO";"04456299673";"08/01/1978";"CONTRATO TEMPORARIO";"HAC";"COORDENACAO DE INTERNACAO - ONCOLOGICA";"PENF";"TECNICO DE ENFERMAGEM";"II";"A";"25/03/2021";"2021/03/25 00:00:00";"2023/03/24 00:00:00"
14498554;3;"DIOGENES MAGNO JACO";"02605477606";"12/03/1974";"CONTRATO TEMPORARIO";"HMAL";"COORDENACAO DA UNIDADE DE TERAPIA INTENSIVA ADULTO";"PENF";"TECNICO DE ENFERMAGEM";"II";"A";"03/02/2022";"2022/02/03 00:00:00";"2023/02/02 00:00:00"
12990966;3;"DIOGO DE VASCONCELLOS SABIDO GOMES";"05730940637";"01/11/1982";"CONTRATO TEMPORARIO";"HMAL";"COORDENACAO DA ORTOPEDIA";"MED";"MEDICO ORTOPEDISTA E TRAUMATOLOGISTA";"III";"A";"15/02/2022";"2022/02/15 00:00:00";"2023/02/14 00:00:00"
14047591;2;"DIOGO MARTINS PEREIRA";"08455824611";"17/07/1989";"CONTRATO TEMPORARIO";"HIJPII";"COORDENACAO DE ASSISTENCIA FARMACEUTICA";"TOS";"TECNICO EM FARMACIA";"II";"A";"04/07/2022";"2022/07/04 00:00:00";"2022/12/30 00:00:00"
15322837;1;"DIONEI GOMES FERREIRA";"12206375648";"11/02/1992";"CONTRATO TEMPORARIO";"HJK";"COORDENACAO DE INTERNACAO - ADULTO";"PENF";"TECNICO DE ENFERMAGEM";"II";"A";"29/09/2022";"2022/09/29 00:00:00";"2023/09/28 00:00:00"
10862548;3;"DIONILDA TEODORO BRAGA ARAUJO";"85906271600";"18/12/1967";"CONTRATO TEMPORARIO";"JXXIII";"COORDENACAO DO SERVICO DE ARQUIVO MEDICO E ESTATISTICA";"TOS";"AUXILIAR ADMINISTRATIVO";"I";"A";"01/02/2022";"2022/02/01 00:00:00";"2023/01/31 00:00:00"
14930481;1;"DIRCE TAMIRES D BRANDAO";"09602756659";NA;"CONTRATO TEMPORARIO";"HEM";NA;"MEDRE";"MEDICO";"I";"A";NA;"2021/03/01 00:00:00";"2023/02/28 00:00:00"
14880686;1;"DOUGLAS DE ALMEIDA SANTOS";"10174922639";NA;"CONTRATO TEMPORARIO";"IRS";NA;"MEDRE";"MEDICO";"I";"A";NA;"2020/03/01 00:00:00";"2023/02/28 00:00:00"
15071848;1;"DOUGLAS DE SOUZA";"10832892688";"13/09/1991";"CONTRATO TEMPORARIO";"JXXIII";"COORDENACAO DO CENTRO DE TRATAMENTO DE QUEIMADOS";"PENF";"TECNICO DE ENFERMAGEM";"II";"A";"02/02/2022";"2022/02/02 00:00:00";"2023/02/01 00:00:00"
14414635;6;"DOUGLAS DONADONE SOARES";"10192283693";"13/03/1991";"CONTRATO TEMPORARIO";"JXXIII";"COORDENACAO DA UNIDADE DE TERAPIA INTENSIVA ADULTO";"MED";"MEDICO CLINICO";"III";"A";"02/02/2022";"2022/02/02 00:00:00";"2023/02/01 00:00:00"
14414635;5;"DOUGLAS DONADONE SOARES";"10192283693";"13/03/1991";"CONTRATO TEMPORARIO";"JXXIII";"COORDENACAO DA UNIDADE DE TERAPIA INTENSIVA ADULTO";"MED";"MEDICO CLINICO";"III";"A";"10/09/2021";"2021/09/10 00:00:00";"2023/06/30 00:00:00"
14955843;2;"DOUGLAS DONIZETH RESENDE";"05193178669";"27/01/1983";"CONTRATO TEMPORARIO";"HRAD";"COORDENACAO DA UNIDADE DE PACIENTES EXTERNOS";"MED";"MEDICO ORTOPEDISTA E TRAUMATOLOGISTA";"III";"A";"0000-00-00";"2022/04/05 00:00:00";"2023/04/04 00:00:00"
14955835;1;"DOUGLAS HENRIQUE DA SILVA CAMBRAIA";"07853163614";"29/08/1987";"CONTRATO TEMPORARIO";"HRAD";"COORDENACAO DA UNIDADE CIRURGICA";"PENF";"ENFERMEIRO";"IV";"A";"0000-00-00";"2021/04/16 00:00:00";"2023/04/15 00:00:00"
13111059;1;"DOUGLAS SILVA DE PAULA";"10792108655";"02/03/1990";"CONTRATO TEMPORARIO";"HRJP";"COORDENACAO DE ASSISTENCIA FARMACEUTICA";"TOS";"TECNICO EM FARMACIA";"II";"A";"02/07/2022";"2022/07/02 00:00:00";"2023/07/01 00:00:00"
15108251;1;"DOUGLAS VINICIUS SAMPAIO DA FONSECA";"09871172621";"13/03/1989";"CONTRATO TEMPORARIO";"HGB-JA";"COORDENACAO DE SAUDE MENTAL";"PENF";"TECNICO DE ENFERMAGEM";"II";"A";"22/02/2022";"2022/02/22 00:00:00";"2023/01/21 00:00:00"
9392713;4;"DULCE MARIA TEIXEIRA TALHADAS";"48674257615";"09/10/1965";"CONTRATO TEMPORARIO";"DIGEPE";"(DESAT.)GERENCIA DE PROVIMENTO E ADMINISTRACAO DE PESSOAL";"TOS";"AUXILIAR ADMINISTRATIVO";"I";"A";"07/02/2022";"2022/02/07 00:00:00";"2023/02/06 00:00:00"
14052799;2;"DULCILENE MARTA ARAUJO";"65964560644";"15/09/1967";"CONTRATO TEMPORARIO";"CMT";"GERENCIA ADMINISTRATIVA";"TOS";"TECNICO DE CONTABILIDADE";"II";"A";"01/12/2021";"2021/12/01 00:00:00";"2023/06/30 00:00:00"
15142151;1;"ECIMAR GONCALVES DA SILVA JUNIOR";"01786366142";NA;"CONTRATO TEMPORARIO";"HRAD";NA;"MEDRE";"MEDICO";"I";"A";NA;"2022/03/01 00:00:00";"2023/02/28 00:00:00"
14888390;2;"ECLAIR MOISES FENSKE ANTUNES";"70362831068";NA;"CONTRATO TEMPORARIO";"HEM";NA;"PENF";"ENFERMEIRO";"IV";"A";NA;"2022/02/01 00:00:00";"2023/01/31 00:00:00"
14541189;1;"EDERCILIA DE LIMA AMARAL";"76445089615";"18/11/1966";"CONTRATO TEMPORARIO";"MOV";"COORDENACAO DA UNIDADE DE NEONATOLOGIA";"PENF";"TECNICO DE ENFERMAGEM";"II";"A";"07/02/2022";"2022/02/07 00:00:00";"2023/02/06 00:00:00"
14850382;3;"EDIA NUBIA RODRIGUES CHAVES";"05021203630";"18/05/1980";"CONTRATO TEMPORARIO";"HEM";"COORDENACAO DAS UNIDADES DE INTERNACAO";"PENF";"ENFERMEIRO";"IV";"A";"01/02/2022";"2022/02/01 00:00:00";"2023/01/31 00:00:00"
14850382;1;"EDIA NUBIA RODRIGUES CHAVES";"05021203630";"18/05/1980";"CONTRATO TEMPORARIO";"HJK";"COORDENACAO MEDICA DA URGENCIA E EMERGENCIA";"PENF";"ENFERMEIRO";"IV";"A";"25/01/2022";"2022/02/01 00:00:00";"2023/01/31 00:00:00"
14626493;2;"EDIEZER GONCALVES SILVA";"08768547650";"01/11/1986";"CONTRATO TEMPORARIO";"HRAD";"COORDENACAO DA UNIDADE DE PACIENTES EXTERNOS";"PENF";"ENFERMEIRO";"IV";"A";"0000-00-00";"2021/09/01 00:00:00";"2023/06/30 00:00:00"
15102080;1;"EDILAINE MARINA SANCHES";"08620546643";"28/09/1984";"CONTRATO TEMPORARIO";"HGB-JA";"COORDENACAO DE PATRIMONIO";"TOS";"AUXILIAR ADMINISTRATIVO";"I";"A";"01/02/2022";"2022/02/01 00:00:00";"2023/01/31 00:00:00"
14904254;2;"EDILAINE MARTINS ROSA OLIVEIRA";"10668437677";"02/03/1990";"CONTRATO TEMPORARIO";"HRAD";"COORDENACAO DAS UNIDADES DE INTERNACAO";"PENF";"TECNICO DE ENFERMAGEM";"II";"A";"0000-00-00";"2022/04/01 00:00:00";"2023/03/31 00:00:00"
10869683;3;"EDILENE APARECIDA FRANCISCA DOS REIS";"92228267600";"28/11/1967";"CONTRATO TEMPORARIO";"MOV";"COORDENACAO DA UNIDADE CIRURGICA";"PENF";"TECNICO DE ENFERMAGEM";"II";"A";"04/01/2022";"2022/01/04 00:00:00";"2023/01/03 00:00:00"
13979737;2;"EDILTON ALVES DA SILVA";"30510066372";"04/03/1964";"CONTRATO TEMPORARIO";"CSSFA";"COORDENACAO TECNICA DE ENFERMAGEM";"TOS";"AUXILIAR ADMINISTRATIVO";"I";"A";"04/11/2021";"2021/11/04 00:00:00";"2023/06/30 00:00:00"
15072085;1;"EDILZA GUIMARAES FERNANDES";"09762562666";NA;"CONTRATO TEMPORARIO";"JXXIII";NA;"PENF";"TECNICO DE ENFERMAGEM";"II";"A";NA;"2022/02/02 00:00:00";"2023/02/01 00:00:00"
13954409;2;"EDINAN ALVES MACHADO";"96393025620";"16/06/1970";"CONTRATO TEMPORARIO";"CSSI";"COORDENACAO DE APOIO DIAGNOSTICO E TERAPEUTICO";"AGAS";"FARMACEUTICO";"I";"A";"09/07/2021";"2021/07/09 00:00:00";"2023/06/30 00:00:00"
14934244;1;"EDIPO ALVES SABINO";"09335864692";NA;"CONTRATO TEMPORARIO";"HJK";NA;"MEDRE";"MEDICO";"I";"A";NA;"2021/03/02 00:00:00";"2023/03/01 00:00:00"
13800255;3;"EDIRLANE PAULINA ALVES";"04383602657";"16/01/1979";"CONTRATO TEMPORARIO";"HGB-JA";"COORDENACAO DA UNIDADE DE CLINICA MEDICA";"PENF";"TECNICO DE ENFERMAGEM";"II";"A";"09/01/2022";"2022/01/09 00:00:00";"2023/01/08 00:00:00"
13800255;2;"EDIRLANE PAULINA ALVES";"04383602657";"16/01/1979";"CONTRATO TEMPORARIO";"HGB-JA";"COORDENACAO DA UNIDADE DE URGENCIA E EMERGENCIA";"PENF";"TECNICO DE ENFERMAGEM";"II";"A";"10/09/2022";"2022/09/10 00:00:00";"2023/09/09 00:00:00"
14591010;3;"EDMAR SANTOS MENDES";"01382271603";"07/02/1981";"CONTRATO TEMPORARIO";"CEPAI";"COORDENACAO DE INTERNACAO E AMBULATORIO";"PENF";"TECNICO DE ENFERMAGEM";"II";"A";"22/02/2022";"2022/02/22 00:00:00";"2023/02/21 00:00:00"
15335870;1;"EDMARA LORENA DE OLIVEIRA";"07952354612";"09/08/1984";"CONTRATO TEMPORARIO";"JXXIII";"COORDENACAO DE URGENCIA E EMERGENCIA ADULTO";"PENF";"TECNICO DE ENFERMAGEM";"II";"A";"05/10/2022";"2022/10/05 00:00:00";"2023/10/04 00:00:00"
15072143;1;"EDMEA ANTONIA MARCONES PAVANI";"85906956620";"20/11/1971";"CONTRATO TEMPORARIO";"JXXIII";"COORDENACAO DE ASSISTENCIA FARMACEUTICA";"PENF";"TECNICO DE ENFERMAGEM";"II";"A";"02/01/2022";"2022/01/02 00:00:00";"2023/01/01 00:00:00"
12280855;3;"EDMILSON ANTONIO MARIANO";"03251084631";NA;"CONTRATO TEMPORARIO";"JXXIII";NA;"PENF";"ENFERMEIRO";"IV";"A";NA;"2022/04/13 00:00:00";"2023/04/12 00:00:00"
15324924;1;"EDNA ADAO";"05069863657";"20/12/1966";"CONTRATO TEMPORARIO";"CSSFA";"COORDENACAO DA UNIDADE DE INTERNACAO E PACIENTES EXTERNOS";"PENF";"TECNICO DE ENFERMAGEM";"II";"A";"03/10/2022";"2022/10/03 00:00:00";"2023/10/02 00:00:00"
2632297;5;"EDNA CESAR MATTOS - PJF";"43225349615";"21/12/1961";NA;"HRJP";"COORDENACAO DA MATERNIDADE";NA;"NAO ASSOCIADA";NA;NA;"01/01/2006";NA;NA
15070428;1;"EDNALDA SOARES DA SILVA";"76368718668";"08/09/1971";"CONTRATO TEMPORARIO";"HMAL";"COORDENACAO DO BLOCO CIRURGICO";"PENF";"TECNICO DE ENFERMAGEM";"II";"A";"01/02/2022";"2022/02/01 00:00:00";"2023/01/31 00:00:00"
14717995;3;"EDNAMAR SANTOS PEDREIRA";"26452375687";"19/02/1957";"CONTRATO TEMPORARIO";"JXXIII";"COORDENACAO DE DIAGNOSTICO POR IMAGEM";"TOS";"AUXILIAR ADMINISTRATIVO";"I";"A";"08/07/2022";"2022/01/25 00:00:00";"2023/01/24 00:00:00"
15077399;1;"EDSON EZEQUIEL PAULO";"08658232603";"11/04/1988";"CONTRATO TEMPORARIO";"HCM";"COORDENACAO TECNICA DE ENFERMAGEM";"PENF";"TECNICO DE ENFERMAGEM";"II";"A";"01/02/2022";"2022/02/01 00:00:00";"2023/01/31 00:00:00"
15024060;1;"EDSON GERALDO PEREIRA";"67039243687";"12/06/1971";"CONTRATO TEMPORARIO";"HRAD";"COORDENACAO DE GESTAO DA INFORMACAO";"TOS";"AUXILIAR ADMINISTRATIVO";"I";"A";"0000-00-00";"2021/10/04 00:00:00";"2023/06/30 00:00:00"
15082720;1;"EDSON JOSE MATEUS";"10759990654";"02/01/1995";"CONTRATO TEMPORARIO";"HGB-JA";"COORDENACAO DE SAUDE MENTAL";"PENF";"TECNICO DE ENFERMAGEM";"II";"A";"02/02/2022";"2022/02/02 00:00:00";"2023/02/01 00:00:00"
14176739;3;"EDUARDA APARECIDA ANDRADE";"07291150620";"25/09/1990";"CONTRATO TEMPORARIO";"HRAD";"COORDENACAO DA UNIDADE DE PACIENTES EXTERNOS";"MED";"MEDICO GINECOLOGISTA";"III";"A";"0000-00-00";"2022/04/01 00:00:00";"2023/03/31 00:00:00"
14777395;3;"EDUARDA CRISTINA SOARES MACIEL";"10817350667";"10/09/1991";"CONTRATO TEMPORARIO";"HJK";"COORDENACAO DE ASSISTENCIA FARMACEUTICA";"AGAS";"FARMACEUTICO";"I";"A";"11/04/2022";"2022/04/11 00:00:00";"2023/04/10 00:00:00"
14886246;1;"EDUARDA PAES FONTOURA ALVES DOS SANTOS";"10604095694";NA;"CONTRATO TEMPORARIO";"HCM";NA;"MEDRE";"MEDICO";"I";"A";NA;"2020/03/01 00:00:00";"2023/02/28 00:00:00"
15117450;1;"EDUARDO DE CASTRO CARDOSO OLIVEIRA";"10748749608";NA;"CONTRATO TEMPORARIO";"HJK";NA;"MEDRE";"MEDICO";"I";"A";NA;"2022/03/01 00:00:00";"2023/02/28 00:00:00"
15326713;1;"EDUARDO DE PAULA MARIANO";"10788583654";"28/02/1994";"CONTRATO TEMPORARIO";"HGB-JA";"COORDENACAO DA UNIDADE DE URGENCIA E EMERGENCIA";"PENF";"TECNICO DE ENFERMAGEM";"II";"A";"07/10/2022";"2022/10/07 00:00:00";"2023/10/06 00:00:00"
11276128;2;"EDUARDO FAGUNDES RODRIGUES";"01446486605";"01/10/1982";"CONTRATO TEMPORARIO";"HJK";"COORDENACAO MEDICA DA URGENCIA E EMERGENCIA";"PENF";"ENFERMEIRO";"IV";"A";"02/11/2022";"2022/11/02 00:00:00";"2023/11/01 00:00:00"
13800271;3;"EDUARDO FERREIRA BATISTA";"09403851635";"06/05/1988";"CONTRATO TEMPORARIO";"HGB-JA";"COORDENACAO DA UNIDADE DE CLINICA MEDICA";"PENF";"TECNICO DE ENFERMAGEM";"II";"A";"01/02/2022";"2022/02/03 00:00:00";"2023/02/02 00:00:00"
14717987;2;"EDUARDO HENRIQUE FREITAS DA SILVA";"01436585651";"03/02/1984";"CONTRATO TEMPORARIO";"HEM";"COORDENACAO DAS UNIDADES CRITICAS";"TOS";"AUXILIAR ADMINISTRATIVO";"I";"A";"25/04/2022";"2022/04/25 00:00:00";"2023/04/24 00:00:00"
12231411;4;"EDUARDO LUIZ NOGUEIRA GONCALVES";"03611030694";"12/01/1978";"CONTRATO TEMPORARIO";"JXXIII";"COORDENACAO DE URGENCIA E EMERGENCIA ADULTO";"MED";"MEDICO ORTOPEDISTA E TRAUMATOLOGISTA";"III";"A";"03/03/2022";"2022/03/03 00:00:00";"2023/03/02 00:00:00"
14329981;4;"EDUARDO RIBEIRO MUNDIM";"42132258600";"14/01/1963";"CONTRATO TEMPORARIO";"HEM";"COORDENACAO DA UNIDADE DE PACIENTES EXTERNOS";"MED";"MEDICO ENDOCRINOLOGISTA E METABOLOGISTA";"III";"A";"01/02/2022";"2022/02/01 00:00:00";"2023/01/31 00:00:00"
12457412;4;"EDUARDO SIQUEIRA FERNANDES";"05367554695";"27/06/1981";"CONTRATO TEMPORARIO";"HJK";"COORDENACAO DA MATERNIDADE";"MED";"MEDICO CLINICO";"III";"A";"25/02/2022";"2022/02/25 00:00:00";"2023/02/24 00:00:00"
14668156;3;"EDUARDO VIEIRA DA ROCHA";"01580888674";"20/06/1987";"CONTRATO TEMPORARIO";"HEM";"COORDENACAO DAS UNIDADES DE INTERNACAO";"PENF";"TECNICO DE ENFERMAGEM";"II";"A";"03/07/2022";"2022/07/03 00:00:00";"2023/07/02 00:00:00"
14919559;1;"EDVALDO LUIZ DA SILVA";"07962343613";"27/07/1985";"CONTRATO TEMPORARIO";"HEM";"COORDENACAO DAS UNIDADES CRITICAS";"PENF";"ENFERMEIRO";"IV";"A";"01/07/2022";"2022/07/01 00:00:00";"2023/06/30 00:00:00"
14899967;2;"EDVONE MARLY DA SILVA SANTOS";"04271847623";"27/01/1979";"CONTRATO TEMPORARIO";"HEM";"COORDENACAO DAS UNIDADES CRITICAS";"PENF";"TECNICO DE ENFERMAGEM";"II";"A";"02/07/2022";"2022/07/02 00:00:00";"2023/07/01 00:00:00"
15068174;1;"EFIGENIA DE SOUZA";"03339926603";"26/11/1976";"CONTRATO TEMPORARIO";"JXXIII";"COORDENACAO DE URGENCIA E EMERGENCIA PEDIATRICA";"PENF";"TECNICO DE ENFERMAGEM";"IV";"A";"01/02/2022";"2022/02/01 00:00:00";"2023/01/31 00:00:00"
15076953;1;"ELAINE APARECIDA DE SANTANA";"00139028650";"30/06/1976";"CONTRATO TEMPORARIO";"HCM";"COORDENACAO TECNICA DE ENFERMAGEM";"PENF";"TECNICO DE ENFERMAGEM";"II";"A";"01/02/2022";"2022/02/01 00:00:00";"2023/01/31 00:00:00"
14667240;1;"ELAINE CRISTINA CARLOS";"08330396606";"25/10/1987";"CONTRATO TEMPORARIO";"HRJP";"COORDENACAO DAS UNIDADES CRITICAS";"PENF";"TECNICO DE ENFERMAGEM";"II";"A";"02/07/2022";"2022/07/02 00:00:00";"2023/07/01 00:00:00"
13869128;2;"ELAINE CRISTINA DE ANDRADA MELO ALVES";"68678657200";"06/05/1981";"CONTRATO TEMPORARIO";"HGB-JA";"COORDENACAO DE APOIO DIAGNOSTICO E TERAPEUTICO";"MED";"MEDICO EM RADIOLOG.E DIAGNOST.POR IMAGEM";"III";"A";"08/02/2022";"2022/02/08 00:00:00";"2023/02/07 00:00:00"
14912257;2;"ELAINE CRISTINA DE OLIVEIRA TAWIL";"07525554803";"26/11/1963";"CONTRATO TEMPORARIO";"HRAD";"COORDENACAO DAS UNIDADES DE INTERNACAO";"AGAS";"ASSISTENTE SOCIAL";"I";"A";"0000-00-00";"2022/04/01 00:00:00";"2023/03/31 00:00:00"
14903439;2;"ELAINE CRISTINA FERREIRA DOS SANTOS";"09273725686";"05/09/1989";"CONTRATO TEMPORARIO";"CMT";"GERENCIA ASSISTENCIAL";"TOS";"AUXILIAR ADMINISTRATIVO";"I";"A";"01/02/2022";"2022/02/01 00:00:00";"2023/01/31 00:00:00"
14338750;3;"ELAINE DE RESENDE VAZ";"05785836661";"16/11/1972";"CONTRATO TEMPORARIO";"HJK";"COORDENACAO MEDICA DA TERAPIA INTENSIVA NEONATAL";"PENF";"ENFERMEIRO";"IV";"A";"07/08/2021";"2021/08/07 00:00:00";"2023/06/30 00:00:00"
14435952;1;"ELAINE DE SOUSA NETO";"05784162632";"24/11/1978";"CONTRATO TEMPORARIO";"HRAD";"COORDENACAO DA UNIDADE DE PACIENTES EXTERNOS";"PENF";"TECNICO DE ENFERMAGEM";"II";"A";"0000-00-00";"2022/02/01 00:00:00";"2023/01/31 00:00:00"
13803986;2;"ELAINE EUSTACHIO PRENASSI";"06069265696";"02/09/1982";"CONTRATO TEMPORARIO";"HGB-JA";"COORDENACAO DA UNIDADE DE URGENCIA E EMERGENCIA";"PENF";"TECNICO DE ENFERMAGEM";"II";"A";"01/02/2021";"2021/02/01 00:00:00";"2023/01/31 00:00:00"
15083967;1;"ELAINE FARIA BICALHO";"94204241620";"22/04/1974";"CONTRATO TEMPORARIO";"HRAD";"COORDENACAO DE GESTAO DE PESSOAS";"PENF";"ENFERMEIRO DO TRABALHO";"VI";"A";"0000-00-00";"2022/02/01 00:00:00";"2023/01/31 00:00:00"
15084031;1;"ELAINE GESTEIRA SILVA MELO";"08044803629";"01/01/1985";"CONTRATO TEMPORARIO";"HGB-JA";"COORDENACAO DE SAUDE MENTAL";"PENF";"TECNICO DE ENFERMAGEM";"II";"A";"02/02/2022";"2022/02/02 00:00:00";"2023/02/01 00:00:00"
14458772;2;"ELAINE GOMES CRUZ PEREIRA";"00124212603";"27/11/1973";"CONTRATO TEMPORARIO";"HIJPII";"COORDENACAO DO AMBULATORIO DE PEDIATRIA";"PENF";"TECNICO DE ENFERMAGEM";"II";"A";"06/10/2022";"2022/10/06 00:00:00";"2023/10/05 00:00:00"
13962790;2;"ELAINE JANUARIA DA SILVA";"03462459660";"16/08/1974";"CONTRATO TEMPORARIO";"HCM";"COORDENACAO DE APOIO DIAGNOSTICO E TERAPEUTICO";"AGAS";"FARMACEUTICO";"I";"A";"07/04/2021";"2021/04/07 00:00:00";"2023/04/06 00:00:00"
14700892;1;"ELAINE JAQUELINE DE OLIVEIRA SILVA";"06704515682";"17/06/1982";"CONTRATO TEMPORARIO";"HIJPII";"COORDENACAO DAS UNIDADES DE INTERNACAO PEDIATRICA";"PENF";"ENFERMEIRO";"IV";"A";"09/06/2022";"2022/06/09 00:00:00";"2023/06/08 00:00:00"
15269293;1;"ELAINE LACERDA SANTOS";"05714802683";"06/01/1983";"CONTRATO TEMPORARIO";"MOV";"COORDENACAO DO BANCO DE LEITE";"TOS";"AUXILIAR ADMINISTRATIVO";"I";"A";"01/07/2022";"2022/07/01 00:00:00";"2023/06/30 00:00:00"
14613780;1;"ELAINE MARIA GOMES DA SILVA VAZ";"09900064682";"25/11/1991";"CONTRATO TEMPORARIO";"HRJP";"COORDENACAO DAS UNIDADES DE INTERNACAO";"PENF";"TECNICO DE ENFERMAGEM";"II";"A";"01/02/2022";"2022/02/01 00:00:00";"2023/01/31 00:00:00"
15066715;1;"ELAINE MARIA TEIXEIRA LORENZT TRASLADACA";"03641411661";"07/10/1978";"CONTRATO TEMPORARIO";"MOV";"COORDENACAO DE APOIO DIAGNOSTICO E TERAPEUTICO";"TOS";"TECNICO EM PATOLOGIA CLINICA";"II";"A";"01/02/2022";"2022/02/01 00:00:00";"2023/01/31 00:00:00"
14850374;1;"ELAINE MOREIRA DA FONSECA MARQUES";"01470063689";"07/01/1985";"CONTRATO TEMPORARIO";"HJK";"COORDENACAO DE INTERNACAO - ADULTO";"PENF";"TECNICO DE ENFERMAGEM";"II";"A";"04/02/2022";"2022/02/07 00:00:00";"2023/02/06 00:00:00"
15070188;1;"ELAINE RODRIGUES DE SOUZA";"08152758620";"21/05/1986";"CONTRATO TEMPORARIO";"DPGF";"(DESAT.)COORDENACAO DE EXECUCAO ORCAMENTARIA E FINANCEIRA";"TOS";"AUXILIAR ADMINISTRATIVO";"I";"A";"01/02/2022";"2022/02/01 00:00:00";"2023/01/31 00:00:00"
14626527;1;"ELAINE SILVA EUGENIO";"10908802609";"21/10/1991";"CONTRATO TEMPORARIO";"CSSFE";"COORDENACAO DE GESTAO DA INFORMACAO E FINANCAS";"TOS";"AUXILIAR ADMINISTRATIVO";"I";"A";"01/02/2022";"2022/02/01 00:00:00";"2023/01/31 00:00:00"
13554811;2;"ELAINE SILVA PINHEIRO LEITE";"01222182645";"13/01/1979";"CONTRATO TEMPORARIO";"JXXIII";"COORDENACAO DE GESTAO DE PESSOAS";"TOS";"AUXILIAR ADMINISTRATIVO";"I";"A";"22/11/2021";"2021/11/22 00:00:00";"2023/06/30 00:00:00"
14874218;2;"ELANE DE ASSIS GONCALVES REIS";"00545517656";"02/07/1965";"CONTRATO TEMPORARIO";"HEM";"COORDENACAO DE APOIO DIAGNOSTICO E TERAPEUTICO";"TOS";"TECNICO EM PATOLOGIA CLINICA";"II";"A";"05/02/2022";"2022/02/05 00:00:00";"2023/02/04 00:00:00"
11276532;4;"ELBA PEREIRA SILVA";"91342783620";"02/01/1973";"CONTRATO TEMPORARIO";"HEM";"COORDENACAO DAS UNIDADES DE INTERNACAO";"PENF";"TECNICO DE ENFERMAGEM";"II";"A";"06/09/2022";"2022/09/06 00:00:00";"2023/09/05 00:00:00"
11276532;2;"ELBA PEREIRA SILVA";"91342783620";"02/01/1973";NA;"HJK";"COORDENACAO DE INTERNACAO - ADULTO";NA;"TECNICO DE ENFERMAGEM";NA;NA;"02/12/2022";NA;NA
12126090;3;"ELCI TERRA";"58354840620";"09/03/1966";"CONTRATO TEMPORARIO";"HEM";"COORDENACAO DAS UNIDADES DE INTERNACAO";"PENF";"TECNICO DE ENFERMAGEM";"II";"A";"23/08/2017";"2021/02/01 00:00:00";"2023/01/31 00:00:00"
14541320;1;"ELCIO DA SILVEIRA MACHADO";"63947854668";"23/08/1968";"CONTRATO TEMPORARIO";"HRAD";"COORDENACAO DA UNIDADE DE PACIENTES EXTERNOS";"MED";"MEDICO NEUROCIRURGIAO";"III";"A";"16/02/2022";"2022/02/11 00:00:00";"2023/02/10 00:00:00"
14901961;2;"ELDINEUZA APARECIZA BARBOSA MACHADO";"04210052620";"26/06/1978";"CONTRATO TEMPORARIO";"HJK";"COORDENACAO DO LABORATORIO";"PENF";"TECNICO DE ENFERMAGEM";"II";"A";"01/02/2022";"2022/02/01 00:00:00";"2023/01/31 00:00:00"
14649842;3;"ELEN FLAVIA PEREIRA";"05914538602";"19/01/1982";"CONTRATO TEMPORARIO";"HJK";"COORDENACAO DE INTERNACAO - ADULTO";"PENF";"TECNICO DE ENFERMAGEM";"II";"A";"03/02/2022";"2022/02/03 00:00:00";"2023/02/02 00:00:00"
14896773;2;"ELENI APARECIDA FERREIRA SILVA";"03245700660";"15/04/1972";"CONTRATO TEMPORARIO";"JXXIII";"COORDENACAO DE ASSISTENCIA FARMACEUTICA";"AGAS";"FARMACEUTICO";"I";"A";"01/07/2022";"2022/07/01 00:00:00";"2022/12/27 00:00:00"
14513758;3;"ELENICE FERNANDES ALCANTARA FURTADO";"02847103694";"27/10/1976";"CONTRATO TEMPORARIO";"JXXIII";"COORDENACAO DAS UNIDADES DE INTERNACAO ADULTO";"PENF";"TECNICO DE ENFERMAGEM";"II";"A";"07/04/2022";"2022/04/07 00:00:00";"2023/04/06 00:00:00"
15108384;1;"ELENICE GARCIA DE MATOS SILVA";"77828593600";"06/09/1969";"CONTRATO TEMPORARIO";"CSSFA";"COORDENACAO DA UNIDADE DE INTERNACAO E PACIENTES EXTERNOS";"PENF";"TECNICO DE ENFERMAGEM";"II";"A";"03/03/2022";"2022/03/04 00:00:00";"2023/03/03 00:00:00"
13804265;3;"ELENICE MARIA FERREIRA CASTRO";"04918998666";"06/07/1981";"CONTRATO TEMPORARIO";"HGB-JA";"COORDENACAO DE ASSISTENCIA FARMACEUTICA";"TOS";"TECNICO EM FARMACIA";"II";"A";"09/02/2022";"2022/02/09 00:00:00";"2023/02/08 00:00:00"
13804265;2;"ELENICE MARIA FERREIRA CASTRO";"04918998666";"06/07/1981";"CONTRATO TEMPORARIO";"HGB-JA";"COORDENACAO DE ASSISTENCIA FARMACEUTICA";"TOS";"TECNICO EM FARMACIA";"II";"A";"02/02/2021";"2021/02/02 00:00:00";"2023/02/01 00:00:00"
11065612;5;"ELENILDA BATISTA PEREIRA";"03997185670";"05/05/1979";"CONTRATO TEMPORARIO";"JXXIII";"COORDENACAO DAS UNIDADES DE INTERNACAO ADULTO";"PENF";"ENFERMEIRO";"IV";"A";"03/02/2022";"2022/02/03 00:00:00";"2023/02/02 00:00:00"
12279089;2;"ELENIR MACIEL BRAGA MACHADO";"04015200640";"14/11/1973";"CONTRATO TEMPORARIO";"HRAD";"COORDENACAO DAS UNIDADES DE INTERNACAO";"PENF";"TECNICO DE ENFERMAGEM";"II";"A";"0000-00-00";"2022/02/02 00:00:00";"2023/02/01 00:00:00"
14626519;1;"ELENISE APARECIDA DA SILVA";"06777069607";"30/05/1984";"CONTRATO TEMPORARIO";"CSSFE";"COORDENACAO DA UNIDADE DE PACIENTES EXTERNOS";"TOS";"AUXILIAR ADMINISTRATIVO";"I";"A";"01/02/2022";"2022/02/01 00:00:00";"2023/01/31 00:00:00"
15123367;1;"ELIANA FERNANDES MAIA";"10360666655";NA;"CONTRATO TEMPORARIO";"HGB-JA";NA;"MEDRE";"MEDICO";"I";"A";NA;"2022/03/01 00:00:00";"2023/02/28 00:00:00"
15089055;1;"ELIANA GONCALVES DOS SANTOS";"12905872721";"04/05/1987";"CONTRATO TEMPORARIO";"HAC";"COORDENACAO DE INTERNACAO - ONCOLOGICA";"PENF";"TECNICO DE ENFERMAGEM";"II";"A";"08/02/2022";"2022/02/08 00:00:00";"2023/02/07 00:00:00"
14889174;2;"ELIANE APARECIDA PEREIRA";"05790695671";"15/05/1982";"CONTRATO TEMPORARIO";"HRAD";"COORDENACAO DAS UNIDADES CRITICAS";"PENF";"ENFERMEIRO";"IV";"A";"0000-00-00";"2022/02/02 00:00:00";"2023/02/01 00:00:00"
14903918;2;"ELIANE CRISTINA RODRIGUES CAMARGO";"03780836602";"14/04/1979";"CONTRATO TEMPORARIO";"HJK";"COORDENACAO MEDICA DA URGENCIA E EMERGENCIA";"PENF";"TECNICO DE ENFERMAGEM";"II";"A";"03/02/2022";"2022/02/08 00:00:00";"2023/02/07 00:00:00"
12919536;4;"ELIANE DE ALMEIDA GRIGOROWSKY BOTELHO";"78516587649";"31/10/1969";"CONTRATO TEMPORARIO";"HJK";"COORDENACAO MEDICA DA URGENCIA E EMERGENCIA";"PENF";"ENFERMEIRO";"IV";"A";"20/09/2022";"2022/09/20 00:00:00";"2023/09/19 00:00:00"
14999973;1;"ELIANE DE ASSIS BERNARDES FARIA";"10306593629";"13/08/1990";"CONTRATO TEMPORARIO";"HJK";"COORDENACAO DE INTERNACAO - ADULTO";"PENF";"TECNICO DE ENFERMAGEM";"II";"A";"12/08/2021";"2021/08/12 00:00:00";"2023/06/30 00:00:00"
12873402;2;"ELIANE DIONISIO BARROS DE OLIVEIRA";"01470816610";"09/11/1982";"CONTRATO TEMPORARIO";"HGB-JA";"COORDENACAO DA UNIDADE DE CLINICA MEDICA";"PENF";"ENFERMEIRO";"IV";"A";"17/09/2022";"2022/09/17 00:00:00";"2023/09/16 00:00:00"
12995346;2;"ELIANE DOS SANTOS BELO";"93527241604";NA;"CONTRATO TEMPORARIO";"JXXIII";NA;"PENF";"TECNICO DE ENFERMAGEM";"II";"A";NA;"2022/02/02 00:00:00";"2023/02/01 00:00:00"
15068034;1;"ELIANE RODRIGUES BARBOSA";"86978225649";"01/10/1968";"CONTRATO TEMPORARIO";"JXXIII";"COORDENACAO DA UNIDADE DE TERAPIA INTENSIVA ADULTO";"PENF";"TECNICO DE ENFERMAGEM";"II";"A";"01/02/2022";"2022/02/01 00:00:00";"2023/01/31 00:00:00"
14355358;2;"ELIANE SOBRINHO DE BARROS";"06485312609";"02/04/1986";"CONTRATO TEMPORARIO";"HJK";"COORDENACAO DE ASSISTENCIA FARMACEUTICA";"AGAS";"FARMACEUTICO BIOQUIMICO";"III";"A";"02/02/2022";"2022/02/02 00:00:00";"2023/02/01 00:00:00"
14437388;1;"ELIEL CESAR MARCIANO";"96461012672";"11/03/1973";"CONTRATO TEMPORARIO";"HRJP";"COORDENACAO DAS UNIDADES DE INTERNACAO";"PENF";"TECNICO DE ENFERMAGEM";"II";"A";"07/09/2022";"2022/09/07 00:00:00";"2023/03/05 00:00:00"
14591150;2;"ELIENE CASSIA MARCELINO AZEVEDO";"06095652650";"06/08/1984";"CONTRATO TEMPORARIO";"HJK";"COORDENACAO MEDICA DA URGENCIA E EMERGENCIA";"PENF";"ENFERMEIRO";"IV";"A";"08/02/2022";"2022/02/08 00:00:00";"2023/02/07 00:00:00"
10899748;4;"ELIERTE DE SOUZA PEREIRA";"39955567600";"28/02/1957";"CONTRATO TEMPORARIO";"JXXIII";"COORDENACAO DE URGENCIA E EMERGENCIA ADULTO";"MED";"MEDICO GENERALISTA";"I";"A";"22/05/2021";"2021/05/22 00:00:00";"2023/05/21 00:00:00"
12586970;2;"ELIETE BATISTA DOS SANTOS";"00504176650";"22/04/1974";"CONTRATO TEMPORARIO";"HAC";"COORDENACAO DE INTERNACAO - ONCOLOGICA";"TOS";"AUXILIAR ADMINISTRATIVO";"I";"A";"08/03/2022";"2022/03/08 00:00:00";"2023/03/07 00:00:00"
13978598;2;"ELISA CONCEICAO MAIA AMARAL";"03975461659";"31/10/1980";"CONTRATO TEMPORARIO";"CSSFE";"COORDENACAO DA UNIDADE DE PACIENTES EXTERNOS";"MED";"MEDICO OFTALMOLOGISTA";"III";"A";"13/09/2021";"2021/09/14 00:00:00";"2023/06/30 00:00:00"
8864910;6;"ELISABETE COSTA FERREIRA";"65866100606";"23/08/1968";"CONTRATO TEMPORARIO";"MOV";"COORDENACAO DA GINECOLOGIA E OBSTETRICIA";"PENF";"ENFERMEIRO";"IV";"A";"04/02/2022";"2022/02/04 00:00:00";"2023/02/03 00:00:00"
15062664;1;"ELISABETE DE OLIVEIRA BARROSO SILVA";"10703363867";"17/11/1965";"CONTRATO TEMPORARIO";"JXXIII";"COORDENACAO DAS UNIDADES DE INTERNACAO ADULTO";"PENF";"TECNICO DE ENFERMAGEM";"II";"A";"09/12/2021";"2021/12/09 00:00:00";"2023/06/30 00:00:00"
14314165;2;"ELISABETH DAMASCENO PEREIRA";"05350334603";"30/10/1975";"CONTRATO TEMPORARIO";"HJK";"COORDENACAO DE INTERNACAO - ADULTO";"PENF";"TECNICO DE ENFERMAGEM";"II";"A";"24/02/2022";"2022/02/24 00:00:00";"2023/02/23 00:00:00"
14639181;1;"ELISABETH FROES DORN";"00720126681";"27/07/1974";"CONTRATO TEMPORARIO";"JXXIII";"COORDENACAO DE ASSISTENCIA FARMACEUTICA";"TOS";"AUXILIAR ADMINISTRATIVO";"I";"A";"04/07/2022";"2022/07/01 00:00:00";"2023/06/30 00:00:00"
13800297;3;"ELISABETH MARIA DA SILVA";"00325599688";"23/02/1975";"CONTRATO TEMPORARIO";"CHPB";"COORDENACAO DA UNIDADE DE CLINICA MEDICA";"PENF";"TECNICO DE ENFERMAGEM";"II";"A";"07/06/2022";"2022/06/07 00:00:00";"2023/06/06 00:00:00"
14925325;1;"ELISANGELA ALVES DE CAMPOS";"06213658661";"26/05/1982";"CONTRATO TEMPORARIO";"HGB-JA";"COORDENACAO DA UNIDADE DE URGENCIA E EMERGENCIA";"PENF";"TECNICO DE ENFERMAGEM";"II";"A";"01/03/2021";"2021/03/01 00:00:00";"2023/02/28 00:00:00"
14649875;1;"ELISANGELA APARECIDA MELO DE PAULA";"06532806617";"22/11/1983";"CONTRATO TEMPORARIO";"HGB-JA";"DIRETORIA GERAL";"TOS";"AUXILIAR ADMINISTRATIVO";"I";"A";"01/02/2022";"2022/02/01 00:00:00";"2023/01/31 00:00:00"
14850671;3;"ELISANGELA CARVALHO ROCHA";"00155960520";"16/02/1981";"CONTRATO TEMPORARIO";"JXXIII";"COORDENACAO DE URGENCIA E EMERGENCIA ADULTO";"MED";"MEDICO CIRURGIAO PLASTICO";"III";"A";"02/03/2022";"2022/03/02 00:00:00";"2023/03/01 00:00:00"
14846943;1;"ELISANGELA DA SILVA DA CRUZ FONSECA";"03416867602";"26/11/1977";"CONTRATO TEMPORARIO";"HJK";"COORDENACAO DE INTERNACAO - ADULTO";"PENF";"TECNICO DE ENFERMAGEM";"II";"A";"14/03/2022";"2022/03/14 00:00:00";"2023/03/13 00:00:00"
14667307;3;"ELISANGELA FERREIRA PINTO";"02619446651";"13/10/1975";"CONTRATO TEMPORARIO";"HJK";"COORDENACAO DE INTERNACAO - ADULTO";"PENF";"TECNICO DE ENFERMAGEM";"II";"A";"04/02/2022";"2022/02/04 00:00:00";"2023/02/03 00:00:00"
14255368;5;"ELISANGELA FREITAS JORGE LOPES";"04783633622";"22/03/1982";"CONTRATO TEMPORARIO";"JXXIII";"COORDENACAO DA UNIDADE DE TERAPIA INTENSIVA PEDIATRICA";"PENF";"TECNICO DE ENFERMAGEM";"II";"A";"21/04/2022";"2022/04/21 00:00:00";"2023/04/20 00:00:00"
15071046;1;"ELISANGELA GONCALVES MATIAS SILVA";"00147655609";"17/02/1973";"CONTRATO TEMPORARIO";"HJK";"COORDENACAO DO LABORATORIO";"TOS";"TECNICO EM PATOLOGIA CLINICA";"II";"A";"01/02/2022";"2022/02/01 00:00:00";"2023/01/31 00:00:00"
15068083;1;"ELISANGELA MARIA DA SILVA";"06465522608";"02/06/1984";"CONTRATO TEMPORARIO";"HIJPII";"COORDENACAO DAS UNIDADES DE INTERNACAO PEDIATRICA";"PENF";"TECNICO DE ENFERMAGEM";"II";"A";"01/02/2022";"2022/02/01 00:00:00";"2023/01/31 00:00:00"
14893895;1;"ELISANGELA PEREIRA DO AMARAL";"00069956677";"03/03/1976";"CONTRATO TEMPORARIO";"HAC";"COORDENACAO DE ASSISTENCIA FARMACEUTICA";"TOS";"TECNICO EM FARMACIA";"II";"A";"24/02/2022";"2022/02/24 00:00:00";"2023/02/23 00:00:00"
14667216;1;"ELISANGELA PESSOA DE ALMEIDA";"07155314684";"26/06/1986";"CONTRATO TEMPORARIO";"MOV";"COORDENACAO DO BANCO DE LEITE";"AGAS";"NUTRICIONISTA";"I";"A";"01/02/2022";"2022/02/01 00:00:00";"2023/01/31 00:00:00"
15077894;1;"ELISANGELA SOARES LOPES FERREIRA";"04669307630";"24/06/1981";"CONTRATO TEMPORARIO";"HRAD";"COORDENACAO DAS UNIDADES DE INTERNACAO";"PENF";"TECNICO DE ENFERMAGEM";"II";"A";"0000-00-00";"2022/02/02 00:00:00";"2023/02/01 00:00:00"
12515045;2;"ELISANGELA TIBURCIO DA ROCHA";"02963496664";"26/02/1978";"CONTRATO TEMPORARIO";"HJK";"COORDENACAO DE INTERNACAO - ADULTO";"PENF";"ENFERMEIRO";"IV";"A";"01/02/2022";"2022/02/02 00:00:00";"2023/02/01 00:00:00"
14878797;1;"ELIZA LAVALL BAMBERG";"10490004636";NA;"CONTRATO TEMPORARIO";"HRJP";NA;"MEDRE";"MEDICO";"I";"A";NA;"2020/03/01 00:00:00";"2023/02/28 00:00:00"
15262470;1;"ELIZABETE DOS SANTOS LIMA";"06154759657";"26/10/1980";"CONTRATO TEMPORARIO";"JXXIII";"COORDENACAO DO CENTRO DE TRATAMENTO DE QUEIMADOS";"PENF";"TECNICO DE ENFERMAGEM";"II";"A";"22/06/2022";"2022/06/22 00:00:00";"2023/06/21 00:00:00"
14661193;2;"ELIZABETE FERNANDES DA SILVA";"04626366660";"10/11/1980";"CONTRATO TEMPORARIO";"HIJPII";"COORDENACAO DO CENTRO DE TRATAMENTO DE QUEIMADOS";"PENF";"TECNICO DE ENFERMAGEM";"II";"A";"03/03/2022";"2022/03/03 00:00:00";"2023/03/02 00:00:00"
14909162;4;"ELIZANA LUCIA ARAUJO";"10325314608";"09/08/1990";"CONTRATO TEMPORARIO";"MOV";"COORDENACAO DA UNIDADE DE TERAPIA INTENSIVA";"PENF";"TECNICO DE ENFERMAGEM";"II";"A";"01/02/2022";"2022/02/01 00:00:00";"2023/01/31 00:00:00"
14899694;1;"ELIZANE APARECIDA DE SOUZA SILVA";"04446159623";"01/10/1980";"CONTRATO TEMPORARIO";"HRJP";"COORDENACAO DAS UNIDADES CRITICAS";"PENF";"TECNICO DE ENFERMAGEM";"II";"A";"02/07/2022";"2022/07/02 00:00:00";"2023/07/01 00:00:00"
13627153;3;"ELIZANGELA APARECIDA DE RESENDE";"05724601630";"15/07/1983";"CONTRATO TEMPORARIO";"HJK";"COORDENACAO DE ASSISTENCIA FARMACEUTICA";"TOS";"TECNICO EM FARMACIA";"II";"A";"04/02/2022";"2022/02/04 00:00:00";"2023/02/03 00:00:00"
15067770;1;"ELIZANGELA CRISTINA NERYS";"00697453669";"19/03/1976";"CONTRATO TEMPORARIO";"CSSI";"COORDENACAO DA UNIDADE DE PACIENTES EXTERNOS";"PENF";"TECNICO DE ENFERMAGEM";"II";"A";"01/02/2022";"2022/02/01 00:00:00";"2023/01/31 00:00:00"
10915155;5;"ELIZANGELA DA CONCEICAO GOMES";"02995569640";"18/11/1977";"CONTRATO TEMPORARIO";"HJK";"COORDENACAO DA MATERNIDADE";"PENF";"ENFERMEIRO";"IV";"A";"02/02/2022";"2022/02/02 00:00:00";"2023/02/01 00:00:00"
14919682;2;"ELIZANGELA DUARTE DA SILVA";"04930422612";"17/04/1979";"CONTRATO TEMPORARIO";"HEM";"COORDENACAO DAS UNIDADES DE INTERNACAO";"PENF";"TECNICO DE ENFERMAGEM";"II";"A";"02/06/2022";"2022/07/02 00:00:00";"2023/07/01 00:00:00"
14613723;1;"ELIZANIA MARIA DE OLIVEIRA SANTOS";"82012792634";"09/11/1972";"CONTRATO TEMPORARIO";"HGB-JA";"COORDENACAO DE SAUDE MENTAL";"PENF";"TECNICO DE ENFERMAGEM";"II";"A";"04/02/2022";"2022/02/04 00:00:00";"2023/02/03 00:00:00"
12341616;2;"ELLEN CAROLINA ARAUJO";"05233574608";"27/08/1979";"CONTRATO TEMPORARIO";"HJK";"COORDENACAO MEDICA DA URGENCIA E EMERGENCIA";"PENF";"TECNICO DE ENFERMAGEM";"II";"A";"20/04/2022";"2022/04/20 00:00:00";"2023/04/19 00:00:00"
15078090;1;"ELOINA QUELES SILVA SOUZA";"94282560649";"07/01/1973";"CONTRATO TEMPORARIO";"HRAD";"COORDENACAO DAS UNIDADES DE INTERNACAO";"PENF";"ENFERMEIRO";"IV";"A";"0000-00-00";"2022/03/03 00:00:00";"2023/03/02 00:00:00"
13804562;2;"ELOISA HELENA VICENTE DE OLIVEIRA";"04669360604";"29/09/1975";"CONTRATO TEMPORARIO";"HGB-JA";"COORDENACAO DA UNIDADE DE CLINICA MEDICA";"PENF";"TECNICO DE ENFERMAGEM";"II";"A";"01/07/2022";"2022/07/01 00:00:00";"2023/06/30 00:00:00"
13771795;3;"ELSE MARIA PAIVA DE MORAES";"55148778687";"08/02/1971";"CONTRATO TEMPORARIO";"DIGEPE";"(DESAT.)COORDENACAO DE SAUDE DO TRABALHADOR";"MED";"MEDICO DO TRABALHO";"III";"A";"04/07/2022";"2022/07/04 00:00:00";"2023/07/03 00:00:00"
12958161;3;"EMANUELA FERREIRA DIAS VITOR";"07454883664";"12/11/1984";"CONTRATO TEMPORARIO";"HIJPII";"COORDENACAO DE URGENCIA E EMERGENCIA PEDIATRICA";"PENF";"TECNICO DE ENFERMAGEM";"II";"A";"23/06/2022";"2022/06/23 00:00:00";"2023/06/22 00:00:00"
14756258;2;"EMANUELE MARIANNE SOUZA KROGER";"12904391681";"30/09/1995";"CONTRATO TEMPORARIO";"HJK";"COORDENACAO DO LABORATORIO";"MED";"MEDICO CLINICO";"III";"A";"27/06/2022";"2022/06/29 00:00:00";"2023/06/28 00:00:00"
14850648;2;"EMERSON FERNANDO SAMBUGARO";"07867475605";"03/04/1989";"CONTRATO TEMPORARIO";"HEM";"COORDENACAO DAS UNIDADES DE INTERNACAO";"PENF";"TECNICO DE ENFERMAGEM";"II";"A";"01/02/2022";"2022/02/01 00:00:00";"2023/01/31 00:00:00"
14850648;3;"EMERSON FERNANDO SAMBUGARO";"07867475605";"03/04/1989";"CONTRATO TEMPORARIO";"HEM";"COORDENACAO DAS UNIDADES DE INTERNACAO";"PENF";"TECNICO DE ENFERMAGEM";"II";"A";"14/03/2022";"2022/03/14 00:00:00";"2023/03/13 00:00:00"
14912984;2;"EMILENE GOMES E SILVA";"08664454639";"09/07/1989";"CONTRATO TEMPORARIO";"DPGF";"(DESAT.)GERENCIA DE SUPRIMENTOS, LOGISTICA E PATRIMONIO";"TOS";"AUXILIAR ADMINISTRATIVO";"I";"A";"01/02/2022";"2022/02/01 00:00:00";"2023/01/31 00:00:00"
14912091;2;"ENDER VILMAR SAMBUGARO";"06170043660";"30/08/1981";"CONTRATO TEMPORARIO";"CEPAI";"COORDENACAO DE INTERNACAO E AMBULATORIO";"PENF";"TECNICO DE ENFERMAGEM";"II";"A";"02/03/2022";"2022/03/02 00:00:00";"2023/03/01 00:00:00"
13980131;2;"ENI DOS REIS RODRIGUES";"25730029691";"03/01/1957";"CONTRATO TEMPORARIO";"HJK";"COORDENACAO DO SERVIÇO DE NUTRICAO E DIETETICA";"AGAS";"NUTRICIONISTA";"I";"A";"08/03/2022";"2022/03/08 00:00:00";"2023/03/07 00:00:00"
11468089;4;"ENY LEANDRA DOS SANTOS";"05650467641";"12/12/1980";"CONTRATO TEMPORARIO";"JXXIII";"COORDENACAO DAS UNIDADES DE INTERNACAO ADULTO";"PENF";"TECNICO DE ENFERMAGEM";"II";"A";"19/06/2022";"2022/06/19 00:00:00";"2023/06/18 00:00:00"
15065519;1;"ERASMO THIAGO DA SILVA VIEIRA";"06853937635";"09/02/1987";"CONTRATO TEMPORARIO";"HGB-JA";"COORDENACAO DA UNIDADE CIRURGICA";"MED";"MEDICO ORTOPEDISTA E TRAUMATOLOGISTA";"III";"A";"20/12/2021";"2021/12/20 00:00:00";"2023/06/30 00:00:00"
14903900;2;"ERENICE VENANCIO FERREIRA";"92489141600";"23/12/1970";"CONTRATO TEMPORARIO";"HJK";"COORDENACAO MEDICA DA URGENCIA E EMERGENCIA";"PENF";"TECNICO DE ENFERMAGEM";"II";"A";"03/02/2022";"2022/02/03 00:00:00";"2023/02/02 00:00:00"
15074164;1;"ERICA APARECIDA DE ARAUJO";"08259482665";"01/02/1986";"CONTRATO TEMPORARIO";"MOV";"COORDENACAO DA UNIDADE DE NEONATOLOGIA";"PENF";"TECNICO DE ENFERMAGEM";"II";"A";"07/02/2022";"2022/02/07 00:00:00";"2023/02/06 00:00:00"
14161731;2;"ERICA ARAUJO SANTIAGO";"78731216234";NA;"CONTRATO TEMPORARIO";"IRS";NA;"MEDRE";"MEDICO";"I";"A";NA;"2021/03/01 00:00:00";"2023/02/28 00:00:00"
13049762;3;"ERICA CARLA LAGE DE OLIVEIRA";"07383344642";"11/01/1986";"CONTRATO TEMPORARIO";"JXXIII";"COORDENACAO DO BLOCO CIRURGICO";"MED";"MEDICO ANESTESIOLOGISTA";"III";"A";"03/03/2022";"2022/03/03 00:00:00";"2023/03/02 00:00:00"
15152416;1;"ERICA CAROLINE ALVES RIBEIRO";"09886258659";"23/06/1990";"CONTRATO TEMPORARIO";"JXXIII";"COORDENACAO DE LABORATORIO E AGENCIA TRANSFUSIONAL";"TOS";"TECNICO EM PATOLOGIA CLINICA";"II";"A";"23/02/2022";"2022/02/23 00:00:00";"2023/02/22 00:00:00"
15289093;1;"ERICA CHRISTINA GIL DE SOUZA";"03849077683";"05/05/1980";"CONTRATO TEMPORARIO";"HEM";"COORDENACAO DAS UNIDADES CRITICAS";"PENF";"TECNICO DE ENFERMAGEM";"II";"A";"03/07/2022";"2022/07/03 00:00:00";"2023/07/02 00:00:00"
12698494;2;"ERICA DE FATIMA DA SILVA";"06182807660";"13/05/1982";"CONTRATO TEMPORARIO";"HMAL";"COORDENACAO DAS UNIDADES DE INTERNACAO CIRURGICA DE RETAGUARDA";"PENF";"TECNICO DE ENFERMAGEM";"II";"A";"28/05/2021";"2021/05/28 00:00:00";"2023/05/27 00:00:00"
15306566;1;"ERICA SANDY DIAS GONCALVES";"01961124602";"19/06/1999";NA;"HJK";"DIRETORIA GERAL";NA;"NAO ASSOCIADA";NA;NA;"24/08/2022";NA;NA
14662613;2;"ERICA TAIZA DUTRA REIS VIVEIROS";"09191299608";"25/09/1988";"CONTRATO TEMPORARIO";"CHPB";"COORDENACAO DA UNIDADE DE URGENCIA E EMERGENCIA";"PENF";"TECNICO DE ENFERMAGEM";"II";"A";"08/10/2022";"2022/10/08 00:00:00";"2023/10/07 00:00:00"
15335847;1;"ERICA VANESSA PARREIRAS ROVESSE";"05121276621";"22/05/1982";"CONTRATO TEMPORARIO";"HAC";"COORDENACAO DO LABORATORIO";"AGAS";"FARMACEUTICO";"I";"A";"06/10/2022";"2022/10/06 00:00:00";"2023/10/05 00:00:00"
12414397;3;"ERICA XAVIER FRANCA";"03555192671";"07/09/1979";"CONTRATO TEMPORARIO";"HJK";"COORDENACAO DE INTERNACAO - ADULTO";"PENF";"TECNICO DE ENFERMAGEM";"II";"A";"01/02/2022";"2022/02/01 00:00:00";"2023/01/31 00:00:00"
14756209;1;"ERICA ZERBONE SANTANNA";"14358943756";NA;"CONTRATO TEMPORARIO";"HIJPII";NA;"MEDRE";"MEDICO";"I";"A";NA;"2022/03/01 00:00:00";"2023/02/28 00:00:00"
15268352;1;"ERIKA ARUJO MOURA DE SOUSA";"05350393600";"02/04/1983";"CONTRATO TEMPORARIO";"HAC";"COORDENACAO DE INTERNACAO - ONCOLOGICA";"PENF";"ENFERMEIRO";"IV";"A";"01/06/2022";"2022/06/01 00:00:00";"2023/05/31 00:00:00"
12866059;2;"ERIKA BARRETO NUNES FRANCA";"04648464630";NA;"CONTRATO TEMPORARIO";"MGT";NA;"PENF";"ENFERMEIRO";"IV";"A";NA;"2022/02/01 00:00:00";"2023/01/31 00:00:00"
12336517;2;"ERIKA DE SOUZA MELO";"07970573665";"28/01/1987";"CONTRATO TEMPORARIO";"CMT";"GERENCIA ASSISTENCIAL";"PENF";"TECNICO DE ENFERMAGEM";"II";"A";"01/02/2022";"2022/02/01 00:00:00";"2023/01/31 00:00:00"
15232911;2;"ERIKA FATIMA DA SILVA MACIEL";"03019869676";"15/06/1977";"CONTRATO TEMPORARIO";"JXXIII";"COORDENACAO DE ASSISTENCIA FARMACEUTICA";"TOS";"TECNICO EM FARMACIA";"II";"A";"26/06/2022";"2022/06/26 00:00:00";"2023/06/25 00:00:00"
15232911;1;"ERIKA FATIMA DA SILVA MACIEL";"03019869676";"15/06/1977";"CONTRATO TEMPORARIO";"MOV";"COORDENACAO DE APOIO DIAGNOSTICO E TERAPEUTICO";"TOS";"TECNICO EM FARMACIA";"II";"A";"11/05/2022";"2022/05/11 00:00:00";"2023/05/10 00:00:00"
13847140;4;"ERIKA FATIMA RESENDE";"06300135608";"13/05/1984";"CONTRATO TEMPORARIO";"JXXIII";"COORDENACAO DE LABORATORIO E AGENCIA TRANSFUSIONAL";"AGAS";"FARMACEUTICO BIOQUIMICO";"I";"A";"03/02/2022";"2022/02/03 00:00:00";"2023/02/02 00:00:00"
13954607;3;"ERIKA GUSTINI SIMOES";"84113049572";"18/01/1987";"CONTRATO TEMPORARIO";"JXXIII";"COORDENACAO DE URGENCIA E EMERGENCIA ADULTO";"MED";"MEDICO PEDIATRA";"III";"A";"20/08/2019";"2021/02/01 00:00:00";"2023/03/02 00:00:00"
13823398;3;"ERIKA MARTINS GUIA CABRAL";"06833965609";"28/01/1984";"CONTRATO TEMPORARIO";"CHPB";"COORDENACAO DA UNIDADE DE URGENCIA E EMERGENCIA";"PENF";"TECNICO DE ENFERMAGEM";"II";"A";"09/03/2021";"2021/03/09 00:00:00";"2023/03/08 00:00:00"
12698627;2;"ERIKA MOTA ANDRADE MACHADO";"02621600484";"16/05/1979";"CONTRATO TEMPORARIO";"JXXIII";"COORDENACAO DE URGENCIA E EMERGENCIA ADULTO";"PENF";"ENFERMEIRO";"IV";"A";"04/07/2022";"2022/07/04 00:00:00";"2023/07/03 00:00:00"
9790403;2;"ERIKA OLIVEIRA TELLES HORTA";"04048755641";NA;"CONTRATO TEMPORARIO";"JXXIII";NA;"MEDRE";"MEDICO";"I";"A";NA;"2020/03/01 00:00:00";"2023/02/28 00:00:00"
15232820;1;"ERIVALDO BRITO DE SOUZA";"02864998513";"16/12/1985";"CONTRATO TEMPORARIO";"MOV";"COORDENACAO DA GINECOLOGIA E OBSTETRICIA";"MED";"MEDICO ANESTESIOLOGISTA";"III";"A";"21/04/2022";"2022/04/21 00:00:00";"2023/04/20 00:00:00"
12154076;6;"ERIVANDA DE ARAUJO SILVA";"05612235640";"06/06/1981";"CONTRATO TEMPORARIO";"JXXIII";"COORDENACAO DA CENTRAL DE MATERIAL E ESTERILIZACAO";"PENF";"TECNICO DE ENFERMAGEM";"II";"A";"04/07/2022";"2022/07/04 00:00:00";"2023/07/03 00:00:00"
12154076;5;"ERIVANDA DE ARAUJO SILVA";"05612235640";"06/06/1981";"CONTRATO TEMPORARIO";"HIJPII";"COORDENACAO DA UNIDADE DE TERAPIA INTENSIVA ADULTO";"PENF";"TECNICO DE ENFERMAGEM";"II";"A";"01/02/2022";"2022/02/01 00:00:00";"2023/01/31 00:00:00"
11553963;6;"ERLAINE APARECIDA BASTOS DE OLIVEIRA SAN";"00808674641";"18/10/1975";"CONTRATO TEMPORARIO";"HMAL";"COORDENACAO DAS UNIDADES DE INTERNACAO CIRURGICA DE RETAGUARDA";"PENF";"ENFERMEIRO";"IV";"A";"28/09/2022";"2022/09/28 00:00:00";"2023/09/27 00:00:00"
11553963;5;"ERLAINE APARECIDA BASTOS DE OLIVEIRA SAN";"00808674641";"18/10/1975";"CONTRATO TEMPORARIO";"JXXIII";"COORDENACAO DA UNIDADE DE TERAPIA INTENSIVA ADULTO";"PENF";"ENFERMEIRO";"IV";"A";"01/02/2022";"2022/02/01 00:00:00";"2023/01/31 00:00:00"
14667208;1;"ERNANI LUIZ DUARTE FERREIRA";"06088463686";"17/08/1983";"CONTRATO TEMPORARIO";"HJK";"COORDENACAO DE ASSISTENCIA FARMACEUTICA";"TOS";"TECNICO EM FARMACIA";"II";"A";"02/02/2022";"2022/02/02 00:00:00";"2023/02/01 00:00:00"
15033871;1;"ERVIO FRANCISCO MAIA JUNIOR";"95710027634";"22/11/1975";"CONTRATO TEMPORARIO";"AJUR";"(DESAT.)PROCURADORIA";"AGAS";"ADVOGADO";"I";"A";"26/10/2021";"2021/11/04 00:00:00";"2023/06/30 00:00:00"
14901474;2;"ESTEFANI CAMPOS LOURENCO";"12104012660";"14/11/1994";"CONTRATO TEMPORARIO";"HJK";"COORDENACAO DA MATERNIDADE";"PENF";"TECNICO DE ENFERMAGEM";"II";"A";"01/06/2021";"2021/06/01 00:00:00";"2023/05/31 00:00:00"
14889505;2;"ESTELITA LUCILIA DE ALMEIDA";"00470460660";"08/09/1974";"CONTRATO TEMPORARIO";"MOV";"COORDENACAO DA UNIDADE DE TERAPIA INTENSIVA";"PENF";"ENFERMEIRO";"VI";"A";"17/09/2021";"2021/09/17 00:00:00";"2023/06/30 00:00:00"
14905384;1;"ETIELLE THALIA BARRETO MERLIN";"17353265779";NA;"CONTRATO TEMPORARIO";"HRJP";NA;"PENF";"TECNICO DE ENFERMAGEM";"II";"A";NA;"2022/07/02 00:00:00";"2022/12/28 00:00:00"
15118052;1;"EUGENIO FABRICIO DE OLIVEIRA MOTA";"13411204656";NA;"CONTRATO TEMPORARIO";"HJK";NA;"MEDRE";"MEDICO";"I";"A";NA;"2022/03/01 00:00:00";"2023/02/28 00:00:00"
10896694;5;"EUMARA BARBOSA SILVA";"74998307649";"14/05/1969";"CONTRATO TEMPORARIO";"HEM";"COORDENACAO DE GESTAO DA INFORMACAO";"MED";"MEDICO INFECTOLOGISTA";"III";"A";"21/02/2018";"2022/03/11 00:00:00";"2023/03/10 00:00:00"
15038839;2;"EUNICE APARECIDA ELIAS";"06104291678";"07/01/1982";"CONTRATO TEMPORARIO";"HGB-JA";"COORDENACAO DE SAUDE MENTAL";"PENF";"TECNICO DE ENFERMAGEM";"II";"A";"04/02/2022";"2022/02/04 00:00:00";"2023/02/03 00:00:00"
14414916;4;"EURIPEDES JUNIO BADARO DE CARVALHO";"01590158636";"26/01/1991";"CONTRATO TEMPORARIO";"HAC";"COORDENACAO DE INTERNACAO - ONCOLOGICA";"MED";"MEDICO CLINICO";"III";"A";"21/02/2022";"2022/02/21 00:00:00";"2023/02/20 00:00:00"
14414916;3;"EURIPEDES JUNIO BADARO DE CARVALHO";"01590158636";"26/01/1991";"CONTRATO TEMPORARIO";"HAC";"COORDENACAO DA UNIDADE DE TERAPIA INTENSIVA ADULTO";"MED";"MEDICO CLINICO";"III";"A";"04/05/2021";"2021/05/04 00:00:00";"2023/05/03 00:00:00"
15348881;1;"EUSTAQUIO CLARET DOS SANTOS JUNIOR";"09345974644";NA;"CONTRATO TEMPORARIO";"JXXIII";NA;"MED";"MEDICO CIRURGIAO GERAL";"III";"A";NA;"2022/10/06 00:00:00";"2023/10/05 00:00:00"
90019597;9;"EUSTAQUIO CLARET DOS SANTOS JUNIOR";"09345974644";"0000-00-00";NA;"HJXXIII";"COORDENACAO DE URGENCIA E EMERGENCIA ADULTO";NA;"";NA;NA;"06/10/2022";NA;NA
10871903;6;"EVA APARECIDA DA SILVA TERRA";"95623434649";"13/08/1975";"CONTRATO TEMPORARIO";"JXXIII";"COORDENACAO DA UNIDADE DE TERAPIA INTENSIVA ADULTO";"PENF";"ENFERMEIRO";"IV";"A";"22/03/2022";"2022/03/22 00:00:00";"2023/03/21 00:00:00"
11238292;4;"EVA CRISTINA MARQUES RITO RODRIGUES";"04871339602";"12/03/1980";"CONTRATO TEMPORARIO";"HGB-JA";"COORDENACAO DA UNIDADE DE PACIENTES CRITICOS";"PENF";"TECNICO DE ENFERMAGEM";"II";"A";"10/01/2022";"2022/01/10 00:00:00";"2023/01/09 00:00:00"
11238292;2;"EVA CRISTINA MARQUES RITO RODRIGUES";"04871339602";"12/03/1980";"CONTRATO TEMPORARIO";"HGB-JA";"COORDENACAO DA UNIDADE DE CLINICA MEDICA";"PENF";"TECNICO DE ENFERMAGEM";"II";"A";"07/11/2022";"2022/11/07 00:00:00";"2023/11/06 00:00:00"
15165384;1;"EVALDO JOSE DE ANDRADE FERREIRA";"03702819690";"06/05/1979";"CONTRATO TEMPORARIO";"HJK";"COORDENACAO MEDICA DA URGENCIA E EMERGENCIA";"PENF";"ENFERMEIRO";"IV";"A";"18/03/2022";"2022/03/18 00:00:00";"2023/03/17 00:00:00"
12231338;6;"EVANDO LAZARO TEIXEIRA ESPINDOLA";"04832134620";"22/08/1982";"CONTRATO TEMPORARIO";"JXXIII";"COORDENACAO DAS UNIDADES DE INTERNACAO ADULTO";"PENF";"TECNICO DE ENFERMAGEM";"II";"A";"02/02/2022";"2022/02/02 00:00:00";"2023/02/01 00:00:00"
14946552;1;"EVARISTO CARVALHO ARAUJO DE PAULA";"54635977668";"14/07/1966";"CONTRATO TEMPORARIO";"CHPB";"COORDENACAO DA UNIDADE DE CUIDADOS CONTINUADOS INTEGRADOS";"PENF";"TECNICO DE ENFERMAGEM";"II";"A";"24/03/2021";"2021/03/24 00:00:00";"2023/03/23 00:00:00"
14819262;3;"EVELINE LISBOA CAVALCANTI DIAS PIMENTEL";"07769541646";"24/09/1987";"CONTRATO TEMPORARIO";"HRAD";"COORDENACAO DE APOIO DIAGNOSTICO E TERAPEUTICO";"AGAS";"FARMACEUTICO BIOQUIMICO";"I";"A";"0000-00-00";"2022/02/01 00:00:00";"2023/01/31 00:00:00"
10935302;3;"EZEQUIEL ALVES DA SILVA";"73751391649";"02/01/1969";"CONTRATO TEMPORARIO";"HIJPII";"COORDENACAO DE DIAGNOSTICO POR IMAGEM";"TOS";"TECNICO EM RADIOLOGIA";"II";"A";"12/01/2022";"2022/01/12 00:00:00";"2023/01/11 00:00:00"
11490950;3;"FABIANA ANTONIA DE ORCENA";"03830305605";"29/01/1980";"CONTRATO TEMPORARIO";"JXXIII";"COORDENACAO DO CENTRO DE TRATAMENTO DE QUEIMADOS";"PENF";"TECNICO DE ENFERMAGEM";"II";"A";"02/02/2022";"2022/02/02 00:00:00";"2023/02/01 00:00:00"
11229630;3;"FABIANA APARECIDA CAMPOS";"06222318630";"27/12/1979";"CONTRATO TEMPORARIO";"HGB-JA";"COORDENACAO DA UNIDADE DE URGENCIA E EMERGENCIA";"PENF";"TECNICO DE ENFERMAGEM";"II";"A";"29/11/2022";"2022/11/29 00:00:00";"2023/11/28 00:00:00"
14913479;1;"FABIANA APARECIDA DA CRUZ LISBOA";"01209499622";"22/08/1979";"CONTRATO TEMPORARIO";"DPGF";"(DESAT.)GERENCIA DE INFRAESTRUTURA PREDIAL";"AGAS";"ENGENHEIRO";"I";"A";"01/02/2022";"2022/02/01 00:00:00";"2023/01/31 00:00:00"
14926166;2;"FABIANA APARECIDA DE ARAUJO";"01506683681";"18/02/1983";"CONTRATO TEMPORARIO";"HGB-JA";"COORDENACAO DA UNIDADE DE URGENCIA E EMERGENCIA";"PENF";"TECNICO DE ENFERMAGEM";"II";"A";"01/07/2022";"2022/07/01 00:00:00";"2023/06/30 00:00:00"
13805171;2;"FABIANA CLEIDE DOS SANTOS";"10449252647";"19/02/1990";"CONTRATO TEMPORARIO";"HGB-JA";"COORDENACAO DA UNIDADE DE URGENCIA E EMERGENCIA";"PENF";"TECNICO DE ENFERMAGEM";"II";"A";"01/07/2022";"2022/07/01 00:00:00";"2023/06/30 00:00:00"
14255467;1;"FABIANA COELHO DE SOUZA";"05342798647";"24/12/1980";"CONTRATO TEMPORARIO";"CSPD";"COORDENACAO DA UNIDADE DE CUIDADO AO ADULTO";"PENF";"TECNICO DE ENFERMAGEM";"II";"A";"01/06/2016";"2022/02/01 00:00:00";"2023/01/31 00:00:00"
13804109;3;"FABIANA CRISTINA PEREIRA";"04691446613";"06/01/1979";"CONTRATO TEMPORARIO";"HGB-JA";"COORDENACAO DA UNIDADE CIRURGICA";"PENF";"TECNICO DE ENFERMAGEM";"II";"A";"18/11/2021";"2021/11/18 00:00:00";"2023/06/30 00:00:00"
14567721;1;"FABIANA DE PAULA BAIAO";"06504044678";"03/06/1985";"CONTRATO TEMPORARIO";"CSPD";"COORDENACAO DA UNIDADE DE CUIDADO AO ADULTO";"PENF";"ENFERMEIRO";"IV";"A";"19/10/2017";"2022/02/01 00:00:00";"2023/01/31 00:00:00"
14880082;2;"FABIANA DE PAULA MATOS";"09541106684";"15/11/1989";"CONTRATO TEMPORARIO";"JXXIII";"COORDENACAO DA UNIDADE DE TERAPIA INTENSIVA ADULTO";"PENF";"TECNICO DE ENFERMAGEM";"II";"A";"02/02/2022";"2022/02/02 00:00:00";"2023/02/01 00:00:00"
14963391;2;"FABIANA DE SOUZA ANDRADE";"03519347660";"20/08/1978";"CONTRATO TEMPORARIO";"JXXIII";"COORDENACAO DE URGENCIA E EMERGENCIA ADULTO";"PENF";"TECNICO DE ENFERMAGEM";"II";"A";"30/09/2022";"2022/09/30 00:00:00";"2023/09/29 00:00:00"
14963391;1;"FABIANA DE SOUZA ANDRADE";"03519347660";"20/08/1978";"CONTRATO TEMPORARIO";"JXXIII";"COORDENACAO DAS UNIDADES DE INTERNACAO ADULTO";"PENF";"TECNICO DE ENFERMAGEM";"II";"A";"14/05/2021";"2021/05/14 00:00:00";"2023/05/13 00:00:00"
15017866;1;"FABIANA FERREIRA DA SILVA";"08287157692";"18/02/1990";"CONTRATO TEMPORARIO";"MGT";"GERENCIA ADMINISTRATIVA";"TOS";"AUXILIAR ADMINISTRATIVO";"I";"A";"23/09/2021";"2021/09/23 00:00:00";"2023/06/30 00:00:00"
14579932;1;"FABIANA GIL DE SOUZA";"04898754678";"15/09/1980";"CONTRATO TEMPORARIO";"";"(DESAT.)COORDENACAO DE CONTROLE DE PAGAMENTO E TAXACAO";"TOS";"AUXILIAR ADMINISTRATIVO";"I";"A";"01/02/2022";"2022/02/01 00:00:00";"2023/01/31 00:00:00"
13856521;4;"FABIANA LOURDES DOS SANTOS ARAUJO";"08300588698";"11/02/1987";"CONTRATO TEMPORARIO";"HGB-JA";"COORDENACAO DE ASSISTENCIA FARMACEUTICA";"TOS";"TECNICO EM FARMACIA";"II";"A";"06/01/2022";"2022/01/06 00:00:00";"2023/01/05 00:00:00"
13822564;2;"FABIANA MAGDA DE C PIRES MAGELA";"05022362643";"30/05/1980";"CONTRATO TEMPORARIO";"IRS";"COORDENACAO DAS UNIDADES DE INTERNACAO";"AGAS";"ASSISTENTE SOCIAL";"I";"A";"10/05/2021";"2021/05/10 00:00:00";"2023/05/09 00:00:00"
15072788;1;"FABIANA MARTINS TEIXEIRA VICENTE";"08049341771";"10/10/1978";"CONTRATO TEMPORARIO";"HRJP";"COORDENACAO DAS UNIDADES DE INTERNACAO";"PENF";"ENFERMEIRO";"IV";"A";"01/02/2022";"2022/02/01 00:00:00";"2023/01/31 00:00:00"
14882963;3;"FABIANA SERENO ALVES";"10984413707";"24/07/1991";"CONTRATO TEMPORARIO";"JXXIII";"COORDENACAO DE URGENCIA E EMERGENCIA ADULTO";"MED";"MEDICO CIRURGIAO GERAL";"III";"A";"20/10/2021";"2021/10/20 00:00:00";"2023/06/30 00:00:00"
11219649;3;"FABIANA SILVA MALAQUIAS";"01402288611";"20/12/1983";"CONTRATO TEMPORARIO";"HAC";"COORDENACAO DO AMBULATORIO";"PENF";"ENFERMEIRO";"IV";"A";"06/10/2016";"2021/02/01 00:00:00";"2023/01/31 00:00:00"
14582258;1;"FABIANA STEPHANIE DA SILVA SANTOS";"01411789652";"04/01/1984";"CONTRATO TEMPORARIO";"HJK";"COORDENACAO CIRURGICA";"PENF";"ENFERMEIRO";"IV";"A";"03/02/2022";"2022/02/03 00:00:00";"2023/02/02 00:00:00"
12104048;4;"FABIANA VIEIRA SILVA";"01240313667";"11/07/1981";"CONTRATO TEMPORARIO";"JXXIII";"COORDENACAO DO CENTRO DE TRATAMENTO DE QUEIMADOS";"PENF";"TECNICO DE ENFERMAGEM";"II";"A";"04/03/2022";"2022/03/04 00:00:00";"2023/03/03 00:00:00"
10934263;2;"FABIANE CAMILOZZI BARROSO";"05070103610";"28/02/1981";"CONTRATO TEMPORARIO";"DIGEPE";"(DESAT.)NUCLEO DE ESTATISTICA E GESTAO DA FORCA DE TRABALHO";"TOS";"AUXILIAR ADMINISTRATIVO";"I";"A";"04/07/2022";"2022/07/04 00:00:00";"2023/07/03 00:00:00"
14896369;2;"FABIANE DE SOUZA BALDUTTI";"04307142624";"19/04/1980";"CONTRATO TEMPORARIO";"HGB-JA";"COORDENACAO DA UNIDADE DE URGENCIA E EMERGENCIA";"PENF";"TECNICO DE ENFERMAGEM";"II";"A";"01/02/2022";"2022/02/01 00:00:00";"2023/01/31 00:00:00"
10887735;2;"FABIANE PEREIRA DE ALCANTARA";"04804143602";"14/08/1978";NA;"HJXXIII";"NUCLEO DE ENSINO E PESQUISA";NA;"AUXILIAR ADMINISTRATIVO";NA;NA;"04/07/2022";NA;NA
15129935;1;"FABIANO CASELATO";"01301054658";"02/02/1980";"CONTRATO TEMPORARIO";"HIJPII";"COORDENACAO DAS UNIDADES DE INTERNACAO PEDIATRICA";"PENF";"ENFERMEIRO";"IV";"A";"09/03/2022";"2022/03/09 00:00:00";"2023/03/08 00:00:00"
14581144;3;"FABIANO PEREIRA DA SILVA";"08241403623";"08/04/1987";"CONTRATO TEMPORARIO";"MGT";"GERENCIA ADMINISTRATIVA";"TOS";"AUXILIAR ADMINISTRATIVO";"I";"A";"04/07/2022";"2022/07/04 00:00:00";"2023/07/03 00:00:00"
11232923;3;"FABIO BALTAZAR DO NASCIMENTO";"25534769653";"31/07/1958";"CONTRATO TEMPORARIO";"HRAD";"COORDENACAO DE GESTAO DA INFORMACAO";"MED";"MEDICO";"III";"A";"0000-00-00";"2022/04/12 00:00:00";"2023/04/11 00:00:00"
14909147;2;"FABIO CUNHA DE ALMEIDA";"04252650640";"29/09/1979";"CONTRATO TEMPORARIO";"JXXIII";"COORDENACAO DE URGENCIA E EMERGENCIA ADULTO";"MED";"MEDICO NEUROCIRURGIAO";"III";"A";"06/08/2020";"2021/02/01 00:00:00";"2023/01/31 00:00:00"
14934079;1;"FABIO FANTAZZINI VIEIRA";"09919156663";NA;"CONTRATO TEMPORARIO";"HAC";NA;"MEDRE";"MEDICO";"I";"A";NA;"2021/03/01 00:00:00";"2023/02/28 00:00:00"
11285392;2;"FABIO LIMA MACHADO";"06254795647";"22/09/1982";"CONTRATO TEMPORARIO";"CSPD";"COORDENACAO DA UNIDADE DE CUIDADO AO ADULTO";"PENF";"TECNICO DE ENFERMAGEM";"II";"A";"30/07/2018";"2022/02/01 00:00:00";"2023/01/31 00:00:00"
15316821;1;"FABIO MACHADO DE ALMEIDA";"09241186607";"12/12/1988";"CONTRATO TEMPORARIO";"HRJP";"COORDENACAO DAS UNIDADES DE INTERNACAO";"PENF";"TECNICO DE ENFERMAGEM";"II";"A";"05/09/2022";"2022/09/05 00:00:00";"2023/09/04 00:00:00"
14846810;2;"FABIO MITSUHIRO SATAKE";"32564303846";"04/10/1985";"CONTRATO TEMPORARIO";"HAC";"COORDENACAO DO AMBULATORIO";"MED";"MEDICO CIRURGIAO GERAL";"III";"A";"30/11/2019";"2021/02/01 00:00:00";"2023/01/31 00:00:00"
14905079;2;"FABIO RODRIGUES VIEIRA";"01592681689";"07/10/1987";"CONTRATO TEMPORARIO";"HJK";"COORDENACAO DA EQUIPE MULTIDISCIPLINAR";"AGAS";"FISIOTERAPEUTA RESPIRATORIA";"III";"A";"27/06/2022";"2022/06/27 00:00:00";"2023/06/26 00:00:00"
11676723;4;"FABIO VIDEIRA CHAGAS";"03000625674";"07/01/1977";"CONTRATO TEMPORARIO";"HRJP";"COORDENACAO DAS UNIDADES DE INTERNACAO";"MED";"MEDICO PEDIATRA";"III";"A";"01/04/2022";"2022/04/01 00:00:00";"2023/03/31 00:00:00"
14667612;2;"FABIOLA BARBOZA DE LIMA";"02829621662";"04/10/1972";"CONTRATO TEMPORARIO";"HRAD";"COORDENACAO DAS UNIDADES DE INTERNACAO";"PENF";"TECNICO DE ENFERMAGEM";"II";"A";"0000-00-00";"2022/02/02 00:00:00";"2023/02/01 00:00:00"
14716211;2;"FABIOLA CAROLINE DE ALMEIDA";"05087987605";"26/05/1981";"CONTRATO TEMPORARIO";"JXXIII";"COORDENACAO DE DIAGNOSTICO POR IMAGEM";"PENF";"ENFERMEIRO";"IV";"A";"03/03/2022";"2022/03/03 00:00:00";"2023/03/02 00:00:00"
14613988;2;"FABIOLA VALADARES RIANI RODRIGUES";"10838261663";"20/05/1992";"CONTRATO TEMPORARIO";"HRJP";"COORDENACAO DE GESTAO DE PESSOAS";"TOS";"AUXILIAR ADMINISTRATIVO";"I";"A";"05/01/2022";"2022/01/05 00:00:00";"2023/01/04 00:00:00"
13433396;2;"FABRICIA PRISCILA CALDEIRA COSTA PINHEIR";"09562455602";"13/05/1990";"CONTRATO TEMPORARIO";"JXXIII";"COORDENACAO DE FATURAMENTO";"TOS";"AUXILIAR ADMINISTRATIVO";"I";"A";"01/02/2022";"2022/02/01 00:00:00";"2023/01/31 00:00:00"
14983548;1;"FABRICIO DA SILVA COSTA";"06924874762";"19/02/1976";"CONTRATO TEMPORARIO";"HRJP";"COORDENACAO DE GESTAO DA INFORMACAO E FINANCAS";"TOS";"TECNICO EM INFORMATICA";"II";"A";"02/08/2021";"2021/08/02 00:00:00";"2023/06/30 00:00:00"
13834874;2;"FABRICIO JUNQUEIRA DE MELO";"06781383620";"04/08/1983";"CONTRATO TEMPORARIO";"JXXIII";"COORDENACAO DO BLOCO CIRURGICO";"MED";"MEDICO ANESTESIOLOGISTA";"III";"A";"27/05/2021";"2021/05/27 00:00:00";"2023/05/26 00:00:00"
14899629;2;"FABRICIO LAFETA COSTA";"07983300662";"26/09/1989";"CONTRATO TEMPORARIO";"HAC";"COORDENACAO DO AMBULATORIO";"MED";"MEDICO CIRURGIAO GERAL";"III";"A";"05/01/2022";"2022/02/05 00:00:00";"2023/02/04 00:00:00"
13069596;3;"FABRISIA DA SILVA RODRIGUES";"05082887629";"26/04/1983";"CONTRATO TEMPORARIO";"JXXIII";"COORDENACAO DE DIAGNOSTICO POR IMAGEM";"TOS";"TECNICO EM RADIOLOGIA";"II";"A";"03/03/2022";"2022/03/03 00:00:00";"2023/03/02 00:00:00"
14777411;2;"FAIRUSY CAVALCANTE DE SOUZA GIORDANI";"08966695647";"17/03/1987";"CONTRATO TEMPORARIO";"HCM";"COORDENACAO DAS UNIDADES DE INTERNACAO";"AGAS";"ASSISTENTE SOCIAL";"I";"A";"01/02/2022";"2022/02/01 00:00:00";"2023/01/31 00:00:00"
14255533;1;"FATIMA COSTA DA SILVA";"03310811484";"24/03/1978";"CONTRATO TEMPORARIO";"HRAD";"COORDENACAO DAS UNIDADES DE INTERNACAO";"PENF";"TECNICO DE ENFERMAGEM";"II";"A";"0000-00-00";"2022/02/02 00:00:00";"2023/02/01 00:00:00"
13394572;3;"FATIMA DE SOUZA BELTRAME";"42258006953";"09/10/1960";"CONTRATO TEMPORARIO";"DIGEPE";"(DESAT.)COORDENACAO DE PERICIA MEDICA";"TOS";"AUXILIAR ADMINISTRATIVO";"I";"A";"01/02/2022";"2022/02/01 00:00:00";"2023/01/31 00:00:00"
14970719;2;"FELIPE ANTONIO DE MELO";"10770403697";"23/01/1991";"CONTRATO TEMPORARIO";"CHPB";"COORDENACAO DE APOIO DIAGNOSTICO E TERAPEUTICO";"TOS";"TECNICO EM RADIOLOGIA";"II";"A";"05/09/2022";"2022/09/05 00:00:00";"2023/09/04 00:00:00"
14403166;2;"FELIPE AUGUSTO BARROS DISCACCIATI";"08727871681";"09/01/1991";"CONTRATO TEMPORARIO";"JXXIII";"COORDENACAO DE URGENCIA E EMERGENCIA ADULTO";"MED";"MEDICO ORTOPEDISTA E TRAUMATOLOGISTA";"III";"A";"13/11/2021";"2021/11/13 00:00:00";"2023/06/30 00:00:00"
14774541;3;"FELIPE BASILATO MAZEGA";"08030026617";"14/05/1989";"CONTRATO TEMPORARIO";"JXXIII";"COORDENACAO DE URGENCIA E EMERGENCIA ADULTO";"MED";"MEDICO CIRURGIAO DE MAO";"III";"A";"03/03/2022";"2022/03/03 00:00:00";"2023/03/02 00:00:00"
14236251;4;"FELIPE CARVALHAES POSSAS";"09786477693";"16/02/1989";"CONTRATO TEMPORARIO";"JXXIII";"COORDENACAO MEDICA DA UNIDADE DE TOXICOLOGIA";"MED";"MEDICO CLINICO";"III";"A";"03/03/2022";"2022/03/03 00:00:00";"2023/03/02 00:00:00"
14953160;2;"FELIPE CEOLIN BARBOSA";"09465069655";NA;"CONTRATO TEMPORARIO";"HGB-JA";NA;"TOS";"TECNICO EM RADIOLOGIA";"II";"A";NA;"2021/06/28 00:00:00";"2023/06/27 00:00:00"
14756282;1;"FELIPE DE CARVALHO BARBOSA";"10903602660";NA;"CONTRATO TEMPORARIO";"HMAL";NA;"MEDRE";"MEDICO";"I";"A";NA;"2019/03/01 00:00:00";"2023/02/28 00:00:00"
14958953;1;"FELIPE DE SOUZA SIMIL";"05749787630";"31/08/1982";"CONTRATO TEMPORARIO";"IRS";"NUCLEO DE ENSINO E PESQUISA";"MED";"MEDICO PSIQUIATRA";"III";"A";"10/05/2021";"2021/05/10 00:00:00";"2023/05/09 00:00:00"
14151187;3;"FELIPE GUIMARAES GARCIA DE CARVALHO";"09258117697";"23/03/1989";"CONTRATO TEMPORARIO";"HJK";"COORDENACAO CIRURGICA";"MED";"MEDICO ANESTESIOLOGISTA";"III";"A";"25/03/2019";"2021/02/01 00:00:00";"2023/01/31 00:00:00"
14946644;1;"FELIPE JUNIOR NETO";"11264693605";"09/03/1994";"CONTRATO TEMPORARIO";"HEM";"COORDENACAO DAS UNIDADES DE INTERNACAO";"PENF";"TECNICO DE ENFERMAGEM";"II";"A";"03/07/2022";"2022/07/03 00:00:00";"2023/07/02 00:00:00"
14667521;3;"FELIPE LEONARDO RIGO";"08494599666";"12/07/1987";"CONTRATO TEMPORARIO";"JXXIII";"COORDENACAO DAS UNIDADES DE INTERNACAO ADULTO";"PENF";"ENFERMEIRO";"IV";"A";"01/02/2022";"2022/02/01 00:00:00";"2023/01/31 00:00:00"
15118862;1;"FELIPE SILVA DE OLIVEIRA";"09052471673";NA;"CONTRATO TEMPORARIO";"HJK";NA;"MEDRE";"MEDICO";"I";"A";NA;"2022/03/01 00:00:00";"2023/02/28 00:00:00"
15117880;1;"FELIPE ZACARONI BOTREL";"12463877600";NA;"CONTRATO TEMPORARIO";"HJK";NA;"MEDRE";"MEDICO";"I";"A";NA;"2022/03/01 00:00:00";"2023/02/28 00:00:00"
11304847;5;"FELIPPE PENZIN MONTEIRO";"03365946667";"22/05/1979";"CONTRATO TEMPORARIO";"HEM";"COORDENACAO DAS UNIDADES DE INTERNACAO";"MED";"MEDICO INFECTOLOGISTA";"III";"A";"01/02/2022";"2022/02/01 00:00:00";"2023/01/31 00:00:00"
10909117;5;"FELIX QUENTASI ESCOBAR";"01279013613";"31/03/1955";"CONTRATO TEMPORARIO";"JXXIII";"COORDENACAO DAS UNIDADES DE INTERNACAO ADULTO";"MED";"MEDICO GENERALISTA";"I";"A";"17/10/2021";"2021/10/17 00:00:00";"2023/06/30 00:00:00"
14762108;4;"FERNANDA ALVES BOY";"07843252606";"08/04/1991";"CONTRATO TEMPORARIO";"JXXIII";"COORDENACAO DE URGENCIA E EMERGENCIA ADULTO";"MED";"MEDICO CIRURGIAO GERAL";"III";"A";"03/03/2022";"2022/03/03 00:00:00";"2023/03/02 00:00:00"
15123359;1;"FERNANDA ALVES LUZ";"07302507686";NA;"CONTRATO TEMPORARIO";"MOV";NA;"MEDRE";"MEDICO";"I";"A";NA;"2022/03/01 00:00:00";"2023/02/28 00:00:00"
12697215;2;"FERNANDA ANICIO COTA LAGE ALVIM";"07244081693";"17/10/1986";"CONTRATO TEMPORARIO";"MOV";"COORDENACAO DE APOIO DIAGNOSTICO E TERAPEUTICO";"TOS";"TECNICO EM FARMACIA";"II";"A";"01/02/2022";"2022/02/01 00:00:00";"2023/01/31 00:00:00"
13802160;3;"FERNANDA ANTUNES BARBOSA";"07854386617";"17/07/1986";"CONTRATO TEMPORARIO";"HGB-JA";"COORDENACAO DE SAUDE MENTAL";"PENF";"TECNICO DE ENFERMAGEM";"II";"A";"22/11/2021";"2021/11/22 00:00:00";"2023/06/30 00:00:00"
12201562;3;"FERNANDA APARECIDA DUARTE DE SA";"07050737690";"07/12/1984";"CONTRATO TEMPORARIO";"HGB-JA";"COORDENACAO DE ENFERMAGEM E EQUIPE MULTIDISCIPLINAR";"AGAS";"ASSISTENTE SOCIAL";"I";"A";"25/11/2021";"2021/11/25 00:00:00";"2023/06/30 00:00:00"
15260763;1;"FERNANDA ARAUJO GAMALOYOLA";"08641316663";"12/10/1990";"CONTRATO TEMPORARIO";"HIJPII";"COORDENACAO DO SERVICO DE NUTRICAO E DIETETICA";"AGAS";"NUTRICIONISTA";"I";"A";"20/06/2022";"2022/06/20 00:00:00";"2023/06/19 00:00:00"
14668412;1;"FERNANDA BONOMO BITTENCOURT";"01358921636";"15/07/1981";"CONTRATO TEMPORARIO";"JXXIII";"COORDENACAO DE URGENCIA E EMERGENCIA ADULTO";"PENF";"ENFERMEIRO";"IV";"A";"23/09/2022";"2022/09/23 00:00:00";"2023/09/22 00:00:00"
14925770;1;"FERNANDA CHAVES CAPANEMA ALVARES";"11590889690";NA;"CONTRATO TEMPORARIO";"MOV";NA;"MEDRE";"MEDICO";"I";"A";NA;"2021/03/01 00:00:00";"2023/02/28 00:00:00"
10887891;3;"FERNANDA CHRISTINA CAMARGOS MONTEIRO";"04529034674";"03/12/1980";"CONTRATO TEMPORARIO";"HRAD";"COORDENACAO DE GESTAO DE PESSOAS";"TOS";"AUXILIAR ADMINISTRATIVO";"I";"A";"03/08/2021";"2021/08/02 00:00:00";"2023/06/30 00:00:00"
13800339;2;"FERNANDA CLAUDIA DA SILVA";"04842207647";"27/03/1980";"CONTRATO TEMPORARIO";"HGB-JA";"COORDENACAO DA UNIDADE DE CLINICA MEDICA";"PENF";"TECNICO DE ENFERMAGEM";"II";"A";"01/02/2022";"2022/02/01 00:00:00";"2023/01/31 00:00:00"
15082894;1;"FERNANDA CRISTINA ARANTES DE JESUS";"08986524643";"30/09/1984";"CONTRATO TEMPORARIO";"HGB-JA";"COORDENACAO DA UNIDADE DE CLINICA MEDICA";"PENF";"TECNICO DE ENFERMAGEM";"II";"A";"01/02/2022";"2022/02/01 00:00:00";"2023/01/31 00:00:00"
14613962;2;"FERNANDA CRISTINA DE OLIVEIRA";"05859945604";"06/07/1982";"CONTRATO TEMPORARIO";"HGB-JA";"COORDENACAO DE SAUDE MENTAL";"PENF";"TECNICO DE ENFERMAGEM";"II";"A";"21/03/2022";"2022/03/21 00:00:00";"2023/03/20 00:00:00"
14958771;1;"FERNANDA CRISTINA DE OLIVEIRA";"10494760699";"13/04/1995";"CONTRATO TEMPORARIO";"HGB-JA";"COORDENACAO DA UNIDADE DE URGENCIA E EMERGENCIA";"PENF";"TECNICO DE ENFERMAGEM";"II";"A";"05/05/2021";"2021/05/05 00:00:00";"2023/05/04 00:00:00"
15142359;1;"FERNANDA CRISTINA DE OLIVEIRA FRANCISCO";"11229030654";NA;"CONTRATO TEMPORARIO";"HRAD";NA;"MEDRE";"MEDICO";"I";"A";NA;"2022/03/01 00:00:00";"2023/02/28 00:00:00"
14255574;2;"FERNANDA CRISTINA GUEDES";"04637493676";"15/04/1981";"CONTRATO TEMPORARIO";"MOV";"COORDENACAO DE APOIO DIAGNOSTICO E TERAPEUTICO";"AGAS";"FARMACEUTICO BIOQUIMICO";"I";"A";"01/02/2022";"2022/02/01 00:00:00";"2023/01/31 00:00:00"
14290688;1;"FERNANDA CRISTINA PEREIRA ESTEVAM DOS SANTOS";"05223484673";"24/01/1981";NA;"HJK";"COORDENACAO DA MATERNIDADE";NA;"TECNICO DE ENFERMAGEM";NA;NA;"26/12/2022";NA;NA
14897672;3;"FERNANDA CRISTINA SAMPAIO CHAGAS";"06874089625";"16/10/1982";"CONTRATO TEMPORARIO";"HEM";"COORDENACAO DAS UNIDADES CRITICAS";"AGAS";"FISIOTERAPEUTA RESPIRATORIA";"III";"A";"17/01/2022";"2022/01/17 00:00:00";"2023/01/16 00:00:00"
14846968;3;"FERNANDA DE FARIA MARIANO";"11745281681";"10/07/1992";"CONTRATO TEMPORARIO";"HGB-JA";"COORDENACAO DA UNIDADE CIRURGICA";"MED";"MEDICO ANESTESIOLOGISTA";"III";"A";"08/07/2021";"2021/07/08 00:00:00";"2023/06/30 00:00:00"
15204118;1;"FERNANDA DRUMOND RABELO";"12062704623";NA;"CONTRATO TEMPORARIO";"HGB-JA";NA;"MEDRE";"MEDICO";"I";"A";NA;"2022/03/18 00:00:00";"2023/03/17 00:00:00"
14900567;2;"FERNANDA FERREIRA DE SOUSA";"07389748621";NA;"CONTRATO TEMPORARIO";"HRAD";NA;"MED";"MEDICO PEDIATRA";"III";"A";NA;"2021/07/09 00:00:00";"2023/06/30 00:00:00"
14001945;2;"FERNANDA FRANCA COSTA";"07963353620";NA;"CONTRATO TEMPORARIO";"JXXIII";NA;"MED";"MEDICO HEMATOLOGISTA";"III";"A";NA;"2022/02/14 00:00:00";"2023/02/13 00:00:00"
14700926;3;"FERNANDA GABRIELA COLOMBO DRUMOND SANTOS";"08981614601";"14/11/1987";"CONTRATO TEMPORARIO";"JXXIII";"COORDENACAO DA UNIDADE DE TERAPIA INTENSIVA ADULTO";"MED";"MEDICO NUTROLOGISTA";"III";"A";"03/03/2022";"2022/03/03 00:00:00";"2023/03/02 00:00:00"
15117930;1;"FERNANDA GANDRA COSTA";"10669058602";NA;"CONTRATO TEMPORARIO";"HAC";NA;"MEDRE";"MEDICO";"I";"A";NA;"2022/03/01 00:00:00";"2023/02/28 00:00:00"
15067036;1;"FERNANDA GOUVEIA GOULART";"05986640683";"09/02/1984";"CONTRATO TEMPORARIO";"HRAD";"COORDENACAO DA UNIDADE DE PACIENTES EXTERNOS";"MED";"MEDICO GINECOLOGISTA";"III";"A";"0000-00-00";"2022/02/05 00:00:00";"2023/02/04 00:00:00"
15125891;1;"FERNANDA HERMETO SOARES";"13506894676";NA;"CONTRATO TEMPORARIO";"JXXIII";NA;"MEDRE";"MEDICO";"I";"A";NA;"2022/03/01 00:00:00";"2023/02/28 00:00:00"
14950414;1;"FERNANDA LUIZA ALBERTO BRAGA";"11736367650";NA;"CONTRATO TEMPORARIO";"IRS";NA;"MEDRE";"MEDICO";"I";"A";NA;"2021/03/01 00:00:00";"2023/02/28 00:00:00"
15189509;1;"FERNANDA MACHADO DIEL";"07060373675";NA;"CONTRATO TEMPORARIO";"MOV";NA;"MEDRE";"MEDICO";"I";"A";NA;"2022/03/01 00:00:00";"2023/02/28 00:00:00"
14415541;3;"FERNANDA MARCIA SOUZA E RESENDE";"10333026608";"17/06/1993";"CONTRATO TEMPORARIO";"JXXIII";"COORDENACAO DA UNIDADE DE TERAPIA INTENSIVA PEDIATRICA";"MED";"MEDICO PEDIATRA";"III";"A";"11/04/2022";"2022/04/11 00:00:00";"2023/04/10 00:00:00"
14591531;1;"FERNANDA MILENA CARDOSO";"06449404680";"08/01/1983";"CONTRATO TEMPORARIO";"DIGEPE";"(DESAT.)COORDENACAO DE EXECUCAO ORCAMENTARIA E FINANCEIRA";"TOS";"AUXILIAR ADMINISTRATIVO";"I";"A";"01/02/2022";"2022/02/01 00:00:00";"2023/01/31 00:00:00"
13706163;2;"FERNANDA MOREIRA BRAGA ANTUNES";"04325217630";"26/03/1978";"CONTRATO TEMPORARIO";"HJK";"COORDENACAO DA UNIDADE DE TERAPIA INTENSIVA ADULTO";"PENF";"TECNICO DE ENFERMAGEM";"II";"A";"02/02/2022";"2022/02/02 00:00:00";"2023/02/01 00:00:00"
13677844;1;"FERNANDA NERI SANTOS";"06043656671";"09/07/1983";"CONTRATO TEMPORARIO";"AJUR";"(DESAT.)NUCLEO DE CONSULTORIA";"AGAS";"ADVOGADO";"I";"A";"30/03/2021";"2021/03/30 00:00:00";"2023/03/29 00:00:00"
14114607;1;"FERNANDA OLIVEIRA TRINDADE DE ASSIS";"00269031642";"08/04/1974";"CONTRATO TEMPORARIO";"HGB-JA";"COORDENACAO DE ASSISTENCIA FARMACEUTICA";"TOS";"TECNICO EM FARMACIA";"II";"A";"02/02/2022";"2022/02/02 00:00:00";"2023/02/01 00:00:00"
14541791;2;"FERNANDA ONOFRE SOUZA";"01203035586";"06/05/1985";"CONTRATO TEMPORARIO";"HEM";"COORDENACAO DAS UNIDADES DE INTERNACAO";"PENF";"ENFERMEIRO";"IV";"A";"01/07/2022";"2022/07/01 00:00:00";"2023/06/30 00:00:00"
14883102;4;"FERNANDA PRESTES DAMAZIO";"11221806670";"27/06/1993";"CONTRATO TEMPORARIO";"JXXIII";"COORDENACAO DE URGENCIA E EMERGENCIA ADULTO";"MED";"MEDICO CLINICO";"III";"A";"02/07/2022";"2022/07/02 00:00:00";"2023/07/01 00:00:00"
14883102;3;"FERNANDA PRESTES DAMAZIO";"11221806670";"27/06/1993";"CONTRATO TEMPORARIO";"JXXIII";"COORDENACAO DE URGENCIA E EMERGENCIA ADULTO";"MED";"MEDICO CLINICO";"III";"A";"03/07/2022";"2022/07/03 00:00:00";"2023/07/02 00:00:00"
15123441;1;"FERNANDA ROCHA GOMES";"10304232610";NA;"CONTRATO TEMPORARIO";"MOV";NA;"MEDRE";"MEDICO";"I";"A";NA;"2022/03/03 00:00:00";"2023/03/02 00:00:00"
14956379;1;"FERNANDA SCELZA GIANOTTI";"14407349760";NA;"CONTRATO TEMPORARIO";"HRAD";NA;"MEDRE";"MEDICO";"I";"A";NA;"2021/04/12 00:00:00";"2023/04/11 00:00:00"
11590361;4;"FERNANDA SILVA NUNES";"04968464690";"31/08/1981";"CONTRATO TEMPORARIO";"HRAD";"COORDENACAO DA MATERNIDADE";"PENF";"ENFERMEIRO";"IV";"A";"0000-00-00";"2022/02/02 00:00:00";"2023/02/01 00:00:00"
13914270;2;"FERNANDA SILVEIRA PUIATTI NEVES";"05179502608";"29/04/1982";"CONTRATO TEMPORARIO";"CHPB";"COORDENACAO DE ENFERMAGEM E EQUIPE MULTIDISCIPLINAR";"AGAS";"FONOAUDIOLOGO";"I";"A";"22/04/2021";"2021/04/22 00:00:00";"2023/04/21 00:00:00"
13557947;1;"FERNANDA SOARES DOS REIS CUNHA";"06340395635";"26/02/1984";"CONTRATO TEMPORARIO";"AJUR";"(DESAT.)NUCLEO DE CONTENCIOSO";"AGAS";"ADVOGADO";"I";"A";"05/04/2021";"2021/04/05 00:00:00";"2023/04/04 00:00:00"
15070584;1;"FERNANDA SONIA DIAS DOS ANJOS PEREIRA MA";"06324671690";"01/01/1981";"CONTRATO TEMPORARIO";"JXXIII";"COORDENACAO DA UNIDADE DE TERAPIA INTENSIVA ADULTO";"PENF";"TECNICO DE ENFERMAGEM";"II";"A";"01/02/2022";"2022/02/01 00:00:00";"2023/01/31 00:00:00"
14317374;2;"FERNANDA SOUSA COSTA";"08664767688";"29/03/1990";"CONTRATO TEMPORARIO";"HJK";"COORDENACAO MEDICA DA URGENCIA E EMERGENCIA";"PENF";"TECNICO DE ENFERMAGEM";"II";"A";"06/07/2022";"2022/07/06 00:00:00";"2023/07/05 00:00:00"
14317374;1;"FERNANDA SOUSA COSTA";"08664767688";"29/03/1990";"CONTRATO TEMPORARIO";"HEM";"COORDENACAO DAS UNIDADES DE INTERNACAO";"PENF";"TECNICO DE ENFERMAGEM";"II";"A";"06/07/2022";"2022/07/06 00:00:00";"2023/07/05 00:00:00"
14912927;1;"FERNANDA SOUZA SALLES";"01585956619";"11/05/1990";"CONTRATO TEMPORARIO";"HRJP";"COORDENACAO DA MATERNIDADE";"MED";"MEDICO PEDIATRA";"III";"A";"10/10/2020";"2021/02/01 00:00:00";"2023/01/31 00:00:00"
13850227;2;"FERNANDA VALERIO HENRIQUES";"08130020602";NA;"CONTRATO TEMPORARIO";"MOV";NA;"MED";"MEDICO OBSTETRA";"III";"A";NA;"2022/02/05 00:00:00";"2023/02/04 00:00:00"
14882310;1;"FERNANDO AUGUSTO JANUARIO DE MENEZES";"12273032625";NA;"CONTRATO TEMPORARIO";"HAC";NA;"MEDRE";"MEDICO";"I";"A";NA;"2020/03/01 00:00:00";"2023/02/28 00:00:00"
14415590;2;"FERNANDO BARROS DE SOUSA";"08081517626";"27/02/1990";"CONTRATO TEMPORARIO";"MOV";"COORDENACAO DA GINECOLOGIA E OBSTETRICIA";"MED";"MEDICO GINECOLOGISTA";"III";"A";"11/02/2022";"2022/02/11 00:00:00";"2023/02/10 00:00:00"
11746880;2;"FERNANDO CASSIO RIBEIRO RESENDE";"03085410651";"22/05/1977";"CONTRATO TEMPORARIO";"DPGF";"(DESAT.)COORDENACAO DE EXECUCAO ORCAMENTARIA E FINANCEIRA";"TOS";"AUXILIAR ADMINISTRATIVO";"II";"A";"01/02/2022";"2022/02/01 00:00:00";"2023/01/31 00:00:00"
15084262;1;"FERNANDO DO VALLE";"09522987670";"21/01/1988";"CONTRATO TEMPORARIO";"HGB-JA";"COORDENACAO DE APOIO DIAGNOSTICO E TERAPEUTICO";"TOS";"TECNICO EM RADIOLOGIA";"II";"A";"01/02/2022";"2022/02/01 00:00:00";"2023/01/31 00:00:00"
14415657;5;"FERNANDO MALDINI PENNA DE MASCARENHAS AM";"10143636677";"04/04/1990";"CONTRATO TEMPORARIO";"JXXIII";"COORDENACAO DO BLOCO CIRURGICO";"MED";"MEDICO CIRURGIAO PLASTICO";"III";"A";"01/03/2022";"2022/03/01 00:00:00";"2023/02/28 00:00:00"
14315568;4;"FERNANDO ROMUALDO SALATIEL";"68773099600";"17/11/1969";"CONTRATO TEMPORARIO";"HIJPII";"COORDENACAO DO CENTRO DE TRATAMENTO DE QUEIMADOS";"PENF";"ENFERMEIRO";"IV";"A";"06/02/2022";"2022/02/06 00:00:00";"2023/02/05 00:00:00"
14315568;3;"FERNANDO ROMUALDO SALATIEL";"68773099600";"17/11/1969";"CONTRATO TEMPORARIO";"HJK";"COORDENACAO DE INTERNACAO - ADULTO";"PENF";"ENFERMEIRO";"IV";"A";"09/02/2022";"2022/02/13 00:00:00";"2023/02/12 00:00:00"
13849583;2;"FERNANDO VITOR DE SOUZA";"03589817607";"26/09/1978";"CONTRATO TEMPORARIO";"HGB-JA";"COORDENACAO DE APOIO DIAGNOSTICO E TERAPEUTICO";"AGAS";"FARMACEUTICO";"I";"A";"30/06/2022";"2022/06/30 00:00:00";"2023/06/29 00:00:00"
14625503;4;"FILIPE MATEUS COSTA TEIXEIRA";"06905963674";"17/01/1992";"CONTRATO TEMPORARIO";"HAC";"COORDENACAO DO AMBULATORIO";"MED";"MEDICO CLINICO";"III";"A";"07/03/2022";"2022/03/07 00:00:00";"2023/03/06 00:00:00"
14884092;1;"FILIPE PERES BARRETO";"12926726686";NA;"CONTRATO TEMPORARIO";"HJK";NA;"MEDRE";"MEDICO";"I";"A";NA;"2020/03/01 00:00:00";"2023/02/28 00:00:00"
14946347;1;"FILIPE SALIBA LANCA";"01426633602";NA;"CONTRATO TEMPORARIO";"HAC";NA;"MEDRE";"MEDICO";"I";"A";NA;"2021/03/23 00:00:00";"2023/03/22 00:00:00"
13370861;4;"FLAVIA ALVES DA COSTA";"05980642650";"20/08/1983";"CONTRATO TEMPORARIO";"MOV";"COORDENACAO DE APOIO DIAGNOSTICO E TERAPEUTICO";"TOS";"AUXILIAR ADMINISTRATIVO";"I";"A";"05/04/2022";"2022/04/05 00:00:00";"2023/04/04 00:00:00"
14591242;4;"FLAVIA ANERIA FINAMORE ANDREAZZE";"03766056697";"11/12/1976";"CONTRATO TEMPORARIO";"HAC";"COORDENACAO DO LABORATORIO";"TOS";"TECNICO EM PATOLOGIA CLINICA";"II";"A";"02/02/2022";"2022/02/02 00:00:00";"2023/02/01 00:00:00"
15323744;1;"FLAVIA APARECIDA CIPRIANO";"02687644684";"15/11/1974";"CONTRATO TEMPORARIO";"JXXIII";"COORDENACAO DO CENTRO DE TRATAMENTO DE QUEIMADOS";"PENF";"TECNICO DE ENFERMAGEM";"II";"A";"27/09/2022";"2022/09/27 00:00:00";"2023/09/26 00:00:00"
13723655;4;"FLAVIA APARECIDA DE ANDRADE PEREIRA RIOS";"06648461659";"11/10/1986";"CONTRATO TEMPORARIO";"CSSI";"COORDENACAO DE APOIO DIAGNOSTICO E TERAPEUTICO";"TOS";"TECNICO EM PATOLOGIA CLINICA";"II";"A";"13/07/2021";"2021/07/13 00:00:00";"2023/06/30 00:00:00"
14638001;2;"FLAVIA CARDOSO LOPEZ VIEIRA";"09000183642";"14/10/1987";"CONTRATO TEMPORARIO";"HEM";"COORDENACAO DAS UNIDADES DE INTERNACAO";"MED";"MEDICO CLINICO";"III";"A";"04/02/2022";"2022/02/04 00:00:00";"2023/02/03 00:00:00"
14661201;2;"FLAVIA CUNHA DE OLIVEIRA SANTOS";"02848150637";"05/04/1976";"CONTRATO TEMPORARIO";"JXXIII";"COORDENACAO DA UNIDADE DE TERAPIA INTENSIVA PEDIATRICA";"PENF";"ENFERMEIRO";"VI";"A";"04/07/2022";"2022/07/04 00:00:00";"2023/07/03 00:00:00"
13314042;3;"FLAVIA DA MATA CHIACCHIO LEITE";"01609570600";"21/07/1987";"CONTRATO TEMPORARIO";"HIJPII";"COORDENACAO DO AMBULATORIO ADULTO";"MED";"MEDICO PSIQUIATRA";"III";"A";"05/07/2022";"2022/07/05 00:00:00";"2023/07/04 00:00:00"
14667505;3;"FLAVIA DE PAULA MELO MENDONCA";"05767108650";"07/09/1981";"CONTRATO TEMPORARIO";"HEM";"COORDENACAO DAS UNIDADES DE INTERNACAO";"PENF";"TECNICO DE ENFERMAGEM";"II";"A";"14/07/2018";"2021/02/01 00:00:00";"2023/01/31 00:00:00"
14619241;2;"FLAVIA DOMINGUES VITORINO";"06586760674";"10/10/1984";"CONTRATO TEMPORARIO";"IRS";"COORDENACAO DA UNIDADE DE PACIENTES EXTERNOS";"MED";"MEDICO PSIQUIATRA";"III";"A";"09/07/2021";"2021/07/09 00:00:00";"2023/06/30 00:00:00"
15119696;1;"FLAVIA DUARTE NOGUEIRA";"10112734626";NA;"CONTRATO TEMPORARIO";"HIJPII";NA;"MEDRE";"MEDICO";"I";"A";NA;"2022/03/01 00:00:00";"2023/02/28 00:00:00"
15018476;1;"FLAVIA FELIPE THIBAU REIS";"11806032651";"27/02/1994";"CONTRATO TEMPORARIO";"JXXIII";"COORDENACAO DE URGENCIA E EMERGENCIA ADULTO";"PENF";"ENFERMEIRO";"IV";"A";"14/09/2021";"2021/09/14 00:00:00";"2023/06/30 00:00:00"
14679302;2;"FLAVIA LUISA DE SOUSA";"06631728614";"03/12/1985";"CONTRATO TEMPORARIO";"HRAD";"COORDENACAO DE APOIO DIAGNOSTICO E TERAPEUTICO";"TOS";"TECNICO EM RADIOLOGIA";"II";"A";"0000-00-00";"2022/02/04 00:00:00";"2023/02/03 00:00:00"
14255616;1;"FLAVIA MORAIS SANTOS";"00131042688";"03/03/1973";"CONTRATO TEMPORARIO";"HJK";"COORDENACAO DE INTERNACAO - ADULTO";"PENF";"TECNICO DE ENFERMAGEM";"II";"A";"06/02/2022";"2022/02/06 00:00:00";"2023/02/05 00:00:00"
14580112;2;"FLAVIA ROCHA DE OLIVEIRA";"92418163687";"25/05/1974";"CONTRATO TEMPORARIO";"JXXIII";"COORDENACAO DE GESTAO DE PESSOAS";"TOS";"AUXILIAR ADMINISTRATIVO";"I";"A";"01/02/2022";"2022/02/01 00:00:00";"2023/01/31 00:00:00"
13742945;2;"FLAVIA ROCHA PINHEIRO";"07486366681";"29/01/1987";"CONTRATO TEMPORARIO";"MOV";"COORDENACAO DE APOIO DIAGNOSTICO E TERAPEUTICO";"TOS";"TECNICO EM PATOLOGIA CLINICA";"II";"A";"09/06/2022";"2022/06/09 00:00:00";"2023/06/08 00:00:00"
13800347;3;"FLAVIA RODRIGUES CAMPOS GOMES";"03398920640";"14/04/1975";"CONTRATO TEMPORARIO";"HGB-JA";"COORDENACAO DA UNIDADE DE CLINICA MEDICA";"PENF";"ENFERMEIRO";"IV";"A";"01/02/2022";"2022/02/01 00:00:00";"2023/01/31 00:00:00"
14910319;1;"FLAVIA SILVA AVELAR";"07744065778";NA;"CONTRATO TEMPORARIO";"HRJP";NA;"MED";"MEDICO GINECOLOGISTA";"III";"A";NA;"2022/02/01 00:00:00";"2023/01/31 00:00:00"
14910319;2;"FLAVIA SILVA AVELAR II";"07744065778";"0000-00-00";NA;"HRJP";"COORDENACAO DA MATERNIDADE";NA;"";NA;NA;"01/02/2022";NA;NA
13083704;2;"FLAVIA TAYLLINE VIEIRA SILVA";"10134384695";"30/07/1992";"CONTRATO TEMPORARIO";"DIRASS";"(DESAT.)COORDENACAO DE ENGENHARIA CLINICA";"AGAS";"ENGENHEIRO";"III";"A";"16/04/2021";"2021/04/16 00:00:00";"2023/06/30 00:00:00"
14945307;1;"FLAVIANE BACHIM DE OLIVEIRA";"09631328651";NA;"CONTRATO TEMPORARIO";"HGB-JA";NA;"MEDRE";"MEDICO";"I";"A";NA;"2021/03/01 00:00:00";"2023/02/28 00:00:00"
14614705;3;"FLAVIO AUGUSTO DE ALMEIDA FARIA";"97745650615";"19/04/1975";"CONTRATO TEMPORARIO";"HEM";"COORDENACAO DAS UNIDADES DE INTERNACAO";"MED";"MEDICO INFECTOLOGISTA";"III";"A";"20/05/2021";"2021/05/20 00:00:00";"2023/05/19 00:00:00"
11807401;2;"FLAVIO EDUARDO DA SILVA";"28237517857";"22/06/1981";"CONTRATO TEMPORARIO";"CMT";"GERENCIA ASSISTENCIAL";"PENF";"ENFERMEIRO";"IV";"A";"07/02/2022";"2022/02/07 00:00:00";"2023/01/06 00:00:00"
14760888;3;"FLAVIO HENRIQUE BERNARDES PAPA";"05971992643";"22/06/1994";"CONTRATO TEMPORARIO";"JXXIII";"COORDENACAO DE URGENCIA E EMERGENCIA ADULTO";"MED";"MEDICO CLINICO";"III";"A";"17/05/2021";"2021/05/17 00:00:00";"2023/05/16 00:00:00"
10427268;2;"FLAVIO PIRES DE AZEVEDO";"76829472768";"11/04/1962";"CONTRATO TEMPORARIO";"CSSFE";"COORDENACAO DA UNIDADE DE CUIDADO AO ADULTO";"MED";"MEDICO OTORRINOLARINGOLOGISTA";"III";"A";"01/02/2022";"2022/02/01 00:00:00";"2023/01/31 00:00:00"
13779376;2;"FLORIDA DA SILVA ALEIXO";"03144639680";"08/05/1973";"CONTRATO TEMPORARIO";"JXXIII";"COORDENACAO DO CENTRO DE TRATAMENTO DE QUEIMADOS";"PENF";"TECNICO DE ENFERMAGEM";"II";"A";"02/02/2022";"2022/02/02 00:00:00";"2023/02/01 00:00:00"
14273874;3;"FRANCERLY SOUZA RUFINO";"01465595686";"21/01/1983";"CONTRATO TEMPORARIO";"JXXIII";"COORDENACAO DE URGENCIA E EMERGENCIA ADULTO";"PENF";"TECNICO DE ENFERMAGEM";"II";"A";"18/03/2022";"2022/03/18 00:00:00";"2023/03/17 00:00:00"
14513899;2;"FRANCIANE CRISTINA COSTA CAMPARA";"06904942622";"29/09/1983";"CONTRATO TEMPORARIO";"HGB-JA";"COORDENACAO DA UNIDADE DE URGENCIA E EMERGENCIA";"PENF";"TECNICO DE ENFERMAGEM";"II";"A";"01/02/2022";"2022/02/01 00:00:00";"2023/01/31 00:00:00"
14784680;2;"FRANCIELE CRISTINA CAIXETA LOPES";"08568171630";"08/03/1991";"CONTRATO TEMPORARIO";"HRAD";"COORDENACAO DAS UNIDADES CRITICAS";"PENF";"TECNICO DE ENFERMAGEM";"II";"A";"0000-00-00";"2021/12/28 00:00:00";"2023/06/30 00:00:00"
14513931;1;"FRANCIELE GOMES VIEIRA";"09560007629";"11/02/1991";"CONTRATO TEMPORARIO";"HJK";"COORDENACAO DE INTERNACAO - ADULTO";"PENF";"TECNICO DE ENFERMAGEM";"II";"A";"08/02/2022";"2022/02/08 00:00:00";"2023/02/07 00:00:00"
14052757;2;"FRANCIELE ROSA DIAS";"11468399608";"26/09/1994";"CONTRATO TEMPORARIO";"HGB-JA";"COORDENACAO DE ASSISTENCIA FARMACEUTICA";"TOS";"TECNICO EM FARMACIA";"II";"A";"06/01/2022";"2022/01/06 00:00:00";"2023/01/05 00:00:00"
12813820;4;"FRANCIELLE MACHADO SOARES";"09454337602";"10/12/1989";"CONTRATO TEMPORARIO";"HRAD";"COORDENACAO DE ASSISTENCIA FARMACEUTICA";"TOS";"TECNICO EM FARMACIA";"II";"A";"0000-00-00";"2022/01/22 00:00:00";"2023/01/21 00:00:00"
14946818;1;"FRANCIELLE SANTANA SANTOS";"06299405686";NA;"CONTRATO TEMPORARIO";"HJK";NA;"MED";"MEDICO GENERALISTA";"I";"A";NA;"2022/07/04 00:00:00";"2023/01/03 00:00:00"
14878821;2;"FRANCIELY MAYRA REIS CARMO";"10831836644";"01/01/1991";"CONTRATO TEMPORARIO";"HRJP";"COORDENACAO DAS UNIDADES CRITICAS";"MED";"MEDICO CLINICO";"III";"A";"29/06/2022";"2022/06/30 00:00:00";"2023/06/29 00:00:00"
14883938;1;"FRANCINE LEMOS FREITAS FONTOURA";"12901470602";NA;"CONTRATO TEMPORARIO";"HJK";NA;"MEDRE";"MEDICO";"I";"A";NA;"2020/03/01 00:00:00";"2023/02/28 00:00:00"
15064660;1;"FRANCINE RUBIAO DA CUNHA";"10496775600";"14/01/1992";"CONTRATO TEMPORARIO";"HEM";"COORDENACAO DAS UNIDADES DE INTERNACAO";"MED";"MEDICO OFTALMOLOGISTA";"III";"A";"14/12/2021";"2021/12/14 00:00:00";"2023/06/30 00:00:00"
14979744;2;"FRANCISCA DE CARVALHO";"09406198657";"08/07/1988";"CONTRATO TEMPORARIO";"JXXIII";"COORDENACAO DA UNIDADE DE TERAPIA INTENSIVA ADULTO";"PENF";"TECNICO DE ENFERMAGEM";"II";"A";"01/03/2022";"2022/02/01 00:00:00";"2023/01/31 00:00:00"
14716203;2;"FRANCISNET APARECIDA SILVA";"06060997600";"01/09/1979";"CONTRATO TEMPORARIO";"HRAD";"COORDENACAO DAS UNIDADES DE INTERNACAO";"PENF";"TECNICO DE ENFERMAGEM";"II";"A";"0000-00-00";"2022/11/02 00:00:00";"2023/11/01 00:00:00"
13764436;1;"FRANCO MAGALHAES SANT ANNA";"06533625608";"01/11/1983";"CONTRATO TEMPORARIO";"IRS";"COORDENACAO DA UNIDADE DE PACIENTES EXTERNOS";"MED";"MEDICO PSIQUIATRA";"III";"A";"03/02/2022";"2022/02/03 00:00:00";"2023/02/02 00:00:00"
13764436;2;"FRANCO MAGALHAES SANT ANNA";"06533625608";NA;"CONTRATO TEMPORARIO";"IRS";NA;"MEDRE";"MEDICO";"I";"A";NA;"2022/03/01 00:00:00";"2023/02/28 00:00:00"
14759658;2;"FREDERICO PRADO ABREU";"08604062610";"08/01/1990";"CONTRATO TEMPORARIO";"HEM";"COORDENACAO DAS UNIDADES DE INTERNACAO";"MED";"MEDICO INFECTOLOGISTA";"III";"A";"30/05/2022";"2022/05/30 00:00:00";"2023/05/29 00:00:00"
14479810;2;"FREDERICO SILVA PIMENTA";"06762789650";NA;"CONTRATO TEMPORARIO";"JXXIII";NA;"MED";"MEDICO ORTOPEDISTA E TRAUMATOLOGISTA";"III";"A";NA;"2022/03/03 00:00:00";"2023/03/02 00:00:00"
14479810;1;"FREDERICO SILVA PIMENTA";"06762789650";"02/01/1984";NA;"HMAL";"COORDENACAO DO AMBULATORIO ADULTO";NA;"MEDICO ORTOPEDISTA E TRAUMATOLOGISTA";NA;NA;"25/05/2017";NA;NA
15316789;1;"GABRIAINE DE ALMEIDA";"11067811710";"31/03/1984";"CONTRATO TEMPORARIO";"HRJP";"COORDENACAO DAS UNIDADES CRITICAS";"PENF";"TECNICO DE ENFERMAGEM";"II";"A";"12/09/2022";"2022/09/12 00:00:00";"2023/09/11 00:00:00"
15123201;1;"GABRIEL ALENCAR MOTA";"12630651630";NA;"CONTRATO TEMPORARIO";"HGB-JA";NA;"MEDRE";"MEDICO";"I";"A";NA;"2022/03/01 00:00:00";"2023/02/28 00:00:00"
15117633;1;"GABRIEL CRUZ MALTA";"03766742531";NA;"CONTRATO TEMPORARIO";"HJK";NA;"MEDRE";"MEDICO";"I";"A";NA;"2022/03/09 00:00:00";"2023/03/08 00:00:00"
14884191;2;"GABRIEL DE SOUZA FERNANDES FILHO";"09856853605";"04/04/1995";"CONTRATO TEMPORARIO";"HJK";"COORDENACAO MEDICA DA URGENCIA E EMERGENCIA";"MED";"MEDICO CLINICO";"III";"A";"01/07/2022";"2022/07/01 00:00:00";"2023/06/30 00:00:00"
15017676;1;"GABRIEL FONTE BOA TEOFILO";"01338952625";"02/12/1979";"CONTRATO TEMPORARIO";"HJK";"COORDENACAO DA EQUIPE MULTIDISCIPLINAR";"AGAS";"FISIOTERAPEUTA RESPIRATORIA";"III";"A";"01/09/2021";"2021/09/01 00:00:00";"2023/06/30 00:00:00"
15269673;1;"GABRIEL GONZALEZ DA SILVA CRUZ";"11384817697";"17/11/1994";"CONTRATO TEMPORARIO";"IRS";"GERENCIA ASSISTENCIAL";"TOS";"AUXILIAR ADMINISTRATIVO";"I";"A";"01/07/2022";"2022/07/01 00:00:00";"2023/06/30 00:00:00"
14932511;2;"GABRIEL HADDAD DINIZ RIBEIRO";"09472569625";NA;"CONTRATO TEMPORARIO";"HIJPII";NA;"MEDRE";"MEDICO";"I";"A";NA;"2021/03/01 00:00:00";"2023/02/28 00:00:00"
13155841;2;"GABRIEL HENRIQUE SILVA VIEIRA";"07980862627";"08/12/1987";"CONTRATO TEMPORARIO";"HCM";"COORDENACAO DE APOIO DIAGNOSTICO E TERAPEUTICO";"TOS";"AUXILIAR ADMINISTRATIVO";"I";"A";"01/02/2022";"2022/02/01 00:00:00";"2023/01/31 00:00:00"
14181002;3;"GABRIEL MARTINS CRUZ CAMPOS";"12500142710";"07/06/1992";"CONTRATO TEMPORARIO";"HJK";"COORDENACAO DA MATERNIDADE";"MED";"MEDICO GINECOLOGISTA";"III";"A";"01/02/2022";"2022/02/07 00:00:00";"2023/02/06 00:00:00"
14971378;3;"GABRIEL MEIRELES AZEVEDO PEREIRA";"11833906616";"05/08/1995";"CONTRATO TEMPORARIO";"HGB-JA";"COORDENACAO DA UNIDADE CIRURGICA";"MED";"MEDICO ORTOPEDISTA E TRAUMATOLOGISTA";"III";"A";"28/05/2022";"2022/05/28 00:00:00";"2023/05/27 00:00:00"
14971378;2;"GABRIEL MEIRELES AZEVEDO PEREIRA";"11833906616";NA;"CONTRATO TEMPORARIO";"HMAL";NA;"MEDRE";"MEDICO";"I";"A";NA;"2022/03/01 00:00:00";"2023/02/28 00:00:00"
14878623;3;"GABRIEL MIRANDA DE SENNA FIGUEIREDO";"11820197654";"08/09/1992";"CONTRATO TEMPORARIO";"CHPB";"COORDENACAO DA UNIDADE DE PACIENTES CRITICOS";"MED";"MEDICO CLINICO";"III";"A";"04/06/2022";"2022/06/04 00:00:00";"2023/06/03 00:00:00"
14878623;1;"GABRIEL MIRANDA DE SENNA FIGUEIREDO";"11820197654";NA;"CONTRATO TEMPORARIO";"HGB-JA";NA;"MEDRE";"MEDICO";"I";"A";NA;"2022/03/01 00:00:00";"2023/02/28 00:00:00"
14934087;1;"GABRIEL MOREIRA ALVES REIS";"09470781694";NA;"CONTRATO TEMPORARIO";"HAC";NA;"MEDRE";"MEDICO";"I";"A";NA;"2021/03/01 00:00:00";"2023/02/28 00:00:00"
15124977;1;"GABRIEL NASCIMENTO CASAGRANDE";"01667377639";"12/07/1997";"CONTRATO TEMPORARIO";"HGB-JA";"COORDENACAO DA UNIDADE DE CLINICA MEDICA";"PENF";"TECNICO DE ENFERMAGEM";"II";"A";"11/03/2022";"2022/03/11 00:00:00";"2023/03/10 00:00:00"
14651269;1;"GABRIEL NEVES FERNANDES";"11817621629";"31/03/1994";"CONTRATO TEMPORARIO";"DPGF";"(DESAT.)COORDENACAO DE MANUTENCAO DE INFRAESTRUTURA PREDIAL";"TOS";"AUXILIAR ADMINISTRATIVO";"I";"A";"07/02/2022";"2022/02/07 00:00:00";"2023/02/06 00:00:00"
13855556;4;"GABRIEL OLIVEIRA BORGES GUEBA FARIA LOPE";"12433956722";"28/01/1988";"CONTRATO TEMPORARIO";"HJK";"COORDENACAO DA MATERNIDADE";"MED";"MEDICO GINECOLOGISTA";"III";"A";"07/02/2022";"2022/02/07 00:00:00";"2023/02/06 00:00:00"
14884639;2;"GABRIEL SALLES DE QUEIROZ";"01622140656";"07/01/1995";"CONTRATO TEMPORARIO";"JXXIII";"COORDENACAO DA UNIDADE DE TERAPIA INTENSIVA ADULTO";"MED";"MEDICO CLINICO";"III";"A";"12/04/2022";"2022/04/12 00:00:00";"2023/04/11 00:00:00"
14614010;2;"GABRIEL TEIXEIRA PAIVA";"10618029656";NA;"CONTRATO TEMPORARIO";"JXXIII";NA;"TOS";"AUXILIAR ADMINISTRATIVO";"I";"A";NA;"2022/02/02 00:00:00";"2023/02/01 00:00:00"
14958813;1;"GABRIEL VITOR DA SILVA";"09534220620";"19/11/1988";"CONTRATO TEMPORARIO";"DIRASS";"(DESAT.)COORDENACAO DE ENGENHARIA CLINICA";"AGAS";"ENGENHEIRO";"III";"A";"01/04/2021";"2021/03/31 00:00:00";"2023/03/30 00:00:00"
15102130;1;"GABRIELA ASSUNTA PINHEIRO DA SILVA BARRA";"08860338611";"23/02/1987";"CONTRATO TEMPORARIO";"HGB-JA";"COORDENACAO DA UNIDADE DE URGENCIA E EMERGENCIA";"PENF";"TECNICO DE ENFERMAGEM";"II";"A";"01/02/2022";"2022/02/01 00:00:00";"2023/01/31 00:00:00"
15125552;1;"GABRIELA BRITO BOTHREL";"09682766605";NA;"CONTRATO TEMPORARIO";"JXXIII";NA;"MEDRE";"MEDICO";"I";"A";NA;"2022/03/01 00:00:00";"2023/02/28 00:00:00"
15077290;1;"GABRIELA CAETANO MARINS";"02067279173";"07/09/1987";"CONTRATO TEMPORARIO";"HRAD";"COORDENACAO DA MATERNIDADE";"PENF";"ENFERMEIRO";"IV";"A";"0000-00-00";"2022/02/01 00:00:00";"2023/01/31 00:00:00"
15123060;1;"GABRIELA CAMPOS DOS SANTOS";"10814971652";NA;"CONTRATO TEMPORARIO";"HGB-JA";NA;"MEDRE";"MEDICO";"I";"A";NA;"2022/03/01 00:00:00";"2023/02/28 00:00:00"
14624969;3;"GABRIELA CARDOSO MAIA DE ALBUQUERQUE";"01733252622";"03/06/1989";"CONTRATO TEMPORARIO";"HRAD";"GERENCIA ASSISTENCIAL";"MED";"MEDICO CLINICO";"III";"A";"0000-00-00";"2021/02/01 00:00:00";"2023/01/31 00:00:00"
13603949;5;"GABRIELA CASANOVA MARTINS DOS SANTOS";"09316126673";"19/02/1988";"CONTRATO TEMPORARIO";"JXXIII";"COORDENACAO DAS UNIDADES DE INTERNACAO ADULTO";"MED";"MEDICO CLINICO";"III";"A";"08/02/2022";"2022/02/08 00:00:00";"2023/02/07 00:00:00"
14880470;4;"GABRIELA CHULA DE ALCANTARA SOARES";"07271830600";"11/05/1993";"CONTRATO TEMPORARIO";"MOV";"COORDENACAO DA UNIDADE DE NEONATOLOGIA";"MED";"MEDICO PEDIATRA";"III";"A";"02/05/2022";"2022/05/02 00:00:00";"2023/05/01 00:00:00"
14880470;3;"GABRIELA CHULA DE ALCANTARA SOARES";"07271830600";"11/05/1993";"CONTRATO TEMPORARIO";"MOV";"COORDENACAO DA UNIDADE DE NEONATOLOGIA";"MED";"MEDICO PEDIATRA";"III";"A";"06/09/2021";"2021/09/06 00:00:00";"2023/06/30 00:00:00"
14114854;4;"GABRIELA CORREA REIS OLIVEIRA";"07172589637";"07/05/1986";"CONTRATO TEMPORARIO";"HJK";"COORDENACAO MEDICA DA TERAPIA INTENSIVA NEONATAL";"MED";"MEDICO PEDIATRA";"III";"A";"02/04/2022";"2022/04/02 00:00:00";"2023/04/01 00:00:00"
14114854;3;"GABRIELA CORREA REIS OLIVEIRA";"07172589637";"07/05/1986";"CONTRATO TEMPORARIO";"HJK";"COORDENACAO MEDICA DA TERAPIA INTENSIVA NEONATAL";"MED";"MEDICO PEDIATRA";"III";"A";"27/09/2021";"2021/09/27 00:00:00";"2023/06/30 00:00:00"
14416655;2;"GABRIELA DE CAMPOS VIVEIROS";"10003634655";"08/11/1992";"CONTRATO TEMPORARIO";"HJK";"COORDENACAO DA UNIDADE DE TERAPIA INTENSIVA ADULTO";"MED";"MEDICO CLINICO";"III";"A";"05/02/2022";"2022/02/05 00:00:00";"2023/02/04 00:00:00"
14896377;2;"GABRIELA DE OLIVEIRA ABRANTES SOUZA";"07533198611";"30/07/1984";"CONTRATO TEMPORARIO";"HGB-JA";"COORDENACAO DA UNIDADE DE URGENCIA E EMERGENCIA";"PENF";"TECNICO DE ENFERMAGEM";"II";"A";"02/02/2022";"2022/02/02 00:00:00";"2023/02/01 00:00:00"
14774590;3;"GABRIELA FARIAS DE SALES PALHARES";"09767422684";"08/06/1989";"CONTRATO TEMPORARIO";"HIJPII";"COORDENACAO DA UNIDADE DE TERAPIA INTENSIVA PEDIATRICA";"AGAS";"FISIOTERAPEUTA RESPIRATORIA";"III";"A";"10/11/2021";"2021/11/10 00:00:00";"2023/06/30 00:00:00"
15118037;2;"GABRIELA FREITAS MILAGRES MATOS";"08924469606";"05/11/1987";"CONTRATO TEMPORARIO";"HJK";"COORDENACAO MEDICA DA URGENCIA E EMERGENCIA";"MED";"MEDICO GENERALISTA";"I";"A";"04/07/2022";"2022/07/04 00:00:00";"2023/01/03 00:00:00"
15118037;1;"GABRIELA FREITAS MILAGRES MATOS";"08924469606";NA;"CONTRATO TEMPORARIO";"HAC";NA;"MEDRE";"MEDICO";"I";"A";NA;"2022/03/01 00:00:00";"2023/02/28 00:00:00"
13892997;4;"GABRIELA GONCALVES DO NASCIMENTO";"06520760684";"12/06/1980";"CONTRATO TEMPORARIO";"HGB-JA";"COORDENACAO DE APOIO DIAGNOSTICO E TERAPEUTICO";"TOS";"TECNICO EM RADIOLOGIA";"II";"A";"02/02/2022";"2022/02/03 00:00:00";"2023/02/02 00:00:00"
14932529;1;"GABRIELA MASCARENHAS CAFE GOUVEA";"10012623601";NA;"CONTRATO TEMPORARIO";"HIJPII";NA;"MEDRE";"MEDICO";"I";"A";NA;"2021/03/01 00:00:00";"2023/02/28 00:00:00"
14911242;2;"GABRIELA MATOSO NASCIMENTO";"10484554670";"14/10/1991";"CONTRATO TEMPORARIO";"JXXIII";"COORDENACAO DA UNIDADE DE TERAPIA INTENSIVA ADULTO";"MED";"MEDICO CLINICO";"III";"A";"09/09/2021";"2021/09/09 00:00:00";"2023/06/30 00:00:00"
14239560;2;"GABRIELA MIRANDA MENDES";"08964710630";"22/02/1988";"CONTRATO TEMPORARIO";"HJK";"COORDENACAO MEDICA DA TERAPIA INTENSIVA NEONATAL";"MED";"MEDICO PEDIATRA";"III";"A";"03/02/2022";"2022/02/03 00:00:00";"2023/02/02 00:00:00"
9143191;0;"GABRIELA PIRES DOS SANTOS";"09143191673";"0000-00-00";NA;"HAC";"COORDENACAO CIRURGICA";NA;"";NA;NA;"0000-00-00";NA;NA
14147151;6;"GABRIELA ROMANIELLO SOARES";"10616311680";"29/12/1991";"CONTRATO TEMPORARIO";"JXXIII";"COORDENACAO DA UNIDADE DE TERAPIA INTENSIVA ADULTO";"MED";"MEDICO CLINICO";"III";"A";"03/03/2022";"2022/03/03 00:00:00";"2023/03/02 00:00:00"
15293723;1;"GABRIELLE PEIXOTO ROCHA";"12365473652";"18/01/1998";"CONTRATO TEMPORARIO";"HJK";"COORDENACAO MEDICA DA URGENCIA E EMERGENCIA";"MED";"MEDICO GENERALISTA";"I";"A";"03/07/2022";"2022/07/03 00:00:00";"2022/12/29 00:00:00"
15076714;1;"GABRIELLY FERREIRA PRATES";"06724121604";"04/04/1984";"CONTRATO TEMPORARIO";"HCM";"COORDENACAO TECNICA DE ENFERMAGEM";"PENF";"TECNICO DE ENFERMAGEM";"II";"A";"01/02/2022";"2022/02/01 00:00:00";"2023/01/31 00:00:00"
14915144;2;"GEISA OLIVEIRA RIBEIRO";"07353773677";"14/09/1985";"CONTRATO TEMPORARIO";"HAC";"COORDENACAO DO SERVICO DE DIAGNOSTICO POR IMAGEM";"MED";"MEDICO EM RADIOLOG.E DIAGNOST.POR IMAGEM";"III";"A";"05/07/2022";"2022/07/05 00:00:00";"2023/07/04 00:00:00"
14722771;1;"GEISA PORTES JUNIOR";"10810435632";"07/05/1993";"CONTRATO TEMPORARIO";"CHPB";"COORDENACAO DE SAUDE MENTAL";"PENF";"TECNICO DE ENFERMAGEM";"II";"A";"01/02/2019";"2021/02/01 00:00:00";"2023/06/30 00:00:00"
14756332;3;"GEISE CRISTINE ESPINDOLA";"08277191677";"22/12/1989";"CONTRATO TEMPORARIO";"HCM";"COORDENACAO DAS UNIDADES DE INTERNACAO";"MED";"MEDICO";"III";"A";"07/06/2022";"2022/06/07 00:00:00";"2023/06/06 00:00:00"
13053434;5;"GEISE NAZARETH FERREIRA";"04567085612";NA;"CONTRATO TEMPORARIO";"JXXIII";NA;"PENF";"TECNICO DE ENFERMAGEM";"II";"A";NA;"2022/10/27 00:00:00";"2023/10/26 00:00:00"
13053434;9;"GEISE NAZARETH FERREIRA";"04567085612";"0000-00-00";NA;"HJXXIII";"COORDENACAO DAS UNIDADES DE INTERNACAO ADULTO";NA;"";NA;NA;"27/10/2022";NA;NA
12357752;3;"GEISIANE DA SILVA MOREIRA";"04273284626";"15/03/1981";"CONTRATO TEMPORARIO";"HJK";"COORDENACAO DO LABORATORIO";"TOS";"TECNICO EM PATOLOGIA CLINICA";"II";"A";"02/02/2022";"2022/02/02 00:00:00";"2023/02/01 00:00:00"
14910210;2;"GEISIANE DE SOUZA BUENO LEONOR";"01615778659";"04/04/1988";"CONTRATO TEMPORARIO";"HMAL";"COORDENACAO DAS UNIDADES DE INTERNACAO ADULTO";"PENF";"TECNICO DE ENFERMAGEM";"II";"A";"03/02/2022";"2022/02/03 00:00:00";"2023/02/02 00:00:00"
14899702;1;"GEISMAR PAULA GOMES MENDES";"05776659604";"31/12/1981";"CONTRATO TEMPORARIO";"HRJP";"COORDENACAO DE APOIO DIAGNOSTICO E TERAPEUTICO";"TOS";"TECNICO EM PATOLOGIA CLINICA";"II";"A";"01/02/2022";"2022/02/01 00:00:00";"2023/01/31 00:00:00"
14911341;1;"GEIZA MARICA ZONZIN";"05866606666";"08/10/1979";"CONTRATO TEMPORARIO";"HGB-JA";"COORDENACAO DA UNIDADE DE CLINICA MEDICA";"PENF";"TECNICO DE ENFERMAGEM";"II";"A";"02/02/2022";"2022/02/02 00:00:00";"2023/02/01 00:00:00"
14946826;2;"GEIZA MARTINS GONCALVES";"05468969602";"25/01/1983";"CONTRATO TEMPORARIO";"HEM";"COORDENACAO DAS UNIDADES CRITICAS";"PENF";"TECNICO DE ENFERMAGEM";"II";"A";"02/07/2022";"2022/07/02 00:00:00";"2023/07/01 00:00:00"
15119746;1;"GEORGE MICHEL TEIXEIRA DE SOUSA";"60006142338";NA;"CONTRATO TEMPORARIO";"HIJPII";NA;"MEDRE";"MEDICO";"I";"A";NA;"2022/03/01 00:00:00";"2023/02/28 00:00:00"
13955109;2;"GEORGETON DE OLIVEIRA";"66451760668";NA;"CONTRATO TEMPORARIO";"HEM";NA;"AGAS";"FARMACEUTICO BIOQUIMICO";"I";"A";NA;"2022/06/30 00:00:00";"2022/12/26 00:00:00"
15164759;1;"GEOVANE DE OLIVEIRA";"05439457666";"14/09/1983";"CONTRATO TEMPORARIO";"HRAD";"COORDENACAO DE INFRAESTRUTURA";"TOS";"TECNICO EM INFORMATICA";"II";"A";"0000-00-00";"2022/04/11 00:00:00";"2023/04/10 00:00:00"
10919587;4;"GERALDO MAJELA DOS SANTOS DA SILVA";"65073215672";"10/04/1964";"CONTRATO TEMPORARIO";"CHPB";"COORDENACAO DE SAUDE MENTAL";"MED";"MEDICO PSIQUIATRA";"III";"A";"04/09/2021";"2021/09/04 00:00:00";"2023/06/30 00:00:00"
14679328;1;"GERALDO MOISES MARQUES DE ASSIS";"04472618605";"01/06/1980";"CONTRATO TEMPORARIO";"CMT";"GERENCIA ASSISTENCIAL";"PENF";"TECNICO DE ENFERMAGEM";"II";"A";"01/02/2022";"2022/02/01 00:00:00";"2023/01/31 00:00:00"
11775616;3;"GERALDO MOREIRA RESENDE REBELLO DA SILVA";"04115628600";"24/10/1980";"CONTRATO TEMPORARIO";"HGB-JA";"COORDENACAO DE SAUDE MENTAL";"PENF";"TECNICO DE ENFERMAGEM";"II";"A";"01/02/2022";"2022/02/01 00:00:00";"2023/01/31 00:00:00"
14980312;2;"GERMANIA EMILIA DE ALMEIDA BARBOSA";"04726490605";"17/06/1979";"CONTRATO TEMPORARIO";"JXXIII";"COORDENACAO DA UNIDADE DE TERAPIA INTENSIVA ADULTO";"PENF";"TECNICO DE ENFERMAGEM";"II";"A";"01/02/2022";"2022/02/01 00:00:00";"2023/01/31 00:00:00"
14542070;2;"GERMANO SENNA OLIVEIRA DO VALLE";"06920425637";"15/02/1985";"CONTRATO TEMPORARIO";"JXXIII";"COORDENACAO DE URGENCIA E EMERGENCIA ADULTO";"MED";"MEDICO ORTOPEDISTA E TRAUMATOLOGISTA";"III";"A";"12/09/2017";"2021/02/01 00:00:00";"2023/01/31 00:00:00"
14649982;2;"GESIANE AREDES DE OLIVEIRA";"06561611675";"21/08/1983";"CONTRATO TEMPORARIO";"JXXIII";"GERENCIA DA EQUIPE MULTIDISCIPLINAR";"AGAS";"ASSISTENTE SOCIAL";"I";"A";"17/05/2021";"2021/05/17 00:00:00";"2023/05/16 00:00:00"
14355598;2;"GESIANE COSTA";"07021935692";"12/02/1982";"CONTRATO TEMPORARIO";"IRS";"COORDENACAO DE COMPRAS E LOGISTICA";"TOS";"AUXILIAR ADMINISTRATIVO";"I";"A";"01/02/2022";"2022/02/01 00:00:00";"2023/01/31 00:00:00"
15281165;1;"GESSYCA CORZINO MEDINA";"10923288660";NA;"CONTRATO TEMPORARIO";"CSPD";NA;"AGAS";"NUTRICIONISTA";"I";"A";NA;"2022/07/01 00:00:00";"2022/12/31 00:00:00"
15281165;2;"GESSYCA CORZINO MEDINA";"10923288660";"0000-00-00";NA;"CSPD";"COORDENACAO DE HOTELARIA";NA;"";NA;NA;"01/07/2022";NA;NA
15072580;1;"GEYSA DE ALCANTARA";"08949256606";"29/05/1988";"CONTRATO TEMPORARIO";"CSPD";"COORDENACAO DA UNIDADE DE CUIDADO AO ADULTO";"PENF";"ENFERMEIRO";"IV";"A";"01/02/2022";"2022/02/01 00:00:00";"2023/01/31 00:00:00"
15288640;1;"GEZIANE FERREIRA MATTOS";"04360535600";"11/08/1981";"CONTRATO TEMPORARIO";"HEM";"COORDENACAO DAS UNIDADES DE INTERNACAO";"PENF";"TECNICO DE ENFERMAGEM";"II";"A";"07/07/2022";"2022/07/07 00:00:00";"2023/07/06 00:00:00"
14130892;2;"GIANCARLO PEREIRA ZILLE";"08377033607";"30/04/1987";"CONTRATO TEMPORARIO";"JXXIII";"COORDENACAO DE URGENCIA E EMERGENCIA ADULTO";"MED";"MEDICO CIRURGIAO GERAL";"III";"A";"05/03/2022";"2022/03/05 00:00:00";"2023/03/04 00:00:00"
14513840;1;"GIANE EVELINE CUNHA BARBOSA";"06323229692";"01/06/1985";"CONTRATO TEMPORARIO";"HRJP";"COORDENACAO DA MATERNIDADE";"PENF";"TECNICO DE ENFERMAGEM";"II";"A";"01/02/2022";"2022/02/01 00:00:00";"2023/01/31 00:00:00"
15156300;1;"GIANE MOREIRA PRACA";"09001515606";"19/06/1991";"CONTRATO TEMPORARIO";"JXXIII";"COORDENACAO DE URGENCIA E EMERGENCIA ADULTO";"MED";"MEDICO PEDIATRA";"III";"A";"07/03/2022";"2022/03/07 00:00:00";"2023/03/06 00:00:00"
13802293;2;"GIANY MAGDA SALES LEITE";"98731181600";"30/06/1971";"CONTRATO TEMPORARIO";"HGB-JA";"COORDENACAO DA UNIDADE DE URGENCIA E EMERGENCIA";"PENF";"TECNICO DE ENFERMAGEM";"II";"A";"07/09/2022";"2022/09/07 00:00:00";"2023/09/06 00:00:00"
15196207;1;"GICELDA N DE OLIVEIRA DUARTE";"03570925625";"30/07/1975";"CONTRATO TEMPORARIO";"HJK";"COORDENACAO DO LABORATORIO";"TOS";"TECNICO EM PATOLOGIA CLINICA";"II";"A";"18/04/2022";"2022/04/18 00:00:00";"2023/04/17 00:00:00"
12169801;5;"GILBERTO LOPES DOS SANTOS";"03308280612";"02/05/1976";"CONTRATO TEMPORARIO";"HEM";"COORDENACAO DAS UNIDADES DE INTERNACAO";"PENF";"TECNICO DE ENFERMAGEM";"II";"A";"11/02/2022";"2022/07/01 00:00:00";"2023/06/30 00:00:00"
15030778;2;"GILBERTO RAMOS FROTA";"09676299693";"25/06/1988";"CONTRATO TEMPORARIO";"JXXIII";"COORDENACAO DE URGENCIA E EMERGENCIA ADULTO";"MED";"MEDICO NEUROCIRURGIAO";"III";"A";"19/07/2022";"2022/07/19 00:00:00";"2023/01/14 00:00:00"
15030778;1;"GILBERTO RAMOS FROTA";"09676299693";"25/06/1988";"CONTRATO TEMPORARIO";"JXXIII";"COORDENACAO DE URGENCIA E EMERGENCIA ADULTO";"MED";"MEDICO NEUROCIRURGIAO";"III";"A";"16/10/2021";"2021/10/16 00:00:00";"2023/06/30 00:00:00"
14758502;1;"GILCILENE GOMES ROCHA NOGUEIRA";"05726341619";"27/03/1979";"CONTRATO TEMPORARIO";"HGB-JA";"COORDENACAO DE SAUDE MENTAL";"PENF";"TECNICO DE ENFERMAGEM";"II";"A";"01/02/2022";"2022/02/01 00:00:00";"2023/01/31 00:00:00"
11869559;2;"GILDA ANGELITA FERREIRA DE SOUSA";"74461460606";"08/11/1968";"CONTRATO TEMPORARIO";"HRAD";"COORDENACAO DA UNIDADE CIRURGICA";"PENF";"TECNICO DE ENFERMAGEM";"II";"A";"0000-00-00";"2022/02/01 00:00:00";"2023/01/31 00:00:00"
14958714;2;"GILDA MAIA DE AZEVEDO";"01210526646";"02/03/1981";"CONTRATO TEMPORARIO";"HJK";"COORDENACAO DE ASSISTENCIA FARMACEUTICA";"TOS";"AUXILIAR ADMINISTRATIVO";"I";"A";"03/02/2022";"2022/02/03 00:00:00";"2023/02/02 00:00:00"
8610123;3;"GILMARA SANTOS DO AMARAL";"90515730653";"19/08/1971";"CONTRATO TEMPORARIO";"JXXIII";"COORDENACAO DE ASSISTENCIA FARMACEUTICA";"TOS";"TECNICO EM FARMACIA";"II";"A";"01/02/2022";"2022/02/01 00:00:00";"2023/01/31 00:00:00"
15066202;1;"GILSON PEREIRA SANTANA";"06002120688";"23/07/1984";"CONTRATO TEMPORARIO";"DIGEPE";"(DESAT.)GERENCIA DE SAUDE E SEGURANCA DO TRABALHADOR";"TOS";"AUXILIAR ADMINISTRATIVO";"I";"A";"01/02/2022";"2022/02/01 00:00:00";"2023/01/31 00:00:00"
14626808;2;"GILVAN JOSE DE ABREU";"04284956647";"25/04/1973";"CONTRATO TEMPORARIO";"HRAD";"COORDENACAO DAS UNIDADES DE INTERNACAO";"PENF";"TECNICO DE ENFERMAGEM";"II";"A";"0000-00-00";"2022/07/05 00:00:00";"2023/07/04 00:00:00"
14626808;1;"GILVAN JOSE DE ABREU";"04284956647";"25/04/1973";"CONTRATO TEMPORARIO";"HRAD";"COORDENACAO DAS UNIDADES DE INTERNACAO";"PENF";"TECNICO DE ENFERMAGEM";"II";"A";"0222-02-01";"2022/02/01 00:00:00";"2023/01/31 00:00:00"
14591598;1;"GIORDANA BRUNA MATTAR XAVIER";"01327310619";"10/01/1984";"CONTRATO TEMPORARIO";"IRS";"NUCLEO DE ENSINO E PESQUISA";"TOS";"AUXILIAR ADMINISTRATIVO";"I";"A";"01/07/2022";"2022/07/01 00:00:00";"2023/06/30 00:00:00"
10881571;5;"GIORDANA KENYA DE OLIVEIRA";"03674899612";"26/04/1978";"CONTRATO TEMPORARIO";"HEM";"COORDENACAO TECNICA DE ENFERMAGEM";"TOS";"AUXILIAR ADMINISTRATIVO";"I";"A";"03/01/2022";"2022/01/03 00:00:00";"2023/01/02 00:00:00"
15290901;1;"GIOVANA NEVES MARTINS";"03447867574";"17/12/1993";"CONTRATO TEMPORARIO";"HIJPII";"COORDENACAO DE URGENCIA E EMERGENCIA PEDIATRICA";"MED";"MEDICO GENERALISTA";"I";"A";"01/07/2022";"2022/07/01 00:00:00";"2022/12/27 00:00:00"
14021166;2;"GIOVANA RODRIGUES DE PINHO TAVARES";"04692121602";"12/11/1980";"CONTRATO TEMPORARIO";"MOV";"COORDENACAO DA GINECOLOGIA E OBSTETRICIA";"MED";"MEDICO ANESTESIOLOGISTA";"III";"A";"02/02/2022";"2022/02/02 00:00:00";"2023/02/01 00:00:00"
14946388;1;"GIOVANE BOTELHO BACELAR";"03130763597";NA;"CONTRATO TEMPORARIO";"HAC";NA;"MEDRE";"MEDICO";"I";"A";NA;"2021/03/04 00:00:00";"2023/03/03 00:00:00"
15264534;1;"GIOVANE GRIGOLI COSTA";"07687371682";"25/07/1983";"CONTRATO TEMPORARIO";"HRJP";"COORDENACAO DE APOIO DIAGNOSTICO E TERAPEUTICO";"TOS";"TECNICO EM PATOLOGIA CLINICA";"II";"A";"01/07/2022";"2022/07/01 00:00:00";"2023/06/30 00:00:00"
14053441;3;"GIOVANI LUIZ DE MOURA";"05867300609";"07/06/1982";"CONTRATO TEMPORARIO";"JXXIII";"COORDENACAO DAS UNIDADES DE INTERNACAO ADULTO";"PENF";"TECNICO DE ENFERMAGEM";"II";"A";"01/02/2022";"2022/02/01 00:00:00";"2023/01/31 00:00:00"
15078413;1;"GIOVANNA CRISTINA DE SOUZA";"03844996605";"15/01/1974";"CONTRATO TEMPORARIO";"MOV";"COORDENACAO DO BANCO DE LEITE";"PENF";"TECNICO DE ENFERMAGEM";"II";"A";"02/02/2022";"2022/02/02 00:00:00";"2023/02/01 00:00:00"
15121973;1;"GIOVANNA GERMANO TOSE";"15646797721";NA;"CONTRATO TEMPORARIO";"HIJPII";NA;"MEDRE";"MEDICO";"I";"A";NA;"2022/03/01 00:00:00";"2023/02/28 00:00:00"
15234818;1;"GIOVANNA NEVES PIMENTEL VIEIRA";"05479381520";"26/07/1997";"CONTRATO TEMPORARIO";"CHPB";"COORDENACAO DA UNIDADE DE PACIENTES CRITICOS";"MED";"MEDICO GENERALISTA";"I";"A";"30/05/2022";"2022/05/30 00:00:00";"2023/05/29 00:00:00"
11200631;4;"GISELE BAMENGA DE FREITAS";"10370355857";"14/01/1969";"CONTRATO TEMPORARIO";"CSSFE";"COORDENACAO DA UNIDADE DE CUIDADO AO ADULTO";"AGAS";"ASSISTENTE SOCIAL";"I";"A";"01/02/2022";"2022/02/01 00:00:00";"2023/01/31 00:00:00"
14052948;5;"GISELE BARROSO TAMARINDO";"03366160667";"10/06/1979";"CONTRATO TEMPORARIO";"HIJPII";"COORDENACAO DAS UNIDADES DE INTERNACAO PEDIATRICA";"PENF";"TECNICO DE ENFERMAGEM";"II";"A";"04/03/2022";"2022/03/04 00:00:00";"2023/03/03 00:00:00"
10893527;3;"GISELE BASTOS DE SA";"56121334649";"21/01/1964";"CONTRATO TEMPORARIO";"IRS";"COORDENACAO DA UNIDADE DE PACIENTES EXTERNOS";"AGAS";"ASSISTENTE SOCIAL";"I";"A";"26/01/2022";"2022/01/26 00:00:00";"2023/01/25 00:00:00"
13800446;3;"GISELE DE FATIMA DO NASCIMENTO CASTRO";"05486356684";"09/11/1981";"CONTRATO TEMPORARIO";"HGB-JA";"COORDENACAO DA UNIDADE DE CLINICA MEDICA";"PENF";"TECNICO DE ENFERMAGEM";"II";"A";"16/03/2021";"2021/03/16 00:00:00";"2023/03/15 00:00:00"
15105760;1;"GISELE FONSECA DA SILVA";"13714157654";"13/01/1997";"CONTRATO TEMPORARIO";"CHPB";"COORDENACAO DA UNIDADE DE CUIDADOS CONTINUADOS INTEGRADOS";"PENF";"TECNICO DE ENFERMAGEM";"II";"A";"27/02/2022";"2022/02/27 00:00:00";"2023/02/26 00:00:00"
14567812;2;"GISELE GOMES DA SILVA";"02728634670";"14/08/1977";"CONTRATO TEMPORARIO";"JXXIII";"COORDENACAO DE FATURAMENTO";"TOS";"AUXILIAR ADMINISTRATIVO";"I";"A";"01/02/2022";"2022/02/01 00:00:00";"2023/01/31 00:00:00"
14661227;1;"GISELE MARIA DA SILVA CUNHA NOBRE";"03417711630";"22/10/1979";"CONTRATO TEMPORARIO";"DIEST";"(DESAT.)COORDENACAO DE PLANEJAMENTO E PROGRAMACAO DE INTERVENCAO";"TOS";"AUXILIAR ADMINISTRATIVO";"I";"A";"01/02/2022";"2022/02/01 00:00:00";"2023/01/31 00:00:00"
14701171;1;"GISELE PINHO TAVARES CARVALHO";"04508854613";"08/07/1978";"CONTRATO TEMPORARIO";"MOV";"COORDENACAO DA GINECOLOGIA E OBSTETRICIA";"MED";"MEDICO ANESTESIOLOGISTA";"III";"A";"06/02/2022";"2022/02/06 00:00:00";"2023/02/05 00:00:00"
14130975;3;"GISELE RESENDE MOREIRA DE SOUZA";"11029605602";"31/05/1990";"CONTRATO TEMPORARIO";"HGB-JA";"COORDENACAO DA UNIDADE DE CUIDADOS CONTINUADOS INTEGRADOS";"MED";"ESPECIALISTA EM CLINICA MEDICA";"III";"A";"02/06/2022";"2022/06/02 00:00:00";"2023/06/01 00:00:00"
11208097;4;"GISELLE ALMEIDA DE FARIA TAVARES";"01304085651";"30/03/1980";"CONTRATO TEMPORARIO";"HEM";"COORDENACAO DAS UNIDADES CRITICAS";"MED";"MEDICO EM MEDICINA INTENSIVA";"III";"A";"05/11/2021";"2021/11/05 00:00:00";"2023/06/30 00:00:00"
12635835;4;"GISELLE DE SOUZA MAIRINK";"03799561609";"14/07/1979";"CONTRATO TEMPORARIO";"HJK";"COORDENACAO MEDICA DA URGENCIA E EMERGENCIA";"PENF";"ENFERMEIRO";"IV";"A";"15/02/2022";"2022/02/15 00:00:00";"2023/02/14 00:00:00"
12635835;3;"GISELLE DE SOUZA MAIRINK";"03799561609";NA;"CONTRATO TEMPORARIO";"JXXIII";NA;"PENF";"ENFERMEIRO";"IV";"A";NA;"2021/02/01 00:00:00";"2023/01/07 00:00:00"
15286404;2;"GISELLE GOULART MACHADO";"01365254666";"14/03/1988";"CONTRATO TEMPORARIO";"HEM";"COORDENACAO DAS UNIDADES DE INTERNACAO";"MED";"MEDICO ANESTESIOLOGISTA";"III";"A";"07/07/2022";"2022/06/28 00:00:00";"2022/12/24 00:00:00"
15286404;1;"GISELLE GOULART MACHADO";"01365254666";"14/03/1988";"CONTRATO TEMPORARIO";"HAC";"COORDENACAO CIRURGICA";"MED";"MEDICO ANESTESIOLOGISTA";"III";"A";"06/07/2022";"2022/07/06 00:00:00";"2023/07/05 00:00:00"
12710141;1;"GISELLE PEREIRA LIMA LOPES";"05284687663";"10/09/1981";"CONTRATO TEMPORARIO";"";"(DESAT.)COORDENACAO DE CONTROLE DE PAGAMENTO E TAXACAO";"TOS";"AUXILIAR ADMINISTRATIVO";"I";"A";"02/01/2018";"2022/04/18 00:00:00";"2023/04/17 00:00:00"
11491057;4;"GISELLE SANTOS FERREIRA";"05568389632";"25/07/1982";"CONTRATO TEMPORARIO";"JXXIII";"COORDENACAO DO AMBULATORIO ADULTO";"PENF";"TECNICO DE ENFERMAGEM";"II";"A";"04/07/2022";"2022/07/04 00:00:00";"2023/07/03 00:00:00"
13800495;3;"GISLAINE ALINE DELFINO DA SILVA";"04886494633";"01/11/1980";"CONTRATO TEMPORARIO";"HGB-JA";"COORDENACAO DA UNIDADE DE URGENCIA E EMERGENCIA";"PENF";"TECNICO DE ENFERMAGEM";"II";"A";"01/02/2022";"2022/02/01 00:00:00";"2023/01/31 00:00:00"
13800495;2;"GISLAINE ALINE DELFINO DA SILVA";"04886494633";"01/11/1980";"CONTRATO TEMPORARIO";"HGB-JA";"COORDENACAO DA UNIDADE CIRURGICA";"PENF";"TECNICO DE ENFERMAGEM";"II";"A";"01/07/2022";"2022/07/01 00:00:00";"2023/06/30 00:00:00"
12697199;3;"GISLAINE DO ROSARIO ROBERTO";"08132417666";"10/07/1988";"CONTRATO TEMPORARIO";"HRAD";"COORDENACAO DE APOIO DIAGNOSTICO E TERAPEUTICO";"AGAS";"BIOQUIMICO";"I";"A";"0000-00-00";"2022/06/27 00:00:00";"2023/06/26 00:00:00"
14913743;2;"GISLAINE DOS SANTOS FONSECA";"01498694608";"25/08/1983";"CONTRATO TEMPORARIO";"IRS";"COORDENACAO DE GESTAO DE PESSOAS";"TOS";"AUXILIAR ADMINISTRATIVO";"I";"A";"04/04/2022";"2022/04/04 00:00:00";"2023/04/03 00:00:00"
14926109;1;"GISLAINE MARCIA MORAES";"11556573650";"19/06/1995";"CONTRATO TEMPORARIO";"HGB-JA";"COORDENACAO DA UNIDADE DE URGENCIA E EMERGENCIA";"PENF";"TECNICO DE ENFERMAGEM";"II";"A";"04/03/2021";"2021/03/05 00:00:00";"2023/03/04 00:00:00"
14841332;2;"GISLAINE RENATA DA SILVA LEITE";"02367540683";"10/09/1975";"CONTRATO TEMPORARIO";"JXXIII";"COORDENACAO DA UNIDADE DE TERAPIA INTENSIVA PEDIATRICA";"PENF";"TECNICO DE ENFERMAGEM";"II";"A";"16/06/2022";"2022/06/16 00:00:00";"2023/06/15 00:00:00"
10869204;2;"GISLENE GONCALVES DO VALE";"81810814634";"27/09/1968";"CONTRATO TEMPORARIO";"IRS";"COORDENACAO DO CENTRO DE EDUCACAO INFANTIL";"TOS";"PROFESSOR RECREADOR";"II";"A";"01/02/2022";"2022/02/01 00:00:00";"2023/01/31 00:00:00"
15086093;1;"GISLENE GONCALVES LETE";"07723290608";"09/08/1983";"CONTRATO TEMPORARIO";"JXXIII";"COORDENACAO DE ASSISTENCIA FARMACEUTICA";"TOS";"TECNICO EM FARMACIA";"II";"A";"03/02/2022";"2022/02/03 00:00:00";"2023/02/02 00:00:00"
15062755;1;"GISLENE REIS PROCOPIO";"06873345601";"24/04/1984";NA;"ADC";"(DESAT.)PROCURADORIA";NA;"ADVOGADO";NA;NA;"09/12/2021";NA;NA
14880694;1;"GIULIA CAMPOS LAGE";"12365420613";NA;"CONTRATO TEMPORARIO";"IRS";NA;"MEDRE";"MEDICO";"I";"A";NA;"2020/03/01 00:00:00";"2023/02/28 00:00:00"
14591671;1;"GLAUCIA DE SOUZA ALMEIDA";"08242817642";"07/04/1985";"CONTRATO TEMPORARIO";"CEPAI";"NUCLEO DE ENSINO E PESQUISA";"TOS";"AUXILIAR ADMINISTRATIVO";"I";"A";"01/02/2022";"2022/02/01 00:00:00";"2023/01/31 00:00:00"
12530424;2;"GLAUCIA ELISIEN DA SILVA NASCIMENTO";"03837900690";"05/11/1978";"CONTRATO TEMPORARIO";"HGB-JA";"COORDENACAO DO CENTRO DE EDUCACAO INFANTIL";"TOS";"PROFESSOR RECREADOR";"II";"A";"11/01/2017";"2022/02/14 00:00:00";"2023/02/13 00:00:00"
14946404;1;"GLAUCIA JULIANA NEUBANER DUELI";"10147685605";NA;"CONTRATO TEMPORARIO";"HJK";NA;"MEDRE";"MEDICO";"I";"A";NA;"2021/03/19 00:00:00";"2023/03/18 00:00:00"
11398955;2;"GLAUCIA MASCARENHAS MOURTHE";"04346994628";NA;"CONTRATO TEMPORARIO";"HJK";NA;"AGAS";"PSICOLOGO";"I";"A";NA;"2022/07/07 00:00:00";"2023/01/02 00:00:00"
14888408;2;"GLAUCIA NOHANY CERUTTI CAMPOS";"07794896673";"16/08/1993";"CONTRATO TEMPORARIO";"HJK";"COORDENACAO MEDICA DA URGENCIA E EMERGENCIA";"PENF";"TECNICO DE ENFERMAGEM";"II";"A";"07/07/2022";"2022/07/07 00:00:00";"2023/07/06 00:00:00"
14888408;1;"GLAUCIA NOHANY CERUTTI CAMPOS";"07794896673";"16/08/1993";"CONTRATO TEMPORARIO";"HEM";"COORDENACAO DAS UNIDADES CRITICAS";"PENF";"TECNICO DE ENFERMAGEM";"II";"A";"06/07/2022";"2022/07/06 00:00:00";"2023/07/05 00:00:00"
10886257;3;"GLAUCIA SILVA MATOZINHOS";"02551341698";"03/05/1976";"CONTRATO TEMPORARIO";"JXXIII";"COORDENACAO DA UNIDADE DE TERAPIA INTENSIVA ADULTO";"PENF";"TECNICO DE ENFERMAGEM";"II";"A";"20/02/2022";"2022/02/20 00:00:00";"2023/02/19 00:00:00"
14904148;2;"GLAUCIO GUELBER DE ANDRADE COSTA";"06011611656";"21/09/1982";"CONTRATO TEMPORARIO";"HRJP";"COORDENACAO DE ASSISTENCIA FARMACEUTICA";"TOS";"TECNICO EM FARMACIA";"II";"A";"12/01/2022";"2022/01/12 00:00:00";"2023/01/11 00:00:00"
14834717;1;"GLEICE MARIA RODRIGUES PENNA";"01116712644";"26/03/1975";"CONTRATO TEMPORARIO";"HJK";"COORDENACAO DE INTERNACAO - ADULTO";"PENF";"TECNICO DE ENFERMAGEM";"II";"A";"11/02/2022";"2022/02/11 00:00:00";"2023/02/10 00:00:00"
14709992;2;"GLEICE REGINA DOS SANTOS BOMFIM";"01272602699";"21/07/1983";"CONTRATO TEMPORARIO";"JXXIII";"COORDENACAO DO CENTRO DE TRATAMENTO DE QUEIMADOS";"PENF";"TECNICO DE ENFERMAGEM";"II";"A";"02/07/2022";"2022/07/02 00:00:00";"2023/07/01 00:00:00"
15067762;1;"GLEICIARA DA SILVA DIAS";"08649507646";"13/03/1989";"CONTRATO TEMPORARIO";"CSSI";"COORDENACAO DA UNIDADE DE CUIDADO AO ADULTO";"PENF";"TECNICO DE ENFERMAGEM";"II";"A";"01/02/2022";"2022/02/01 00:00:00";"2023/01/31 00:00:00"
12946687;2;"GLEIZIMARA ALVES FERNANDES";"06914599670";"10/10/1982";"CONTRATO TEMPORARIO";"CMT";"GERENCIA ASSISTENCIAL";"PENF";"TECNICO DE ENFERMAGEM";"II";"A";"01/02/2022";"2022/02/01 00:00:00";"2023/01/31 00:00:00"
13823042;2;"GLENDA FIGUEIREDO REIS BASTOS";"07024956623";"14/11/1984";"CONTRATO TEMPORARIO";"HMAL";"COORDENACAO DO SERVICO DE NUTRICAO E DIETETICA";"AGAS";"NUTRICIONISTA";"I";"A";"21/05/2021";"2021/05/21 00:00:00";"2023/05/20 00:00:00"
13823042;1;"GLENDA FIGUEIREDO REIS BASTOS";"07024956623";"14/11/1984";"CONTRATO TEMPORARIO";"HCM";"COORDENACAO DAS UNIDADES DE INTERNACAO";"AGAS";"NUTRICIONISTA";"I";"A";"25/10/2022";"2022/10/25 00:00:00";"2023/10/24 00:00:00"
14946438;1;"GLENDA OLIVEIRA SOUZA";"01292106255";NA;"CONTRATO TEMPORARIO";"HJK";NA;"MEDRE";"MEDICO";"I";"A";NA;"2021/03/25 00:00:00";"2023/03/24 00:00:00"
14480164;2;"GLEUDSON SILVA DE AQUINO";"75584646334";"04/07/1977";"CONTRATO TEMPORARIO";"HCM";"COORDENACAO DAS UNIDADES DE INTERNACAO";"AGAS";"TERAPEUTA OCUPACIONAL";"I";"A";"01/02/2022";"2022/02/01 00:00:00";"2023/01/31 00:00:00"
14902340;5;"GLEYCIANE DE JESUS";"09879197682";"09/07/1990";"CONTRATO TEMPORARIO";"HJK";"COORDENACAO DE ASSISTENCIA FARMACEUTICA";"TOS";"TECNICO EM FARMACIA";"II";"A";"01/07/2022";"2022/07/01 00:00:00";"2023/06/30 00:00:00"
14228704;3;"GRACIELLY CRISTINA DE SOUZA";"01413284604";"23/03/1981";"CONTRATO TEMPORARIO";"JXXIII";"COORDENACAO DA UNIDADE DE TERAPIA INTENSIVA ADULTO";"PENF";"ENFERMEIRO";"IV";"A";"25/06/2021";"2021/06/25 00:00:00";"2023/06/24 00:00:00"
14661235;2;"GRACILDA EMANUELE DOS REIS";"01342044681";"28/12/1981";"CONTRATO TEMPORARIO";"JXXIII";"COORDENACAO DO BLOCO CIRURGICO";"PENF";"TECNICO DE ENFERMAGEM";"II";"A";"26/09/2022";"2022/09/26 00:00:00";"2023/09/25 00:00:00"
14355622;2;"GRACILENE DE OLIVEIRA GAMA SILVA";"09352656601";"25/04/1990";"CONTRATO TEMPORARIO";"CEPAI";"GERENCIA ASSISTENCIAL";"TOS";"AUXILIAR ADMINISTRATIVO";"I";"A";"24/02/2022";"2022/02/24 00:00:00";"2023/02/23 00:00:00"
14542260;3;"GRASCILIANE APARECIDA VIEIRA";"07554512609";"20/03/1986";"CONTRATO TEMPORARIO";"HIJPII";"COORDENACAO DA UNIDADE DE TERAPIA INTENSIVA PEDIATRICA";"PENF";"ENFERMEIRO";"IV";"A";"14/09/2021";"2021/09/14 00:00:00";"2023/06/30 00:00:00"
14896724;2;"GRAZIELA APARECIDA DINIZ";"01480516694";"17/04/1982";"CONTRATO TEMPORARIO";"MOV";"COORDENACAO DA UNIDADE DE NEONATOLOGIA";"PENF";"TECNICO DE ENFERMAGEM";"II";"A";"01/02/2022";"2022/02/01 00:00:00";"2023/01/31 00:00:00"
14899959;1;"GRAZIELA RODRIGUES DA SILVA GONCALVES";"09997047613";"06/05/1992";"CONTRATO TEMPORARIO";"HJK";"COORDENACAO DA MATERNIDADE";"PENF";"TECNICO DE ENFERMAGEM";"II";"A";"02/11/2022";"2022/11/02 00:00:00";"2023/11/01 00:00:00"
10889327;4;"GRAZIELLA ROSANA GAFFURI";"41978595620";"16/02/1963";"CONTRATO TEMPORARIO";"HIJPII";"COORDENACAO DAS UNIDADES DE INTERNACAO PEDIATRICA";"AGAS";"ASSISTENTE SOCIAL";"I";"A";"27/09/2022";"2022/09/27 00:00:00";"2023/09/26 00:00:00"
90018033;0;"GRAZIELLE CRISTINA CARVALHO DOS SANTOS";"04520560632";"0000-00-00";NA;"HJK";"COORDENACAO DO LABORATORIO";NA;"";NA;NA;"06/12/2022";NA;NA
14661243;3;"GRAZIELLE NUNES SOARES";"04747132619";"28/11/1980";"CONTRATO TEMPORARIO";"JXXIII";"COORDENACAO DA UNIDADE DE TERAPIA INTENSIVA PEDIATRICA";"PENF";"TECNICO DE ENFERMAGEM";"II";"A";"06/04/2022";"2022/04/06 00:00:00";"2023/04/05 00:00:00"
14670673;2;"GRAZIELLE REGINA DOS SANTOS SOUZA";"04520563658";"15/10/1981";"CONTRATO TEMPORARIO";"HJK";"COORDENACAO DE ASSISTENCIA FARMACEUTICA";"TOS";"TECNICO EM FARMACIA";"II";"A";"02/06/2022";"2022/06/02 00:00:00";"2023/06/01 00:00:00"
12765251;2;"GRECIA APARECIDA REZENDE";"05275248679";"12/07/1981";"CONTRATO TEMPORARIO";"JXXIII";"COORDENACAO DAS UNIDADES DE INTERNACAO CIRURGICA";"PENF";"TECNICO DE ENFERMAGEM";"II";"A";"04/02/2022";"2022/02/04 00:00:00";"2023/02/03 00:00:00"
14352157;3;"GREICIMAR ANDREIA SANTOS";"06708791692";"26/01/1984";"CONTRATO TEMPORARIO";"CSSI";"COORDENACAO DA UNIDADE DE PACIENTES EXTERNOS";"PENF";"TECNICO DE ENFERMAGEM";"II";"A";"30/09/2021";"2021/09/30 00:00:00";"2023/06/30 00:00:00"
14428338;3;"GRISSON CAMILO DE LELLIS JUNIOR";"06527368666";"03/03/1988";"CONTRATO TEMPORARIO";"JXXIII";"COORDENACAO DE URGENCIA E EMERGENCIA ADULTO";"MED";"MEDICO CIRURGIAO PLASTICO";"III";"A";"11/11/2019";"2021/02/01 00:00:00";"2023/01/31 00:00:00"
14939177;1;"GUILHERME ANGELO DOS SANTOS SILVA";"09378623638";NA;"CONTRATO TEMPORARIO";"HRAD";NA;"MEDRE";"MEDICO";"I";"A";NA;"2021/03/01 00:00:00";"2023/02/28 00:00:00"
15086572;1;"GUILHERME AUGUSTO SFREDO";"12395023620";"24/09/1994";"CONTRATO TEMPORARIO";"HGB-JA";"COORDENACAO DE SAUDE MENTAL";"PENF";"TECNICO DE ENFERMAGEM";"II";"A";"11/02/2022";"2022/02/11 00:00:00";"2023/02/10 00:00:00"
14937767;1;"GUILHERME AUGUSTO SOUSA BATISTA";"07622145629";NA;"CONTRATO TEMPORARIO";"JXXIII";NA;"MEDRE";"MEDICO";"I";"A";NA;"2021/03/01 00:00:00";"2023/02/28 00:00:00"
12048401;2;"GUILHERME CARVALHO MISSIAGGIA";"03020151678";"04/09/1976";"CONTRATO TEMPORARIO";"HEM";"COORDENACAO DE APOIO DIAGNOSTICO E TERAPEUTICO";"MED";"MEDICO EM RADIOLOG.E DIAGNOST.POR IMAGEM";"III";"A";"04/07/2022";"2022/07/04 00:00:00";"2023/07/03 00:00:00"
15118235;1;"GUILHERME DO CARMO SILVA";"13062762683";NA;"CONTRATO TEMPORARIO";"HJK";NA;"MEDRE";"MEDICO";"I";"A";NA;"2022/03/01 00:00:00";"2023/02/28 00:00:00"
14934095;1;"GUILHERME DUTRA COSTA";"09993937665";NA;"CONTRATO TEMPORARIO";"HAC";NA;"MEDRE";"MEDICO";"I";"A";NA;"2021/03/01 00:00:00";"2023/02/28 00:00:00"
14340202;5;"GUILHERME FIGUEIREDO COSTA";"08596580662";"12/04/1985";"CONTRATO TEMPORARIO";"JXXIII";"COORDENACAO DA UNIDADE DE TERAPIA INTENSIVA ADULTO";"PENF";"ENFERMEIRO";"IV";"A";"03/02/2022";"2022/02/03 00:00:00";"2023/02/02 00:00:00"
14340202;3;"GUILHERME FIGUEIREDO COSTA";"08596580662";"12/04/1985";"CONTRATO TEMPORARIO";"JXXIII";"COORDENACAO DA UNIDADE DE TERAPIA INTENSIVA ADULTO";"PENF";"ENFERMEIRO";"IV";"A";"04/07/2022";"2022/07/04 00:00:00";"2023/07/03 00:00:00"
14416507;5;"GUILHERME GOMES RIBEIRO";"08263506662";"21/01/1989";"CONTRATO TEMPORARIO";"JXXIII";"COORDENACAO DE URGENCIA E EMERGENCIA ADULTO";"MED";"MEDICO CLINICO";"III";"A";"24/02/2022";"2022/02/24 00:00:00";"2023/02/23 00:00:00"
14887780;3;"GUILHERME GOMIDE CABRAL";"09811941688";NA;"CONTRATO TEMPORARIO";"HIJPII";NA;"MEDRE";"MEDICO";"I";"A";NA;"2022/03/01 00:00:00";"2023/02/28 00:00:00"
14937775;1;"GUILHERME NEVES FURTADO";"14522917724";NA;"CONTRATO TEMPORARIO";"JXXIII";NA;"MEDRE";"MEDICO";"I";"A";NA;"2021/03/01 00:00:00";"2023/02/28 00:00:00"
15265135;1;"GUILHERME OLIVEIRA MOREIRA";"07685060698";"20/09/1985";"CONTRATO TEMPORARIO";"HGB-JA";"COORDENACAO DE INFRAESTRUTURA";"TOS";"TECNICO EM INFORMATICA";"II";"A";"01/07/2022";"2022/07/01 00:00:00";"2023/06/30 00:00:00"
14756308;1;"GUILHERME RIBEIRO MANSUR BARBOSA";"06536070674";NA;"CONTRATO TEMPORARIO";"JXXIII";NA;"MEDRE";"MEDICO";"I";"A";NA;"2019/03/01 00:00:00";"2023/02/28 00:00:00"
12459145;4;"GUILHERME VAZ DE MELO TRINDADE";"06509601656";"01/08/1985";"CONTRATO TEMPORARIO";"DIRASS";"(DESAT.)COORDENACAO DE PLANEJAMENTO DE AQUISICOES ASSISTENCIAIS";"AGAS";"FARMACEUTICO";"III";"A";"01/02/2022";"2022/02/01 00:00:00";"2023/01/31 00:00:00"
14937791;1;"GUILHERME VELOSO GOMES";"11516859685";NA;"CONTRATO TEMPORARIO";"JXXIII";NA;"MEDRE";"MEDICO";"I";"A";NA;"2021/03/01 00:00:00";"2023/02/28 00:00:00"
14937643;1;"GUILHERME VELOSO RAMOS";"12917479663";NA;"CONTRATO TEMPORARIO";"JXXIII";NA;"MEDRE";"MEDICO";"I";"A";NA;"2021/03/01 00:00:00";"2023/02/28 00:00:00"
14937817;1;"GUILHERME VICTOR OLIVEIRA PIMENTA DOS RE";"12395243663";NA;"CONTRATO TEMPORARIO";"JXXIII";NA;"MEDRE";"MEDICO";"I";"A";NA;"2021/03/01 00:00:00";"2023/02/28 00:00:00"
14937817;9;"GUILHERME VICTOR OLIVEIRA PIMENTA DOS REIS";"12395243663";"0000-00-00";NA;"HJXXIII";"COORDENACAO DE URGENCIA E EMERGENCIA ADULTO";NA;"";NA;NA;"30/11/2022";NA;NA
15158520;1;"GUSTAVO ALBERTO RODRIGUES COSTA";"01457147645";"02/01/1983";"CONTRATO TEMPORARIO";"JXXIII";"COORDENACAO DE URGENCIA E EMERGENCIA ADULTO";"MED";"MEDICO NEUROLOGISTA";"III";"A";"19/03/2022";"2022/03/19 00:00:00";"2023/03/18 00:00:00"
13330253;2;"GUSTAVO CASTELO BRANCO AVELAR";"48682918668";"15/09/1964";"CONTRATO TEMPORARIO";"HMAL";"COORDENACAO DE TECNOLOGIA DA INFORMACAO";"TOS";"TECNICO EM INFORMATICA";"II";"A";"30/05/2022";"2022/05/30 00:00:00";"2023/05/29 00:00:00"
15181738;1;"GUSTAVO HENRIQUE DE SOUZA ROCHA";"12098275650";"08/04/1993";"CONTRATO TEMPORARIO";"HGB-JA";"COORDENACAO DE ENFERMAGEM E EQUIPE MULTIDISCIPLINAR";"AGAS";"PSICOLOGO";"I";"A";"13/04/2022";"2022/04/13 00:00:00";"2023/04/12 00:00:00"
14614879;2;"GUSTAVO HENRIQUE LOURENCO LADEIRA";"09800908650";"14/09/1991";"CONTRATO TEMPORARIO";"JXXIII";"COORDENACAO DE URGENCIA E EMERGENCIA ADULTO";"MED";"MEDICO CLINICO";"III";"A";"09/02/2021";"2021/02/09 00:00:00";"2023/02/08 00:00:00"
14614879;3;"GUSTAVO HENRIQUE LOURENCO LADEIRA";"09800908650";NA;"CONTRATO TEMPORARIO";"HJK";NA;"MEDRE";"MEDICO";"I";"A";NA;"2022/03/01 00:00:00";"2023/02/28 00:00:00"
15030844;1;"GUSTAVO JUSTINO DOS SANTOS";"11988715636";"08/03/1994";"CONTRATO TEMPORARIO";"HGB-JA";"COORDENACAO DE APOIO DIAGNOSTICO E TERAPEUTICO";"AGAS";"BIOQUIMICO";"I";"A";"21/09/2021";"2021/09/20 00:00:00";"2023/06/30 00:00:00"
15118029;1;"GUSTAVO PEREIRA PEIXOTO";"04412004350";NA;"CONTRATO TEMPORARIO";"HJK";NA;"MEDRE";"MEDICO";"I";"A";NA;"2022/03/01 00:00:00";"2023/02/28 00:00:00"
15142466;1;"GUSTAVO PIRES MONTEIRO";"12803819651";NA;"CONTRATO TEMPORARIO";"HRAD";NA;"MEDRE";"MEDICO";"I";"A";NA;"2022/03/01 00:00:00";"2023/02/28 00:00:00"
14812994;1;"HANNAH CARDOSO BARBOSA";"11009734601";"11/01/1992";"CONTRATO TEMPORARIO";"HJK";"COORDENACAO DE ASSISTENCIA FARMACEUTICA";"AGAS";"FARMACEUTICO";"III";"A";"01/02/2022";"2022/02/01 00:00:00";"2023/01/31 00:00:00"
14890362;1;"HARLEY SAN CHERNENK CAETANO";"09584541676";NA;"CONTRATO TEMPORARIO";"HRJP";NA;"PENF";"ENFERMEIRO";"IV";"A";NA;"2022/11/23 00:00:00";"2023/11/22 00:00:00"
14890362;2;"HARLEY SAN CHERNENK CAETANO";"09584541676";"0000-00-00";NA;"HRJP";"COORDENACAO DA UNIDADE CIRURGICA";NA;"";NA;NA;"21/11/2022";NA;NA
10886315;3;"HARLLEN THADEU MERCHED";"78845505634";"16/01/1966";"CONTRATO TEMPORARIO";"JXXIII";"COORDENACAO DAS UNIDADES DE INTERNACAO ADULTO";"MED";"MEDICO EM MEDICINA INTENSIVA REGULADOR C";"III";"A";"18/03/2022";"2022/03/18 00:00:00";"2023/03/17 00:00:00"
14889570;3;"HEBERT OLIMPIO JUNIOR";"10161746675";"25/01/1991";"CONTRATO TEMPORARIO";"CSPD";"COORDENACAO DA UNIDADE DE PACIENTES EXTERNOS";"AGAS";"FISIOTERAPEUTA";"I";"A";"01/02/2022";"2022/02/01 00:00:00";"2023/01/31 00:00:00"
14421416;2;"HEITOR MAIA RODRIGUES";"07345033422";"03/04/1991";"CONTRATO TEMPORARIO";"JXXIII";"COORDENACAO DE URGENCIA E EMERGENCIA ADULTO";"MED";"MEDICO ORTOPEDISTA E TRAUMATOLOGISTA";"III";"A";"05/03/2022";"2022/03/05 00:00:00";"2023/03/04 00:00:00"
10868180;2;"HELAINE CRISTINE SOUZA ANJOS";"03490307666";"28/08/1975";"CONTRATO TEMPORARIO";"HJK";"COORDENACAO DE INTERNACAO - ADULTO";"PENF";"TECNICO DE ENFERMAGEM";"II";"A";"07/07/2022";"2022/07/07 00:00:00";"2023/07/06 00:00:00"
14591820;2;"HELANE APARECIDA DA CRUZ";"05969798606";"29/12/1971";"CONTRATO TEMPORARIO";"HEM";"COORDENACAO DE APOIO DIAGNOSTICO E TERAPEUTICO";"TOS";"TECNICO EM PATOLOGIA CLINICA";"II";"A";"12/05/2022";"2022/05/12 00:00:00";"2023/05/11 00:00:00"
14638142;1;"HELBA ARAUJO SANCHES";"76863786672";"25/08/1966";"CONTRATO TEMPORARIO";"HJK";"COORDENACAO DE ASSISTENCIA FARMACEUTICA";"TOS";"AUXILIAR ADMINISTRATIVO";"I";"A";"24/02/2022";"2022/02/24 00:00:00";"2023/02/23 00:00:00"
14978019;2;"HELBERT MAGALHAES AMORIM";"05615721600";"18/12/1982";"CONTRATO TEMPORARIO";"HGB-JA";"COORDENACAO DE INFRAESTRUTURA";"TOS";"TECNICO EM INFORMATICA";"II";"A";"14/06/2022";"2022/06/14 00:00:00";"2023/06/13 00:00:00"
15067945;1;"HELEM CARLA SOUZA GUALBERTO CARDOSO";"08512988690";"16/12/1985";"CONTRATO TEMPORARIO";"JXXIII";"COORDENACAO DAS UNIDADES DE INTERNACAO ADULTO";"PENF";"TECNICO DE ENFERMAGEM";"II";"A";"01/02/2022";"2022/02/01 00:00:00";"2023/01/31 00:00:00"
15146293;1;"HELEM DOS SANTOS KELLER FORTUNATO";"05108117604";"19/10/1979";"CONTRATO TEMPORARIO";"HRJP";"COORDENACAO DE INFRAESTRUTURA";"TOS";"AUXILIAR ADMINISTRATIVO";"I";"A";"17/03/2022";"2022/03/17 00:00:00";"2023/03/16 00:00:00"
15142862;1;"HELENA NATHALIA SILVA MELO";"12381120645";NA;"CONTRATO TEMPORARIO";"HRAD";NA;"MEDRE";"MEDICO";"I";"A";NA;"2022/03/01 00:00:00";"2023/02/28 00:00:00"
14568075;2;"HELIA CRISTINA DE SOUZA";"00179389610";"27/06/1972";"CONTRATO TEMPORARIO";"HGB-JA";"COORDENACAO DA UNIDADE DE PACIENTES CRITICOS";"PENF";"ENFERMEIRO";"IV";"A";"02/02/2022";"2022/02/02 00:00:00";"2023/02/01 00:00:00"
15077845;1;"HELISSAN DIAS DOS SANTOS GOMES";"09240208658";"30/04/1990";"CONTRATO TEMPORARIO";"HRAD";"COORDENACAO DA UNIDADE CIRURGICA";"PENF";"TECNICO DE ENFERMAGEM";"II";"A";"0000-00-00";"2022/02/02 00:00:00";"2023/02/01 00:00:00"
14920995;1;"HELLEN APARECIDA GOMES INACIA";"11387723642";"28/12/1993";"CONTRATO TEMPORARIO";"MOV";"COORDENACAO DA GINECOLOGIA E OBSTETRICIA";"PENF";"TECNICO DE ENFERMAGEM";"II";"A";"05/02/2021";"2021/02/05 00:00:00";"2023/02/04 00:00:00"
14053235;3;"HELLEN CRISTIANE CAIXETA DE SOUZA";"04483706624";"30/01/1981";"CONTRATO TEMPORARIO";"HRAD";"COORDENACAO DA UNIDADE DE PACIENTES EXTERNOS";"PENF";"TECNICO DE ENFERMAGEM";"II";"A";"0000-00-00";"2022/02/02 00:00:00";"2023/02/01 00:00:00"
15066830;1;"HELLYSSA CATARYNA SALDANHA";"06587161405";"13/01/1993";"CONTRATO TEMPORARIO";"HRAD";"COORDENACAO DE APOIO DIAGNOSTICO E TERAPEUTICO";"AGAS";"BIOQUIMICO";"I";"A";"0000-00-00";"2022/02/01 00:00:00";"2023/01/31 00:00:00"
15293558;1;"HELOISA DAVANSO DE SOUZA";"39510454850";"04/03/1992";"CONTRATO TEMPORARIO";"HRAD";"COORDENACAO DA UNIDADE DE PACIENTES EXTERNOS";"MED";"MEDICO CIRURGIAO GERAL";"III";"A";"0000-00-00";"2022/06/29 00:00:00";"2023/06/28 00:00:00"
15124985;2;"HELTON LUIS AYELLO FORASTIERI FILHO";"10609511777";"16/01/1986";"CONTRATO TEMPORARIO";"JXXIII";"COORDENACAO DE URGENCIA E EMERGENCIA ADULTO";"MED";"MEDICO CIRURGIAO GERAL";"III";"A";"04/07/2022";"2022/07/04 00:00:00";"2023/07/03 00:00:00"
15124985;1;"HELTON LUIS AYELLO FORASTIERI FILHO";"10609511777";NA;"CONTRATO TEMPORARIO";"JXXIII";NA;"MEDRE";"MEDICO";"I";"A";NA;"2022/03/01 00:00:00";"2023/02/28 00:00:00"
13001482;4;"HENRIQUE BOREM LOPES";"05047490645";"04/11/1982";"CONTRATO TEMPORARIO";"JXXIII";"COORDENACAO DE URGENCIA E EMERGENCIA ADULTO";"MED";"MEDICO ORTOPEDISTA E TRAUMATOLOGISTA";"III";"A";"19/05/2021";"2021/05/19 00:00:00";"2023/05/18 00:00:00"
14934145;1;"HENRIQUE FIGUEIREDO PAPINI DE MORAES";"11698432631";NA;"CONTRATO TEMPORARIO";"HJK";NA;"MEDRE";"MEDICO";"I";"A";NA;"2021/03/02 00:00:00";"2023/03/01 00:00:00"
15174386;1;"HENRIQUE GOMES RIBEIRO";"09819076609";NA;"CONTRATO TEMPORARIO";"JXXIII";NA;"MEDRE";"MEDICO";"I";"A";NA;"2022/03/21 00:00:00";"2023/03/20 00:00:00"
14882302;1;"HENRIQUE RABELO BERNARDES";"11911319639";NA;"CONTRATO TEMPORARIO";"HAC";NA;"MEDRE";"MEDICO";"I";"A";NA;"2020/03/01 00:00:00";"2023/02/28 00:00:00"
14590954;3;"HENRIQUETA GONCALVES FERREIRA";"00515651613";"17/08/1976";"CONTRATO TEMPORARIO";"JXXIII";"COORDENACAO DO SERVICO DE NUTRICAO E DIETETICA";"TOS";"TECNICO EM NUTRICAO E DIETETICA";"II";"A";"05/02/2022";"2022/02/05 00:00:00";"2023/02/04 00:00:00"
10520351;4;"HERCULES ABREU DE SAO JOSE";"81981910620";"19/05/1972";"CONTRATO TEMPORARIO";"JXXIII";"COORDENACAO DAS UNIDADES DE INTERNACAO CIRURGICA";"PENF";"ENFERMEIRO";"IV";"A";"29/07/2021";"2021/07/29 00:00:00";"2023/06/30 00:00:00"
13020953;3;"HESTER MARIANE OLIVEIRA PESTANA BEVILAQU";"07088266601";"12/10/1984";"CONTRATO TEMPORARIO";"HRJP";"COORDENACAO DA UNIDADE CIRURGICA";"MED";"MEDICO CIRURGIAO GERAL";"III";"A";"02/05/2021";"2021/05/02 00:00:00";"2023/05/01 00:00:00"
14882443;1;"HIGNER LUIS COSTA FORASTIERI";"13125563747";NA;"CONTRATO TEMPORARIO";"JXXIII";NA;"MEDRE";"MEDICO";"I";"A";NA;"2020/03/01 00:00:00";"2023/02/28 00:00:00"
15339484;1;"HILDA CAMBRAIA DA COSTA";"58913904691";"21/06/1967";"CONTRATO TEMPORARIO";"HRAD";"COORDENACAO DA UNIDADE CIRURGICA";"PENF";"TECNICO DE ENFERMAGEM";"II";"A";"0000-00-00";"2022/11/07 00:00:00";"2023/11/06 00:00:00"
14499081;3;"HINAIANA BARBOSA MIRANDA";"01333281633";"03/11/1976";"CONTRATO TEMPORARIO";"JXXIII";"COORDENACAO DE LABORATORIO E AGENCIA TRANSFUSIONAL";"AGAS";"FARMACEUTICO BIOQUIMICO";"I";"A";"09/06/2021";"2021/06/09 00:00:00";"2023/06/08 00:00:00"
15274640;1;"HORTENCIA TEIXEIRA DE MORAIS";"10567675610";NA;"CONTRATO TEMPORARIO";"HRJP";NA;"MED";"MEDICO PEDIATRA";"III";"A";NA;"2022/06/30 00:00:00";"2022/12/26 00:00:00"
15292261;1;"HUELTON CRUVINEL BENFICA";"11228154686";NA;"CONTRATO TEMPORARIO";"HRAD";NA;"MED";"MEDICO ORTOPEDISTA E TRAUMATOLOGISTA";"III";"A";NA;"2022/07/06 00:00:00";"2023/01/01 00:00:00"
15289689;1;"HUGO RAMALHO CRUZEIRO";"10553192639";"11/05/1990";"CONTRATO TEMPORARIO";"HRJP";"COORDENACAO DA MATERNIDADE";"PENF";"ENFERMEIRO OBSTETRICO";"VI";"A";"04/07/2022";"2022/07/02 00:00:00";"2023/07/01 00:00:00"
14591788;3;"HULYANNA ANDRESSA DE SOUZA CASTRO";"05950375696";"24/07/1984";"CONTRATO TEMPORARIO";"HEM";"COORDENACAO DAS UNIDADES CRITICAS";"AGAS";"FISIOTERAPEUTA";"III";"A";"27/04/2022";"2022/04/28 00:00:00";"2023/04/27 00:00:00"
14638233;3;"HUMBERTO COUY DE SALES";"98922327634";"25/05/1976";"CONTRATO TEMPORARIO";"JXXIII";"COORDENACAO DE DIAGNOSTICO POR IMAGEM";"TOS";"TECNICO EM RADIOLOGIA";"II";"A";"29/11/2021";"2021/11/29 00:00:00";"2023/06/30 00:00:00"
50368;1;"HUMBERTO LUCIO BARBOSA";"50827626649";"0000-00-00";NA;"HRAD";"COORDENACAO DA UNIDADE DE PACIENTES EXTERNOS";NA;"";NA;NA;"0000-00-00";NA;NA
15075849;1;"IANE NAYARA VASCONCELOS DIAS CRUZ";"09676366633";"17/10/1989";"CONTRATO TEMPORARIO";"MOV";"COORDENACAO DA UNIDADE DE NEONATOLOGIA";"PENF";"TECNICO DE ENFERMAGEM";"II";"A";"14/02/2022";"2022/02/14 00:00:00";"2023/02/13 00:00:00"
14514004;3;"IARA CRISTINA AMARAL MAGALHAES";"07609382612";"30/03/1983";"CONTRATO TEMPORARIO";"JXXIII";"COORDENACAO DE URGENCIA E EMERGENCIA ADULTO";"MED";"MEDICO OFTALMOLOGISTA";"III";"A";"03/03/2022";"2022/03/03 00:00:00";"2023/03/02 00:00:00"
14911267;2;"IARA DO CARMO CANDIDO BRITO DE SOUZA";"04377807676";"25/02/1977";"CONTRATO TEMPORARIO";"HCM";"COORDENACAO TECNICA DE ENFERMAGEM";"PENF";"TECNICO DE ENFERMAGEM";"II";"A";"01/02/2022";"2022/02/01 00:00:00";"2023/01/31 00:00:00"
15086101;1;"IARA SILVA";"05864301647";"08/12/1983";"CONTRATO TEMPORARIO";"HGB-JA";"COORDENACAO DA UNIDADE DE CLINICA MEDICA";"PENF";"TECNICO DE ENFERMAGEM";"II";"A";"02/02/2022";"2022/02/02 00:00:00";"2023/02/01 00:00:00"
13548425;2;"IARA SILVA MARQUES";"35929430659";"27/05/1959";"CONTRATO TEMPORARIO";"HAC";"COORDENACAO DO SERVICO DE DIAGNOSTICO POR IMAGEM";"AGAS";"FISICO MEDICO";"III";"A";"03/05/2021";"2021/05/03 00:00:00";"2023/05/02 00:00:00"
14911648;2;"IARA TAVARES DA SILVA";"11677900652";"10/12/1993";"CONTRATO TEMPORARIO";"HGB-JA";"COORDENACAO DA UNIDADE DE PACIENTES CRITICOS";"PENF";"TECNICO DE ENFERMAGEM";"II";"A";"11/12/2021";"2021/12/11 00:00:00";"2023/06/30 00:00:00"
15294937;1;"IASMIM ESTELA COSTA";"12228882623";"01/03/1997";"CONTRATO TEMPORARIO";"HIJPII";"COORDENACAO DE URGENCIA E EMERGENCIA PEDIATRICA";"MED";"MEDICO GENERALISTA";"I";"A";"01/07/2022";"2022/07/01 00:00:00";"2022/12/27 00:00:00"
13891692;2;"IBRAHIM JACOB NETO";"04947842610";"20/04/1981";"CONTRATO TEMPORARIO";"CSPD";"COORDENACAO DA UNIDADE DE CUIDADO AO ADULTO";"MED";"MEDICO CLINICO";"III";"A";"04/09/2016";"2021/02/01 00:00:00";"2023/01/31 00:00:00"
14662654;3;"ICARO AIRON SANTOS- CA";"11809580633";"02/03/1993";NA;"MOV";"COORDENACAO DE APOIO DIAGNOSTICO E TERAPEUTICO";NA;"FARMACEUTICO BIOQUIMICO";NA;NA;"22/09/2021";NA;NA
12287405;4;"IDALINA OLIVEIRA DE JESUS ROCHA";"91612632653";"10/01/1961";"CONTRATO TEMPORARIO";"JXXIII";"COORDENACAO DA CENTRAL DE MATERIAL E ESTERILIZACAO";"PENF";"TECNICO DE ENFERMAGEM";"II";"A";"03/03/2022";"2022/03/03 00:00:00";"2023/03/02 00:00:00"
10989879;4;"IDAMARIS PEREIRA DA SILVA";"05975332613";"12/01/1979";"CONTRATO TEMPORARIO";"JXXIII";"COORDENACAO DE GESTAO DE PESSOAS";"TOS";"AUXILIAR ADMINISTRATIVO";"I";"A";"01/02/2022";"2022/02/02 00:00:00";"2023/02/01 00:00:00"
11117405;5;"IEDO AVELINO DIAS DA SILVEIRA";"06558958686";"08/05/1985";"CONTRATO TEMPORARIO";"JXXIII";"COORDENACAO DE URGENCIA E EMERGENCIA ADULTO";"MED";"MEDICO ORTOPEDISTA E TRAUMATOLOGISTA";"III";"A";"03/03/2022";"2022/03/03 00:00:00";"2023/03/02 00:00:00"
13183587;3;"IGAL ALOM PINHEIRO DA SILVA";"82069247600";"12/04/1972";"CONTRATO TEMPORARIO";"DIEST";"(DESAT.)GERENCIA DE TECNOLOGIA E GESTAO DA INFORMACAO";"TOS";"TECNICO EM INFORMATICA";"II";"A";"01/12/2021";"2021/12/01 00:00:00";"2023/06/30 00:00:00"
15067093;1;"IGOR EMILIANO DE CARVALHO";"04070718656";"18/02/1980";"CONTRATO TEMPORARIO";"JXXIII";"COORDENACAO DE DIAGNOSTICO POR IMAGEM";"TOS";"TECNICO EM RADIOLOGIA";"II";"A";"15/01/2022";"2022/01/15 00:00:00";"2023/01/14 00:00:00"
14882344;1;"IGOR ESMERALDO DE OLIVEIRA";"11582935696";NA;"CONTRATO TEMPORARIO";"HAC";NA;"MEDRE";"MEDICO";"I";"A";NA;"2022/03/01 00:00:00";"2023/02/28 00:00:00"
14934178;1;"IGOR MIGLIO DE CASTRO";"12387128605";NA;"CONTRATO TEMPORARIO";"HJK";NA;"MEDRE";"MEDICO";"I";"A";NA;"2021/03/01 00:00:00";"2023/02/28 00:00:00"
14667679;1;"IGOR TEIXEIRA BARBOSA";"08230034699";"13/05/1987";"CONTRATO TEMPORARIO";"HJK";"COORDENACAO DE ASSISTENCIA FARMACEUTICA";"AGAS";"FARMACEUTICO";"III";"A";"22/02/2022";"2022/02/22 00:00:00";"2023/02/21 00:00:00"
14813182;3;"IGOR VASCONCELOS BARROS CRONEMBERGER";"06822292616";"11/03/1989";"CONTRATO TEMPORARIO";"HAC";"COORDENACAO DO AMBULATORIO";"MED";"MEDICO NEUROLOGISTA";"III";"A";"23/02/2022";"2022/02/23 00:00:00";"2023/02/22 00:00:00"
14813182;2;"IGOR VASCONCELOS BARROS CRONEMBERGER";"06822292616";"11/03/1989";"CONTRATO TEMPORARIO";"HJK";"COORDENACAO MEDICA DA URGENCIA E EMERGENCIA";"MED";"MEDICO NEUROLOGISTA";"III";"A";"14/06/2022";"2022/06/14 00:00:00";"2023/06/13 00:00:00"
15072200;1;"ILDA PINTO DE SOUZA";"02574313658";"24/06/1976";"CONTRATO TEMPORARIO";"JXXIII";"COORDENACAO DA UNIDADE DE TERAPIA INTENSIVA ADULTO";"PENF";"TECNICO DE ENFERMAGEM";"II";"A";"02/02/2022";"2022/02/02 00:00:00";"2023/02/01 00:00:00"
14834766;1;"ILDECI PEREIRA DA CRUZ FERNANDES";"06259557655";"05/03/1982";"CONTRATO TEMPORARIO";"HJK";"COORDENACAO DE INTERNACAO - ADULTO";"PENF";"TECNICO DE ENFERMAGEM";"II";"A";"07/03/2022";"2022/03/07 00:00:00";"2023/03/06 00:00:00"
14895379;2;"ILDEMARA DA SILVA";"03654228607";"07/06/1978";"CONTRATO TEMPORARIO";"JXXIII";"COORDENACAO DAS UNIDADES DE INTERNACAO CIRURGICA";"PENF";"ENFERMEIRO";"IV";"A";"03/02/2022";"2022/02/03 00:00:00";"2023/02/02 00:00:00"
14895379;1;"ILDEMARA DA SILVA";"03654228607";"07/06/1978";"CONTRATO TEMPORARIO";"JXXIII";"COORDENACAO DE URGENCIA E EMERGENCIA ADULTO";"PENF";"ENFERMEIRO";"IV";"A";"04/07/2022";"2022/07/04 00:00:00";"2023/07/03 00:00:00"
14568190;2;"ILDVANE OLIVEIRA SILVA";"03052152645";"20/10/1977";"CONTRATO TEMPORARIO";"HEM";"COORDENACAO DAS UNIDADES CRITICAS";"PENF";"ENFERMEIRO";"IV";"A";"02/07/2022";"2022/07/02 00:00:00";"2023/07/01 00:00:00"
14568190;1;"ILDVANE OLIVEIRA SILVA";"03052152645";"20/10/1977";"CONTRATO TEMPORARIO";"HJK";"COORDENACAO DA UNIDADE DE TERAPIA INTENSIVA ADULTO";"PENF";"ENFERMEIRO";"IV";"A";"05/02/2022";"2022/02/05 00:00:00";"2023/02/04 00:00:00"
15276074;1;"ILZA FRANCISCA DE OLIVEIRA PEREIRA";"03164391692";"29/07/1976";"CONTRATO TEMPORARIO";"HJK";"COORDENACAO DE INTERNACAO - ADULTO";"PENF";"TECNICO DE ENFERMAGEM";"II";"A";"06/07/2022";"2022/07/06 00:00:00";"2023/07/05 00:00:00"
14716260;1;"INA DE MOURA SILVA";"71706240791";"15/11/1964";"CONTRATO TEMPORARIO";"CEPAI";"COORDENACAO DE ASSISTENCIA FARMACEUTICA";"PENF";"TECNICO DE ENFERMAGEM";"II";"A";"01/02/2022";"2022/02/02 00:00:00";"2023/02/01 00:00:00"
14340004;1;"INEZ MARIA DE JESUS SILVA";"01175893650";"04/10/1978";"CONTRATO TEMPORARIO";"HJK";"COORDENACAO DE INTERNACAO - ADULTO";"PENF";"ENFERMEIRO";"IV";"A";"01/02/2022";"2022/02/01 00:00:00";"2023/01/31 00:00:00"
14884217;2;"INGRED HELLEN DE RESENDE ANDRADE";"11388949660";NA;"CONTRATO TEMPORARIO";"HJK";NA;"MED";"MEDICO CLINICO";"III";"A";NA;"2022/07/06 00:00:00";"2023/07/05 00:00:00"
14710115;5;"INGRID DA COSTA MATIAS";"10097125601";"02/03/1991";"CONTRATO TEMPORARIO";"HAC";"COORDENACAO DO AMBULATORIO";"MED";"MEDICO CLINICO";"III";"A";"10/03/2022";"2022/03/10 00:00:00";"2023/03/09 00:00:00"
14615124;3;"INGRID SILVA OLIVEIRA MACHADO";"03341182551";"13/07/1988";"CONTRATO TEMPORARIO";"HJK";"COORDENACAO DA MATERNIDADE";"MED";"MEDICO GINECOLOGISTA";"III";"A";"08/02/2022";"2022/02/09 00:00:00";"2023/02/08 00:00:00"
14679476;1;"INGRYDE SALLES SILVA DE OLIVEIRA";"12126881636";"12/09/1994";"CONTRATO TEMPORARIO";"HJK";"COORDENACAO DA UNIDADE DE TERAPIA INTENSIVA ADULTO";"PENF";"ENFERMEIRO";"IV";"A";"02/02/2022";"2022/02/02 00:00:00";"2023/02/01 00:00:00"
14667661;3;"IOLANDA ALVES DE ALMEIDA";"06700467608";"22/12/1985";"CONTRATO TEMPORARIO";"DPGF";"(DESAT.)COORDENACAO DE PLANEJAMENTO E CONTROLE ORCAMENTARIO";"TOS";"AUXILIAR ADMINISTRATIVO";"I";"A";"01/02/2022";"2022/02/01 00:00:00";"2023/01/31 00:00:00"
14581185;2;"IONE BASTOS VINHAL";"76683540691";"08/06/1971";"CONTRATO TEMPORARIO";"HAC";"COORDENACAO DE ASSISTENCIA FARMACEUTICA";"TOS";"AUXILIAR ADMINISTRATIVO";"I";"A";"07/02/2022";"2022/02/07 00:00:00";"2023/02/06 00:00:00"
15072754;1;"IRACI BATISTA BERNARNDO";"00758808658";"25/09/1975";"CONTRATO TEMPORARIO";"HRJP";"COORDENACAO DA MATERNIDADE";"PENF";"TECNICO DE ENFERMAGEM";"II";"A";"01/02/2022";"2022/02/01 00:00:00";"2023/01/31 00:00:00"
14052146;2;"IRAMARIS SUELI DE OLIVEIRA";"81786360691";"27/10/1970";"CONTRATO TEMPORARIO";"MOV";"COORDENACAO DA GINECOLOGIA E OBSTETRICIA";"PENF";"ENFERMEIRO";"IV";"A";"01/02/2022";"2022/02/01 00:00:00";"2023/01/31 00:00:00"
14052146;1;"IRAMARIS SUELI DE OLIVEIRA";"81786360691";"27/10/1970";"CONTRATO TEMPORARIO";"MOV";"COORDENACAO DA GINECOLOGIA E OBSTETRICIA";"PENF";"ENFERMEIRO";"IV";"A";"09/05/2022";"2022/05/09 00:00:00";"2023/05/08 00:00:00"
14897680;2;"IRANI BATISTA BERNARDO NOGUEIRA";"96319216620";"25/09/1975";"CONTRATO TEMPORARIO";"HRJP";"COORDENACAO DAS UNIDADES CRITICAS";"PENF";"TECNICO DE ENFERMAGEM";"II";"A";"01/02/2022";"2022/02/01 00:00:00";"2023/01/31 00:00:00"
14902324;2;"IRANI FERNANDES RIBAS";"58378294234";"06/05/1975";"CONTRATO TEMPORARIO";"HEM";"COORDENACAO DAS UNIDADES DE INTERNACAO";"PENF";"ENFERMEIRO";"IV";"A";"03/11/2022";"2022/11/03 00:00:00";"2023/11/02 00:00:00"
15293772;1;"IRAYCI RODRIGUES MACIEL";"08287400627";"06/02/1988";"CONTRATO TEMPORARIO";"HJK";"COORDENACAO MEDICA DA URGENCIA E EMERGENCIA";"PENF";"TECNICO DE ENFERMAGEM";"II";"A";"06/07/2022";"2022/07/06 00:00:00";"2023/07/05 00:00:00"
15115637;1;"IRENE PATRICIO DUARTE DE MELO TEIXEIRA";"05099723659";"26/10/1975";"CONTRATO TEMPORARIO";"JXXIII";"COORDENACAO DA UNIDADE DE TERAPIA INTENSIVA ADULTO";"PENF";"TECNICO DE ENFERMAGEM";"II";"A";"01/02/2022";"2022/02/01 00:00:00";"2023/01/31 00:00:00"
14562623;2;"IRVINNG BRONSON GONCALVES PAIVA";"08703099601";"19/05/1987";"CONTRATO TEMPORARIO";"DPGF";"(DESAT.)GERENCIA DE INFRAESTRUTURA PREDIAL";"AGAS";"ENGENHEIRO";"I";"A";"01/02/2022";"2022/02/01 00:00:00";"2023/01/31 00:00:00"
14146906;3;"ISA TEIXEIRA SILVA";"09497381662";"16/05/1990";"CONTRATO TEMPORARIO";"MOV";"COORDENACAO DA GINECOLOGIA E OBSTETRICIA";"MED";"MEDICO GINECOLOGISTA";"III";"A";"01/02/2022";"2022/02/01 00:00:00";"2023/01/31 00:00:00"
14557565;1;"ISABEL CRISTINA DE OLIVEIRA FIGUEIREDO S";"68321490697";"03/08/1962";"CONTRATO TEMPORARIO";"HMAL";"COORDENACAO DAS UNIDADES DE INTERNACAO PEDIATRICA";"PENF";"TECNICO DE ENFERMAGEM";"II";"A";"11/02/2022";"2022/02/11 00:00:00";"2023/02/10 00:00:00"
12533345;4;"ISABEL LETICIA BORGES DIAS";"01270132610";"17/03/1983";"CONTRATO TEMPORARIO";"HCM";"COORDENACAO DAS UNIDADES DE INTERNACAO";"AGAS";"PSICOLOGO";"I";"A";"13/04/2021";"2021/04/13 00:00:00";"2023/04/12 00:00:00"
14874374;2;"ISABELA ALVES CAMPOS DE LACERDA";"09688869651";"08/07/1991";"CONTRATO TEMPORARIO";"HJK";"COORDENACAO MEDICA DA TERAPIA INTENSIVA NEONATAL";"MED";"MEDICO PEDIATRA";"III";"A";"02/05/2021";"2021/05/02 00:00:00";"2023/05/01 00:00:00"
14895346;3;"ISABELA ASSIS MICHARALOS";"11515289605";"12/02/1992";"CONTRATO TEMPORARIO";"JXXIII";"COORDENACAO DO BLOCO CIRURGICO";"MED";"MEDICO ANESTESIOLOGISTA";"III";"A";"10/02/2022";"2022/02/10 00:00:00";"2023/02/09 00:00:00"
13904982;5;"ISABELA AUGUSTA DE CASTRO LEMOS";"09158163697";"09/02/1989";"CONTRATO TEMPORARIO";"JXXIII";"COORDENACAO DE URGENCIA E EMERGENCIA ADULTO";"MED";"MEDICO CLINICO";"III";"A";"20/02/2022";"2022/02/20 00:00:00";"2023/02/19 00:00:00"
14355689;2;"ISABELA BIONDI JORGE";"04824859654";"19/02/1982";"CONTRATO TEMPORARIO";"HAC";"COORDENACAO DA EQUIPE MULTIDISCIPLINAR";"AGAS";"TERAPEUTA OCUPACIONAL";"I";"A";"01/02/2022";"2022/02/01 00:00:00";"2023/01/31 00:00:00"
14946891;2;"ISABELA COLEN DE OLIVEIRA";"11466930608";"15/09/1992";"CONTRATO TEMPORARIO";"JXXIII";"COORDENACAO DAS UNIDADES DE INTERNACAO ADULTO";"AGAS";"FISIOTERAPEUTA RESPIRATORIA";"III";"A";"01/02/2022";"2022/02/01 00:00:00";"2023/01/31 00:00:00"
14723019;1;"ISABELA COSTA CARVALHO";"07908994695";"20/06/1987";"CONTRATO TEMPORARIO";"HJK";"COORDENACAO CIRURGICA";"MED";"MEDICO ANESTESIOLOGISTA";"III";"A";"10/01/2019";"2021/02/01 00:00:00";"2023/01/31 00:00:00"
13202338;2;"ISABELA CRISTINA FERNANDES";"10906330688";"05/10/1992";"CONTRATO TEMPORARIO";"HAC";"GERENCIA DE GESTAO DE PESSOAS";"TOS";"AUXILIAR ADMINISTRATIVO";"I";"A";"01/02/2022";"2022/02/01 00:00:00";"2023/01/31 00:00:00"
14896393;2;"ISABELA CRISTINA MOREIRA HELENO";"12628501694";"17/06/1994";"CONTRATO TEMPORARIO";"HGB-JA";"COORDENACAO DA UNIDADE DE CLINICA MEDICA";"PENF";"ENFERMEIRO";"IV";"A";"01/02/2022";"2022/02/01 00:00:00";"2023/01/31 00:00:00"
14934186;1;"ISABELA CRISTINA PORTO REZENDE MACHADO";"08579609623";NA;"CONTRATO TEMPORARIO";"HJK";NA;"MEDRE";"MEDICO";"I";"A";NA;"2021/03/01 00:00:00";"2023/02/28 00:00:00"
14880488;1;"ISABELA FURTADO GUIOTTI";"13086794674";NA;"CONTRATO TEMPORARIO";"MOV";NA;"MEDRE";"MEDICO";"I";"A";NA;"2020/03/01 00:00:00";"2023/02/28 00:00:00"
13894084;2;"ISABELA MARTELETO TEIXEIRA";"09676431630";"16/02/1989";"CONTRATO TEMPORARIO";"HGB-JA";"COORDENACAO DE ASSISTENCIA FARMACEUTICA";"AGAS";"FARMACEUTICO";"III";"A";"24/11/2020";"2022/07/01 00:00:00";"2023/06/30 00:00:00"
15115322;1;"ISABELA MARTINS DA SILVA";"01944938656";NA;"CONTRATO TEMPORARIO";"HMAL";NA;"PENF";"TECNICO DE ENFERMAGEM";"II";"A";NA;"2022/02/02 00:00:00";"2023/02/01 00:00:00"
14887806;1;"ISABELA PINTO BRAGA";"10805250689";NA;"CONTRATO TEMPORARIO";"HGB-JA";NA;"MEDRE";"MEDICO";"I";"A";NA;"2020/03/30 00:00:00";"2023/03/29 00:00:00"
15062060;1;"ISABELA ROCHA DE CASTRO";"08011889621";"07/02/1993";"CONTRATO TEMPORARIO";"HEM";"COORDENACAO DAS UNIDADES CRITICAS";"MED";"MEDICO GENERALISTA";"III";"A";"13/06/2022";"2022/06/13 00:00:00";"2023/06/12 00:00:00"
14944870;2;"ISABELA RUFINI GONCALVES";"12524578631";"20/12/1994";"CONTRATO TEMPORARIO";"HIJPII";"COORDENACAO DE URGENCIA E EMERGENCIA PEDIATRICA";"MED";"MEDICO GENERALISTA";"I";"A";"02/07/2022";"2022/07/02 00:00:00";"2022/12/28 00:00:00"
14944870;1;"ISABELA RUFINI GONCALVES";"12524578631";NA;"CONTRATO TEMPORARIO";"HIJPII";NA;"MEDRE";"MEDICO";"I";"A";NA;"2021/03/01 00:00:00";"2023/02/28 00:00:00"
14925655;1;"ISABELA SHENG LING MIAW";"08982095608";NA;"CONTRATO TEMPORARIO";"MOV";NA;"MEDRE";"MEDICO";"I";"A";NA;"2021/03/01 00:00:00";"2023/02/28 00:00:00"
13886908;4;"ISABELA TAVARES B MATIAS DOS SANTOS";"08110051600";"18/09/1986";"CONTRATO TEMPORARIO";"JXXIII";"COORDENACAO DAS UNIDADES DE INTERNACAO PEDIATRICA";"MED";"MEDICO";"III";"A";"22/02/2022";"2022/02/22 00:00:00";"2023/02/21 00:00:00"
15119480;1;"ISABELLA BARBOSA COELHO";"12428185616";NA;"CONTRATO TEMPORARIO";"CHPB";NA;"MEDRE";"MEDICO";"I";"A";NA;"2022/03/01 00:00:00";"2023/02/28 00:00:00"
15350119;1;"ISABELLA CRISTINA BRAGA ALMADA";"11749664674";"12/01/1993";"CONTRATO TEMPORARIO";"HJK";"COORDENACAO DA MATERNIDADE";"PENF";"ENFERMEIRO";"IV";"A";"07/11/2022";"2022/11/07 00:00:00";"2023/11/06 00:00:00"
14650014;2;"ISABELLA CRISTINA CAMPOS";"05532262667";"18/09/1981";"CONTRATO TEMPORARIO";"HJK";"COORDENACAO DO LABORATORIO";"TOS";"TECNICO EM PATOLOGIA CLINICA";"II";"A";"07/11/2022";"2022/11/07 00:00:00";"2023/11/06 00:00:00"
14889588;5;"ISABELLA CRISTINA DE AMORIM VITORINO";"04969759600";"24/04/1980";"CONTRATO TEMPORARIO";"HJK";"COORDENACAO DE ASSISTENCIA FARMACEUTICA";"PENF";"TECNICO DE ENFERMAGEM";"II";"A";"21/03/2022";"2022/03/21 00:00:00";"2023/03/20 00:00:00"
14889588;4;"ISABELLA CRISTINA DE AMORIM VITORINO";"04969759600";"24/04/1980";"CONTRATO TEMPORARIO";"HJK";"COORDENACAO MEDICA DA URGENCIA E EMERGENCIA";"PENF";"TECNICO DE ENFERMAGEM";"II";"A";"05/02/2022";"2022/02/05 00:00:00";"2023/02/04 00:00:00"
14937825;1;"ISABELLA CRISTINA DO CARMO";"10393516628";NA;"CONTRATO TEMPORARIO";"JXXIII";NA;"MEDRE";"MEDICO";"I";"A";NA;"2021/03/01 00:00:00";"2023/02/28 00:00:00"
14937825;9;"ISABELLA CRISTINA DO CARMO";"10393516628";"0000-00-00";NA;"HJXXIII";"COORDENACAO DAS UNIDADES DE INTERNACAO ADULTO";NA;"";NA;NA;"09/11/2022";NA;NA
14979702;2;"ISABELLA GERALDA CARMO COELHO";"07144079689";"04/10/1989";"CONTRATO TEMPORARIO";"JXXIII";"COORDENACAO DE URGENCIA E EMERGENCIA ADULTO";"PENF";"ENFERMEIRO";"IV";"A";"05/02/2022";"2022/02/05 00:00:00";"2023/02/04 00:00:00"
14887335;1;"ISABELLA TAYNAH RODRIGUES NOGUEIRA DIAS";"12116345669";NA;"CONTRATO TEMPORARIO";"HRAD";NA;"MEDRE";"MEDICO";"I";"A";NA;"2020/03/02 00:00:00";"2023/03/01 00:00:00"
14977904;1;"ISABELLE LOPES GONTIJO LIMA";"08259116642";"06/07/1990";"CONTRATO TEMPORARIO";"HRAD";"COORDENACAO DA UNIDADE DE PACIENTES EXTERNOS";"MED";"MEDICO CLINICO";"III";"A";"0000-00-00";"2021/07/03 00:00:00";"2023/06/30 00:00:00"
15278393;1;"ISABELLE NEBIAS ABRANCHES BARBOSA";"12610347677";"28/02/1996";"CONTRATO TEMPORARIO";"HIJPII";"COORDENACAO DE URGENCIA E EMERGENCIA PEDIATRICA";"MED";"MEDICO GENERALISTA";"I";"A";"01/07/2022";"2022/07/01 00:00:00";"2022/12/27 00:00:00"
15157431;1;"ISADORA CRISTINA DE CARVALHO CAMPOS";"11259286622";NA;"CONTRATO TEMPORARIO";"HJK";NA;"MEDRE";"MEDICO";"I";"A";NA;"2022/03/14 00:00:00";"2023/03/13 00:00:00"
14925986;1;"ISADORA DE OLIVEIRA CARVALHO";"15110294712";NA;"CONTRATO TEMPORARIO";"HRJP";NA;"MEDRE";"MEDICO";"I";"A";NA;"2021/03/01 00:00:00";"2023/02/28 00:00:00"
14944888;1;"ISADORA ESTEVAM SILVA";"11893553612";NA;"CONTRATO TEMPORARIO";"HIJPII";NA;"MEDRE";"MEDICO";"I";"A";NA;"2021/03/01 00:00:00";"2023/02/28 00:00:00"
14883979;1;"ISADORA MAGALHAES MELGES";"11570743673";NA;"CONTRATO TEMPORARIO";"HJK";NA;"MEDRE";"MEDICO";"I";"A";NA;"2020/03/01 00:00:00";"2023/02/28 00:00:00"
14893291;3;"ISAURA MARIA DA COSTA SANTOS";"06925980655";"08/06/1983";"CONTRATO TEMPORARIO";"HAC";"COORDENACAO DE INTERNACAO - ONCOLOGICA";"PENF";"TECNICO DE ENFERMAGEM";"II";"A";"07/07/2022";"2022/07/07 00:00:00";"2023/07/06 00:00:00"
11342516;4;"ISIS DA COSTA PARANHOS SANTOS";"04714188623";"14/01/1981";"CONTRATO TEMPORARIO";"JXXIII";"COORDENACAO DE LABORATORIO E AGENCIA TRANSFUSIONAL";"TOS";"TECNICO EM PATOLOGIA CLINICA";"II";"A";"19/01/2022";"2022/01/19 00:00:00";"2023/01/18 00:00:00"
4002143;5;"ISLEY ALVES MARTINS COSTA";"03917277611";"09/10/1974";"CONTRATO TEMPORARIO";"JXXIII";"COORDENACAO DO CENTRO DE TRATAMENTO DE QUEIMADOS";"PENF";"ENFERMEIRO";"IV";"A";"14/03/2022";"2022/03/14 00:00:00";"2023/03/13 00:00:00"
14439301;2;"ISMAEL XAVIER RIBEIRO";"06551439632";"03/03/1983";"CONTRATO TEMPORARIO";"HRJP";"COORDENACAO DAS UNIDADES CRITICAS";"PENF";"TECNICO DE ENFERMAGEM";"II";"A";"04/01/2022";"2022/01/04 00:00:00";"2023/01/03 00:00:00"
14542377;3;"ITAIANE APARECIDA MARTINS";"09859932603";"14/05/1990";"CONTRATO TEMPORARIO";"JXXIII";"COORDENACAO DE LABORATORIO E AGENCIA TRANSFUSIONAL";"PENF";"TECNICO DE ENFERMAGEM";"II";"A";"10/03/2022";"2022/03/10 00:00:00";"2023/03/09 00:00:00"
14756415;3;"ITALO DE OLIVEIRA PACHECO";"06049297657";"28/06/1983";"CONTRATO TEMPORARIO";"HRAD";"COORDENACAO DA UNIDADE CIRURGICA";"MED";"MEDICO ANESTESIOLOGISTA";"III";"A";"0000-00-00";"2022/03/18 00:00:00";"2023/03/17 00:00:00"
14756415;2;"ITALO DE OLIVEIRA PACHECO";"06049297657";"28/06/1983";"CONTRATO TEMPORARIO";"HRAD";"COORDENACAO DA UNIDADE CIRURGICA";"MED";"MEDICO ANESTESIOLOGISTA";"III";"A";"0000-00-00";"2022/07/06 00:00:00";"2023/07/05 00:00:00"
14931075;1;"ITALO MIRANDA MOURAO JUNIOR";"07189744681";NA;"CONTRATO TEMPORARIO";"HMAL";NA;"MEDRE";"MEDICO";"I";"A";NA;"2021/03/01 00:00:00";"2023/02/28 00:00:00"
14229124;3;"IVANETE GOMES PINHEIRO";"05661530684";"20/12/1977";"CONTRATO TEMPORARIO";"JXXIII";"COORDENACAO DO CENTRO DE TRATAMENTO DE QUEIMADOS";"PENF";"TECNICO DE ENFERMAGEM";"II";"A";"05/03/2022";"2022/03/05 00:00:00";"2023/03/04 00:00:00"
14591911;1;"IVANI CLEIDE DO NASCIMENTO";"11026827647";"18/11/1989";"CONTRATO TEMPORARIO";"JXXIII";"COORDENACAO DE LABORATORIO E AGENCIA TRANSFUSIONAL";"PENF";"TECNICO DE ENFERMAGEM";"II";"A";"05/03/2022";"2022/03/05 00:00:00";"2023/03/04 00:00:00"
15018484;1;"IVANILDE PEREIRA GONCALVES";"05368377673";"04/05/1981";"CONTRATO TEMPORARIO";"HIJPII";"COORDENACAO DA UNIDADE DE TERAPIA INTENSIVA PEDIATRICA";"PENF";"TECNICO DE ENFERMAGEM";"II";"A";"02/09/2021";"2021/09/02 00:00:00";"2023/06/30 00:00:00"
15018484;2;"IVANILDE PEREIRA GONCALVES";"05368377673";"0000-00-00";NA;"HMAL";"COORDENACAO DAS UNIDADES DE INTERNACAO CIRURGICA DE RETAGUARDA";NA;"";NA;NA;"06/11/2022";NA;NA
13899729;2;"IVANOE PEREIRA DUTRA DA MOTA";"10072538600";"26/08/1989";"CONTRATO TEMPORARIO";"HRAD";"COORDENACAO DA UNIDADE CIRURGICA";"MED";"MEDICO ANESTESIOLOGISTA";"III";"A";"0000-00-00";"2022/02/01 00:00:00";"2023/01/31 00:00:00"
13371182;4;"IVONE ANDREZA MORAES COSTA";"02849695670";"07/05/1976";"CONTRATO TEMPORARIO";"HEM";"COORDENACAO DA UNIDADE DE PACIENTES EXTERNOS";"PENF";"ENFERMEIRO";"IV";"A";"01/02/2022";"2022/02/01 00:00:00";"2023/01/31 00:00:00"
14679526;2;"IVONE BAMBIRRA";"77124391687";"05/03/1968";"CONTRATO TEMPORARIO";"JXXIII";"COORDENACAO DE LABORATORIO E AGENCIA TRANSFUSIONAL";"TOS";"TECNICO EM PATOLOGIA CLINICA";"II";"A";"01/07/2022";"2022/07/01 00:00:00";"2022/12/27 00:00:00"
14892608;1;"IVONETE APARECIDA MACIEL DA COSTA OLIVEI";"03334034607";"11/08/1968";"CONTRATO TEMPORARIO";"HRJP";"COORDENACAO DAS UNIDADES DE INTERNACAO";"PENF";"TECNICO DE ENFERMAGEM";"II";"A";"07/09/2022";"2022/09/07 00:00:00";"2023/03/05 00:00:00"
15289531;1;"IVONETE BATISTA DE SOUSA";"05220722670";"29/03/1972";"CONTRATO TEMPORARIO";"HEM";"COORDENACAO DAS UNIDADES DE INTERNACAO";"PENF";"TECNICO DE ENFERMAGEM";"II";"A";"07/07/2022";"2022/07/07 00:00:00";"2023/07/06 00:00:00"
15278633;1;"IVONICE DE SOUZA DONATO";"04337487611";"20/05/1979";"CONTRATO TEMPORARIO";"JXXIII";"COORDENACAO DE SAUDE E SEGURANCA DO TRABALHADOR";"TOS";"TECNICO DE SEGURANCA DO TRABALHO";"II";"A";"04/07/2022";"2022/07/04 00:00:00";"2022/12/30 00:00:00"
14756431;2;"IZABEL APARECIDA COELHO";"11701599660";"29/10/1991";"CONTRATO TEMPORARIO";"HEM";"COORDENACAO DAS UNIDADES DE INTERNACAO";"MED";"MEDICO INFECTOLOGISTA";"III";"A";"02/06/2022";"2022/06/02 00:00:00";"2023/06/01 00:00:00"
13665724;2;"IZABEL CRISTINA MARCAL DE SOUZA CARREIRO";"07345170683";NA;"CONTRATO TEMPORARIO";"MOV";NA;"MED";"MEDICO ANESTESIOLOGISTA";"III";"A";NA;"2022/07/01 00:00:00";"2022/12/27 00:00:00"
15286008;1;"IZABELA CRISTINA ALMEIDA DUARTE";"08772181613";"19/01/1988";"CONTRATO TEMPORARIO";"JXXIII";"COORDENACAO DO BLOCO CIRURGICO";"MED";"MEDICO ANESTESIOLOGISTA";"III";"A";"01/07/2022";"2022/07/01 00:00:00";"2022/12/27 00:00:00"
14937833;1;"IZABELLA CAMPOLINA SANTOS";"06926976678";NA;"CONTRATO TEMPORARIO";"JXXIII";NA;"MEDRE";"MEDICO";"I";"A";NA;"2021/03/01 00:00:00";"2023/02/28 00:00:00"
14650030;1;"IZABELLA CAROLINE DE ALMEIDA LEITE";"09126744660";"09/09/1989";"CONTRATO TEMPORARIO";"DIGEPE";"(DESAT.)COORDENACAO DE SAUDE DO TRABALHADOR";"TOS";"TECNICO DE SEGURANCA DO TRABALHO";"II";"A";"01/02/2022";"2022/02/01 00:00:00";"2023/01/31 00:00:00"
14944896;1;"IZABELLA DA SILVA MENDES";"07286959603";NA;"CONTRATO TEMPORARIO";"HIJPII";NA;"MEDRE";"MEDICO";"I";"A";NA;"2021/03/01 00:00:00";"2023/02/28 00:00:00"
14963375;1;"IZAMARY MAGNA PAIXAO DE LOURDES";"07993970679";"11/10/1985";"CONTRATO TEMPORARIO";"JXXIII";"COORDENACAO DAS UNIDADES DE INTERNACAO ADULTO";"PENF";"TECNICO DE ENFERMAGEM";"II";"A";"14/05/2021";"2021/05/14 00:00:00";"2023/05/13 00:00:00"
13397054;2;"JACQUELINE DE ALMEIDA XAVIER";"06021039670";"07/03/1984";"CONTRATO TEMPORARIO";"HIJPII";"COORDENACAO DE HOTELARIA";"TOS";"AUXILIAR ADMINISTRATIVO";"I";"A";"02/02/2022";"2022/02/02 00:00:00";"2023/02/01 00:00:00"
15017379;1;"JACQUELINE DE PAULA ALMEIDA NUNES";"04793724620";"12/04/1982";"CONTRATO TEMPORARIO";"MOV";"COORDENACAO DA UNIDADE CIRURGICA";"PENF";"ENFERMEIRO";"IV";"A";"22/09/2021";"2021/09/22 00:00:00";"2023/06/30 00:00:00"
14625065;5;"JACQUELINE DELGADO CAMPOS";"09477121606";"13/02/1990";"CONTRATO TEMPORARIO";"HAC";"COORDENACAO DA UNIDADE DE TERAPIA INTENSIVA ADULTO";"MED";"MEDICO CLINICO";"III";"A";"04/03/2022";"2022/03/04 00:00:00";"2023/03/03 00:00:00"
14625065;4;"JACQUELINE DELGADO CAMPOS";"09477121606";"13/02/1990";"CONTRATO TEMPORARIO";"HAC";"COORDENACAO DO AMBULATORIO";"MED";"MEDICO CLINICO";"III";"A";"08/02/2022";"2022/02/08 00:00:00";"2023/02/07 00:00:00"
15072176;1;"JACQUELINE EVELYN DOS SANTOS";"06194551607";"20/06/1983";"CONTRATO TEMPORARIO";"JXXIII";"COORDENACAO DAS UNIDADES DE INTERNACAO CIRURGICA";"PENF";"TECNICO DE ENFERMAGEM";"II";"A";"02/02/2022";"2022/02/02 00:00:00";"2023/02/01 00:00:00"
14691521;1;"JACQUELINE FERREIRA FARIA";"06742583630";"27/07/1986";"CONTRATO TEMPORARIO";"HAC";"COORDENACAO DA UNIDADE DE TERAPIA INTENSIVA ADULTO";"PENF";"TECNICO DE ENFERMAGEM";"II";"A";"21/09/2018";"2021/02/01 00:00:00";"2023/01/31 00:00:00"
14995542;1;"JACQUELINE FREITAS SOUZA PAOLINELLI";"07071520623";"08/11/1985";"CONTRATO TEMPORARIO";"CSSFA";"COORDENACAO TECNICA DE ENFERMAGEM";"PENF";"ENFERMEIRO";"IV";"A";"0000-00-00";"2021/08/20 00:00:00";"2023/06/30 00:00:00"
14892665;1;"JACQUELINE MIRANDA DORNELAS DE SOUZA SIL";"08682246694";"18/05/1988";"CONTRATO TEMPORARIO";"HRJP";"GERENCIA ASSISTENCIAL";"PENF";"ENFERMEIRO";"IV";"A";"02/07/2022";"2022/07/02 00:00:00";"2023/07/01 00:00:00"
15044761;3;"JACQUELINE PINTO MOREIRA FULGENCIO";"03107724602";"07/05/1978";"CONTRATO TEMPORARIO";"HJK";"COORDENACAO DA MATERNIDADE";"PENF";"ENFERMEIRO";"IV";"A";"10/02/2022";"2022/02/10 00:00:00";"2023/02/09 00:00:00"
15044761;2;"JACQUELINE PINTO MOREIRA FULGENCIO";"03107724602";NA;"CONTRATO TEMPORARIO";"HJK";NA;"PENF";"ENFERMEIRO";"IV";"A";NA;"2022/07/07 00:00:00";"2023/07/06 00:00:00"
12870283;2;"JACQUELINE RODRIGUES FERREIRA";"08052294690";"15/11/1984";"CONTRATO TEMPORARIO";"AJUR";"(DESAT.)PROCURADORIA";"AGAS";"ADVOGADO";"I";"A";"19/04/2021";"2021/04/19 00:00:00";"2023/04/18 00:00:00"
11869435;3;"JACQUELINE SILVA MATHIAS PEREIRA";"00129007617";"24/03/1975";"CONTRATO TEMPORARIO";"HJK";"COORDENACAO DE INTERNACAO - ADULTO";"PENF";"TECNICO DE ENFERMAGEM";"II";"A";"08/02/2022";"2022/02/08 00:00:00";"2023/02/07 00:00:00"
14614143;2;"JACQUELINE TEIXEIRA GALVAO SANTOS";"09350668610";"27/07/1989";"CONTRATO TEMPORARIO";"HRAD";"COORDENACAO DE ASSISTENCIA FARMACEUTICA";"TOS";"TECNICO EM FARMACIA";"II";"A";"0000-00-00";"2021/12/16 00:00:00";"2023/06/30 00:00:00"
15086192;1;"JACQUISLAINE CRISTENE DE ANDRADE";"11195003625";"23/05/1998";"CONTRATO TEMPORARIO";"HGB-JA";"COORDENACAO DA UNIDADE DE URGENCIA E EMERGENCIA";"PENF";"TECNICO DE ENFERMAGEM";"II";"A";"02/02/2022";"2022/02/02 00:00:00";"2023/02/01 00:00:00"
15122351;1;"JADE CHARTONE EUSTAQUIO";"13054468607";NA;"CONTRATO TEMPORARIO";"HGB-JA";NA;"MEDRE";"MEDICO";"I";"A";NA;"2022/03/01 00:00:00";"2023/02/28 00:00:00"
14930507;1;"JADE GOMES OLIVEIRA";"08671074641";NA;"CONTRATO TEMPORARIO";"HEM";NA;"MEDRE";"MEDICO";"I";"A";NA;"2020/03/01 00:00:00";"2023/02/28 00:00:00"
14661276;3;"JADERSON LENIN DE SOUZA";"08382295657";"26/09/1987";"CONTRATO TEMPORARIO";"JXXIII";"COORDENACAO DE GESTAO DE PESSOAS";"TOS";"AUXILIAR ADMINISTRATIVO";"I";"A";"29/11/2021";"2021/11/29 00:00:00";"2023/06/30 00:00:00"
15092786;1;"JADIR ALMEIDA MAGALHAES";"06918480685";"17/06/1984";"CONTRATO TEMPORARIO";"HAC";"COORDENACAO DO LABORATORIO";"AGAS";"FARMACEUTICO";"I";"A";"07/02/2022";"2022/02/07 00:00:00";"2023/02/06 00:00:00"
15204316;1;"JAILSON MATOS FACUNDO";"64395073387";NA;"CONTRATO TEMPORARIO";"JXXIII";NA;"MEDRE";"MEDICO";"I";"A";NA;"2022/03/01 00:00:00";"2023/02/28 00:00:00"
14882666;2;"JAIME ENRIQUE DURAN BUSTAMANTE";"23788866837";"31/01/1992";"CONTRATO TEMPORARIO";"JXXIII";"COORDENACAO DE URGENCIA E EMERGENCIA ADULTO";"MED";"MEDICO CIRURGIAO GERAL";"III";"A";"03/03/2022";"2022/02/18 00:00:00";"2023/02/17 00:00:00"
10899805;4;"JAIME VITOR DE BARROS";"69309744634";"21/07/1966";"CONTRATO TEMPORARIO";"HEM";"COORDENACAO DAS UNIDADES CRITICAS";"PENF";"ENFERMEIRO";"IV";"A";"04/07/2022";"2022/07/04 00:00:00";"2023/07/03 00:00:00"
15198625;1;"JAKELINE RAIMUNDA MACHADO";"88268896604";"22/06/1968";"CONTRATO TEMPORARIO";"MOV";"COORDENACAO DA UNIDADE CIRURGICA";"PENF";"ENFERMEIRO";"IV";"A";"18/04/2022";"2022/04/18 00:00:00";"2023/04/17 00:00:00"
11840204;2;"JANAINA APARECIDA CAMPOS";"06402717665";"14/05/1985";"CONTRATO TEMPORARIO";"MOV";"COORDENACAO DA UNIDADE DE TERAPIA INTENSIVA";"AGAS";"FISIOTERAPEUTA RESPIRATORIA";"III";"A";"23/06/2022";"2022/06/23 00:00:00";"2023/06/22 00:00:00"
14667851;2;"JANAINA CHAGAS DA SILVA";"04329911663";"01/04/1980";"CONTRATO TEMPORARIO";"";"(DESAT.)GERENCIA DE PROVIMENTO E ADMINISTRACAO DE PESSOAL";"TOS";"AUXILIAR ADMINISTRATIVO";"I";"A";"01/02/2022";"2022/02/01 00:00:00";"2023/01/31 00:00:00"
14946834;2;"JANAINA DILA PINTO";"07803918611";"28/05/1985";"CONTRATO TEMPORARIO";"HJK";"COORDENACAO DE INTERNACAO - ADULTO";"PENF";"TECNICO DE ENFERMAGEM";"II";"A";"22/04/2022";"2022/04/22 00:00:00";"2023/04/21 00:00:00"
8864472;3;"JANAINA DUARTE DE CARVALHO";"02734873613";"16/11/1975";"CONTRATO TEMPORARIO";"HJK";"COORDENACAO MEDICA DA URGENCIA E EMERGENCIA";"PENF";"ENFERMEIRO";"IV";"A";"06/07/2022";"2022/07/06 00:00:00";"2023/07/05 00:00:00"
14592182;5;"JANAINA FARNESE DA SILVA";"07086442607";"23/05/1985";"CONTRATO TEMPORARIO";"IRS";"COORDENACAO DAS UNIDADES DE INTERNACAO";"PENF";"TECNICO DE ENFERMAGEM";"II";"A";"01/03/2022";"2022/03/01 00:00:00";"2023/02/28 00:00:00"
14592182;4;"JANAINA FARNESE DA SILVA";"07086442607";"23/05/1985";"CONTRATO TEMPORARIO";"HIJPII";"COORDENACAO DAS UNIDADES DE INTERNACAO ADULTO";"PENF";"TECNICO DE ENFERMAGEM";"II";"A";"02/02/2022";"2022/02/02 00:00:00";"2023/02/01 00:00:00"
14626907;4;"JANAINA MACIEL ROSA DE PAULA";"07670652632";"03/06/1985";"CONTRATO TEMPORARIO";"IRS";"COORDENACAO TECNICA DE ENFERMAGEM";"PENF";"TECNICO DE ENFERMAGEM";"II";"A";"21/02/2022";"2022/02/21 00:00:00";"2023/02/20 00:00:00"
15115942;1;"JANAINA MARCIA DO CARMO";"04310174680";"31/01/1979";"CONTRATO TEMPORARIO";"JXXIII";"COORDENACAO DA UNIDADE DE TERAPIA INTENSIVA ADULTO";"PENF";"ENFERMEIRO";"IV";"A";"02/02/2022";"2022/02/02 00:00:00";"2023/02/01 00:00:00"
15074875;1;"JANAINA NAVES SOARES";"04077452627";"23/06/1979";"CONTRATO TEMPORARIO";"CSSFE";"COORDENACAO DA UNIDADE DE PACIENTES EXTERNOS";"AGAS";"FISIOTERAPEUTA";"I";"A";"01/02/2022";"2022/02/01 00:00:00";"2023/01/31 00:00:00"
13106398;2;"JANAYNA FERREIRA KROL";"09395207612";NA;"CONTRATO TEMPORARIO";"HIJPII";NA;"TOS";"AUXILIAR ADMINISTRATIVO";"I";"A";NA;"2022/02/01 00:00:00";"2023/01/31 00:00:00"
14541734;1;"JANDERSON NASIARENO ROSA";"08605506644";"12/02/1987";"CONTRATO TEMPORARIO";"HEM";"COORDENACAO DAS UNIDADES CRITICAS";"PENF";"TECNICO DE ENFERMAGEM";"II";"A";"04/07/2022";"2022/07/04 00:00:00";"2023/07/03 00:00:00"
14592273;2;"JANE BORBOREMA ROCHA";"06141863663";"24/02/1983";"CONTRATO TEMPORARIO";"HJK";"COORDENACAO DO LABORATORIO";"PENF";"TECNICO DE ENFERMAGEM";"II";"A";"05/02/2022";"2022/02/05 00:00:00";"2023/02/04 00:00:00"
13602370;2;"JANE IZIDORO GUIMARAES";"01440648638";"10/10/1984";"CONTRATO TEMPORARIO";"HIJPII";"COORDENACAO DAS UNIDADES DE INTERNACAO PEDIATRICA";"PENF";"TECNICO DE ENFERMAGEM";"II";"A";"04/03/2022";"2022/03/04 00:00:00";"2023/03/03 00:00:00"
14650097;2;"JANETE EMILIA MARQUES SILVA";"85906484604";"22/03/1973";"CONTRATO TEMPORARIO";"IRS";"COORDENACAO DAS UNIDADES DE INTERNACAO";"PENF";"TECNICO DE ENFERMAGEM";"II";"A";"15/02/2022";"2022/02/15 00:00:00";"2023/02/14 00:00:00"
15182736;1;"JANETE RITA DA SILVA";"89038304668";"08/08/1971";"CONTRATO TEMPORARIO";"HAC";"COORDENACAO DE INTERNACAO - ONCOLOGICA";"PENF";"TECNICO DE ENFERMAGEM";"II";"A";"28/02/2022";"2022/02/28 00:00:00";"2023/02/27 00:00:00"
13212907;3;"JANINE ARAUJO QUERINO";"01385733608";"07/01/1982";"CONTRATO TEMPORARIO";"HIJPII";"COORDENACAO DE ASSISTENCIA FARMACEUTICA";"AGAS";"FARMACEUTICO";"III";"A";"18/02/2022";"2022/02/18 00:00:00";"2023/02/17 00:00:00"
15146475;1;"JANINE MADUREIRA RODRIGUES";"08308936601";"24/06/1987";"CONTRATO TEMPORARIO";"HAC";"COORDENACAO DE INTERNACAO - ONCOLOGICA";"MED";"MEDICO CLINICO";"III";"A";"02/03/2022";"2022/03/02 00:00:00";"2023/03/01 00:00:00"
15122799;1;"JAQUELINE ANDRADE RIBEIRO COSTA SANTOS";"00118897640";"24/11/1972";"CONTRATO TEMPORARIO";"JXXIII";"COORDENACAO DAS UNIDADES DE INTERNACAO ADULTO";"PENF";"TECNICO DE ENFERMAGEM";"II";"A";"01/02/2022";"2022/02/01 00:00:00";"2023/01/31 00:00:00"
14229611;1;"JAQUELINE FERREIRA DE CASTRO";"03724117620";"20/02/1980";"CONTRATO TEMPORARIO";"MOV";"COORDENACAO DA GINECOLOGIA E OBSTETRICIA";"PENF";"ENFERMEIRO";"IV";"A";"04/03/2022";"2022/03/04 00:00:00";"2023/03/03 00:00:00"
12733374;3;"JAQUELINE GONCALVES NONAKA";"06929514667";"17/09/1984";"CONTRATO TEMPORARIO";"HJK";"COORDENACAO DA MATERNIDADE";"MED";"MEDICO GINECOLOGISTA";"III";"A";"08/03/2022";"2022/03/08 00:00:00";"2023/03/07 00:00:00"
14679666;2;"JAQUELINE PAULA DE ASSIS";"09716924674";"22/06/1990";"CONTRATO TEMPORARIO";"JXXIII";"COORDENACAO DA CENTRAL DE MATERIAL E ESTERILIZACAO";"PENF";"TECNICO DE ENFERMAGEM";"II";"A";"03/10/2022";"2022/10/03 00:00:00";"2023/10/02 00:00:00"
15124647;1;"JAQUELINE SARA SILVA CARDOSO";"01629761605";NA;"CONTRATO TEMPORARIO";"JXXIII";NA;"MEDRE";"MEDICO";"I";"A";NA;"2022/03/01 00:00:00";"2023/02/28 00:00:00"
14580245;1;"JARLES DUMONT COSTA";"04948171603";"27/11/1980";"CONTRATO TEMPORARIO";"";"(DESAT.)CENTRAL DE SERVICOS EM GESTAO DE PESSOAS";"TOS";"AUXILIAR ADMINISTRATIVO";"I";"A";"18/05/2022";"2022/05/17 00:00:00";"2023/05/16 00:00:00"
13014030;4;"JASON ALVES MARQUES";"05149555622";"29/10/1981";"CONTRATO TEMPORARIO";"HEM";"COORDENACAO DAS UNIDADES DE INTERNACAO";"MED";"MEDICO UROLOGISTA";"III";"A";"04/05/2022";"2022/05/04 00:00:00";"2023/05/03 00:00:00"
15288632;1;"JEAN MIGUEL DE MELO OLIVEIRA";"89635159668";"28/02/1976";"CONTRATO TEMPORARIO";"HEM";"COORDENACAO DAS UNIDADES DE INTERNACAO";"PENF";"ENFERMEIRO";"IV";"A";"05/07/2022";"2022/07/05 00:00:00";"2023/07/04 00:00:00"
15271372;1;"JENIFFER LAYNE DA SILVA";"12974209696";"22/10/1996";"CONTRATO TEMPORARIO";"HGB-JA";"COORDENACAO DE APOIO DIAGNOSTICO E TERAPEUTICO";"TOS";"TECNICO EM PATOLOGIA CLINICA";"II";"A";"29/06/2022";"2022/06/29 00:00:00";"2023/06/28 00:00:00"
15067283;1;"JENIFFER LEAL MARTINS DE SOUZA MENDES";"10305436660";"02/07/1989";"CONTRATO TEMPORARIO";"HEM";"COORDENACAO DAS UNIDADES DE INTERNACAO";"PENF";"TECNICO DE ENFERMAGEM";"II";"A";"02/02/2022";"2022/02/01 00:00:00";"2023/01/31 00:00:00"
14691471;2;"JENNIFER GONCALVES SOARES DE OLIVEIRA";"09481291669";"29/12/1986";"CONTRATO TEMPORARIO";"HEM";"COORDENACAO DAS UNIDADES DE INTERNACAO";"AGAS";"ASSISTENTE SOCIAL";"I";"A";"01/02/2022";"2022/02/01 00:00:00";"2023/01/31 00:00:00"
14638266;1;"JENNIFER SANTANA LOPES";"06448353623";"27/03/1984";"CONTRATO TEMPORARIO";"HGB-JA";"COORDENACAO DA UNIDADE DE URGENCIA E EMERGENCIA";"PENF";"TECNICO DE ENFERMAGEM";"II";"A";"02/02/2022";"2022/02/02 00:00:00";"2023/02/01 00:00:00"
14691513;1;"JESSICA CECILIA MARTINS REZENDE";"10048206660";"22/04/1991";"CONTRATO TEMPORARIO";"HJK";"COORDENACAO MEDICA DA URGENCIA E EMERGENCIA";"TOS";"AUXILIAR ADMINISTRATIVO";"I";"A";"02/05/2022";"2022/05/02 00:00:00";"2023/05/01 00:00:00"
15124233;1;"JESSICA MARQUES MACEDO";"01324765682";NA;"CONTRATO TEMPORARIO";"HEM";NA;"MEDRE";"MEDICO";"I";"A";NA;"2022/03/01 00:00:00";"2023/02/28 00:00:00"
15239924;1;"JESSICA MIKAELLY PEREIRA SANTOS";"10240869680";"30/01/1991";"CONTRATO TEMPORARIO";"HGB-JA";"COORDENACAO DE ASSISTENCIA FARMACEUTICA";"AGAS";"FARMACEUTICO";"III";"A";"05/05/2022";"2022/05/05 00:00:00";"2023/05/04 00:00:00"
14934251;1;"JESSICA MONIQUE ZEFERINO SILVEIRA";"09495307600";NA;"CONTRATO TEMPORARIO";"HJK";NA;"MEDRE";"MEDICO";"I";"A";NA;"2021/03/01 00:00:00";"2023/02/28 00:00:00"
14667885;1;"JESSICA PORTES JUNIOR";"10472587650";"26/08/1991";"CONTRATO TEMPORARIO";"HGB-JA";"COORDENACAO DA UNIDADE DE PACIENTES CRITICOS";"PENF";"TECNICO DE ENFERMAGEM";"II";"A";"01/02/2022";"2022/02/01 00:00:00";"2023/01/31 00:00:00"
14580260;1;"JESSICA TALITA BARNABE AMARAL COSTA";"07108671662";"24/04/1992";"CONTRATO TEMPORARIO";"MOV";"COORDENACAO DA UNIDADE DE NEONATOLOGIA";"PENF";"TECNICO DE ENFERMAGEM";"II";"A";"27/12/2017";"2021/02/01 00:00:00";"2023/01/30 00:00:00"
15089261;1;"JESSIKA DA SILVA CAMPOS";"10365232688";"10/01/1991";"CONTRATO TEMPORARIO";"HGB-JA";"COORDENACAO DE SAUDE MENTAL";"PENF";"TECNICO DE ENFERMAGEM";"II";"A";"29/06/2022";"2022/06/29 00:00:00";"2023/06/28 00:00:00"
14918858;2;"JHENNY STEPHANIE CARRANO SERAFIM";"09495213614";"04/09/1991";"CONTRATO TEMPORARIO";"HJK";"COORDENACAO DA MATERNIDADE";"PENF";"ENFERMEIRO";"IV";"A";"04/02/2022";"2022/02/04 00:00:00";"2023/02/03 00:00:00"
14900419;4;"JICELI DE ARAUJO MOURAO FERNANDES";"04310429696";"21/07/1981";"CONTRATO TEMPORARIO";"HEM";"COORDENACAO DAS UNIDADES CRITICAS";"PENF";"TECNICO DE ENFERMAGEM";"II";"A";"14/03/2022";"2022/03/14 00:00:00";"2023/03/13 00:00:00"
14900419;3;"JICELI DE ARAUJO MOURAO FERNANDES";"04310429696";"21/07/1981";"CONTRATO TEMPORARIO";"JXXIII";"COORDENACAO DO CENTRO DE TRATAMENTO DE QUEIMADOS";"PENF";"TECNICO DE ENFERMAGEM";"II";"A";"02/02/2022";"2022/02/02 00:00:00";"2023/02/01 00:00:00"
14053904;1;"JIRLANIA DIAS BRAGA";"87892260625";"28/12/1964";"CONTRATO TEMPORARIO";"HIJPII";"COORDENACAO DAS UNIDADES DE INTERNACAO PEDIATRICA";"PENF";"ENFERMEIRO";"IV";"A";"05/06/2022";"2022/06/05 00:00:00";"2023/06/04 00:00:00"
12946992;2;"JOANA D ARC CORDEIRO ROCHA";"03252882671";"29/06/1977";"CONTRATO TEMPORARIO";"JXXIII";"COORDENACAO DO CENTRO DE TRATAMENTO DE QUEIMADOS";"PENF";"TECNICO DE ENFERMAGEM";"II";"A";"01/06/2021";"2021/06/01 00:00:00";"2023/05/31 00:00:00"
14012587;3;"JOANA DARC SILVA";"03173223624";"01/08/1974";"CONTRATO TEMPORARIO";"HRAD";"COORDENACAO DAS UNIDADES DE INTERNACAO";"PENF";"TECNICO DE ENFERMAGEM";"II";"A";"0000-00-00";"2022/07/06 00:00:00";"2023/07/05 00:00:00"
14115455;2;"JOANA LUCIA HENRIQUE MOREIRA SILVA";"85892912604";"24/06/1965";"CONTRATO TEMPORARIO";"DPGF";"(DESAT.)PROCURADORIA";"TOS";"TECNICO DE CONTABILIDADE";"II";"A";"27/10/2021";"2021/10/27 00:00:00";"2023/06/30 00:00:00"
15165996;1;"JOANA MARIA ALVES";"72721596187";"08/08/1980";"CONTRATO TEMPORARIO";"CSSFA";"COORDENACAO DE GESTAO DE PESSOAS";"TOS";"TECNICO DE SEGURANCA DO TRABALHO";"II";"A";"11/04/2022";"2022/04/11 00:00:00";"2023/04/10 00:00:00"
14756597;3;"JOANA PAULA MENDES";"10275898636";"17/10/1991";"CONTRATO TEMPORARIO";"HJK";"COORDENACAO DA UNIDADE DE TERAPIA INTENSIVA ADULTO";"MED";"MEDICO CLINICO";"III";"A";"01/02/2022";"2022/02/01 00:00:00";"2023/01/31 00:00:00"
12284410;4;"JOANA STELA GONCALVES ILDELFONSO RAMOS";"03917470616";"25/09/1978";"CONTRATO TEMPORARIO";"HEM";"COORDENACAO DE ASSISTENCIA FARMACEUTICA";"AGAS";"FARMACEUTICO";"III";"A";"01/02/2022";"2022/02/01 00:00:00";"2023/01/31 00:00:00"
14607741;2;"JOAO ALVES DE ARAUJO JUNIOR";"10064517659";"14/06/1990";"CONTRATO TEMPORARIO";"HAC";"COORDENACAO DE ASSISTENCIA FARMACEUTICA";"AGAS";"FARMACEUTICO";"III";"A";"01/02/2022";"2022/02/01 00:00:00";"2023/01/31 00:00:00"
14662696;3;"JOAO CARLOS CASTRO DIAS GOMES";"07382504654";"31/12/1984";"CONTRATO TEMPORARIO";"HJK";"COORDENACAO DE COMPRAS E CONTRATOS";"TOS";"AUXILIAR ADMINISTRATIVO";"I";"A";"07/12/2021";"2021/12/07 00:00:00";"2023/06/30 00:00:00"
50367;2;"JOAO CARLOS MARTINS FASCIANI";"06699381652";"0000-00-00";NA;"HRAD";"DIRETORIA GERAL";NA;"";NA;NA;"0000-00-00";NA;NA
15339500;1;"JOAO CARLOS MARTINS FASCIANI ADM I";"06699381652";"16/05/1985";NA;"HRAD";"DIRETORIA GERAL";NA;"NAO ASSOCIADA";NA;NA;"01/10/2022";NA;NA
13028204;4;"JOAO CLAUDIO SOARES DE SOUSA";"01573465607";"11/10/1986";"CONTRATO TEMPORARIO";"HJK";"COORDENACAO CIRURGICA";"MED";"MEDICO CIRURGIAO GERAL";"III";"A";"05/02/2022";"2022/02/05 00:00:00";"2023/02/04 00:00:00"
13028204;3;"JOAO CLAUDIO SOARES DE SOUSA";"01573465607";"11/10/1986";"CONTRATO TEMPORARIO";"HAC";"COORDENACAO DO AMBULATORIO";"MED";"MEDICO CIRURGIAO GERAL";"III";"A";"08/05/2021";"2021/05/08 00:00:00";"2023/05/07 00:00:00"
14979686;1;"JOAO CLEBER ALVES SOARES";"10786497661";"04/07/1991";"CONTRATO TEMPORARIO";"HRAD";"COORDENACAO DE ASSISTENCIA FARMACEUTICA";"AGAS";"FARMACEUTICO";"I";"A";"0000-00-00";"2021/07/14 00:00:00";"2023/06/30 00:00:00"
14459077;3;"JOAO CORREA PAIXAO";"08301145641";"10/03/1989";"CONTRATO TEMPORARIO";"JXXIII";"COORDENACAO DE URGENCIA E EMERGENCIA ADULTO";"MED";"MEDICO ORTOPEDISTA E TRAUMATOLOGISTA";"III";"A";"03/03/2022";"2022/03/03 00:00:00";"2023/03/02 00:00:00"
11238334;3;"JOAO EDUARDO ROSSI DA COSTA";"08869834875";"16/05/1960";"CONTRATO TEMPORARIO";"HGB-JA";"COORDENACAO DA UNIDADE CIRURGICA";"MED";"MEDICO CIRURGIAO GERAL";"III";"A";"02/01/2022";"2022/01/02 00:00:00";"2023/01/01 00:00:00"
15261134;1;"JOAO FABIO DE CARVALHO FERREIRA";"07500635648";"26/06/1985";"CONTRATO TEMPORARIO";"CHPB";"COORDENACAO DE SAUDE MENTAL";"MED";"MEDICO PSIQUIATRA";"III";"A";"20/06/2022";"2022/06/20 00:00:00";"2023/06/19 00:00:00"
15124621;1;"JOAO FELIPE DE MOURA PINA";"06480553969";NA;"CONTRATO TEMPORARIO";"HEM";NA;"MEDRE";"MEDICO";"I";"A";NA;"2022/03/01 00:00:00";"2023/02/28 00:00:00"
14958946;2;"JOAO GUILHERME COUTO PAREDES";"39457195850";"17/03/1989";"CONTRATO TEMPORARIO";"HCM";"COORDENACAO DAS UNIDADES DE INTERNACAO";"MED";"MEDICO";"III";"A";"03/06/2022";"2022/06/03 00:00:00";"2023/06/02 00:00:00"
15071962;1;"JOAO LUCAS PINHEIRO LEITE";"11514012693";"13/05/1994";"CONTRATO TEMPORARIO";"HRJP";"COORDENACAO DE APOIO DIAGNOSTICO E TERAPEUTICO";"AGAS";"FARMACEUTICO";"I";"A";"01/02/2022";"2022/02/01 00:00:00";"2023/01/31 00:00:00"
14191522;3;"JOAO PAULO DE OLIVEIRA GUIMARAES";"06555396628";"28/02/1985";"CONTRATO TEMPORARIO";"HRAD";"COORDENACAO DA UNIDADE DE PACIENTES EXTERNOS";"MED";"MEDICO CIRURGIAO GERAL";"III";"A";"0000-00-00";"2021/12/21 00:00:00";"2023/06/30 00:00:00"
14909519;3;"JOAO PAULO FREITAS SILVA";"08078276656";"09/04/1987";"CONTRATO TEMPORARIO";"HEM";"COORDENACAO DAS UNIDADES DE INTERNACAO";"AGAS";"FISIOTERAPEUTA RESPIRATORIA";"III";"A";"05/05/2022";"2022/05/05 00:00:00";"2023/05/04 00:00:00"
14909519;2;"JOAO PAULO FREITAS SILVA";"08078276656";"09/04/1987";"CONTRATO TEMPORARIO";"HJK";"COORDENACAO DA EQUIPE MULTIDISCIPLINAR";"AGAS";"FISIOTERAPEUTA RESPIRATORIA";"III";"A";"02/07/2022";"2022/07/02 00:00:00";"2023/07/01 00:00:00"
15154297;1;"JOAO PAULO MORAIS NEIVA";"08670592657";"28/09/1991";"CONTRATO TEMPORARIO";"JXXIII";"COORDENACAO DE URGENCIA E EMERGENCIA ADULTO";"MED";"MEDICO GENERALISTA";"I";"A";"05/02/2022";"2022/02/05 00:00:00";"2023/02/04 00:00:00"
14909196;3;"JOAO PAULO SILVA BARBATO";"11131368630";"27/06/1992";"CONTRATO TEMPORARIO";"HAC";"COORDENACAO DE ARQUIVO MEDICO E ESTATISTICA";"TOS";"AUXILIAR ADMINISTRATIVO";"I";"A";"01/02/2022";"2022/02/01 00:00:00";"2023/01/31 00:00:00"
15115561;1;"JOAO PEDRO DA SILVA SOUTO";"11905076681";"15/11/1994";"CONTRATO TEMPORARIO";"HMAL";"COORDENACAO DE COMPRAS E CONTRATOS";"TOS";"AUXILIAR ADMINISTRATIVO";"I";"A";"01/02/2022";"2022/02/01 00:00:00";"2023/01/31 00:00:00"
15076813;1;"JOAO PEDRO FROES CHAGA";"12937912613";"30/09/1995";"CONTRATO TEMPORARIO";"HCM";"COORDENACAO TECNICA DE ENFERMAGEM";"PENF";"TECNICO DE ENFERMAGEM";"II";"A";"01/02/2022";"2022/02/01 00:00:00";"2023/01/31 00:00:00"
14355713;2;"JOAO REVERT GOMES";"05989030622";"16/10/1984";"CONTRATO TEMPORARIO";"HMAL";"COORDENACAO DO BLOCO CIRURGICO";"PENF";"TECNICO DE ENFERMAGEM";"II";"A";"03/03/2022";"2022/03/03 00:00:00";"2023/03/02 00:00:00"
15264633;1;"JOAO VICTOR NEZIO DE CARVALHO";"11284398676";"23/05/1991";"CONTRATO TEMPORARIO";"HGB-JA";"COORDENACAO DA UNIDADE CIRURGICA";"MED";"MEDICO ANESTESIOLOGISTA";"III";"A";"29/06/2022";"2022/06/30 00:00:00";"2022/12/26 00:00:00"
15265044;1;"JOAO VIEIRA DE ALMEIDA NETO";"06917559652";"16/11/1989";"CONTRATO TEMPORARIO";"CHPB";"COORDENACAO DA UNIDADE CIRURGICA";"MED";"MEDICO GENERALISTA";"I";"A";"27/06/2022";"2022/06/27 00:00:00";"2022/12/23 00:00:00"
14884118;1;"JOAO VITOR COTRIM GONCALVES";"05476222529";NA;"CONTRATO TEMPORARIO";"HJK";NA;"MEDRE";"MEDICO";"I";"A";NA;"2020/03/01 00:00:00";"2023/02/28 00:00:00"
15189582;1;"JOAO VITOR LIBONI GUIMARAES RIOS";"13282855613";NA;"CONTRATO TEMPORARIO";"HMAL";NA;"MEDRE";"MEDICO";"I";"A";NA;"2022/03/01 00:00:00";"2023/02/28 00:00:00"
12044426;2;"JOELMA APARECIDA DA SILVA RIBEIRO";"54185483600";"22/06/1965";"CONTRATO TEMPORARIO";"HRJP";"COORDENACAO DA MATERNIDADE";"PENF";"TECNICO DE ENFERMAGEM";"II";"A";"01/02/2022";"2022/02/01 00:00:00";"2023/01/31 00:00:00"
15261498;1;"JOHNATHAN NEDSON FARIAS PEREIRA DA SILVA";"06527927665";"18/07/1984";"CONTRATO TEMPORARIO";"CSSI";"COORDENACAO DA UNIDADE DE PACIENTES EXTERNOS";"MED";"MEDICO GENERALISTA";"I";"A";"21/06/2022";"2022/06/21 00:00:00";"2023/06/20 00:00:00"
14615447;3;"JOICE COUTINHO DE ALVARENGA";"12180385781";"09/05/1993";"CONTRATO TEMPORARIO";"JXXIII";"COORDENACAO DA UNIDADE DE TERAPIA INTENSIVA ADULTO";"MED";"MEDICO CLINICO";"III";"A";"01/02/2022";"2022/02/01 00:00:00";"2023/01/31 00:00:00"
14039911;3;"JOICE DE OLIVEIRA GOMES";"08134353665";"19/12/1984";"CONTRATO TEMPORARIO";"HRJP";"COORDENACAO DE GESTAO DE PESSOAS";"TOS";"AUXILIAR ADMINISTRATIVO";"I";"A";"01/02/2022";"2022/02/01 00:00:00";"2023/01/31 00:00:00"
10878528;2;"JONAS FERREIRA DE SOUZA";"74202499620";"29/09/1965";"CONTRATO TEMPORARIO";"IRS";"COORDENACAO DAS UNIDADES DE INTERNACAO";"PENF";"TECNICO DE ENFERMAGEM";"II";"A";"01/02/2022";"2022/02/01 00:00:00";"2023/01/31 00:00:00"
14650048;2;"JONAS SOARES SILVA SANTOS";"07093204694";"08/08/1984";"CONTRATO TEMPORARIO";"JXXIII";"COORDENACAO DE URGENCIA E EMERGENCIA ADULTO";"MED";"MEDICO NEUROCIRURGIAO";"III";"A";"03/03/2022";"2022/03/03 00:00:00";"2023/03/02 00:00:00"
15067069;1;"JONATHAN FIUZA DA CRUZ";"09859889678";"13/02/1989";"CONTRATO TEMPORARIO";"JXXIII";"COORDENACAO DE DIAGNOSTICO POR IMAGEM";"TOS";"TECNICO EM RADIOLOGIA";"II";"A";"15/01/2022";"2022/01/15 00:00:00";"2023/01/14 00:00:00"
15107063;1;"JORDANA CRISTILANE ALVES PEREIRA";"01422830616";"26/06/1982";"CONTRATO TEMPORARIO";"JXXIII";"COORDENACAO DE DIAGNOSTICO POR IMAGEM";"TOS";"TECNICO EM RADIOLOGIA";"II";"A";"01/02/2022";"2022/02/01 00:00:00";"2023/01/31 00:00:00"
15072622;1;"JORDANA MARA OLIVEIRA DOS PRAZERES";"01467353663";"13/04/1982";"CONTRATO TEMPORARIO";"HRJP";"COORDENACAO DAS UNIDADES DE INTERNACAO";"PENF";"TECNICO DE ENFERMAGEM";"II";"A";"01/02/2022";"2022/02/01 00:00:00";"2023/01/31 00:00:00"
14880504;1;"JORDANA MOL TEIXEIRA VIEIRA";"09034335674";NA;"CONTRATO TEMPORARIO";"MOV";NA;"MEDRE";"MEDICO";"I";"A";NA;"2020/03/01 00:00:00";"2023/02/28 00:00:00"
15146368;1;"JORDIAN JORGE PINHEIRO";"10773350675";"04/11/1993";"CONTRATO TEMPORARIO";"HAC";"COORDENACAO DA UNIDADE DE TERAPIA INTENSIVA ADULTO";"MED";"MEDICO CLINICO";"III";"A";"04/03/2022";"2022/03/04 00:00:00";"2023/03/03 00:00:00"
13004106;2;"JORGE FELLIPE GARCIA VIEIRA";"09842341607";"17/10/1989";"CONTRATO TEMPORARIO";"JXXIII";"COORDENACAO DAS UNIDADES DE INTERNACAO CIRURGICA";"PENF";"TECNICO DE ENFERMAGEM";"II";"A";"25/06/2022";"2022/06/25 00:00:00";"2023/06/24 00:00:00"
14914592;2;"JORGE LOPES DE OLIVEIRA JUNIOR";"96027037687";"12/01/1975";"CONTRATO TEMPORARIO";"";"(DESAT.)GERENCIA DE INFRAESTRUTURA PREDIAL";"AGAS";"ENGENHEIRO";"I";"A";"01/02/2022";"2022/02/01 00:00:00";"2023/01/31 00:00:00"
12697918;3;"JORGE LUIZ PEDRO";"04054646654";"17/04/1980";"CONTRATO TEMPORARIO";"HJK";"COORDENACAO MEDICA DA URGENCIA E EMERGENCIA";"PENF";"ENFERMEIRO";"IV";"A";"06/02/2022";"2022/02/06 00:00:00";"2023/02/05 00:00:00"
14937858;1;"JORGE SILVEIRA JUNIOR";"03646400579";NA;"CONTRATO TEMPORARIO";"JXXIII";NA;"MEDRE";"MEDICO";"I";"A";NA;"2021/03/01 00:00:00";"2023/02/28 00:00:00"
14915110;1;"JOSE ANTONIO GUERRA";"81726350606";"08/11/1973";"CONTRATO TEMPORARIO";"HJK";"GERENCIA DE GESTAO DE PESSOAS";"TOS";"AUXILIAR ADMINISTRATIVO";"I";"A";"01/02/2022";"2022/02/01 00:00:00";"2023/01/31 00:00:00"
12104766;4;"JOSE ANTONIO INACIO";"04016634695";"23/10/1979";"CONTRATO TEMPORARIO";"HEM";"COORDENACAO DAS UNIDADES CRITICAS";"PENF";"TECNICO DE ENFERMAGEM";"II";"A";"01/02/2022";"2022/02/01 00:00:00";"2023/01/31 00:00:00"
10877504;3;"JOSE ANTONIO MILAGRES";"42431875687";"17/07/1967";"CONTRATO TEMPORARIO";"HGB-JA";"COORDENACAO DA UNIDADE CIRURGICA";"MED";"MEDICO NEUROCIRURGIAO";"III";"A";"01/07/2021";"2021/07/01 00:00:00";"2023/06/30 00:00:00"
14955637;1;"JOSE APARECIDO DE LISBOA";"87816741804";"02/10/1956";"CONTRATO TEMPORARIO";"AJUR";"(DESAT.)GERENCIA DE INFRAESTRUTURA PREDIAL";"AGAS";"ENGENHEIRO";"III";"A";"12/04/2021";"2021/04/12 00:00:00";"2023/04/11 00:00:00"
15074917;1;"JOSE AVELINO NETO";"07286809636";"24/03/1986";"CONTRATO TEMPORARIO";"HRJP";"COORDENACAO DE APOIO DIAGNOSTICO E TERAPEUTICO";"TOS";"TECNICO EM PATOLOGIA CLINICA";"II";"A";"25/01/2022";"2022/01/25 00:00:00";"2023/01/24 00:00:00"
15270861;1;"JOSE CARLOS LEMOS";"57724059691";"29/09/1966";"CONTRATO TEMPORARIO";"HJK";"COORDENACAO DE ARQUIVO MEDICO E ESTATISTICA";"TOS";"AUXILIAR ADMINISTRATIVO";"I";"A";"04/07/2022";"2022/07/04 00:00:00";"2023/07/03 00:00:00"
13804679;2;"JOSE CARLOS PISSOLATTI DE OLIVEIRA";"03724637624";"01/03/1980";"CONTRATO TEMPORARIO";"HGB-JA";"COORDENACAO DA UNIDADE DE URGENCIA E EMERGENCIA";"PENF";"TECNICO DE ENFERMAGEM";"II";"A";"01/02/2022";"2022/02/01 00:00:00";"2023/01/31 00:00:00"
15126071;1;"JOSE HYDE AUGUSTO ZSCHABER ANACLETO";"13092373600";NA;"CONTRATO TEMPORARIO";"JXXIII";NA;"MEDRE";"MEDICO";"I";"A";NA;"2021/03/01 00:00:00";"2023/02/28 00:00:00"
14376941;4;"JOSE ILDEVALDO DE CARVALHO JUNIOR";"03158036657";"23/08/1975";"CONTRATO TEMPORARIO";"HEM";"COORDENACAO DE APOIO DIAGNOSTICO E TERAPEUTICO";"MED";"MEDICO CARDIOLOGISTA";"III";"A";"10/02/2022";"2022/02/10 00:00:00";"2023/02/09 00:00:00"
15124365;2;"JOSE MARCELINO SILVA GARCIA";"95589503272";"18/06/1993";"CONTRATO TEMPORARIO";"IRS";"COORDENACAO DA UNIDADE DE PACIENTES EXTERNOS";"MED";"MEDICO PSIQUIATRA";"III";"A";"09/05/2022";"2022/05/09 00:00:00";"2023/05/08 00:00:00"
10870939;4;"JOSE MARCOS CALIX";"74658832615";"25/05/1969";"CONTRATO TEMPORARIO";"HGB-JA";"COORDENACAO DA UNIDADE DE URGENCIA E EMERGENCIA";"PENF";"TECNICO DE ENFERMAGEM";"II";"A";"02/02/2022";"2022/02/02 00:00:00";"2023/02/01 00:00:00"
14480537;3;"JOSE MARIA CORREA";"04474390652";"16/05/1980";"CONTRATO TEMPORARIO";"HMAL";"COORDENACAO DAS UNIDADES DE INTERNACAO ADULTO";"PENF";"TECNICO DE ENFERMAGEM";"II";"A";"04/03/2022";"2022/03/04 00:00:00";"2023/03/03 00:00:00"
15240476;1;"JOSE MARQUES MOREIRA";"95642331604";"24/03/1974";"CONTRATO TEMPORARIO";"HIJPII";"COORDENACAO DE TECNOLOGIA DA INFORMACAO";"TOS";"TECNICO EM INFORMATICA";"II";"A";"31/05/2022";"2022/05/31 00:00:00";"2023/05/30 00:00:00"
14052682;4;"JOSE MAURICIO ALVES TEIXEIRA";"70539634700";"22/06/1962";"CONTRATO TEMPORARIO";"HGB-JA";"COORDENACAO DA UNIDADE CIRURGICA";"MED";"MEDICO ANESTESIOLOGISTA";"III";"A";"29/12/2021";"2021/12/29 00:00:00";"2023/06/30 00:00:00"
14052682;3;"JOSE MAURICIO ALVES TEIXEIRA";"70539634700";"22/06/1962";"CONTRATO TEMPORARIO";"HGB-JA";"COORDENACAO DA UNIDADE CIRURGICA";"MED";"MEDICO ANESTESIOLOGISTA";"III";"A";"28/06/2021";"2021/06/28 00:00:00";"2023/06/27 00:00:00"
14052310;2;"JOSE NILSON FERREIRA";"03471946640";"29/04/1981";"CONTRATO TEMPORARIO";"HMAL";"COORDENACAO DE TECNOLOGIA DA INFORMACAO";"TOS";"TECNICO EM INFORMATICA";"II";"A";"08/02/2022";"2022/02/08 00:00:00";"2023/02/07 00:00:00"
13307699;5;"JOSE REINALDO RIBEIRO DE QUEIROZ JUNIOR";"05238117647";"30/07/1983";"CONTRATO TEMPORARIO";"JXXIII";"COORDENACAO DE URGENCIA E EMERGENCIA ADULTO";"MED";"MEDICO CIRURGIAO GERAL";"III";"A";"03/03/2022";"2022/03/03 00:00:00";"2023/03/02 00:00:00"
90019176;9;"JOSE REINALDO RIBEIRO DE QUEIROZ JUNIOR IV";"05238117647";"0000-00-00";NA;"HJXXIII";"COORDENACAO DE GESTAO DE PESSOAS";NA;"";NA;NA;"0000-00-00";NA;NA
13313002;1;"JOSE RONALDO ARLINDO";"05856360605";"15/09/1983";"CONTRATO TEMPORARIO";"CSSFE";"COORDENACAO DE APOIO DIAGNOSTICO E TERAPEUTICO";"TOS";"AUXILIAR ADMINISTRATIVO";"I";"A";"01/02/2022";"2022/02/01 00:00:00";"2023/01/31 00:00:00"
15071954;1;"JOSIANE APARECIDA DE SOUZA";"04900866679";"23/08/1982";"CONTRATO TEMPORARIO";"HRJP";"COORDENACAO DE ASSISTENCIA FARMACEUTICA";"TOS";"TECNICO EM FARMACIA";"II";"A";"01/02/2022";"2022/02/01 00:00:00";"2023/01/31 00:00:00"
15107550;1;"JOSIANE DIAS SOARES LEITE";"01654099678";"14/01/1988";"CONTRATO TEMPORARIO";"DPGF";"(DESAT.)COORDENACAO DE ESTAGIO E EXTENSAO";"TOS";"AUXILIAR ADMINISTRATIVO";"I";"A";"01/02/2022";"2022/02/01 00:00:00";"2023/01/31 00:00:00"
14557391;1;"JOSIANE MENDES DE SOUZA";"08804360690";"09/02/1988";"CONTRATO TEMPORARIO";"HJK";"COORDENACAO MEDICA DA URGENCIA E EMERGENCIA";"PENF";"TECNICO DE ENFERMAGEM";"II";"A";"03/02/2022";"2022/02/03 00:00:00";"2023/02/02 00:00:00"
14841357;1;"JOSIANE MOREIRA DE SOUZA";"07404641675";"19/11/1985";"CONTRATO TEMPORARIO";"HJK";"COORDENACAO DE INTERNACAO - ADULTO";"PENF";"TECNICO DE ENFERMAGEM";"II";"A";"14/11/2019";"2021/02/01 00:00:00";"2023/01/31 00:00:00"
14667943;2;"JOSIMARA CORDEIRO FERREIRA";"07020073662";"02/09/1986";"CONTRATO TEMPORARIO";"HCM";"COORDENACAO DAS UNIDADES DE INTERNACAO";"AGAS";"ASSISTENTE SOCIAL";"I";"A";"01/02/2022";"2022/02/01 00:00:00";"2023/01/31 00:00:00"
13713078;2;"JOSMILDA HENRIQUES MORETO";"06392681612";"25/10/1984";"CONTRATO TEMPORARIO";"HRJP";"COORDENACAO DAS UNIDADES DE INTERNACAO";"PENF";"TECNICO DE ENFERMAGEM";"II";"A";"01/07/2022";"2022/07/02 00:00:00";"2023/07/01 00:00:00"
15316755;1;"JOSYENE CONSTANT DA SILVA";"07538810633";"09/01/1985";"CONTRATO TEMPORARIO";"HRJP";"COORDENACAO DE APOIO DIAGNOSTICO E TERAPEUTICO";"TOS";"TECNICO EM PATOLOGIA CLINICA";"II";"A";"09/09/2022";"2022/09/12 00:00:00";"2023/09/11 00:00:00"
14919658;1;"JOYCE APARECIDA DA SILVA";"11642348627";"27/08/1993";"CONTRATO TEMPORARIO";"HGB-JA";"COORDENACAO DA UNIDADE DE URGENCIA E EMERGENCIA";"PENF";"TECNICO DE ENFERMAGEM";"II";"A";"30/06/2022";"2022/06/30 00:00:00";"2023/06/29 00:00:00"
15237910;1;"JOYCE APARECIDA RODRIGUES";"05331942610";"04/03/1983";"CONTRATO TEMPORARIO";"HEM";"COORDENACAO DE APOIO DIAGNOSTICO E TERAPEUTICO";"TOS";"TECNICO EM PATOLOGIA CLINICA";"II";"A";"13/05/2022";"2022/05/13 00:00:00";"2023/05/12 00:00:00"
14850085;2;"JOYCE MARIANE SILVA FUJITA";"36820510829";"10/11/1989";"CONTRATO TEMPORARIO";"HMAL";"COORDENACAO DO AMBULATORIO ADULTO";"PENF";"ENFERMEIRO";"IV";"A";"26/09/2022";"2022/09/26 00:00:00";"2023/09/25 00:00:00"
14934335;1;"JOYCE MENDES DE SA";"11403442690";NA;"CONTRATO TEMPORARIO";"HJK";NA;"MEDRE";"MEDICO";"I";"A";NA;"2021/03/03 00:00:00";"2023/03/02 00:00:00"
14756605;5;"JOYCE RODRIGUES DOS SANTOS";"11130027600";"22/09/1994";"CONTRATO TEMPORARIO";"HJK";"COORDENACAO DA UNIDADE DE TERAPIA INTENSIVA ADULTO";"MED";"MEDICO CLINICO";"III";"A";"29/04/2021";"2021/04/29 00:00:00";"2023/04/28 00:00:00"
14946479;1;"JUCELIA DE FREITAS SOUZA";"00035719206";"29/07/1991";"CONTRATO TEMPORARIO";"HCM";"COORDENACAO TECNICA DE ENFERMAGEM";"PENF";"TECNICO DE ENFERMAGEM";"II";"A";"09/03/2021";"2021/03/09 00:00:00";"2023/03/08 00:00:00"
9777046;5;"JUCELIO ALVES TORRES";"00252402693";"19/01/1974";"CONTRATO TEMPORARIO";"HJK";"COORDENACAO MEDICA DA URGENCIA E EMERGENCIA";"MED";"MEDICO CLINICO";"III";"A";"27/07/2016";"2021/02/01 00:00:00";"2023/01/31 00:00:00"
11238508;4;"JUDITE INES DE OLIVEIRA";"20843860634";"21/01/1950";"CONTRATO TEMPORARIO";"HGB-JA";"COORDENACAO DA UNIDADE DE CLINICA MEDICA";"MED";"MEDICO CLINICO";"III";"A";"28/11/2021";"2021/11/28 00:00:00";"2023/06/30 00:00:00"
14937866;1;"JULIA ALCANTARA COSTA";"13046371667";NA;"CONTRATO TEMPORARIO";"JXXIII";NA;"MEDRE";"MEDICO";"I";"A";NA;"2021/03/01 00:00:00";"2023/02/28 00:00:00"
14930531;1;"JULIA AMELIA RICCI";"11381112609";NA;"CONTRATO TEMPORARIO";"HEM";NA;"MEDRE";"MEDICO";"I";"A";NA;"2021/03/01 00:00:00";"2023/02/28 00:00:00"
15067895;1;"JULIA ARAUJO PRADO";"11931821666";"25/02/1994";"CONTRATO TEMPORARIO";"JXXIII";"GERENCIA DA EQUIPE MULTIDISCIPLINAR";"AGAS";"PSICOLOGO";"I";"A";"01/02/2022";"2022/02/01 00:00:00";"2023/01/31 00:00:00"
15204282;1;"JULIA BARROS SILVA";"08686901638";NA;"CONTRATO TEMPORARIO";"JXXIII";NA;"MEDRE";"MEDICO";"I";"A";NA;"2022/03/30 00:00:00";"2023/03/29 00:00:00"
14756480;5;"JULIA BATISTA RODARTE";"11551027623";"22/11/1994";"CONTRATO TEMPORARIO";"JXXIII";"COORDENACAO DAS UNIDADES DE INTERNACAO ADULTO";"MED";"MEDICO CLINICO";"III";"A";"20/04/2022";"2022/04/20 00:00:00";"2023/04/19 00:00:00"
14913446;1;"JULIA BICALHO SANTOS";"04603406622";"01/03/1980";"CONTRATO TEMPORARIO";"DIGEPE";"(DESAT.)DIRETORIA DE GESTAO DE PESSOAS (DIGEPE)";"AGAS";"ADVOGADO";"I";"A";"01/02/2022";"2022/02/01 00:00:00";"2023/01/31 00:00:00"
13637541;2;"JULIA BRANDAO PINTO";"07286564692";"15/08/1984";"CONTRATO TEMPORARIO";"HJK";"COORDENACAO MEDICA DA TERAPIA INTENSIVA NEONATAL";"MED";"MEDICO PEDIATRA";"III";"A";"03/02/2022";"2022/02/03 00:00:00";"2023/02/02 00:00:00"
14417612;2;"JULIA CASTRO DAMASIO FERREIRA";"08570105657";"15/05/1990";"CONTRATO TEMPORARIO";"MOV";"COORDENACAO DA GINECOLOGIA E OBSTETRICIA";"MED";"MEDICO GINECOLOGISTA";"III";"A";"02/02/2022";"2022/02/02 00:00:00";"2023/02/01 00:00:00"
14928824;1;"JULIA CIPRIANO ROCHA";"12302196686";NA;"CONTRATO TEMPORARIO";"IRS";NA;"MEDRE";"MEDICO";"I";"A";NA;"2021/03/01 00:00:00";"2023/02/28 00:00:00"
13604632;4;"JULIA COELHO CORREA";"09758639676";"06/06/1990";"CONTRATO TEMPORARIO";"MOV";"COORDENACAO DA GINECOLOGIA E OBSTETRICIA";"MED";"MEDICO GINECOLOGISTA";"III";"A";"06/10/2021";"2021/10/06 00:00:00";"2023/06/30 00:00:00"
15123243;1;"JULIA DE OLIVERA CASTRO";"13659288616";NA;"CONTRATO TEMPORARIO";"HRJP";NA;"MEDRE";"MEDICO";"I";"A";NA;"2022/03/01 00:00:00";"2023/03/28 00:00:00"
14925606;1;"JULIA DOMINGUES BARBOSA";"10325659699";NA;"CONTRATO TEMPORARIO";"MOV";NA;"MEDRE";"MEDICO";"I";"A";NA;"2021/03/01 00:00:00";"2023/02/28 00:00:00"
15287014;1;"JULIA DONATONI CAPORALLI";"10215185650";"15/08/1994";"CONTRATO TEMPORARIO";"HIJPII";"COORDENACAO DE URGENCIA E EMERGENCIA PEDIATRICA";"MED";"MEDICO GENERALISTA";"I";"A";"01/07/2022";"2022/07/01 00:00:00";"2022/12/27 00:00:00"
14930549;1;"JULIA GONCALVES FALEIROS CARDOSO";"09865372681";NA;"CONTRATO TEMPORARIO";"HEM";NA;"MEDRE";"MEDICO";"I";"A";NA;"2021/03/01 00:00:00";"2023/02/28 00:00:00"
14480628;1;"JULIA GRACIELA DE ARAUJO SILVA";"08999443612";"05/09/1987";"CONTRATO TEMPORARIO";"HRAD";"COORDENACAO DA MATERNIDADE";"PENF";"TECNICO DE ENFERMAGEM";"II";"A";"0000-00-00";"2022/02/01 00:00:00";"2023/01/31 00:00:00"
15078173;1;"JULIA INEZ HONORIO PEREIRA";"01606059629";"16/12/1987";"CONTRATO TEMPORARIO";"HRAD";"COORDENACAO DAS UNIDADES CRITICAS";"TOS";"AUXILIAR ADMINISTRATIVO";"I";"A";"01/02/2022";"2022/02/01 00:00:00";"2023/01/31 00:00:00"
14716336;2;"JULIA NAZARE DE SOUZA";"80449158691";"20/04/1970";"CONTRATO TEMPORARIO";"JXXIII";"DIRETORIA GERAL";"TOS";"AUXILIAR ADMINISTRATIVO";"I";"A";"01/02/2022";"2022/02/01 00:00:00";"2023/01/31 00:00:00"
15152143;1;"JULIA PASSINI VAZ TOSTES";"11530844657";"08/12/1994";"CONTRATO TEMPORARIO";"JXXIII";"COORDENACAO DA UNIDADE DE TERAPIA INTENSIVA ADULTO";"MED";"MEDICO CLINICO";"III";"A";"03/03/2022";"2022/03/03 00:00:00";"2023/03/02 00:00:00"
14896401;1;"JULIA ROSA PINTO";"11731078609";"21/09/1994";"CONTRATO TEMPORARIO";"HGB-JA";"COORDENACAO DE SAUDE MENTAL";"PENF";"TECNICO DE ENFERMAGEM";"II";"A";"01/02/2022";"2022/02/01 00:00:00";"2023/01/31 00:00:00"
14925994;1;"JULIA SOARES VIEIRA";"12332035680";NA;"CONTRATO TEMPORARIO";"HRJP";NA;"MEDRE";"MEDICO";"I";"A";NA;"2021/03/01 00:00:00";"2023/02/28 00:00:00"
14944904;2;"JULIA TEIXEIRA NEVES BINDA";"13104859760";"10/03/1997";"CONTRATO TEMPORARIO";"JXXIII";"COORDENACAO DE URGENCIA E EMERGENCIA PEDIATRICA";"MED";"MEDICO GENERALISTA";"I";"A";"02/07/2022";"2022/07/01 00:00:00";"2022/12/27 00:00:00"
14944904;1;"JULIA TEIXEIRA NEVES BINDA";"13104859760";NA;"CONTRATO TEMPORARIO";"HIJPII";NA;"MEDRE";"MEDICO";"I";"A";NA;"2021/03/01 00:00:00";"2023/02/28 00:00:00"
13553250;3;"JULIAN PASSOS";"26062989850";"27/10/1974";"CONTRATO TEMPORARIO";"HRAD";"COORDENACAO DA UNIDADE DE PACIENTES EXTERNOS";"MED";"MEDICO CLINICO";"III";"A";"0000-00-00";"2021/11/04 00:00:00";"2023/06/30 00:00:00"
14581581;2;"JULIANA APARECIDA RABELO VAZ";"04063522679";"03/11/1975";"CONTRATO TEMPORARIO";"IRS";"COORDENACAO DE GESTAO DE PESSOAS";"TOS";"AUXILIAR ADMINISTRATIVO";"I";"A";"01/07/2022";"2022/07/01 00:00:00";"2023/06/30 00:00:00"
14723100;1;"JULIANA APARECIDA RODRIGUES";"09765334648";"10/11/1988";"CONTRATO TEMPORARIO";"HGB-JA";"COORDENACAO DA UNIDADE CIRURGICA";"TOS";"AUXILIAR ADMINISTRATIVO";"I";"A";"03/02/2022";"2022/02/01 00:00:00";"2023/01/31 00:00:00"
12968913;2;"JULIANA BRITO DE PAULA";"07527336641";"12/04/1985";"CONTRATO TEMPORARIO";"JXXIII";"COORDENACAO DE FATURAMENTO";"TOS";"AUXILIAR ADMINISTRATIVO";"I";"A";"13/06/2022";"2022/06/13 00:00:00";"2023/06/12 00:00:00"
14723084;2;"JULIANA CARVALHO MARTINS";"04049477602";"21/04/1978";"CONTRATO TEMPORARIO";"HEM";"COORDENACAO DE APOIO DIAGNOSTICO E TERAPEUTICO";"AGAS";"FARMACEUTICO";"I";"A";"16/01/2019";"2022/02/01 00:00:00";"2023/01/31 00:00:00"
1323426;0;"JULIANA CLOTILDES DE OLIVEIRA SANTOS";"01323426698";"0000-00-00";NA;"HAC";"COORDENACAO CIRURGICA";NA;"";NA;NA;"0000-00-00";NA;NA
14880090;1;"JULIANA CORREA DE OLIVEIRA";"05322273603";NA;"CONTRATO TEMPORARIO";"HJK";NA;"MEDRE";"MEDICO";"I";"A";NA;"2021/03/16 00:00:00";"2023/03/15 00:00:00"
14022081;2;"JULIANA CRISTINA DE SOUZA DIAS";"06213486607";"17/11/1984";"CONTRATO TEMPORARIO";"JXXIII";"COORDENACAO DE DIAGNOSTICO POR IMAGEM";"MED";"MEDICO EM RADIOLOG.E DIAGNOST.POR IMAGEM";"III";"A";"25/10/2021";"2021/10/25 00:00:00";"2023/06/30 00:00:00"
15073026;1;"JULIANA CRISTINA DOS SANTOS FERRAZ DUTRA";"06596869610";"09/12/1984";"CONTRATO TEMPORARIO";"IRS";"COORDENACAO TECNICA DE ENFERMAGEM";"PENF";"ENFERMEIRO";"IV";"A";"03/02/2022";"2022/02/03 00:00:00";"2023/02/02 00:00:00"
14955504;1;"JULIANA CRISTINA GONCALVES DOS SANTOS";"00075799693";"14/04/1975";"CONTRATO TEMPORARIO";"MOV";"COORDENACAO DA UNIDADE DE NEONATOLOGIA";"PENF";"TECNICO DE ENFERMAGEM";"II";"A";"20/04/2021";"2021/04/20 00:00:00";"2023/04/19 00:00:00"
14756613;5;"JULIANA CRISTINA NUNES";"10522249620";"10/03/1994";"CONTRATO TEMPORARIO";"HJK";"COORDENACAO DA UNIDADE DE TERAPIA INTENSIVA ADULTO";"MED";"MEDICO CLINICO";"III";"A";"08/05/2021";"2021/05/08 00:00:00";"2023/05/07 00:00:00"
15084874;1;"JULIANA CRISTINA SIMOES DA SILVA";"10670461601";"18/06/1991";"CONTRATO TEMPORARIO";"JXXIII";"COORDENACAO DAS UNIDADES DE INTERNACAO ADULTO";"PENF";"TECNICO DE ENFERMAGEM";"II";"A";"03/02/2022";"2022/02/03 00:00:00";"2023/02/02 00:00:00"
13804240;4;"JULIANA DA ROCHA";"27374271859";"05/05/1976";"CONTRATO TEMPORARIO";"CHPB";"COORDENACAO DA UNIDADE DE URGENCIA E EMERGENCIA";"PENF";"TECNICO DE ENFERMAGEM";"II";"A";"15/03/2021";"2021/03/15 00:00:00";"2023/03/14 00:00:00"
13804240;3;"JULIANA DA ROCHA";"27374271859";"05/05/1976";"CONTRATO TEMPORARIO";"CHPB";"COORDENACAO DA UNIDADE DE PACIENTES CRITICOS";"PENF";"TECNICO DE ENFERMAGEM";"II";"A";"07/09/2022";"2022/09/07 00:00:00";"2023/09/06 00:00:00"
14912232;2;"JULIANA DA SILVA NUNES";"05851225637";"24/04/1984";"CONTRATO TEMPORARIO";"JXXIII";"COORDENACAO DE ASSISTENCIA FARMACEUTICA";"TOS";"TECNICO EM FARMACIA";"II";"A";"02/02/2022";"2022/02/02 00:00:00";"2023/02/01 00:00:00"
14900559;1;"JULIANA DA SILVA VAQUEIRO RIBEIRO";"06771615650";"18/04/1987";"CONTRATO TEMPORARIO";"JXXIII";"COORDENACAO DE LABORATORIO E AGENCIA TRANSFUSIONAL";"TOS";"TECNICO EM PATOLOGIA CLINICA";"II";"A";"01/07/2022";"2022/07/01 00:00:00";"2022/12/27 00:00:00"
14925564;1;"JULIANA DE OLIVEIRA LOURA";"12054423670";NA;"CONTRATO TEMPORARIO";"MOV";NA;"MEDRE";"MEDICO";"I";"A";NA;"2021/03/01 00:00:00";"2023/02/28 00:00:00"
14791867;1;"JULIANA DE SOUZA CORREA";"04423269635";"12/08/1977";"CONTRATO TEMPORARIO";"HJK";"COORDENACAO MEDICA DA URGENCIA E EMERGENCIA";"PENF";"TECNICO DE ENFERMAGEM";"II";"A";"08/06/2019";"2021/02/01 00:00:00";"2023/01/31 00:00:00"
12700118;1;"JULIANA DINIZ CORREA PINTO";"87550342687";"30/04/1971";"CONTRATO TEMPORARIO";"AJUR";"(DESAT.)PROCURADORIA";"AGAS";"ADVOGADO";"I";"A";"13/04/2018";"2022/05/10 00:00:00";"2023/05/09 00:00:00"
15074941;2;"JULIANA EVANGELISTA MAGALHAES";"08723795662";"25/04/1989";"CONTRATO TEMPORARIO";"HRJP";"COORDENACAO DAS UNIDADES CRITICAS";"PENF";"TECNICO DE ENFERMAGEM";"II";"A";"02/07/2022";"2022/07/02 00:00:00";"2023/07/01 00:00:00"
15074941;1;"JULIANA EVANGELISTA MAGALHAES";"08723795662";"25/04/1989";"CONTRATO TEMPORARIO";"HRJP";"COORDENACAO DAS UNIDADES DE INTERNACAO";"PENF";"TECNICO DE ENFERMAGEM";"II";"A";"01/02/2022";"2022/02/01 00:00:00";"2023/01/31 00:00:00"
14910251;2;"JULIANA FERNANDES DE SOUZA";"07011230602";"20/09/1983";"CONTRATO TEMPORARIO";"JXXIII";"COORDENACAO DO CENTRO DE TRATAMENTO DE QUEIMADOS";"PENF";"TECNICO DE ENFERMAGEM";"II";"A";"09/09/2021";"2021/09/09 00:00:00";"2023/06/30 00:00:00"
13047287;3;"JULIANA HELENA GONCALVES BATISTA";"07589622664";"18/07/1985";"CONTRATO TEMPORARIO";"HGB-JA";"COORDENACAO DE SAUDE MENTAL";"PENF";"TECNICO DE ENFERMAGEM";"II";"A";"02/02/2022";"2022/02/02 00:00:00";"2023/02/01 00:00:00"
14614127;1;"JULIANA JUNQUEIRA RIBEIRO";"08312839631";"31/05/1985";"CONTRATO TEMPORARIO";"CSSFA";"COORDENACAO DA UNIDADE DE INTERNACAO E PACIENTES EXTERNOS";"PENF";"TECNICO DE ENFERMAGEM";"II";"A";"0000-00-00";"2022/06/29 00:00:00";"2023/06/28 00:00:00"
14667950;2;"JULIANA KERN CANDIAN FILARDI";"08574205699";"12/01/1990";"CONTRATO TEMPORARIO";"MOV";"COORDENACAO DE APOIO DIAGNOSTICO E TERAPEUTICO";"AGAS";"FARMACEUTICO";"I";"A";"24/06/2022";"2022/06/24 00:00:00";"2023/06/23 00:00:00"
14987002;1;"JULIANA KLEN";"05443271601";"08/11/1983";"CONTRATO TEMPORARIO";"HEM";"COORDENACAO DAS UNIDADES DE INTERNACAO";"PENF";"TECNICO DE ENFERMAGEM";"II";"A";"08/07/2022";"2022/07/08 00:00:00";"2023/07/07 00:00:00"
14987002;2;"JULIANA KLEN";"05443271601";"08/11/1983";"CONTRATO TEMPORARIO";"HAC";"COORDENACAO DE INTERNACAO - ONCOLOGICA";"PENF";"TECNICO DE ENFERMAGEM";"II";"A";"20/08/2021";"2021/08/20 00:00:00";"2023/06/30 00:00:00"
15289069;1;"JULIANA MARIA DE FREITAS";"03977010638";"03/07/1978";"CONTRATO TEMPORARIO";"HEM";"COORDENACAO DAS UNIDADES DE INTERNACAO";"AGAS";"ASSISTENTE SOCIAL";"I";"A";"29/06/2022";"2022/06/29 00:00:00";"2023/06/28 00:00:00"
13614862;6;"JULIANA MATTOS TAVARES";"09846096607";NA;"CONTRATO TEMPORARIO";"JXXIII";NA;"MED";"MEDICO CLINICO";"III";"A";NA;"2022/03/04 00:00:00";"2023/03/03 00:00:00"
13614862;4;"JULIANA MATTOS TAVARES";"09846096607";"28/05/1988";NA;"HJXXIII";"COORDENACAO DO CENTRO DE TRATAMENTO DE QUEIMADOS";NA;"MEDICO CLINICO";NA;NA;"04/03/2022";NA;NA
14963847;1;"JULIANA METZKER OLIVEIRA BERGAMO";"06193113630";NA;"CONTRATO TEMPORARIO";"JXXIII";NA;"MED";"MEDICO CIRURGIAO PLASTICO";"III";"A";NA;"2021/05/25 00:00:00";"2023/05/24 00:00:00"
12892204;3;"JULIANA MOREIRA FERREIRA";"04392021670";"13/06/1977";"CONTRATO TEMPORARIO";"IRS";"COORDENACAO DAS UNIDADES DE INTERNACAO";"PENF";"TECNICO DE ENFERMAGEM";"II";"A";"01/04/2022";"2022/04/01 00:00:00";"2023/03/31 00:00:00"
14627137;3;"JULIANA PAPATELLA ARAUJO";"06076562633";"05/07/1988";"CONTRATO TEMPORARIO";"HEM";"COORDENACAO DAS UNIDADES DE INTERNACAO";"MED";"MEDICO CLINICO";"III";"A";"18/05/2021";"2021/05/18 00:00:00";"2023/05/17 00:00:00"
12588125;2;"JULIANA RIBEIRO SILVA";"06396354667";"31/05/1984";"CONTRATO TEMPORARIO";"HAC";"COORDENACAO DE INTERNACAO - ONCOLOGICA";"PENF";"TECNICO DE ENFERMAGEM";"II";"A";"06/02/2022";"2022/02/06 00:00:00";"2023/02/05 00:00:00"
12156915;5;"JULIANA SARTORELO CARNEIRO BITTENCOURT A";"05279545600";"09/03/1982";"CONTRATO TEMPORARIO";"JXXIII";"COORDENACAO MEDICA DA UNIDADE DE TOXICOLOGIA";"MED";"MEDICO CLINICO";"III";"A";"04/03/2022";"2022/03/04 00:00:00";"2023/03/03 00:00:00"
13963616;3;"JULIANA SILVA CHAGAS";"03572096642";"11/09/1979";"CONTRATO TEMPORARIO";"IRS";"COORDENACAO DO CENTRO DE EDUCACAO INFANTIL";"TOS";"PROFESSOR RECREADOR";"II";"A";"01/02/2022";"2022/02/01 00:00:00";"2023/01/31 00:00:00"
14626923;3;"JULIANA SOARES CAETANO";"09944002682";"30/09/1988";"CONTRATO TEMPORARIO";"JXXIII";"COORDENACAO DO BLOCO CIRURGICO";"MED";"MEDICO ANESTESIOLOGISTA";"III";"A";"18/02/2018";"2021/02/01 00:00:00";"2023/01/31 00:00:00"
11360716;3;"JULIANA VIGIANI DE ARAUJO";"03385087678";"20/03/1977";"CONTRATO TEMPORARIO";"HGB-JA";"COORDENACAO DA UNIDADE DE CLINICA MEDICA";"MED";"MEDICO CLINICO";"III";"A";"20/12/2021";"2021/12/20 00:00:00";"2023/06/30 00:00:00"
14627087;2;"JULIANE MARTINS DE ALMEIDA";"11895083621";"12/07/1994";"CONTRATO TEMPORARIO";"HJK";"COORDENACAO DE FINANCAS";"TOS";"AUXILIAR ADMINISTRATIVO";"I";"A";"06/12/2021";"2021/12/06 00:00:00";"2023/06/30 00:00:00"
14176929;4;"JULIANO ALVES CASTRO";"09428882607";"07/06/1989";"CONTRATO TEMPORARIO";"HRAD";"COORDENACAO DA UNIDADE CIRURGICA";"MED";"MEDICO ANESTESIOLOGISTA";"III";"A";"0000-00-00";"2021/11/18 00:00:00";"2023/06/30 00:00:00"
14176929;3;"JULIANO ALVES CASTRO";"09428882607";"07/06/1989";"CONTRATO TEMPORARIO";"HRAD";"COORDENACAO DA UNIDADE CIRURGICA";"MED";"MEDICO ANESTESIOLOGISTA";"III";"A";"0000-00-00";"2022/02/02 00:00:00";"2023/02/01 00:00:00"
13963657;2;"JULIANO DOS SANTOS VIEGAS";"05248553660";"19/08/1980";"CONTRATO TEMPORARIO";"HGB-JA";"COORDENACAO DA UNIDADE CIRURGICA";"MED";"MEDICO CIRURGIAO PLASTICO";"III";"A";"04/05/2021";"2021/05/04 00:00:00";"2023/05/03 00:00:00"
15017627;1;"JULIANO JUSCELINO SILVA";"06951973636";"29/01/1986";"CONTRATO TEMPORARIO";"HRAD";"COORDENACAO DAS UNIDADES DE INTERNACAO";"PENF";"ENFERMEIRO";"IV";"A";"0000-00-00";"2021/09/27 00:00:00";"2023/06/30 00:00:00"
14615421;5;"JULIETE MURTA SALES";"08796560690";"16/03/1990";"CONTRATO TEMPORARIO";"JXXIII";"COORDENACAO DE URGENCIA E EMERGENCIA ADULTO";"MED";"MEDICO CLINICO";"III";"A";"04/03/2022";"2022/03/04 00:00:00";"2023/03/03 00:00:00"
14615421;2;"JULIETE MURTA SALES";"08796560690";"16/03/1990";"CONTRATO TEMPORARIO";"JXXIII";"COORDENACAO DAS UNIDADES DE INTERNACAO ADULTO";"MED";"MEDICO CLINICO";"III";"A";"16/04/2022";"2022/04/16 00:00:00";"2023/04/15 00:00:00"
14958409;1;"JULIO CESAR DOS SANTOS";"01482801612";"21/01/1983";"CONTRATO TEMPORARIO";"HJK";"COORDENACAO DE INTERNACAO - ADULTO";"PENF";"TECNICO DE ENFERMAGEM";"II";"A";"22/09/2022";"2022/09/22 00:00:00";"2023/09/21 00:00:00"
14568521;3;"JULITA RODRIGUES DE SOUSA MASCARENHAS";"60845767615";"24/02/1965";"CONTRATO TEMPORARIO";"JXXIII";"COORDENACAO DA UNIDADE DE TERAPIA INTENSIVA PEDIATRICA";"PENF";"TECNICO DE ENFERMAGEM";"II";"A";"03/03/2022";"2022/03/03 00:00:00";"2023/03/02 00:00:00"
13979828;1;"JUMARA RIBEIRO SANTOS";"01451369654";"14/06/1981";"CONTRATO TEMPORARIO";"HAC";"COORDENACAO DA EQUIPE MULTIDISCIPLINAR";"AGAS";"FISIOTERAPEUTA";"III";"A";"21/10/2022";"2022/10/24 00:00:00";"2023/10/23 00:00:00"
14592075;1;"JUNIA GRACIELA SILVA";"05443529633";"30/05/1981";"CONTRATO TEMPORARIO";"HJK";"COORDENACAO DE INTERNACAO - ADULTO";"PENF";"TECNICO DE ENFERMAGEM";"II";"A";"02/02/2022";"2022/02/02 00:00:00";"2023/02/01 00:00:00"
10727519;6;"JUNIO ANTONIO DOS SANTOS";"00122698673";"13/06/1974";"CONTRATO TEMPORARIO";"HMAL";"COORDENACAO DE URGENCIA E EMERGENCIA ADULTO";"PENF";"ENFERMEIRO";"IV";"A";"02/03/2022";"2022/03/02 00:00:00";"2023/03/01 00:00:00"
15195563;1;"JUREMA APARECIDA MOREIRA";"03971957617";"30/10/1978";"CONTRATO TEMPORARIO";"JXXIII";"COORDENACAO DE GESTAO DE PESSOAS";"TOS";"AUXILIAR ADMINISTRATIVO";"I";"A";"02/05/2022";"2022/05/02 00:00:00";"2023/05/01 00:00:00"
15316672;1;"JUREMA APARECIDA PEREIRA";"05562493640";"17/05/1979";"CONTRATO TEMPORARIO";"HRJP";"COORDENACAO TECNICA DE ENFERMAGEM";"PENF";"TECNICO DE ENFERMAGEM";"II";"A";"03/09/2022";"2022/09/03 00:00:00";"2023/09/02 00:00:00"
13372305;3;"JUSCELINO JOSE DE PAULA";"59457694600";"14/03/1967";"CONTRATO TEMPORARIO";"HEM";"COORDENACAO DE APOIO DIAGNOSTICO E TERAPEUTICO";"TOS";"TECNICO EM RADIOLOGIA";"II";"A";"27/09/2018";"2022/02/01 00:00:00";"2023/01/31 00:00:00"
14661268;1;"JUSLENE APARECIDA GONCALVES MOREIRA";"03228138674";"30/05/1978";"CONTRATO TEMPORARIO";"CSSFA";"COORDENACAO DA EQUIPE MULTIDISCIPLINAR";"AGAS";"FISIOTERAPEUTA";"I";"A";"19/06/2018";"2022/02/01 00:00:00";"2023/01/31 00:00:00"
14887673;2;"JUSSARA APARECIDA PARREIRAS SANTOS";"10010170642";"17/05/1989";"CONTRATO TEMPORARIO";"HJK";"COORDENACAO MEDICA DA URGENCIA E EMERGENCIA";"PENF";"TECNICO DE ENFERMAGEM";"II";"A";"11/02/2022";"2022/02/11 00:00:00";"2023/02/10 00:00:00"
15009749;1;"JUSSARA CARDOSO DE AVILA DINIZ";"97790508687";"17/04/1971";"CONTRATO TEMPORARIO";"JXXIII";"COORDENACAO DO CENTRO DE TRATAMENTO DE QUEIMADOS";"TOS";"PROFESSOR RECREADOR";"II";"A";"14/03/2022";"2022/03/14 00:00:00";"2023/03/13 00:00:00"
15031719;1;"KAISY NAGELLA ALVES";"11161036644";"12/02/1993";"CONTRATO TEMPORARIO";"JXXIII";"COORDENACAO DE URGENCIA E EMERGENCIA ADULTO";"MED";"MEDICO GENERALISTA";"I";"A";"05/10/2021";"2021/10/05 00:00:00";"2023/06/30 00:00:00"
14131825;5;"KAMILA FERREIRA RIBEIRO TADEU";"09699202610";NA;"CONTRATO TEMPORARIO";"JXXIII";NA;"MED";"MEDICO CLINICO";"III";"A";NA;"2021/02/01 00:00:00";"2023/01/31 00:00:00"
14131825;4;"KAMILA FERREIRA RIBEIRO TADEU V";"09699202610";"07/06/1989";NA;"HJXXIII";"COORDENACAO DA UNIDADE DE TERAPIA INTENSIVA ADULTO";NA;"MEDICO CLINICO";NA;NA;"10/08/2018";NA;NA
14052419;4;"KAMILLA LEOLINA MONTEIRO OLIVEIRA";"01220626635";"07/03/1981";"CONTRATO TEMPORARIO";"JXXIII";"COORDENACAO DE DIAGNOSTICO POR IMAGEM";"MED";"MEDICO EM RADIOLOG.E DIAGNOST.POR IMAGEM";"III";"A";"18/10/2021";"2021/10/18 00:00:00";"2023/06/30 00:00:00"
14052419;3;"KAMILLA LEOLINA MONTEIRO OLIVEIRA";"01220626635";"07/03/1981";"CONTRATO TEMPORARIO";"JXXIII";"COORDENACAO DE DIAGNOSTICO POR IMAGEM";"MED";"MEDICO EM RADIOLOG.E DIAGNOST.POR IMAGEM";"III";"A";"13/03/2017";"2021/02/01 00:00:00";"2023/01/31 00:00:00"
14221303;3;"KAREN CRISTINE PEREIRA RIBEIRO";"09441978680";"12/03/1990";"CONTRATO TEMPORARIO";"HRAD";"COORDENACAO DA UNIDADE DE PACIENTES EXTERNOS";"MED";"MEDICO CIRURGIAO GERAL";"III";"A";"0000-00-00";"2021/09/11 00:00:00";"2023/06/30 00:00:00"
14912810;3;"KAREN DA SILVA CORREA";"12832654606";"20/06/1996";"CONTRATO TEMPORARIO";"JXXIII";"COORDENACAO DA UNIDADE DE TERAPIA INTENSIVA PEDIATRICA";"PENF";"TECNICO DE ENFERMAGEM";"II";"A";"02/02/2022";"2022/02/02 00:00:00";"2023/02/01 00:00:00"
14882351;2;"KAREN DE ALMEIDA PEREIRA";"10290302609";"21/12/1992";"CONTRATO TEMPORARIO";"HAC";"COORDENACAO DA UNIDADE DE TERAPIA INTENSIVA ADULTO";"MED";"MEDICO CLINICO";"III";"A";"08/07/2022";"2022/07/08 00:00:00";"2023/07/07 00:00:00"
15123375;1;"KAREN DE SA SCHETTINO";"10116267640";NA;"CONTRATO TEMPORARIO";"HRJP";NA;"MEDRE";"MEDICO";"I";"A";NA;"2022/03/01 00:00:00";"2023/02/28 00:00:00"
14514541;2;"KARINA ALMEIDA CAMARGO";"08551419641";"30/01/1992";"CONTRATO TEMPORARIO";"HGB-JA";"COORDENACAO DA UNIDADE DE URGENCIA E EMERGENCIA";"PENF";"TECNICO DE ENFERMAGEM";"II";"A";"10/06/2022";"2022/06/10 00:00:00";"2023/06/09 00:00:00"
14614150;1;"KARINA ALVES RIBEIRO";"34742319877";"09/08/1988";"CONTRATO TEMPORARIO";"CSPD";"COORDENACAO DE COMPRAS E LOGISTICA";"TOS";"AUXILIAR ADMINISTRATIVO";"I";"A";"05/03/2018";"2022/02/01 00:00:00";"2023/01/31 00:00:00"
14884225;2;"KARINA AZA COELHO";"10889568669";"17/06/1995";"CONTRATO TEMPORARIO";"HJK";"COORDENACAO MEDICA DA URGENCIA E EMERGENCIA";"MED";"MEDICO CLINICO";"III";"A";"06/07/2022";"2022/07/06 00:00:00";"2023/07/05 00:00:00"
14701338;1;"KARINA BARROS CORREA";"06738088663";"27/03/1984";"CONTRATO TEMPORARIO";"CSPD";"COORDENACAO DA UNIDADE DE CUIDADO AO ADULTO";"PENF";"TECNICO DE ENFERMAGEM";"II";"A";"26/10/2018";"2022/02/01 00:00:00";"2023/01/31 00:00:00"
10952844;4;"KARINA CINDY LADEIA DE OLIVEIRA";"02761197623";"16/11/1976";"CONTRATO TEMPORARIO";"MOV";"COORDENACAO DA UNIDADE DE TERAPIA INTENSIVA";"MED";"MEDICO EM MEDICINA INTENSIVA REGULADOR C";"III";"A";"28/09/2021";"2021/09/28 00:00:00";"2023/06/30 00:00:00"
14890412;1;"KARINA DA SILVA";"06705277696";NA;"CONTRATO TEMPORARIO";"HRJP";NA;"AGAS";"FISIOTERAPEUTA";"I";"A";NA;"2022/07/02 00:00:00";"2022/12/28 00:00:00"
13432638;2;"KARINA DANIELE EVANGELISTA SILVA";"04256098631";"22/06/1979";"CONTRATO TEMPORARIO";"HRJP";"COORDENACAO DAS UNIDADES DE INTERNACAO";"PENF";"TECNICO DE ENFERMAGEM";"II";"A";"07/09/2022";"2022/09/07 00:00:00";"2023/03/05 00:00:00"
14941595;1;"KARINA DE SOUSA PAULA";"09031272612";"12/11/1989";"CONTRATO TEMPORARIO";"HJK";"COORDENACAO DO LABORATORIO";"AGAS";"FARMACEUTICO";"I";"A";"01/02/2022";"2022/02/01 00:00:00";"2023/01/31 00:00:00"
15291008;1;"KARINA GIZELE TEIXEIRA";"09848990658";"13/12/1986";"CONTRATO TEMPORARIO";"HIJPII";"COORDENACAO DE ASSISTENCIA FARMACEUTICA";"TOS";"TECNICO EM FARMACIA";"II";"A";"01/07/2022";"2022/07/01 00:00:00";"2022/12/27 00:00:00"
15147135;1;"KARINA SONIA DOS SANTOS";"01401617670";"25/03/1984";"CONTRATO TEMPORARIO";"HJK";"COORDENACAO DE INTERNACAO - ADULTO";"PENF";"TECNICO DE ENFERMAGEM";"II";"A";"08/03/2022";"2022/03/08 00:00:00";"2023/03/07 00:00:00"
14581284;2;"KARINE ELIZABETH DA SILVA";"11365071677";"22/02/1993";"CONTRATO TEMPORARIO";"HAC";"COORDENACAO DO LABORATORIO";"TOS";"TECNICO EM PATOLOGIA CLINICA";"II";"A";"15/09/2022";"2022/09/15 00:00:00";"2023/09/14 00:00:00"
15118516;1;"KARINE MIRANDA BARBOSA";"09999238629";NA;"CONTRATO TEMPORARIO";"HJK";NA;"MEDRE";"MEDICO";"I";"A";NA;"2022/03/01 00:00:00";"2023/02/28 00:00:00"
13524327;3;"KARISTEN COSTA DIVIDORIO";"06450330651";"28/02/1980";"CONTRATO TEMPORARIO";"AJUR";"(DESAT.)COORDENACAO DE SAUDE DO TRABALHADOR";"PENF";"ENFERMEIRO DO TRABALHO";"VI";"A";"03/05/2021";"2021/05/03 00:00:00";"2023/05/02 00:00:00"
14701288;2;"KARLA COUTO FIGUEIREDO";"01481013645";"26/01/1985";"CONTRATO TEMPORARIO";"HEM";"COORDENACAO DAS UNIDADES CRITICAS";"PENF";"ENFERMEIRO";"IV";"A";"31/05/2022";"2022/05/31 00:00:00";"2023/05/30 00:00:00"
14701288;1;"KARLA COUTO FIGUEIREDO";"01481013645";"26/01/1985";"CONTRATO TEMPORARIO";"HEM";"COORDENACAO DAS UNIDADES DE INTERNACAO";"PENF";"ENFERMEIRO";"IV";"A";"01/07/2022";"2022/07/01 00:00:00";"2023/06/30 00:00:00"
14691547;1;"KARLA CRISTINA DE SOUZA LIMA";"07182735679";"22/02/1986";"CONTRATO TEMPORARIO";"HJK";"COORDENACAO MEDICA DA URGENCIA E EMERGENCIA";"PENF";"TECNICO DE ENFERMAGEM";"II";"A";"05/09/2018";"2021/02/01 00:00:00";"2023/01/31 00:00:00"
14557789;2;"KARLA CRISTINA LIMA PEIXOTO";"01421188694";"29/12/1982";"CONTRATO TEMPORARIO";"JXXIII";"COORDENACAO DA UNIDADE DE TERAPIA INTENSIVA ADULTO";"PENF";"ENFERMEIRO";"IV";"A";"13/12/2021";"2021/12/13 00:00:00";"2023/06/30 00:00:00"
14592547;3;"KARLA MATOS DE OLIVEIRA MENDES";"01444737635";"08/01/1983";"CONTRATO TEMPORARIO";"HEM";"COORDENACAO DA UNIDADE DE PACIENTES EXTERNOS";"MED";"MEDICO DERMATOLOGISTA";"III";"A";"01/02/2022";"2022/02/01 00:00:00";"2023/01/31 00:00:00"
14314579;2;"KARLA MONIZ DE ALMEIDA";"03642628699";"10/08/1979";"CONTRATO TEMPORARIO";"JXXIII";"COORDENACAO DE LABORATORIO E AGENCIA TRANSFUSIONAL";"TOS";"TECNICO EM PATOLOGIA CLINICA";"II";"A";"04/03/2022";"2022/03/03 00:00:00";"2023/03/02 00:00:00"
15066723;1;"KARLA SALOME NEIVA LAGES";"04785013664";"27/01/1975";"CONTRATO TEMPORARIO";"MOV";"COORDENACAO DA UNIDADE DE NEONATOLOGIA";"PENF";"ENFERMEIRO";"IV";"A";"02/02/2022";"2022/02/02 00:00:00";"2023/02/01 00:00:00"
14581300;2;"KARLA TATIANE DOS SANTOS RIBEIRO";"12498937633";"31/12/1994";"CONTRATO TEMPORARIO";"HAC";"COORDENACAO DO LABORATORIO";"TOS";"TECNICO EM PATOLOGIA CLINICA";"II";"A";"01/02/2022";"2022/02/01 00:00:00";"2023/01/31 00:00:00"
15146509;1;"KAROLINY DOS SANTOS RIBEIRO";"11907530657";"10/11/1993";"CONTRATO TEMPORARIO";"HAC";"COORDENACAO DO LABORATORIO";"TOS";"TECNICO EM PATOLOGIA CLINICA";"II";"A";"04/03/2022";"2022/03/04 00:00:00";"2023/03/03 00:00:00"
15288806;1;"KAROLLINE EMANUELLE TRINDADE COIMBRA";"12278382713";NA;"CONTRATO TEMPORARIO";"HEM";NA;"MED";"MEDICO CLINICO";"III";"A";NA;"2022/07/07 00:00:00";"2023/07/06 00:00:00"
14939144;1;"KAROLYNE RODRIGUES LOPES";"09593778675";NA;"CONTRATO TEMPORARIO";"HRAD";NA;"MEDRE";"MEDICO";"I";"A";NA;"2021/03/01 00:00:00";"2023/02/28 00:00:00"
14895304;1;"KATHLEEN OLIVEIRA ALVES COSTA";"12968993658";"19/09/1995";"CONTRATO TEMPORARIO";"HRAD";"COORDENACAO DE APOIO DIAGNOSTICO E TERAPEUTICO";"TOS";"TECNICO EM RADIOLOGIA";"II";"A";"0000-00-00";"2021/02/01 00:00:00";"2023/01/31 00:00:00"
14273965;1;"KATIA ADRIANA COELHO";"04807953630";"07/08/1981";"CONTRATO TEMPORARIO";"HRJP";"COORDENACAO DAS UNIDADES CRITICAS";"PENF";"TECNICO DE ENFERMAGEM";"II";"A";"01/07/2022";"2022/07/02 00:00:00";"2023/07/01 00:00:00"
14592513;1;"KATIA APARECIDA DE ALMEIDA";"07664650631";"05/07/1985";"CONTRATO TEMPORARIO";"HEM";"COORDENACAO DAS UNIDADES CRITICAS";"PENF";"TECNICO DE ENFERMAGEM";"II";"A";"03/07/2022";"2022/07/03 00:00:00";"2023/07/02 00:00:00"
13963673;3;"KATIA CRISTINA DE SOUZA MARTINS";"06510318695";"07/10/1982";"CONTRATO TEMPORARIO";"HGB-JA";"COORDENACAO DA UNIDADE DE CLINICA MEDICA";"PENF";"ENFERMEIRO";"IV";"A";"20/09/2021";"2021/09/20 00:00:00";"2023/06/30 00:00:00"
13963673;2;"KATIA CRISTINA DE SOUZA MARTINS";"06510318695";"07/10/1982";"CONTRATO TEMPORARIO";"HGB-JA";"COORDENACAO DE ASSISTENCIA FARMACEUTICA";"PENF";"ENFERMEIRO";"IV";"A";"30/08/2021";"2021/08/30 00:00:00";"2023/06/30 00:00:00"
14900310;2;"KATIA DE OLIVEIRA SILVA";"00362884625";"11/10/1972";"CONTRATO TEMPORARIO";"HJK";"COORDENACAO DE ASSISTENCIA FARMACEUTICA";"PENF";"TECNICO DE ENFERMAGEM";"II";"A";"04/03/2022";"2022/03/04 00:00:00";"2023/03/03 00:00:00"
14900310;1;"KATIA DE OLIVEIRA SILVA";"00362884625";"11/10/1972";"CONTRATO TEMPORARIO";"HJK";"COORDENACAO DE INTERNACAO - ADULTO";"PENF";"TECNICO DE ENFERMAGEM";"II";"A";"21/03/2022";"2022/03/21 00:00:00";"2023/03/20 00:00:00"
14714984;1;"KATIA FRANCISCA SEVERINO - PJF";"97508802691";"08/11/1967";NA;"HRJP";"COORDENACAO DAS UNIDADES CRITICAS";NA;"NAO ASSOCIADA";NA;NA;"09/11/2004";NA;NA
15128770;1;"KATIA LAMAS MORAIS";"10393771652";"08/01/1991";"CONTRATO TEMPORARIO";"HGB-JA";"COORDENACAO DA UNIDADE DE CLINICA MEDICA";"PENF";"TECNICO DE ENFERMAGEM";"II";"A";"04/03/2022";"2022/03/04 00:00:00";"2023/03/03 00:00:00"
14710164;1;"KATIA REGINA DE SOUZA DIAS LIMA";"18471724820";"08/03/1967";"CONTRATO TEMPORARIO";"HJK";"COORDENACAO DE INTERNACAO - ADULTO";"PENF";"TECNICO DE ENFERMAGEM";"II";"A";"07/11/2022";"2022/11/07 00:00:00";"2023/11/06 00:00:00"
14841571;1;"KATIUCIA ALMEIDA DA SILVA";"05039957629";"16/01/1982";"CONTRATO TEMPORARIO";"HIJPII";"COORDENACAO DAS UNIDADES DE INTERNACAO PEDIATRICA";"PENF";"ENFERMEIRO";"IV";"A";"01/07/2022";"2022/07/01 00:00:00";"2023/06/30 00:00:00"
14592562;2;"KECIA CAROLINA DE OLIVEIRA MATTOS";"09904683646";"08/06/1990";"CONTRATO TEMPORARIO";"HRJP";"COORDENACAO DAS UNIDADES DE INTERNACAO";"PENF";"TECNICO DE ENFERMAGEM";"II";"A";"02/07/2022";"2022/07/02 00:00:00";"2023/07/01 00:00:00"
14903843;2;"KEILA EPIFANIO DE SOUZA";"04769038666";"05/01/1977";"CONTRATO TEMPORARIO";"HJK";"COORDENACAO DE INTERNACAO - ADULTO";"PENF";"TECNICO DE ENFERMAGEM";"II";"A";"07/04/2022";"2022/04/07 00:00:00";"2023/04/06 00:00:00"
14874382;1;"KEILIANI STELLE GONCALVES";"12527330622";"05/02/1996";"CONTRATO TEMPORARIO";"HJK";"COORDENACAO DO SERVIÇO DE NUTRICAO E DIETETICA";"TOS";"TECNICO EM NUTRICAO E DIETETICA";"II";"A";"01/02/2022";"2022/02/01 00:00:00";"2023/01/31 00:00:00"
14882567;1;"KELLEN ALETE SOUZA";"05545771948";NA;"CONTRATO TEMPORARIO";"JXXIII";NA;"MEDRE";"MEDICO";"I";"A";NA;"2020/03/01 00:00:00";"2023/02/28 00:00:00"
14592372;1;"KELLEN SOUZA DOS SANTOS DA SILVA";"06475831603";"22/03/1984";"CONTRATO TEMPORARIO";"MOV";"COORDENACAO DE GESTAO DE PESSOAS";"TOS";"AUXILIAR ADMINISTRATIVO";"I";"A";"01/02/2022";"2022/02/01 00:00:00";"2023/01/31 00:00:00"
10898617;4;"KELLY CRISTINA DE OLIVEIRA LEMES";"27374555881";"04/01/1976";"CONTRATO TEMPORARIO";"MOV";"COORDENACAO DE APOIO DIAGNOSTICO E TERAPEUTICO";"AGAS";"FARMACEUTICO";"I";"A";"02/02/2022";"2022/02/02 00:00:00";"2023/02/01 00:00:00"
15196272;1;"KELLY CRISTINA ELEUTERIO";"04312468664";"17/05/1979";"CONTRATO TEMPORARIO";"HJK";"COORDENACAO MEDICA DA URGENCIA E EMERGENCIA";"PENF";"TECNICO DE ENFERMAGEM";"II";"A";"26/04/2022";"2022/04/26 00:00:00";"2023/04/25 00:00:00"
15350762;1;"KELLY CRISTINA SOARES VASCONCELOS";"07841344562";"28/08/1996";"CONTRATO TEMPORARIO";"HJK";"COORDENACAO DE INTERNACAO - ADULTO";"PENF";"ENFERMEIRO";"IV";"A";"22/11/2022";"2022/11/22 00:00:00";"2023/11/21 00:00:00"
14812887;2;"KELLY DOS REIS PINTO";"06114282612";"15/03/1983";"CONTRATO TEMPORARIO";"JXXIII";"COORDENACAO DA UNIDADE DE TERAPIA INTENSIVA PEDIATRICA";"PENF";"ENFERMEIRO";"IV";"A";"01/02/2022";"2022/02/01 00:00:00";"2023/01/31 00:00:00"
14480834;1;"KELY MAYRE DIAS RODRIGUES";"06378522650";"04/03/1983";"CONTRATO TEMPORARIO";"JXXIII";"COORDENACAO DAS UNIDADES DE INTERNACAO ADULTO";"PENF";"TECNICO DE ENFERMAGEM";"II";"A";"05/07/2022";"2022/07/05 00:00:00";"2023/07/04 00:00:00"
15077480;1;"KENIA HORRANA FERREIRA GOMES";"12036546692";"25/11/1994";"CONTRATO TEMPORARIO";"JXXIII";"COORDENACAO DE URGENCIA E EMERGENCIA ADULTO";"PENF";"ENFERMEIRO";"IV";"A";"01/02/2022";"2022/02/01 00:00:00";"2023/01/31 00:00:00"
14661284;2;"KENIA LARA TOLEDO";"86160133691";"20/08/1974";"CONTRATO TEMPORARIO";"JXXIII";"COORDENACAO DAS UNIDADES DE INTERNACAO ADULTO";"PENF";"TECNICO DE ENFERMAGEM";"II";"A";"04/02/2022";"2022/02/04 00:00:00";"2023/02/03 00:00:00"
8655441;3;"KENIA LUCIANA SILVA";"81454473649";"05/01/1972";"CONTRATO TEMPORARIO";"MOV";"COORDENACAO DA UNIDADE CIRURGICA";"PENF";"TECNICO DE ENFERMAGEM";"II";"A";"09/03/2021";"2021/03/09 00:00:00";"2023/03/08 00:00:00"
14256630;1;"KERLEY CRISTINA DE OLIVEIRA ROSA";"03014969605";"10/10/1976";"CONTRATO TEMPORARIO";"HRAD";"COORDENACAO DAS UNIDADES CRITICAS";"PENF";"TECNICO DE ENFERMAGEM";"II";"A";"0000-00-00";"2022/02/02 00:00:00";"2023/02/01 00:00:00"
14691539;3;"KESIA FERREIRA RICARDO";"06827008606";"02/01/1985";"CONTRATO TEMPORARIO";"JXXIII";"COORDENACAO DE LABORATORIO E AGENCIA TRANSFUSIONAL";"TOS";"TECNICO EM PATOLOGIA CLINICA";"II";"A";"10/11/2021";"2021/11/10 00:00:00";"2023/06/30 00:00:00"
14841399;1;"KESIA LUCAS DE AMORIM SILVA";"05291841680";"27/02/1981";"CONTRATO TEMPORARIO";"HEM";"COORDENACAO DAS UNIDADES CRITICAS";"PENF";"TECNICO DE ENFERMAGEM";"II";"A";"01/07/2022";"2022/07/01 00:00:00";"2023/06/30 00:00:00"
11040532;2;"KHARINE PILLAR DE SOUSA E PENA";"00868106690";"15/12/1974";"CONTRATO TEMPORARIO";"HMAL";"COORDENACAO DO SERVICO DE NUTRICAO E DIETETICA";"AGAS";"NUTRICIONISTA";"I";"A";"03/03/2022";"2022/03/03 00:00:00";"2023/03/02 00:00:00"
14438360;1;"KLAUS MORALES DOS SANTOS";"06022711690";"07/09/1983";"CONTRATO TEMPORARIO";"MOV";"COORDENACAO DA GINECOLOGIA E OBSTETRICIA";"MED";"MEDICO ANESTESIOLOGISTA";"III";"A";"01/02/2022";"2022/02/01 00:00:00";"2023/01/31 00:00:00"
13963731;2;"KLEBER CASSIO CANDIAN";"06901375670";"15/08/1985";"CONTRATO TEMPORARIO";"HGB-JA";"COORDENACAO DE APOIO DIAGNOSTICO E TERAPEUTICO";"TOS";"TECNICO EM RADIOLOGIA";"II";"A";"02/02/2022";"2022/02/02 00:00:00";"2023/02/01 00:00:00"
14355812;3;"KLEITON BORGES PEREIRA";"03427425665";"30/06/1979";"CONTRATO TEMPORARIO";"JXXIII";"COORDENACAO DE URGENCIA E EMERGENCIA ADULTO";"PENF";"ENFERMEIRO";"IV";"A";"04/02/2022";"2022/02/04 00:00:00";"2023/02/03 00:00:00"
12331047;4;"LADYANNA FURTADO DE CARVALHO";"07883852671";"13/02/1989";"CONTRATO TEMPORARIO";"JXXIII";"COORDENACAO DA UNIDADE DE TERAPIA INTENSIVA PEDIATRICA";"PENF";"TECNICO DE ENFERMAGEM";"II";"A";"03/03/2022";"2022/03/03 00:00:00";"2023/03/02 00:00:00"
12330304;4;"LAIANE MOURA FERREIRA";"06208589665";"30/07/1984";"CONTRATO TEMPORARIO";"JXXIII";"COORDENACAO DE URGENCIA E EMERGENCIA ADULTO";"PENF";"ENFERMEIRO";"IV";"A";"02/02/2022";"2022/02/02 00:00:00";"2023/02/01 00:00:00"
14615496;2;"LAIANE TABATA SOUZA CORGOSINHO";"10517236630";"28/10/1989";"CONTRATO TEMPORARIO";"HEM";"COORDENACAO DA UNIDADE DE PACIENTES EXTERNOS";"MED";"MEDICO PSIQUIATRA";"III";"A";"27/04/2022";"2022/04/29 00:00:00";"2023/04/28 00:00:00"
15090129;1;"LAIRA CRISTINA BATISTA FIDELIS";"10792169603";"05/01/1992";"CONTRATO TEMPORARIO";"HGB-JA";"COORDENACAO DA UNIDADE DE CLINICA MEDICA";"PENF";"TECNICO DE ENFERMAGEM";"II";"A";"01/02/2022";"2022/02/01 00:00:00";"2023/01/31 00:00:00"
14884373;1;"LAIS BORGES DA COSTA";"10260461652";NA;"CONTRATO TEMPORARIO";"HJK";NA;"MEDRE";"MEDICO";"I";"A";NA;"2020/03/01 00:00:00";"2023/02/28 00:00:00"
14937874;1;"LAIS CAMPOS DE MIRANDA ANDRADE";"07605763603";NA;"CONTRATO TEMPORARIO";"JXXIII";NA;"MEDRE";"MEDICO";"I";"A";NA;"2021/03/01 00:00:00";"2023/02/28 00:00:00"
13632773;3;"LAIS GOMES LOPES TERRA BAGNO";"07330691690";NA;"CONTRATO TEMPORARIO";"JXXIII";NA;"MED";"MEDICO CIRURGIAO DE MAO";"III";"A";NA;"2022/02/01 00:00:00";"2023/01/31 00:00:00"
13632773;2;"LAIS GOMES LOPES TERRA BAGNO";"07330691690";"08/10/1989";NA;"HMAL";"COORDENACAO DO AMBULATORIO ADULTO";NA;"MEDICO CIRURGIAO DE MAO";NA;NA;"19/11/2019";NA;NA
14756639;2;"LAIS RODRIGUES MAFFIA";"09897697632";NA;"CONTRATO TEMPORARIO";"HJK";NA;"MED";"MEDICO CLINICO";"III";"A";NA;"2022/02/01 00:00:00";"2023/06/30 00:00:00"
14932693;1;"LAIS SALES TEIXEIRA";"09863930610";NA;"CONTRATO TEMPORARIO";"HIJPII";NA;"MEDRE";"MEDICO";"I";"A";NA;"2021/03/01 00:00:00";"2023/02/28 00:00:00"
14883995;1;"LAIS SILVA CARVALHO";"01566829666";NA;"CONTRATO TEMPORARIO";"HJK";NA;"MEDRE";"MEDICO";"I";"A";NA;"2020/03/01 00:00:00";"2023/02/28 00:00:00"
14937908;2;"LAISSA MARIA NEGREIROS ROTELLA";"12896046658";"05/02/1996";"CONTRATO TEMPORARIO";"JXXIII";"COORDENACAO DE URGENCIA E EMERGENCIA ADULTO";"MED";"MEDICO GENERALISTA";"I";"A";"03/07/2022";"2022/07/03 00:00:00";"2022/12/29 00:00:00"
14937908;1;"LAISSA MARIA NEGREIROS ROTELLA";"12896046658";NA;"CONTRATO TEMPORARIO";"JXXIII";NA;"MEDRE";"MEDICO";"I";"A";NA;"2021/03/01 00:00:00";"2023/02/28 00:00:00"
14557680;2;"LAIZA FERREIRA BARROSO";"10140641637";NA;"CONTRATO TEMPORARIO";"DIGEPE";NA;"TOS";"AUXILIAR ADMINISTRATIVO";"I";"A";NA;"2022/02/01 00:00:00";"2023/01/31 00:00:00"
15122823;1;"LARA ALVES PAIVA";"10514432616";NA;"CONTRATO TEMPORARIO";"IRS";NA;"MEDRE";"MEDICO";"I";"A";NA;"2022/03/01 00:00:00";"2023/02/28 00:00:00"
14777460;3;"LARA CLEMENTE PAULINO FERREIRA E SILVA";"08922418613";"15/11/1987";"CONTRATO TEMPORARIO";"JXXIII";"COORDENACAO DO BLOCO CIRURGICO";"MED";"MEDICO ANESTESIOLOGISTA";"III";"A";"02/03/2022";"2022/03/02 00:00:00";"2023/03/01 00:00:00"
14627277;2;"LARA SAAD VALADARES SANTOS";"09475548661";"23/04/1987";"CONTRATO TEMPORARIO";"JXXIII";"COORDENACAO DE URGENCIA E EMERGENCIA ADULTO";"MED";"MEDICO PEDIATRA";"III";"A";"09/04/2018";"2021/02/01 00:00:00";"2023/03/02 00:00:00"
15117948;1;"LARA THOME BARCELLOS";"09868277620";NA;"CONTRATO TEMPORARIO";"HJK";NA;"MEDRE";"MEDICO";"I";"A";NA;"2022/03/01 00:00:00";"2023/02/28 00:00:00"
14230437;3;"LARISSA AMORIM SILVA BRANT";"06361546616";"18/02/1985";"CONTRATO TEMPORARIO";"HMAL";"COORDENACAO DE ASSISTENCIA FARMACEUTICA";"AGAS";"FARMACEUTICO";"I";"A";"02/08/2021";"2021/08/02 00:00:00";"2023/06/30 00:00:00"
15287691;1;"LARISSA APARECIDA MARTINS E SILVA";"12878604601";"13/12/1998";"CONTRATO TEMPORARIO";"HRAD";"COORDENACAO DAS UNIDADES DE INTERNACAO";"PENF";"ENFERMEIRO";"IV";"A";"0000-00-00";"2022/07/05 00:00:00";"2023/07/04 00:00:00"
14947717;2;"LARISSA BAGNO GARCIA";"07588504684";"11/03/1996";"CONTRATO TEMPORARIO";"HIJPII";"COORDENACAO DE URGENCIA E EMERGENCIA PEDIATRICA";"MED";"MEDICO GENERALISTA";"I";"A";"02/07/2022";"2022/07/02 00:00:00";"2022/12/28 00:00:00"
14947717;1;"LARISSA BAGNO GARCIA";"07588504684";NA;"CONTRATO TEMPORARIO";"HIJPII";NA;"MEDRE";"MEDICO";"I";"A";NA;"2021/03/31 00:00:00";"2023/03/30 00:00:00"
14815849;3;"LARISSA DE PAIVA OLIVEIRA";"10706184629";"04/05/1990";"CONTRATO TEMPORARIO";"JXXIII";"COORDENACAO DE URGENCIA E EMERGENCIA ADULTO";"MED";"MEDICO PEDIATRA";"III";"A";"16/09/2021";"2021/09/15 00:00:00";"2023/06/30 00:00:00"
14946412;1;"LARISSA LUANE DE CARVALHO";"01536565148";NA;"CONTRATO TEMPORARIO";"HJK";NA;"MEDRE";"MEDICO";"I";"A";NA;"2021/03/22 00:00:00";"2023/03/21 00:00:00"
15118342;1;"LARISSA MATOS VENTURA";"06718491586";NA;"CONTRATO TEMPORARIO";"HJK";NA;"MEDRE";"MEDICO";"I";"A";NA;"2022/03/04 00:00:00";"2023/03/03 00:00:00"
15241052;1;"LARISSA PAMELLA MAXIMIANO TOMAZ";"15572896705";"06/06/1994";"CONTRATO TEMPORARIO";"CEPAI";"GERENCIA ASSISTENCIAL";"TOS";"AUXILIAR ADMINISTRATIVO";"I";"A";"03/06/2022";"2022/06/03 00:00:00";"2023/06/02 00:00:00"
15126238;1;"LARISSA PARIS GASPARINI";"13945846790";NA;"CONTRATO TEMPORARIO";"JXXIII";NA;"MEDRE";"MEDICO";"I";"A";NA;"2022/03/01 00:00:00";"2023/02/28 00:00:00"
15125651;1;"LARISSA RABELO BARBALHO";"10149672608";NA;"CONTRATO TEMPORARIO";"JXXIII";NA;"MEDRE";"MEDICO";"I";"A";NA;"2022/03/01 00:00:00";"2023/02/28 00:00:00"
15293814;1;"LARISSA TAYENE ALVES FERREIRA";"09453189600";"11/07/1989";"CONTRATO TEMPORARIO";"HJK";"COORDENACAO MEDICA DA URGENCIA E EMERGENCIA";"MED";"MEDICO GENERALISTA";"I";"A";"06/07/2022";"2022/07/06 00:00:00";"2023/01/01 00:00:00"
15199854;1;"LARYSSA FERNANDA FEITOSA FURTADO";"03945877156";NA;"CONTRATO TEMPORARIO";"JXXIII";NA;"MEDRE";"MEDICO";"I";"A";NA;"2022/03/01 00:00:00";"2023/02/28 00:00:00"
14884258;2;"LAURA BARBOSA DRUMMOND";"09062402631";"19/01/1992";"CONTRATO TEMPORARIO";"HJK";"COORDENACAO MEDICA DA URGENCIA E EMERGENCIA";"MED";"MEDICO CLINICO";"III";"A";"10/06/2022";"2022/06/10 00:00:00";"2023/06/09 00:00:00"
14885073;1;"LAURA BRAGA FIGUEIREDO";"09180430694";NA;"CONTRATO TEMPORARIO";"JXXIII";NA;"MEDRE";"MEDICO";"I";"A";NA;"2020/03/01 00:00:00";"2023/02/28 00:00:00"
14756712;2;"LAURA CAROLINA VIDA FERREIRA";"06803788636";"06/04/1993";"CONTRATO TEMPORARIO";"JXXIII";"COORDENACAO DA UNIDADE DE TERAPIA INTENSIVA ADULTO";"MED";"MEDICO CLINICO";"III";"A";"10/02/2022";"2022/02/10 00:00:00";"2023/02/09 00:00:00"
14934111;1;"LAURA ESTHER DE SOUSA AMORIM";"09967626631";NA;"CONTRATO TEMPORARIO";"HAC";NA;"MEDRE";"MEDICO";"I";"A";NA;"2021/03/01 00:00:00";"2023/02/28 00:00:00"
14171862;4;"LAURA FURBINO ELIAS";"06736721660";"10/04/1985";"CONTRATO TEMPORARIO";"HAC";"COORDENACAO DA UNIDADE DE TERAPIA INTENSIVA ADULTO";"MED";"MEDICO CLINICO";"III";"A";"15/06/2022";"2022/06/15 00:00:00";"2023/06/14 00:00:00"
14883250;1;"LAURA GIOVANA GONZAGA COELHO";"07831201688";NA;"CONTRATO TEMPORARIO";"HIJPII";NA;"MEDRE";"MEDICO";"I";"A";NA;"2020/03/01 00:00:00";"2023/02/28 00:00:00"
15121999;1;"LAURA MARIA SILVA THIERSCH";"12481364627";NA;"CONTRATO TEMPORARIO";"HIJPII";NA;"MEDRE";"MEDICO";"I";"A";NA;"2022/03/01 00:00:00";"2023/02/28 00:00:00"
12917340;3;"LAURA MAURICIO DOS SANTOS RIBEIRO";"27536653700";"30/06/1953";"CONTRATO TEMPORARIO";"HRJP";"COORDENACAO DE GESTAO DE PESSOAS";"TOS";"AUXILIAR ADMINISTRATIVO";"I";"A";"01/02/2022";"2022/02/01 00:00:00";"2023/01/31 00:00:00"
14881338;1;"LAURA TORRES GUERRA CAMILO DE OLIVEIRA";"09689262661";NA;"CONTRATO TEMPORARIO";"CHPB";NA;"MEDRE";"MEDICO";"I";"A";NA;"2020/03/02 00:00:00";"2023/02/28 00:00:00"
14934269;1;"LAURA VILACA CARVALHO VIEGAS MARTINS";"11468026682";NA;"CONTRATO TEMPORARIO";"HJK";NA;"MEDRE";"MEDICO";"I";"A";NA;"2021/03/10 00:00:00";"2023/03/09 00:00:00"
11871837;5;"LEANDRO CESAR FEDERICO";"26124354845";"26/03/1977";"CONTRATO TEMPORARIO";"JXXIII";"COORDENACAO DE URGENCIA E EMERGENCIA ADULTO";"MED";"CIRURGIAO VASCULAR";"III";"A";"17/10/2021";"2021/10/17 00:00:00";"2023/06/30 00:00:00"
13374020;4;"LEANDRO DE AVILA LARA";"03981712625";"20/10/1979";"CONTRATO TEMPORARIO";"HJK";"COORDENACAO MEDICA DA URGENCIA E EMERGENCIA";"MED";"MEDICO CLINICO";"III";"A";"26/09/2021";"2021/09/26 00:00:00";"2023/06/30 00:00:00"
14615652;2;"LEANDRO FONSECA DE CARVALHO";"10652887600";"04/07/1993";"CONTRATO TEMPORARIO";"JXXIII";"COORDENACAO DO BLOCO CIRURGICO";"MED";"MEDICO ANESTESIOLOGISTA";"III";"A";"03/03/2022";"2022/03/03 00:00:00";"2023/03/02 00:00:00"
12201646;3;"LEANDRO LUIZ GONCALVES";"01477106693";"13/11/1981";"CONTRATO TEMPORARIO";"HGB-JA";"COORDENACAO DA UNIDADE DE URGENCIA E EMERGENCIA";"PENF";"TECNICO DE ENFERMAGEM";"II";"A";"01/02/2022";"2022/02/01 00:00:00";"2023/01/31 00:00:00"
13453139;1;"LEANDRO PESSOA DUTRA";"08533544642";"21/09/1987";"CONTRATO TEMPORARIO";"HEM";"COORDENACAO DAS UNIDADES CRITICAS";"PENF";"TECNICO DE ENFERMAGEM";"II";"A";"06/07/2022";"2022/07/06 00:00:00";"2023/07/05 00:00:00"
14723118;3;"LEANDRO RODRIGO SOARES";"96990449187";"11/04/1981";"CONTRATO TEMPORARIO";"JXXIII";"COORDENACAO DE URGENCIA E EMERGENCIA ADULTO";"MED";"MEDICO ORTOPEDISTA E TRAUMATOLOGISTA";"III";"A";"03/03/2022";"2022/03/03 00:00:00";"2023/03/02 00:00:00"
14579940;1;"LEANDRO SILVA DAMASIO";"01286217610";"15/11/1979";"CONTRATO TEMPORARIO";"IRS";"COORDENACAO DE GESTAO DE PESSOAS";"TOS";"AUXILIAR ADMINISTRATIVO";"I";"A";"01/02/2022";"2022/02/01 00:00:00";"2023/01/31 00:00:00"
14716344;2;"LEANDRO TELES DE OLIVEIRA PINTO";"06741137645";"03/10/1985";"CONTRATO TEMPORARIO";"HCM";"COORDENACAO TECNICA DE ENFERMAGEM";"PENF";"TECNICO DE ENFERMAGEM";"II";"A";"28/06/2021";"2021/06/28 00:00:00";"2023/06/27 00:00:00"
14716344;1;"LEANDRO TELES DE OLIVEIRA PINTO";"06741137645";"03/10/1985";"CONTRATO TEMPORARIO";"JXXIII";"COORDENACAO DAS UNIDADES DE INTERNACAO ADULTO";"PENF";"TECNICO DE ENFERMAGEM";"II";"A";"02/02/2022";"2022/02/02 00:00:00";"2023/02/01 00:00:00"
15238165;1;"LEARCIR LAUREANO DE ARRUDA";"62938487649";"14/01/1971";"CONTRATO TEMPORARIO";"HEM";"COORDENACAO DE APOIO DIAGNOSTICO E TERAPEUTICO";"TOS";"TECNICO EM RADIOLOGIA";"II";"A";"09/05/2022";"2022/05/09 00:00:00";"2023/05/08 00:00:00"
14355838;1;"LEIA BRUGGER MATIAS DE ALMEIDA";"40186660634";"01/10/1959";"CONTRATO TEMPORARIO";"HJK";"COORDENACAO DE ASSISTENCIA FARMACEUTICA";"TOS";"AUXILIAR ADMINISTRATIVO";"I";"A";"01/02/2022";"2022/02/01 00:00:00";"2023/01/31 00:00:00"
14938294;1;"LEICIANE LAGO PEREIRA SILVA";"08516620646";"04/04/1988";"CONTRATO TEMPORARIO";"CSSI";"COORDENACAO DA UNIDADE DE PACIENTES EXTERNOS";"PENF";"ENFERMEIRO";"IV";"A";"15/03/2021";"2021/03/15 00:00:00";"2023/03/14 00:00:00"
15074958;1;"LEIDIANE EVELIN DELFINO VITORIO LEMOS";"08194892635";"17/10/1987";"CONTRATO TEMPORARIO";"HRJP";"COORDENACAO DAS UNIDADES DE INTERNACAO";"PENF";"TECNICO DE ENFERMAGEM";"II";"A";"01/02/2022";"2022/02/01 00:00:00";"2023/01/31 00:00:00"
14592679;2;"LEIDIMAR MARLEY MOREIRA";"00035930616";"27/09/1973";"CONTRATO TEMPORARIO";"HIJPII";"NUCLEO DE RISCO";"TOS";"AUXILIAR ADMINISTRATIVO";"I";"A";"01/02/2022";"2022/02/01 00:00:00";"2023/01/31 00:00:00"
15067952;1;"LEILA APARECIDA ALVES";"09883742690";"20/06/1988";"CONTRATO TEMPORARIO";"CSSFA";"COORDENACAO DA UNIDADE DE INTERNACAO E PACIENTES EXTERNOS";"PENF";"TECNICO DE ENFERMAGEM";"II";"A";"01/02/2022";"2022/02/01 00:00:00";"2023/01/31 00:00:00"
14541841;2;"LEILA BATISTA ALVES FARIA";"03671242620";"28/05/1979";"CONTRATO TEMPORARIO";"HRAD";"COORDENACAO DA MATERNIDADE";"PENF";"TECNICO DE ENFERMAGEM";"II";"A";"0000-00-00";"2021/10/01 00:00:00";"2023/06/30 00:00:00"
14883268;2;"LEILA BATISTA PENA";"12352778603";"19/01/1993";"CONTRATO TEMPORARIO";"HIJPII";"COORDENACAO DE URGENCIA E EMERGENCIA PEDIATRICA";"MED";"MEDICO GENERALISTA";"I";"A";"02/07/2022";"2022/07/02 00:00:00";"2022/12/28 00:00:00"
14883268;1;"LEILA BATISTA PENA";"12352778603";NA;"CONTRATO TEMPORARIO";"HIJPII";NA;"MEDRE";"MEDICO";"I";"A";NA;"2020/03/01 00:00:00";"2023/02/28 00:00:00"
14791958;1;"LEILA CATIA DE OLIVEIRA";"01491116650";"25/02/1977";"CONTRATO TEMPORARIO";"HJK";"COORDENACAO DE INTERNACAO - ADULTO";"PENF";"TECNICO DE ENFERMAGEM";"II";"A";"07/02/2022";"2022/02/07 00:00:00";"2023/02/06 00:00:00"
15261316;1;"LEILA DA SILVA SOARES";"09136316636";"10/01/1989";"CONTRATO TEMPORARIO";"HIJPII";"COORDENACAO DE ASSISTENCIA FARMACEUTICA";"AGAS";"FARMACEUTICO";"I";"A";"23/06/2022";"2022/06/23 00:00:00";"2023/06/22 00:00:00"
13432356;3;"LEILA NASCIMENTO LEAL DE OLIVEIRA";"04570535690";"22/05/1979";"CONTRATO TEMPORARIO";"DIGEPE";"(DESAT.)COORDENACAO DE EXECUCAO ORCAMENTARIA E FINANCEIRA";"TOS";"AUXILIAR ADMINISTRATIVO";"I";"A";"01/02/2022";"2022/02/01 00:00:00";"2023/01/31 00:00:00"
15287766;1;"LEILIANE VIRGINIA BRAGA";"04852329605";"22/01/1983";"CONTRATO TEMPORARIO";"HRAD";"COORDENACAO DAS UNIDADES DE INTERNACAO";"PENF";"TECNICO DE ENFERMAGEM";"II";"A";"0000-00-00";"2022/07/02 00:00:00";"2023/07/01 00:00:00"
14784698;3;"LELIANE OLIVEIRA CRUZ MOURA";"07795011608";"06/12/1986";"CONTRATO TEMPORARIO";"JXXIII";"COORDENACAO DE LABORATORIO E AGENCIA TRANSFUSIONAL";"PENF";"TECNICO DE ENFERMAGEM";"II";"A";"25/05/2021";"2021/05/25 00:00:00";"2023/05/24 00:00:00"
10895126;3;"LENI MOREIRA PRATES";"05779977690";"21/10/1973";"CONTRATO TEMPORARIO";"MOV";"COORDENACAO DA UNIDADE DE NEONATOLOGIA";"PENF";"TECNICO DE ENFERMAGEM";"II";"A";"04/02/2022";"2022/02/04 00:00:00";"2023/01/03 00:00:00"
14959720;3;"LENILZA APARECIDA LEANDRO";"66025060649";"22/12/1963";"CONTRATO TEMPORARIO";"HEM";"COORDENACAO DAS UNIDADES DE INTERNACAO";"PENF";"TECNICO DE ENFERMAGEM";"II";"A";"10/03/2022";"2022/03/10 00:00:00";"2023/03/09 00:00:00"
14959720;2;"LENILZA APARECIDA LEANDRO";"66025060649";"22/12/1963";"CONTRATO TEMPORARIO";"HJK";"COORDENACAO DA MATERNIDADE";"PENF";"TECNICO DE ENFERMAGEM";"II";"A";"11/03/2022";"2022/03/11 00:00:00";"2023/03/10 00:00:00"
14581318;2;"LENUZIA ANGELINO VERLY ALMEIDA SANTOS";"70797706615";"09/10/1968";"CONTRATO TEMPORARIO";"HAC";"COORDENACAO CIRURGICA";"TOS";"AUXILIAR ADMINISTRATIVO";"I";"A";"01/02/2022";"2022/02/01 00:00:00";"2023/01/31 00:00:00"
11437563;4;"LEONARDO BARNSLEY ARAUJO";"87782057604";"13/11/1976";"CONTRATO TEMPORARIO";"JXXIII";"COORDENACAO DE URGENCIA E EMERGENCIA ADULTO";"MED";"MEDICO NEUROCIRURGIAO";"III";"A";"02/11/2021";"2021/11/02 00:00:00";"2023/06/30 00:00:00"
13625983;2;"LEONARDO BRANCO AIDAR";"01421983664";"21/11/1985";"CONTRATO TEMPORARIO";"HRAD";"COORDENACAO DA UNIDADE DE PACIENTES EXTERNOS";"MED";"MEDICO CIRURGIAO GERAL";"III";"A";"0000-00-00";"2022/03/26 00:00:00";"2023/03/25 00:00:00"
14955850;1;"LEONARDO CORTES ANTUNES";"49486195153";"26/05/1971";"CONTRATO TEMPORARIO";"HRAD";"COORDENACAO DA UNIDADE DE PACIENTES EXTERNOS";"MED";"MEDICO ORTOPEDISTA E TRAUMATOLOGISTA";"III";"A";"0000-00-00";"2021/04/10 00:00:00";"2023/04/09 00:00:00"
50369;1;"LEONARDO DE CAMPOS CORREA OLIVEIRA";"05622827698";"0000-00-00";NA;"HRAD";"COORDENACAO DA UNIDADE DE PACIENTES EXTERNOS";NA;"";NA;NA;"0000-00-00";NA;NA
14407266;2;"LEONARDO LUIZ DE SANTIS COELHO";"90968751687";"14/08/1974";"CONTRATO TEMPORARIO";"HJK";"COORDENACAO DE ASSISTENCIA FARMACEUTICA";"TOS";"AUXILIAR ADMINISTRATIVO";"I";"A";"01/02/2022";"2022/02/01 00:00:00";"2023/01/31 00:00:00"
14407266;1;"LEONARDO LUIZ DE SANTIS COELHO";"90968751687";"14/08/1974";"CONTRATO TEMPORARIO";"CMT";"GERENCIA ADMINISTRATIVA";"TOS";"AUXILIAR ADMINISTRATIVO";"I";"A";"01/02/2022";"2022/02/01 00:00:00";"2023/01/31 00:00:00"
10886349;3;"LEONARDO MARCIUS DE CARVALHO VALLE";"93346565653";"30/07/1971";"CONTRATO TEMPORARIO";"JXXIII";"COORDENACAO DO BLOCO CIRURGICO";"MED";"MEDICO ANESTESIOLOGISTA";"III";"A";"28/05/2021";"2021/05/28 00:00:00";"2023/05/27 00:00:00"
14937916;1;"LEONARDO MENDES MESQUITA";"11519023650";NA;"CONTRATO TEMPORARIO";"JXXIII";NA;"MEDRE";"MEDICO";"I";"A";NA;"2021/03/01 00:00:00";"2023/02/28 00:00:00"
15122021;1;"LEONARDO MENDONCA MONTEIRO DE CASTRO";"10550292659";NA;"CONTRATO TEMPORARIO";"HIJPII";NA;"MEDRE";"MEDICO";"I";"A";NA;"2022/03/01 00:00:00";"2023/02/28 00:00:00"
14880710;1;"LEONARDO MOTTA COSTA LOPES";"07473547666";NA;"CONTRATO TEMPORARIO";"IRS";NA;"MEDRE";"MEDICO";"I";"A";NA;"2020/03/01 00:00:00";"2023/02/28 00:00:00"
14638621;1;"LEONARDO NAMORATO";"05472187613";"15/09/1982";"CONTRATO TEMPORARIO";"HJK";"COORDENACAO MEDICA DA URGENCIA E EMERGENCIA";"MED";"MEDICO CLINICO";"III";"A";"05/07/2022";"2022/07/05 00:00:00";"2023/01/04 00:00:00"
14638621;2;"LEONARDO NAMORATO";"05472187613";"15/09/1982";"CONTRATO TEMPORARIO";"HJK";"COORDENACAO DE INTERNACAO - ADULTO";"MED";"MEDICO CLINICO";"III";"A";"01/02/2022";"2022/02/01 00:00:00";"2023/01/31 00:00:00"
12089231;4;"LEONARDO OLIVEIRA LEITE DE SOUZA";"04012075608";"01/09/1976";"CONTRATO TEMPORARIO";"HGB-JA";"COORDENACAO DA UNIDADE CIRURGICA";"MED";"MEDICO ORTOPEDISTA E TRAUMATOLOGISTA";"III";"A";"12/04/2021";"2021/04/12 00:00:00";"2023/04/11 00:00:00"
14314645;2;"LEONARDO RODRIGUES PEREIRA";"71377395634";"11/07/1968";"CONTRATO TEMPORARIO";"JXXIII";"COORDENACAO DE URGENCIA E EMERGENCIA ADULTO";"MED";"MEDICO OFTALMOLOGISTA";"III";"A";"03/03/2022";"2022/03/03 00:00:00";"2023/03/02 00:00:00"
13855374;6;"LEONARDO SCHIESS SALES ANTUNES";"07356079666";"21/08/1985";"CONTRATO TEMPORARIO";"JXXIII";"COORDENACAO DAS UNIDADES DE INTERNACAO CIRURGICA";"MED";"MEDICO CIRURGIAO GERAL";"III";"A";"07/03/2022";"2022/03/07 00:00:00";"2023/03/06 00:00:00"
13855374;3;"LEONARDO SCHIESS SALES ANTUNES";"07356079666";"21/08/1985";"CONTRATO TEMPORARIO";"JXXIII";"COORDENACAO CIRURGICA";"MED";"MEDICO CIRURGIAO GERAL";"III";"A";"11/03/2018";"2021/02/01 00:00:00";"2023/01/31 00:00:00"
10865830;4;"LEONARDO SOARES ESQUERDO";"03752832690";"14/05/1975";"CONTRATO TEMPORARIO";"JXXIII";"COORDENACAO DO CENTRO DE TRATAMENTO DE QUEIMADOS";"TOS";"AUXILIAR ADMINISTRATIVO";"I";"A";"11/05/2022";"2022/05/11 00:00:00";"2023/05/10 00:00:00"
15074883;1;"LEONARDO VIEIRA DE OLIVEIRA";"07986158697";"20/02/1985";"CONTRATO TEMPORARIO";"HRJP";"COORDENACAO DAS UNIDADES DE INTERNACAO";"PENF";"TECNICO DE ENFERMAGEM";"II";"A";"01/02/2022";"2022/02/01 00:00:00";"2023/01/31 00:00:00"
14541866;5;"LETICIA ALVES ANDRADE ALBUQUERQUE";"08723421665";"14/10/1986";"CONTRATO TEMPORARIO";"JXXIII";"COORDENACAO DA UNIDADE DE TERAPIA INTENSIVA PEDIATRICA";"MED";"MEDICO PEDIATRA";"III";"A";"03/03/2022";"2022/03/03 00:00:00";"2023/03/02 00:00:00"
14933998;1;"LETICIA APARECIDA DE FIGUEIREDO";"09883782640";NA;"CONTRATO TEMPORARIO";"HGB-JA";NA;"MEDRE";"MEDICO";"I";"A";NA;"2021/03/01 00:00:00";"2023/02/28 00:00:00"
14627194;1;"LETICIA APARECIDA RODRIGUES";"12706333685";"07/10/1997";"CONTRATO TEMPORARIO";"CSSFE";"COORDENACAO DE APOIO DIAGNOSTICO E TERAPEUTICO";"TOS";"AUXILIAR ADMINISTRATIVO";"I";"A";"01/02/2022";"2022/02/01 00:00:00";"2023/01/31 00:00:00"
14436406;4;"LETICIA COELHO E SOUZA";"08353330601";"09/03/1987";"CONTRATO TEMPORARIO";"HJK";"COORDENACAO DA UNIDADE DE TERAPIA INTENSIVA NEONATAL";"MED";"MEDICO PEDIATRA";"III";"A";"17/03/2022";"2022/03/17 00:00:00";"2023/03/16 00:00:00"
15067812;1;"LETICIA CRISTINA GOMES DE CASTRO";"13491649684";"03/02/2000";"CONTRATO TEMPORARIO";"JXXIII";"COORDENACAO DAS UNIDADES DE INTERNACAO ADULTO";"PENF";"TECNICO DE ENFERMAGEM";"II";"A";"01/02/2022";"2022/02/01 00:00:00";"2023/01/31 00:00:00"
14896419;2;"LETICIA DE ASSIS NETO";"11586993607";"24/03/1999";"CONTRATO TEMPORARIO";"HGB-JA";"COORDENACAO DA UNIDADE DE PACIENTES CRITICOS";"PENF";"TECNICO DE ENFERMAGEM";"II";"A";"04/03/2022";"2022/03/04 00:00:00";"2023/03/03 00:00:00"
14612360;1;"LETICIA DE SOUZA";"08208877654";"05/04/1990";"CONTRATO TEMPORARIO";"CSPD";"COORDENACAO DE APOIO DIAGNOSTICO E TERAPEUTICO";"AGAS";"FARMACEUTICO";"I";"A";"05/03/2018";"2022/02/01 00:00:00";"2023/01/31 00:00:00"
15196298;1;"LETICIA FERREIRA DE SOUZA";"04492576657";"29/10/1981";"CONTRATO TEMPORARIO";"HJK";"COORDENACAO DE INTERNACAO - ADULTO";"PENF";"TECNICO DE ENFERMAGEM";"II";"A";"15/04/2022";"2022/04/15 00:00:00";"2023/04/14 00:00:00"
14668164;1;"LETICIA GUIMARAES SILVA GOMES";"07597323611";"27/01/1983";"CONTRATO TEMPORARIO";"HRAD";"COORDENACAO DE GESTAO DA INFORMACAO";"TOS";"AUXILIAR ADMINISTRATIVO";"I";"A";"0000-00-00";"2022/02/01 00:00:00";"2023/01/31 00:00:00"
14946537;2;"LETICIA HELOISA DA SILVA VICENTE";"08890637617";NA;"CONTRATO TEMPORARIO";"HRJP";NA;"MED";"MEDICO";"III";"A";NA;"2022/07/01 00:00:00";"2022/12/27 00:00:00"
14900328;2;"LETICIA HEREDIA DA SILVA";"05012779606";"16/07/1977";"CONTRATO TEMPORARIO";"HEM";"COORDENACAO DAS UNIDADES CRITICAS";"PENF";"TECNICO DE ENFERMAGEM";"II";"A";"02/07/2022";"2022/07/02 00:00:00";"2023/06/28 00:00:00"
15196728;1;"LETICIA MAIA DUARTE";"01663525609";NA;"CONTRATO TEMPORARIO";"MOV";NA;"MEDRE";"MEDICO";"I";"A";NA;"2022/04/08 00:00:00";"2023/04/07 00:00:00"
14542005;1;"LETICIA MARIA DE MELO";"11059067609";"02/11/1992";"CONTRATO TEMPORARIO";"HRAD";"COORDENACAO DA UNIDADE DE PACIENTES EXTERNOS";"AGAS";"NUTRICIONISTA";"I";"A";"0000-00-00";"2022/02/01 00:00:00";"2023/01/31 00:00:00"
15268402;2;"LETICIA MATTAR MONICE";"10550822631";"09/07/1990";"CONTRATO TEMPORARIO";"JXXIII";"COORDENACAO DO BLOCO CIRURGICO";"MED";"MEDICO ANESTESIOLOGISTA";"III";"A";"04/07/2022";"2022/07/04 00:00:00";"2022/12/30 00:00:00"
14883276;1;"LETICIA MIGUEZ DE SOUZA MICHELLI";"12920953699";NA;"CONTRATO TEMPORARIO";"HIJPII";NA;"MEDRE";"MEDICO";"I";"A";NA;"2020/03/01 00:00:00";"2023/02/28 00:00:00"
15279045;1;"LETICIA RIBEIRO DE CARVALHO";"13206812712";"03/04/1996";"CONTRATO TEMPORARIO";"HIJPII";"COORDENACAO DE URGENCIA E EMERGENCIA PEDIATRICA";"MED";"MEDICO GENERALISTA";"I";"A";"01/07/2022";"2022/07/01 00:00:00";"2022/12/27 00:00:00"
15118334;1;"LETICIA RODRIGUES PENA TEMER";"13058306601";NA;"CONTRATO TEMPORARIO";"HAC";NA;"MEDRE";"MEDICO";"I";"A";NA;"2022/03/01 00:00:00";"2023/02/28 00:00:00"
14755268;2;"LETICIA RODRIGUES SILVA";"01466405198";"30/09/1994";"CONTRATO TEMPORARIO";"MOV";"COORDENACAO DA UNIDADE DE NEONATOLOGIA";"MED";"MEDICO PEDIATRA";"III";"A";"10/06/2022";"2022/06/10 00:00:00";"2023/06/09 00:00:00"
14884407;1;"LETICIA SALLES FIALHO MENTA";"12374128628";NA;"CONTRATO TEMPORARIO";"HJK";NA;"MEDRE";"MEDICO";"I";"A";NA;"2020/03/01 00:00:00";"2023/02/28 00:00:00"
15195456;2;"LETICIA SILVA DETOMI";"07419427631";"24/03/1994";"CONTRATO TEMPORARIO";"HIJPII";"COORDENACAO DE URGENCIA E EMERGENCIA PEDIATRICA";"MED";"MEDICO PEDIATRA";"III";"A";"01/07/2022";"2022/07/01 00:00:00";"2022/12/27 00:00:00"
14884431;1;"LETICIA SOARES CUNHA MELO";"11104075644";NA;"CONTRATO TEMPORARIO";"HJK";NA;"MEDRE";"MEDICO";"I";"A";NA;"2020/03/01 00:00:00";"2023/02/28 00:00:00"
14937924;2;"LETICIA UTSCH ARAUJO";"12374382680";"29/03/1994";"CONTRATO TEMPORARIO";"JXXIII";"COORDENACAO DE URGENCIA E EMERGENCIA ADULTO";"MED";"MEDICO GENERALISTA";"I";"A";"01/07/2022";"2022/07/01 00:00:00";"2022/12/27 00:00:00"
14937924;1;"LETICIA UTSCH ARAUJO";"12374382680";NA;"CONTRATO TEMPORARIO";"JXXIII";NA;"MEDRE";"MEDICO";"I";"A";NA;"2021/03/01 00:00:00";"2023/02/28 00:00:00"
15123508;1;"LETYCIA LIMAS SILVA";"11885000669";NA;"CONTRATO TEMPORARIO";"MOV";NA;"MEDRE";"MEDICO";"I";"A";NA;"2022/03/01 00:00:00";"2023/02/28 00:00:00"
14823553;1;"LEUDMARLEN RUBIA GUSMAO FIGUEIREDO";"08115817643";"09/05/1992";"CONTRATO TEMPORARIO";"HJK";"COORDENACAO DE HOTELARIA";"TOS";"AUXILIAR ADMINISTRATIVO";"I";"A";"01/02/2022";"2022/02/01 00:00:00";"2023/01/31 00:00:00"
14668107;2;"LIA DA SILVA VICENTE";"06951265631";"20/05/1985";"CONTRATO TEMPORARIO";"CSSFA";"COORDENACAO DE GESTAO DE PESSOAS";"TOS";"AUXILIAR ADMINISTRATIVO";"I";"A";"14/10/2021";"2021/10/14 00:00:00";"2023/06/30 00:00:00"
14154322;3;"LIALA RODRIGUES LOPES MIRANDA";"08263511666";"07/07/1987";"CONTRATO TEMPORARIO";"MOV";"COORDENACAO DA GINECOLOGIA E OBSTETRICIA";"MED";"MEDICO GINECOLOGISTA";"III";"A";"03/07/2022";"2022/07/03 00:00:00";"2023/07/02 00:00:00"
15068364;1;"LIANA LUIZA DA SILVA";"00009063609";"24/02/1973";"CONTRATO TEMPORARIO";"MOV";"COORDENACAO DA GINECOLOGIA E OBSTETRICIA";"PENF";"TECNICO DE ENFERMAGEM";"II";"A";"02/02/2022";"2022/02/02 00:00:00";"2023/02/01 00:00:00"
14934343;1;"LIBERIO MENDONCA GOMES";"08698148697";NA;"CONTRATO TEMPORARIO";"HJK";NA;"MEDRE";"MEDICO";"I";"A";NA;"2021/03/01 00:00:00";"2023/02/28 00:00:00"
15074974;1;"LIDIA ELIANA DA SILVA ADAO";"04693875643";"23/07/1977";"CONTRATO TEMPORARIO";"HRJP";"COORDENACAO DAS UNIDADES CRITICAS";"PENF";"TECNICO DE ENFERMAGEM";"II";"A";"01/02/2022";"2022/02/01 00:00:00";"2023/01/31 00:00:00"
14983522;1;"LIDIA ROCHA NUNES";"09892359631";"26/03/1994";"CONTRATO TEMPORARIO";"JXXIII";"COORDENACAO DO CENTRO DE TRATAMENTO DE QUEIMADOS";"AGAS";"NUTRICIONISTA";"I";"A";"12/07/2021";"2021/07/12 00:00:00";"2023/06/30 00:00:00"
14542047;3;"LIDIANE PEREIRA DOS ANJOS";"07542231677";"26/04/1986";"CONTRATO TEMPORARIO";"HIJPII";"COORDENACAO DAS UNIDADES DE INTERNACAO PEDIATRICA";"PENF";"ENFERMEIRO";"IV";"A";"08/02/2022";"2022/02/08 00:00:00";"2023/02/07 00:00:00"
14612279;1;"LIDIANE PEREIRA SPEZIALI";"03174459605";"22/11/1975";"CONTRATO TEMPORARIO";"DPGF";"(DESAT.)GERENCIA DE LICITACOES E CONTRATOS";"TOS";"AUXILIAR ADMINISTRATIVO";"I";"A";"01/02/2022";"2022/02/01 00:00:00";"2023/01/31 00:00:00"
14514749;2;"LIDIANE SOARES ARAUJO";"07495797657";"25/04/1985";"CONTRATO TEMPORARIO";"HJK";"COORDENACAO DE INTERNACAO - ADULTO";"PENF";"ENFERMEIRO";"IV";"A";"01/02/2022";"2022/02/01 00:00:00";"2023/01/31 00:00:00"
14514749;1;"LIDIANE SOARES ARAUJO";"07495797657";"25/04/1985";"CONTRATO TEMPORARIO";"HAC";"COORDENACAO DE INTERNACAO - ONCOLOGICA";"PENF";"ENFERMEIRO";"IV";"A";"09/09/2022";"2022/09/09 00:00:00";"2023/09/08 00:00:00"
12293247;2;"LIDINHO FERNANDES RODRIGUES";"04861674611";"24/05/1980";"CONTRATO TEMPORARIO";"JXXIII";"COORDENACAO DAS UNIDADES DE INTERNACAO ADULTO";"PENF";"TECNICO DE ENFERMAGEM";"II";"A";"01/02/2022";"2022/02/01 00:00:00";"2023/01/31 00:00:00"
15036320;1;"LIGIA ARAUJO MILANEZ";"08011644602";"16/09/1985";"CONTRATO TEMPORARIO";"HAC";"COORDENACAO DO AMBULATORIO";"MED";"MEDICO ONCOLOGISTA";"III";"A";"27/09/2021";"2021/09/23 00:00:00";"2023/06/30 00:00:00"
15240302;1;"LIGIA BARROS DE OLIVEIRA";"09634760686";"16/02/1990";"CONTRATO TEMPORARIO";"HGB-JA";"COORDENACAO DA UNIDADE DE CLINICA MEDICA";"MED";"MEDICO NEUROLOGISTA";"III";"A";"01/06/2022";"2022/06/01 00:00:00";"2023/05/31 00:00:00"
14542062;1;"LIGIA GOMES GERMANO CARVALHOPEREIRA";"07513726680";"05/10/1985";"CONTRATO TEMPORARIO";"CSSFA";"COORDENACAO TECNICA DE ENFERMAGEM";"PENF";"ENFERMEIRO";"IV";"A";"22/08/2017";"2022/02/01 00:00:00";"2023/01/31 00:00:00"
14956296;2;"LILIAN ADRIANE DE ASSI";"03934842623";"10/09/1977";"CONTRATO TEMPORARIO";"JXXIII";"COORDENACAO DA UNIDADE DE TERAPIA INTENSIVA PEDIATRICA";"AGAS";"FISIOTERAPEUTA RESPIRATORIA";"III";"A";"03/02/2022";"2022/02/03 00:00:00";"2023/02/02 00:00:00"
14956296;1;"LILIAN ADRIANE DE ASSI";"03934842623";"10/09/1977";"CONTRATO TEMPORARIO";"HJK";"COORDENACAO DA EQUIPE MULTIDISCIPLINAR";"AGAS";"FISIOTERAPEUTA";"III";"A";"03/10/2022";"2022/10/03 00:00:00";"2023/10/02 00:00:00"
13963806;2;"LILIAN AFONSO DA SILVA";"08125115650";"05/08/1987";"CONTRATO TEMPORARIO";"JXXIII";"COORDENACAO DE LABORATORIO E AGENCIA TRANSFUSIONAL";"AGAS";"FARMACEUTICO BIOQUIMICO";"I";"A";"14/09/2021";"2021/09/14 00:00:00";"2023/06/30 00:00:00"
13801485;1;"LILIAN AYANE DA COSTA ALVES";"07527075660";"04/03/1987";"CONTRATO TEMPORARIO";"HGB-JA";"COORDENACAO DA UNIDADE CIRURGICA";"PENF";"TECNICO DE ENFERMAGEM";"II";"A";"04/03/2021";"2022/02/02 00:00:00";"2023/02/01 00:00:00"
15085020;1;"LILIAN CRISTINA DOS REIS SANTOS";"06911792630";"06/05/1983";NA;"HJXXIII";"COORDENACAO DE ASSISTENCIA FARMACEUTICA";NA;"TECNICO EM FARMACIA";NA;NA;"01/02/2022";NA;NA
15067333;1;"LILIAN CRISTINA LAGARES";"07291088640";"31/05/1984";"CONTRATO TEMPORARIO";"JXXIII";"COORDENACAO DAS UNIDADES DE INTERNACAO ADULTO";"PENF";"TECNICO DE ENFERMAGEM";"II";"A";"01/02/2022";"2022/02/01 00:00:00";"2023/01/31 00:00:00"
15074966;1;"LILIAN FARIAS FERREIRA";"09428517658";"10/11/1989";"CONTRATO TEMPORARIO";"HRJP";"COORDENACAO DE ASSISTENCIA FARMACEUTICA";"AGAS";"FARMACEUTICO";"I";"A";"01/02/2022";"2022/02/01 00:00:00";"2023/01/31 00:00:00"
14374607;2;"LILIAN FATIMA MARTINS ARAUJO";"01441519602";"13/02/1983";"CONTRATO TEMPORARIO";"HIJPII";"COORDENACAO DE DIAGNOSTICO POR IMAGEM";"TOS";"AUXILIAR ADMINISTRATIVO";"I";"A";"02/02/2022";"2022/02/02 00:00:00";"2023/02/01 00:00:00"
15289465;1;"LILIAN FERREIRA DA SILVA GOMES";"07144488694";"08/08/1981";"CONTRATO TEMPORARIO";"HEM";"COORDENACAO DAS UNIDADES DE INTERNACAO";"PENF";"TECNICO DE ENFERMAGEM";"II";"A";"05/07/2022";"2022/07/05 00:00:00";"2023/07/04 00:00:00"
10954410;3;"LILIAN GOMES COSTA";"05681668681";NA;"CONTRATO TEMPORARIO";"JXXIII";NA;"PENF";"ENFERMEIRO";"IV";"A";NA;"2022/09/30 00:00:00";"2023/09/29 00:00:00"
15048523;1;"LILIAN MARA PIMENTA";"03419224630";"14/03/1979";"CONTRATO TEMPORARIO";"HMAL";"ASSESSORIA DE GESTAO ESTRATEGICA E QUALIDADE";"TOS";"TECNICO DE CONTABILIDADE";"II";"A";"08/11/2021";"2021/11/08 00:00:00";"2023/06/30 00:00:00"
14970768;1;"LILIAN MAYRA MOTERANI";"09816068656";"01/08/1988";"CONTRATO TEMPORARIO";"JXXIII";"COORDENACAO DO CENTRO DE TRATAMENTO DE QUEIMADOS";"PENF";"TECNICO DE ENFERMAGEM";"II";"A";"03/06/2021";"2021/06/03 00:00:00";"2023/06/02 00:00:00"
14701544;4;"LILIAN REGINA DA SILVA DUARTE";"02740934645";"23/10/1974";"CONTRATO TEMPORARIO";"JXXIII";"COORDENACAO DA UNIDADE DE TERAPIA INTENSIVA PEDIATRICA";"PENF";"TECNICO DE ENFERMAGEM";"II";"A";"07/04/2022";"2022/04/07 00:00:00";"2023/04/06 00:00:00"
14889299;1;"LILIANE APARECIDA DE OLIVEIRA";"07171306658";"08/02/1985";"CONTRATO TEMPORARIO";"HRAD";"COORDENACAO DAS UNIDADES DE INTERNACAO";"PENF";"TECNICO DE ENFERMAGEM";"II";"A";"0000-00-00";"2022/02/02 00:00:00";"2023/02/01 00:00:00"
14407563;1;"LILIANE DE CARVALHO CAMPOS BORGES";"00510136656";"10/04/1974";"CONTRATO TEMPORARIO";"HJK";"COORDENACAO DA EQUIPE MULTIDISCIPLINAR";"AGAS";"FISIOTERAPEUTA";"III";"A";"02/07/2022";"2022/07/02 00:00:00";"2023/07/01 00:00:00"
14627228;3;"LILIANE LINHARES DE OLIVEIRA";"08240147666";"08/10/1987";"CONTRATO TEMPORARIO";"HJK";"COORDENACAO DO LABORATORIO";"AGAS";"FARMACEUTICO BIOQUIMICO";"I";"A";"18/05/2022";"2022/05/18 00:00:00";"2023/05/17 00:00:00"
14557748;1;"LILIANE RODRIGUES DE SOUSA";"09595894656";"23/11/1989";"CONTRATO TEMPORARIO";"HJK";"COORDENACAO DE INTERNACAO - ADULTO";"PENF";"TECNICO DE ENFERMAGEM";"II";"A";"21/02/2022";"2022/02/21 00:00:00";"2023/02/20 00:00:00"
14583009;1;"LILITE NAIARA DE SA CONCEICAO";"10021652619";"17/07/1991";"CONTRATO TEMPORARIO";"MGT";"GERENCIA ADMINISTRATIVA";"TOS";"AUXILIAR ADMINISTRATIVO";"I";"A";"02/02/2022";"2022/02/02 00:00:00";"2023/02/01 00:00:00"
12697330;4;"LINDAIR FERREIRA CIMINIO";"04638361625";"11/11/1979";"CONTRATO TEMPORARIO";"HJK";"COORDENACAO MEDICA DA URGENCIA E EMERGENCIA";"PENF";"TECNICO DE ENFERMAGEM";"II";"A";"04/02/2022";"2022/02/04 00:00:00";"2023/02/03 00:00:00"
12790994;4;"LINDAIRES RODRIGUES RIBEIRO";"04275574613";"26/08/1979";"CONTRATO TEMPORARIO";"JXXIII";"COORDENACAO DE GESTAO DE PESSOAS";"TOS";"AUXILIAR ADMINISTRATIVO";"I";"A";"10/05/2022";"2022/05/10 00:00:00";"2023/05/09 00:00:00"
14002547;2;"LINDAURA FLOR DE MAIO ANDRADE";"51163144649";"28/05/1967";"CONTRATO TEMPORARIO";"HIJPII";"COORDENACAO DAS UNIDADES DE INTERNACAO PEDIATRICA";"TOS";"PROFESSOR RECREADOR";"II";"A";"11/11/2021";"2021/11/11 00:00:00";"2023/06/30 00:00:00"
14051734;2;"LISLY KELLY ALVES BATISTA";"07320666626";"31/07/1984";"CONTRATO TEMPORARIO";"CSSFA";"COORDENACAO TECNICA DE ENFERMAGEM";"PENF";"ENFERMEIRO";"IV";"A";"30/07/2021";"2021/07/30 00:00:00";"2023/06/30 00:00:00"
15122047;1;"LIVIA BARBOSA DA SILVA";"10683015621";NA;"CONTRATO TEMPORARIO";"HIJPII";NA;"MEDRE";"MEDICO";"I";"A";NA;"2022/03/01 00:00:00";"2023/02/28 00:00:00"
15065543;1;"LIVIA CARDOSO REIS";"09560922688";"11/07/1992";"CONTRATO TEMPORARIO";"HAC";"COORDENACAO DO AMBULATORIO";"MED";"MEDICO CIRURGIAO GERAL";"III";"A";"11/01/2022";"2022/01/06 00:00:00";"2023/01/05 00:00:00"
15284466;1;"LIVIA CRISTINA LIMA SOARES BARBOSA";"05844717694";"24/11/1981";"CONTRATO TEMPORARIO";"JXXIII";"COORDENACAO DA UNIDADE DE TERAPIA INTENSIVA ADULTO";"MED";"MEDICO CLINICO";"III";"A";"01/07/2022";"2022/07/01 00:00:00";"2022/12/27 00:00:00"
14514772;1;"LIVIA FIGUEROA LAGE";"07327155635";"26/12/1985";"CONTRATO TEMPORARIO";"HJK";"COORDENACAO DA UNIDADE DE TERAPIA INTENSIVA NEONATAL";"MED";"MEDICO PEDIATRA";"III";"A";"04/02/2022";"2022/02/04 00:00:00";"2023/02/03 00:00:00"
14180640;3;"LIVIA INEZ RIBEIRO PERIARD";"12424496714";"16/12/1988";"CONTRATO TEMPORARIO";"JXXIII";"COORDENACAO DO BLOCO CIRURGICO";"MED";"MEDICO ANESTESIOLOGISTA";"III";"A";"01/08/2018";"2021/02/01 00:00:00";"2023/03/02 00:00:00"
14424824;2;"LIVIA LOURENCO DO CARMO";"10437422631";"25/04/1990";"CONTRATO TEMPORARIO";"HRAD";"COORDENACAO DA UNIDADE DE PACIENTES EXTERNOS";"MED";"MEDICO OFTALMOLOGISTA";"III";"A";"25/05/2022";"2022/05/25 00:00:00";"2023/05/24 00:00:00"
14568612;3;"LIVIA MARIA UEBE GONCALVES";"08612410614";"02/10/1988";"CONTRATO TEMPORARIO";"JXXIII";"COORDENACAO DAS UNIDADES DE INTERNACAO ADULTO";"PENF";"ENFERMEIRO";"IV";"A";"04/10/2021";"2021/10/04 00:00:00";"2023/06/30 00:00:00"
14786552;1;"LIVIA MARIS DOS SANTOS CARVALHO";"10380724685";"07/11/1989";"CONTRATO TEMPORARIO";"MOV";"COORDENACAO DE APOIO DIAGNOSTICO E TERAPEUTICO";"AGAS";"FARMACEUTICO BIOQUIMICO";"I";"A";"17/03/2022";"2022/03/17 00:00:00";"2023/03/16 00:00:00"
15152309;1;"LIVIA MATEUS FERREIRA GONCALVES";"04530637646";"10/11/1979";"CONTRATO TEMPORARIO";"JXXIII";"COORDENACAO DE LABORATORIO E AGENCIA TRANSFUSIONAL";"TOS";"TECNICO EM PATOLOGIA CLINICA";"II";"A";"04/03/2022";"2022/03/04 00:00:00";"2023/03/03 00:00:00"
14761001;3;"LIVIA PAMPLONA DE OLIVEIRA";"09932875651";"30/05/1991";"CONTRATO TEMPORARIO";"HEM";"COORDENACAO DAS UNIDADES CRITICAS";"MED";"MEDICO INFECTOLOGISTA";"III";"A";"13/03/2022";"2022/03/13 00:00:00";"2023/03/12 00:00:00"
14701643;2;"LIVIA RAQUEL DE MIRANDA";"99244802600";"10/08/1983";"CONTRATO TEMPORARIO";"CMT";"GERENCIA ASSISTENCIAL";"PENF";"TECNICO DE ENFERMAGEM";"II";"A";"01/02/2022";"2022/02/01 00:00:00";"2023/01/31 00:00:00"
14615736;6;"LIVIA TANURE SANT ANNA";"07625788660";"15/09/1988";"CONTRATO TEMPORARIO";"JXXIII";"COORDENACAO DE URGENCIA E EMERGENCIA ADULTO";"MED";"MEDICO CLINICO";"III";"A";"03/03/2020";"2021/02/01 00:00:00";"2023/03/02 00:00:00"
14884274;2;"LIVIA TASSINARI SCARPAT";"14165385778";"31/10/1993";"CONTRATO TEMPORARIO";"HJK";"COORDENACAO DA UNIDADE DE TERAPIA INTENSIVA ADULTO";"MED";"MEDICO CLINICO";"III";"A";"14/06/2022";"2022/06/18 00:00:00";"2023/06/17 00:00:00"
15023211;1;"LIVIO BRUNO SANTOS CUNHA";"07725823603";"14/08/1984";"CONTRATO TEMPORARIO";"HAC";"COORDENACAO CIRURGICA";"MED";"MEDICO CIRURGIAO DE CABECA E PESCOCO";"III";"A";"29/09/2021";"2021/09/29 00:00:00";"2023/06/30 00:00:00"
14880850;1;"LIZA PEREIRA LEOCADIO";"11252526695";NA;"CONTRATO TEMPORARIO";"IRS";NA;"MEDRE";"MEDICO";"I";"A";NA;"2020/03/01 00:00:00";"2023/02/28 00:00:00"
15197643;1;"LOHANNE DE OLIVEIRA CARNEIRO";"10455624674";"11/12/1994";"CONTRATO TEMPORARIO";"HRAD";"COORDENACAO DA UNIDADE DE PACIENTES EXTERNOS";"MED";"MEDICO ORTOPEDISTA E TRAUMATOLOGISTA";"III";"A";"0000-00-00";"2022/04/24 00:00:00";"2023/04/23 00:00:00"
14439327;5;"LOIANNA MASCARENHAS DA FONSECA";"05424600506";"24/02/1993";"CONTRATO TEMPORARIO";"JXXIII";"COORDENACAO DA UNIDADE DE TERAPIA INTENSIVA ADULTO";"MED";"MEDICO CLINICO";"III";"A";"07/02/2022";"2022/02/07 00:00:00";"2023/02/06 00:00:00"
15197478;1;"LORENA CAROLINE PEREIRA";"10729738639";"02/07/1992";"CONTRATO TEMPORARIO";"HRAD";"COORDENACAO DAS UNIDADES DE INTERNACAO";"PENF";"TECNICO DE ENFERMAGEM";"II";"A";"0000-00-00";"2022/04/25 00:00:00";"2023/04/24 00:00:00"
15166614;1;"LORENA DE SOUZA SANCHES BONGIOVANI";"11527955621";"25/01/1992";"CONTRATO TEMPORARIO";"DIEST";"(DESAT.)GERENCIA DE INFRAESTRUTURA PREDIAL";"AGAS";"ENGENHEIRO";"I";"A";"0000-00-00";"2022/03/28 00:00:00";"2023/03/27 00:00:00"
14919583;2;"LORENA ISIS DOS SANTOS";"08208230669";"24/03/1990";"CONTRATO TEMPORARIO";"HEM";"COORDENACAO DA UNIDADE DE PACIENTES EXTERNOS";"PENF";"ENFERMEIRO";"IV";"A";"01/07/2022";"2022/07/01 00:00:00";"2023/06/30 00:00:00"
14887343;1;"LORENA MARQUES HECK DE PIAU VIEIRA";"11826804617";NA;"CONTRATO TEMPORARIO";"HRAD";NA;"MEDRE";"MEDICO";"I";"A";NA;"2020/03/02 00:00:00";"2023/03/01 00:00:00"
13882428;4;"LORENA MOTA FREITAS BRAGA";"08188830658";"19/09/1988";"CONTRATO TEMPORARIO";"HGB-JA";"COORDENACAO DA UNIDADE DE CLINICA MEDICA";"MED";"MEDICO CLINICO";"III";"A";"26/11/2021";"2021/11/26 00:00:00";"2023/06/30 00:00:00"
14901631;2;"LORENA SAMARA MAGALHAES";"11043646620";"23/05/1992";"CONTRATO TEMPORARIO";"HJK";"COORDENACAO DA EQUIPE MULTIDISCIPLINAR";"AGAS";"ASSISTENTE SOCIAL";"I";"A";"04/10/2022";"2022/10/04 00:00:00";"2023/10/03 00:00:00"
14883284;2;"LOURENE MIRELLE DA CRUZ NOBRE";"08960788686";"06/01/1988";"CONTRATO TEMPORARIO";"HIJPII";"COORDENACAO DE URGENCIA E EMERGENCIA PEDIATRICA";"MED";"MEDICO PEDIATRA";"III";"A";"27/12/2021";"2021/12/27 00:00:00";"2022/12/26 00:00:00"
14946933;1;"LUANA ANGELO DE OLIVEIRA RUAS";"06780659690";"08/02/1986";"CONTRATO TEMPORARIO";"HJK";"COORDENACAO DA MATERNIDADE";"PENF";"TECNICO DE ENFERMAGEM";"II";"A";"06/02/2021";"2021/02/06 00:00:00";"2023/02/05 00:00:00"
14886204;1;"LUANA ASSIS TORRES";"11208124617";NA;"CONTRATO TEMPORARIO";"HEM";NA;"MEDRE";"MEDICO";"I";"A";NA;"2020/03/01 00:00:00";"2023/02/28 00:00:00"
13148820;3;"LUANA CARLA DE PAULA OLIVEIRA";"07050175676";"22/04/1986";"CONTRATO TEMPORARIO";"HGB-JA";"COORDENACAO DE APOIO DIAGNOSTICO E TERAPEUTICO";"AGAS";"FARMACEUTICO";"I";"A";"18/04/2021";"2021/04/18 00:00:00";"2023/04/17 00:00:00"
15070774;1;"LUANA CRISTINA BATISTA DOS SANTOS";"06668091601";"15/08/1981";"CONTRATO TEMPORARIO";"HJK";"COORDENACAO DE INTERNACAO - ADULTO";"PENF";"TECNICO DE ENFERMAGEM";"II";"A";"03/02/2022";"2022/02/03 00:00:00";"2023/02/02 00:00:00"
13844311;1;"LUANA CRISTINA ROSA DOS SANTOS";"01481687603";"06/05/1985";"CONTRATO TEMPORARIO";"HGB-JA";"COORDENACAO DA UNIDADE DE CLINICA MEDICA";"PENF";"ENFERMEIRO";"IV";"A";"02/02/2022";"2022/02/02 00:00:00";"2023/02/01 00:00:00"
14417661;4;"LUANA DIAS GOMES PEREIRA";"09531217637";"14/11/1990";"CONTRATO TEMPORARIO";"JXXIII";"COORDENACAO DE URGENCIA E EMERGENCIA ADULTO";"MED";"MEDICO CLINICO";"III";"A";"05/03/2022";"2022/03/05 00:00:00";"2023/03/04 00:00:00"
15269921;1;"LUANA FERNANDA MOREIRA DA SILVA";"09766535671";"10/03/1996";"CONTRATO TEMPORARIO";"IRS";"COORDENACAO DA UNIDADE DE URGENCIA E EMERGENCIA";"PENF";"TECNICO DE ENFERMAGEM";"II";"A";"01/07/2022";"2022/07/01 00:00:00";"2023/06/30 00:00:00"
14914733;2;"LUANA FERREIRA DE CARVALHO";"11779830602";"26/09/1996";"CONTRATO TEMPORARIO";"HGB-JA";"COORDENACAO DA UNIDADE DE URGENCIA E EMERGENCIA";"PENF";"TECNICO DE ENFERMAGEM";"II";"A";"01/12/2021";"2021/12/01 00:00:00";"2023/06/30 00:00:00"
14411771;2;"LUANA GOMES DA SILVA";"10399995650";"14/05/1991";"CONTRATO TEMPORARIO";"HRJP";"COORDENACAO DAS UNIDADES CRITICAS";"PENF";"TECNICO DE ENFERMAGEM";"II";"A";"30/09/2022";"2022/09/26 00:00:00";"2023/09/25 00:00:00"
15174840;1;"LUANA GONCALVES DE SOUZA";"10116512628";NA;"CONTRATO TEMPORARIO";"MOV";NA;"MEDRE";"MEDICO";"I";"A";NA;"2022/03/14 00:00:00";"2023/03/13 00:00:00"
14913263;1;"LUANA INOSTROSA MAYNART";"11172555656";NA;"CONTRATO TEMPORARIO";"HJK";NA;"MED";"MEDICO GENERALISTA";"I";"A";NA;"2022/07/06 00:00:00";"2023/01/05 00:00:00"
90018037;0;"LUANA INOSTROSA MAYNART - DOIS";"11172555656";"0000-00-00";NA;"HJK";"COORDENACAO MEDICA DA URGENCIA E EMERGENCIA";NA;"";NA;NA;"23/12/2022";NA;NA
14903702;2;"LUANA MARIA SILVA SANTOS";"12245646690";"30/08/1995";"CONTRATO TEMPORARIO";"HRAD";"COORDENACAO DA MATERNIDADE";"AGAS";"NUTRICIONISTA";"I";"A";"0000-00-00";"2022/02/01 00:00:00";"2023/01/31 00:00:00"
14896336;1;"LUANA MARTELETO TEIXEIRA GUILARDUCCI";"10420413693";"16/05/1991";"CONTRATO TEMPORARIO";"HGB-JA";"COORDENACAO DA UNIDADE DE CLINICA MEDICA";"PENF";"ENFERMEIRO";"IV";"A";"02/06/2022";"2022/06/02 00:00:00";"2023/06/01 00:00:00"
13963822;2;"LUANA MOREIRA COELHO";"01640427686";"19/11/1987";"CONTRATO TEMPORARIO";"HRAD";"COORDENACAO DAS UNIDADES CRITICAS";"AGAS";"FISIOTERAPEUTA";"III";"A";"0000-00-00";"2022/02/01 00:00:00";"2023/01/31 00:00:00"
15067937;1;"LUANA SILVA DE CASTRO";"09507355669";"12/09/1988";"CONTRATO TEMPORARIO";"CSSFA";"COORDENACAO DA EQUIPE MULTIDISCIPLINAR";"AGAS";"ASSISTENTE SOCIAL";"I";"A";"01/02/2022";"2022/02/01 00:00:00";"2023/01/31 00:00:00"
15135148;1;"LUANNA RODRIGUES LEITE";"06781156640";"30/09/1994";"CONTRATO TEMPORARIO";"JXXIII";"COORDENACAO DO AMBULATORIO DE PEDIATRIA";"AGAS";"FISIOTERAPEUTA";"I";"A";"16/03/2022";"2022/03/16 00:00:00";"2023/03/15 00:00:00"
15189608;1;"LUCAS ALVIM WERNER";"10904818616";NA;"CONTRATO TEMPORARIO";"MOV";NA;"MEDRE";"MEDICO";"I";"A";NA;"2022/03/01 00:00:00";"2023/02/28 00:00:00"
14934129;1;"LUCAS DE BARROS ANASTACIO";"08016994601";NA;"CONTRATO TEMPORARIO";"HAC";NA;"MEDRE";"MEDICO";"I";"A";NA;"2021/03/01 00:00:00";"2023/02/28 00:00:00"
14887350;1;"LUCAS DE DEUS SOUSA";"09923339629";NA;"CONTRATO TEMPORARIO";"HRAD";NA;"MEDRE";"MEDICO";"I";"A";NA;"2020/03/01 00:00:00";"2023/02/28 00:00:00"
14668057;3;"LUCAS EDUARDO DE ALMEIDA ALVES MACIEL";"08712149624";"03/07/1989";"CONTRATO TEMPORARIO";"JXXIII";"COORDENACAO DE TECNOLOGIA DA INFORMACAO";"TOS";"TECNICO EM INFORMATICA";"II";"A";"09/02/2022";"2022/02/09 00:00:00";"2023/02/08 00:00:00"
15118193;1;"LUCAS FERREIRA REZENDE";"09927213697";NA;"CONTRATO TEMPORARIO";"HJK";NA;"MEDRE";"MEDICO";"I";"A";NA;"2022/03/01 00:00:00";"2023/02/28 00:00:00"
13320460;4;"LUCAS FIGUEIREDO CRUZ E SILVA";"08959437603";"24/02/1987";"CONTRATO TEMPORARIO";"JXXIII";"COORDENACAO DE URGENCIA E EMERGENCIA ADULTO";"MED";"MEDICO ORTOPEDISTA E TRAUMATOLOGISTA";"III";"A";"04/03/2022";"2022/03/04 00:00:00";"2023/03/03 00:00:00"
15286487;1;"LUCAS GABRIEL DE JESUS";"09817682617";"18/03/1992";"CONTRATO TEMPORARIO";"HAC";"COORDENACAO DE INTERNACAO - ONCOLOGICA";"PENF";"TECNICO DE ENFERMAGEM";"II";"A";"05/07/2022";"2022/07/05 00:00:00";"2023/07/04 00:00:00"
14668123;1;"LUCAS GOMES PINHO";"02686658347";"15/04/1988";"CONTRATO TEMPORARIO";"HJK";"COORDENACAO DO SERVICO DE DIAGNOSTICO POR IMAGEM";"MED";"MEDICO EM RADIOLOG.E DIAGNOST.POR IMAGEM";"III";"A";"01/02/2022";"2022/02/01 00:00:00";"2023/01/31 00:00:00"
14931083;1;"LUCAS GONCALVES DIAS DE LIMA";"10350655685";NA;"CONTRATO TEMPORARIO";"HMAL";NA;"MEDRE";"MEDICO";"I";"A";NA;"2021/03/01 00:00:00";"2023/02/28 00:00:00"
14965206;1;"LUCAS HENRIQUE DE CARVALHO";"11907101616";"12/08/1994";"CONTRATO TEMPORARIO";"HAC";"COORDENACAO DA EQUIPE MULTIDISCIPLINAR";"AGAS";"PSICOLOGO";"I";"A";"19/05/2021";"2021/05/19 00:00:00";"2023/05/18 00:00:00"
13576293;2;"LUCAS JULIO DE CARVALHO";"01476735697";"17/10/1984";"CONTRATO TEMPORARIO";"JXXIII";"COORDENACAO DE DIAGNOSTICO POR IMAGEM";"TOS";"TECNICO EM RADIOLOGIA";"II";"A";"31/01/2022";"2022/01/31 00:00:00";"2023/01/30 00:00:00"
14770192;3;"LUCAS LIMA DE ALMEIDA BATISTA";"11497454603";"05/01/1992";"CONTRATO TEMPORARIO";"JXXIII";"COORDENACAO DE DIAGNOSTICO POR IMAGEM";"MED";"MEDICO CLINICO";"III";"A";"02/07/2022";"2022/07/02 00:00:00";"2023/07/01 00:00:00"
14770192;2;"LUCAS LIMA DE ALMEIDA BATISTA";"11497454603";"05/01/1992";"CONTRATO TEMPORARIO";"JXXIII";"COORDENACAO DE DIAGNOSTICO POR IMAGEM";"MED";"MEDICO GENERALISTA";"I";"A";"20/04/2022";"2022/04/20 00:00:00";"2023/04/19 00:00:00"
14593057;2;"LUCAS MAGELA ASSUNCAO";"05827113638";"23/12/1982";"CONTRATO TEMPORARIO";"MOV";"COORDENACAO DE GESTAO DA INFORMACAO";"TOS";"TECNICO EM INFORMATICA";"II";"A";"22/12/2021";"2021/12/22 00:00:00";"2023/06/30 00:00:00"
14661326;1;"LUCAS MAUTONE CAMPOS";"07696223640";"14/07/1985";"CONTRATO TEMPORARIO";"HGB-JA";"COORDENACAO DA UNIDADE CIRURGICA";"MED";"MEDICO ORTOPEDISTA E TRAUMATOLOGISTA";"III";"A";"28/06/2018";"2022/02/03 00:00:00";"2023/02/02 00:00:00"
14756779;3;"LUCAS MOTA ATTONI";"10497224690";"06/04/1992";"CONTRATO TEMPORARIO";"IRS";"COORDENACAO DA UNIDADE DE PACIENTES EXTERNOS";"MED";"MEDICO PSIQUIATRA";"III";"A";"15/09/2022";"2022/09/15 00:00:00";"2023/09/14 00:00:00"
14756779;2;"LUCAS MOTA ATTONI";"10497224690";"06/04/1992";"CONTRATO TEMPORARIO";"CMT";"GERENCIA ASSISTENCIAL";"MED";"MEDICO PSIQUIATRA";"III";"A";"06/07/2022";"2022/07/06 00:00:00";"2023/07/05 00:00:00"
14615728;4;"LUCAS MULLER FONSECA";"01535938650";"28/03/1992";"CONTRATO TEMPORARIO";"JXXIII";"COORDENACAO DE URGENCIA E EMERGENCIA ADULTO";"MED";"MEDICO CLINICO";"III";"A";"03/03/2022";"2022/03/03 00:00:00";"2023/03/02 00:00:00"
14931109;1;"LUCAS NEZIO DE ARAUJO LOPES RIBEIRO";"09528249655";NA;"CONTRATO TEMPORARIO";"HMAL";NA;"MEDRE";"MEDICO";"I";"A";NA;"2021/03/01 00:00:00";"2023/02/28 00:00:00"
14880520;1;"LUCAS PEDROSA LANGE";"11848547692";NA;"CONTRATO TEMPORARIO";"MOV";NA;"MEDRE";"MEDICO";"I";"A";NA;"2020/03/01 00:00:00";"2023/02/28 00:00:00"
14417695;5;"LUCAS PERDIGAO";"08961295608";"16/06/1988";"CONTRATO TEMPORARIO";"JXXIII";"COORDENACAO DE URGENCIA E EMERGENCIA ADULTO";"MED";"MEDICO CLINICO";"III";"A";"01/07/2022";"2022/07/01 00:00:00";"2023/06/30 00:00:00"
14417695;4;"LUCAS PERDIGAO";"08961295608";"16/06/1988";"CONTRATO TEMPORARIO";"JXXIII";"COORDENACAO DE URGENCIA E EMERGENCIA ADULTO";"MED";"MEDICO CLINICO";"III";"A";"01/07/2022";"2022/07/01 00:00:00";"2022/12/27 00:00:00"
15001035;2;"LUCAS RODRIGO FERREIRA";"06293863666";"20/10/1984";"CONTRATO TEMPORARIO";"HRAD";"COORDENACAO DAS UNIDADES DE INTERNACAO";"PENF";"TECNICO DE ENFERMAGEM";"II";"A";"0000-00-00";"2022/02/02 00:00:00";"2023/02/01 00:00:00"
14756662;2;"LUCAS SANTOS BOAVENTURA";"10522372660";"28/05/1992";"CONTRATO TEMPORARIO";"JXXIII";"COORDENACAO DO BLOCO CIRURGICO";"MED";"MEDICO ANESTESIOLOGISTA";"III";"A";"30/05/2022";"2022/05/30 00:00:00";"2023/05/29 00:00:00"
14459291;2;"LUCAS VEBER DE SOUSA";"12535671662";"22/08/1995";"CONTRATO TEMPORARIO";"JXXIII";"COORDENACAO DE LABORATORIO E AGENCIA TRANSFUSIONAL";"TOS";"AUXILIAR ADMINISTRATIVO";"I";"A";"01/02/2022";"2022/02/01 00:00:00";"2023/01/31 00:00:00"
15123870;1;"LUCAS VIANA PEREIRA MACIEL";"11052089666";NA;"CONTRATO TEMPORARIO";"JXXIII";NA;"MEDRE";"MEDICO";"I";"A";NA;"2022/03/01 00:00:00";"2023/02/28 00:00:00"
14883292;1;"LUCCA ROCHA SANTIAGO";"12926032676";NA;"CONTRATO TEMPORARIO";"HIJPII";NA;"MEDRE";"MEDICO";"I";"A";NA;"2020/03/01 00:00:00";"2023/02/28 00:00:00"
90019618;9;"LUCENI LUIZ MATIAS";"99257610691";"0000-00-00";NA;"HJXXIII";"COORDENACAO DE URGENCIA E EMERGENCIA ADULTO";NA;"";NA;NA;"31/10/2022";NA;NA
14850333;4;"LUCIA APARECIDA OLIVEIRA";"81145659691";"04/03/1968";"CONTRATO TEMPORARIO";"HAC";"COORDENACAO DO AMBULATORIO";"PENF";"ENFERMEIRO";"IV";"A";"08/04/2022";"2022/04/08 00:00:00";"2023/04/07 00:00:00"
14850333;3;"LUCIA APARECIDA OLIVEIRA";"81145659691";"04/03/1968";"CONTRATO TEMPORARIO";"HJK";"COORDENACAO DE INTERNACAO - ADULTO";"PENF";"ENFERMEIRO";"IV";"A";"29/09/2022";"2022/09/29 00:00:00";"2023/09/28 00:00:00"
11216884;5;"LUCIA FERNANDES ALEIXO";"40184765668";"06/07/1961";"CONTRATO TEMPORARIO";"IRS";"COORDENACAO DE APOIO DIAGNOSTICO E TERAPEUTICO";"MED";"MEDICO ANESTESIOLOGISTA";"III";"A";"26/01/2022";"2022/01/26 00:00:00";"2023/01/25 00:00:00"
11216884;4;"LUCIA FERNANDES ALEIXO";"40184765668";"06/07/1961";"CONTRATO TEMPORARIO";"MOV";"COORDENACAO DA GINECOLOGIA E OBSTETRICIA";"MED";"MEDICO ANESTESIOLOGISTA";"III";"A";"21/01/2022";"2022/01/21 00:00:00";"2023/01/20 00:00:00"
13933619;2;"LUCIA HELENA CORDEIRO DOS SANTOS";"04540520652";"09/08/1979";"CONTRATO TEMPORARIO";"HAC";"COORDENACAO DE ASSISTENCIA FARMACEUTICA";"TOS";"TECNICO EM FARMACIA";"II";"A";"02/02/2022";"2022/02/02 00:00:00";"2023/02/01 00:00:00"
14339121;3;"LUCIA MARIA CAMARGO BARBOSA";"02833868600";"27/07/1977";"CONTRATO TEMPORARIO";"MOV";"COORDENACAO DA UNIDADE DE NEONATOLOGIA";"PENF";"ENFERMEIRO";"IV";"A";"08/03/2022";"2022/03/08 00:00:00";"2023/03/07 00:00:00"
13844535;2;"LUCIA MARIA DA SILVA";"08300597689";"14/09/1986";"CONTRATO TEMPORARIO";"HGB-JA";"COORDENACAO DA UNIDADE DE CUIDADOS CONTINUADOS INTEGRADOS";"PENF";"TECNICO DE ENFERMAGEM";"II";"A";"02/02/2022";"2022/02/02 00:00:00";"2023/02/01 00:00:00"
12733432;3;"LUCIA VASCONCELLOS ANDRADE";"05979605690";"09/12/1982";"CONTRATO TEMPORARIO";"MOV";"COORDENACAO DA GINECOLOGIA E OBSTETRICIA";"MED";"MEDICO GINECOLOGISTA";"III";"A";"05/11/2021";"2021/11/05 00:00:00";"2023/06/30 00:00:00"
14895288;3;"LUCIANA ANDRADE REZENDE";"09700163601";"05/08/1988";"CONTRATO TEMPORARIO";"HAC";"COORDENACAO CIRURGICA";"MED";"MEDICO ANESTESIOLOGISTA";"III";"A";"01/03/2022";"2022/03/01 00:00:00";"2023/02/28 00:00:00"
15135270;1;"LUCIANA ANGELA ALVES";"04239758629";"21/05/1979";"CONTRATO TEMPORARIO";"JXXIII";"COORDENACAO DAS UNIDADES DE INTERNACAO CIRURGICA";"PENF";"TECNICO DE ENFERMAGEM";"II";"A";"16/03/2022";"2022/03/16 00:00:00";"2023/03/15 00:00:00"
15335771;1;"LUCIANA APARECIDA ANDRADE";"06112901625";"04/10/1984";"CONTRATO TEMPORARIO";"HGB-JA";"COORDENACAO DE APOIO DIAGNOSTICO E TERAPEUTICO";"AGAS";"FARMACEUTICO";"I";"A";"29/10/2022";"2022/10/29 00:00:00";"2023/10/28 00:00:00"
11506532;3;"LUCIANA APARECIDA DA SILVA";"62830805615";"22/01/1972";"CONTRATO TEMPORARIO";"HEM";"COORDENACAO DAS UNIDADES DE INTERNACAO";"PENF";"TECNICO DE ENFERMAGEM";"II";"A";"21/08/2017";"2021/02/01 00:00:00";"2023/01/31 00:00:00"
14892640;2;"LUCIANA APARECIDA PRUDENCIO";"02778841601";"19/04/1973";"CONTRATO TEMPORARIO";"HRJP";"COORDENACAO DAS UNIDADES CRITICAS";"PENF";"TECNICO DE ENFERMAGEM";"II";"A";"01/02/2022";"2022/02/01 00:00:00";"2023/01/31 00:00:00"
12200804;3;"LUCIANA CALDEIRA CASTRO SILVAMENDICINO";"99746239600";"26/07/1972";"CONTRATO TEMPORARIO";"MOV";"COORDENACAO DA UNIDADE CIRURGICA";"PENF";"ENFERMEIRO";"IV";"A";"07/06/2021";"2021/06/07 00:00:00";"2023/06/06 00:00:00"
14514665;3;"LUCIANA CARLA PEREIRA";"07755145603";"08/11/1984";"CONTRATO TEMPORARIO";"HGB-JA";"COORDENACAO DA UNIDADE DE CUIDADOS CONTINUADOS INTEGRADOS";"PENF";"TECNICO DE ENFERMAGEM";"II";"A";"08/11/2022";"2022/11/08 00:00:00";"2023/11/07 00:00:00"
11723749;2;"LUCIANA CARMEN FARIA";"03923529660";"09/06/1979";"CONTRATO TEMPORARIO";"JXXIII";"COORDENACAO DO CENTRO DE TRATAMENTO DE QUEIMADOS";"PENF";"TECNICO DE ENFERMAGEM";"II";"A";"13/10/2022";"2022/10/13 00:00:00";"2023/10/12 00:00:00"
14330484;1;"LUCIANA CARVALHO REIS";"06844121601";"06/05/1985";"CONTRATO TEMPORARIO";"HGB-JA";"COORDENACAO DE ENFERMAGEM E EQUIPE MULTIDISCIPLINAR";"AGAS";"NUTRICIONISTA";"I";"A";"01/02/2022";"2022/02/01 00:00:00";"2023/01/31 00:00:00"
14901110;2;"LUCIANA COELHO DA SILVA";"05586806665";"22/04/1975";"CONTRATO TEMPORARIO";"HAC";"COORDENACAO DE INTERNACAO - ONCOLOGICA";"PENF";"TECNICO DE ENFERMAGEM";"II";"A";"09/11/2022";"2022/11/09 00:00:00";"2023/11/08 00:00:00"
14175723;3;"LUCIANA DE CARVALHO AZEVEDO";"02539327508";"14/08/1985";"CONTRATO TEMPORARIO";"HAC";"COORDENACAO CIRURGICA";"MED";"MEDICO MASTOLOGISTA";"III";"A";"01/02/2022";"2022/02/01 00:00:00";"2023/01/31 00:00:00"
14897052;4;"LUCIANA DOS SANTOS DA SILVA";"07550892601";"31/01/1988";"CONTRATO TEMPORARIO";"JXXIII";"COORDENACAO DAS UNIDADES DE INTERNACAO ADULTO";"PENF";"TECNICO DE ENFERMAGEM";"II";"A";"09/02/2022";"2022/02/09 00:00:00";"2023/02/08 00:00:00"
15279995;1;"LUCIANA DUTRA DE JESUS DOS SANTOS";"06477671638";"14/12/1982";"CONTRATO TEMPORARIO";"HJK";"COORDENACAO DE INTERNACAO - ADULTO";"PENF";"TECNICO DE ENFERMAGEM";"II";"A";"05/07/2022";"2022/07/05 00:00:00";"2023/07/04 00:00:00"
11590015;3;"LUCIANA FATIMA DA SILVA VALE";"05332152698";"25/07/1981";"CONTRATO TEMPORARIO";"CSSFA";"COORDENACAO DA UNIDADE DE INTERNACAO E PACIENTES EXTERNOS";"PENF";"TECNICO DE ENFERMAGEM";"II";"A";"01/02/2022";"2022/02/01 00:00:00";"2023/01/31 00:00:00"
14888457;2;"LUCIANA FERREIRA DE ANDRADE";"06517574603";"27/07/1985";"CONTRATO TEMPORARIO";"HEM";"COORDENACAO DE FINANCAS";"TOS";"AUXILIAR ADMINISTRATIVO";"I";"A";"09/02/2022";"2022/02/09 00:00:00";"2023/02/08 00:00:00"
13954714;3;"LUCIANA FLAVIA SQUARCIO PURYSCO DE OLIVE";"78812550649";"18/06/1969";"CONTRATO TEMPORARIO";"JXXIII";"COORDENACAO DAS UNIDADES DE INTERNACAO ADULTO";"AGAS";"PSICOLOGO";"I";"A";"05/11/2021";"2021/11/05 00:00:00";"2023/06/30 00:00:00"
15193725;1;"LUCIANA GONCALVES DOS SANTOS";"10360386610";"13/09/1985";"CONTRATO TEMPORARIO";"JXXIII";"COORDENACAO DAS UNIDADES DE INTERNACAO ADULTO";"PENF";"TECNICO DE ENFERMAGEM";"II";"A";"03/02/2022";"2022/02/03 00:00:00";"2023/02/02 00:00:00"
14899645;1;"LUCIANA HELENA FERNANDES";"07612975963";"07/07/1990";"CONTRATO TEMPORARIO";"HRAD";"COORDENACAO DA MATERNIDADE";"MED";"MEDICO PEDIATRA";"III";"A";"0000-00-00";"2022/02/01 00:00:00";"2023/01/31 00:00:00"
13801709;2;"LUCIANA MARIA JOSE ALVES ROSA";"05604561665";"20/08/1981";"CONTRATO TEMPORARIO";"HGB-JA";"COORDENACAO DA UNIDADE DE URGENCIA E EMERGENCIA";"PENF";"TECNICO DE ENFERMAGEM";"II";"A";"02/02/2022";"2022/02/02 00:00:00";"2023/02/01 00:00:00"
14592794;2;"LUCIANA MARIA ROCHA OLIVEIRA";"09641455613";"14/02/1989";"CONTRATO TEMPORARIO";"HRAD";"COORDENACAO DE ASSISTENCIA FARMACEUTICA";"TOS";"TECNICO EM FARMACIA";"II";"A";"0000-00-00";"2021/12/01 00:00:00";"2023/06/30 00:00:00"
9743204;3;"LUCIANA MARINO PENA SANTOS";"63073307672";"27/12/1974";"CONTRATO TEMPORARIO";"JXXIII";"GERENCIA DA EQUIPE MULTIDISCIPLINAR";"AGAS";"ASSISTENTE SOCIAL";"I";"A";"01/02/2022";"2022/02/01 00:00:00";"2023/01/31 00:00:00"
10444248;2;"LUCIANA MARTIN DE PAIVA";"00175819661";"26/11/1976";"CONTRATO TEMPORARIO";"HGB-JA";"COORDENACAO DA UNIDADE DE URGENCIA E EMERGENCIA";"PENF";"TECNICO DE ENFERMAGEM";"II";"A";"23/02/2022";"2022/03/23 00:00:00";"2023/03/22 00:00:00"
13374293;4;"LUCIANA MILAGRES DE LIMA";"07793458605";"01/02/1986";"CONTRATO TEMPORARIO";"HCM";"COORDENACAO DAS UNIDADES DE INTERNACAO";"MED";"MEDICO CLINICO";"III";"A";"10/12/2021";"2021/12/10 00:00:00";"2023/06/30 00:00:00"
12962148;3;"LUCIANA NERIS VALENTIM";"05740375860";"12/09/1972";"CONTRATO TEMPORARIO";"HIJPII";"COORDENACAO DAS UNIDADES DE INTERNACAO PEDIATRICA";"PENF";"ENFERMEIRO";"IV";"A";"19/08/2021";"2021/08/19 00:00:00";"2023/06/30 00:00:00"
13848189;3;"LUCIANA PAIXAO LOPES";"96775360606";"15/04/1972";"CONTRATO TEMPORARIO";"JXXIII";"COORDENACAO DAS UNIDADES DE INTERNACAO ADULTO";"AGAS";"NUTRICIONISTA";"I";"A";"03/03/2022";"2022/03/03 00:00:00";"2023/03/02 00:00:00"
10878536;4;"LUCIANA PAULA BATISTA";"04143436620";"29/04/1977";"CONTRATO TEMPORARIO";"HJK";"COORDENACAO DE INTERNACAO - ADULTO";"PENF";"TECNICO DE ENFERMAGEM";"II";"A";"01/02/2022";"2022/02/02 00:00:00";"2023/02/01 00:00:00"
15070725;1;"LUCIANA PUGLIA POMPEU";"05420971682";"19/06/1981";"CONTRATO TEMPORARIO";"HJK";"COORDENACAO DA EQUIPE MULTIDISCIPLINAR";"AGAS";"FISIOTERAPEUTA RESPIRATORIA";"III";"A";"01/02/2022";"2022/02/03 00:00:00";"2023/02/02 00:00:00"
11999703;4;"LUCIANA RODRIGUES MARTINS";"06146573698";"21/06/1983";"CONTRATO TEMPORARIO";"HEM";"COORDENACAO DAS UNIDADES DE INTERNACAO";"PENF";"TECNICO DE ENFERMAGEM";"II";"A";"07/07/2022";"2022/07/07 00:00:00";"2023/07/06 00:00:00"
14053037;4;"LUCIANA VILACA";"90109236653";"08/06/1972";"CONTRATO TEMPORARIO";"HIJPII";"COORDENACAO DAS UNIDADES DE INTERNACAO PEDIATRICA";"PENF";"ENFERMEIRO";"IV";"A";"08/02/2022";"2022/02/08 00:00:00";"2023/02/07 00:00:00"
15170533;1;"LUCIANO FRANCELY RIBEIRO";"03485175641";"14/10/1977";"CONTRATO TEMPORARIO";"MOV";"COORDENACAO DE GESTAO DA INFORMACAO";"TOS";"AUXILIAR ADMINISTRATIVO";"I";"A";"13/04/2022";"2022/04/13 00:00:00";"2023/04/12 00:00:00"
10876142;5;"LUCIANO PEREIRA DOS SANTOS";"00375333630";"29/10/1974";"CONTRATO TEMPORARIO";"HEM";"COORDENACAO DE APOIO DIAGNOSTICO E TERAPEUTICO";"TOS";"TECNICO EM RADIOLOGIA";"II";"A";"26/02/2018";"2022/02/01 00:00:00";"2023/01/31 00:00:00"
14612485;3;"LUCIANO PEREIRA DUARTE";"02773158679";"17/05/1971";"CONTRATO TEMPORARIO";"HEM";"COORDENACAO DAS UNIDADES DE INTERNACAO";"PENF";"TECNICO DE ENFERMAGEM";"II";"A";"06/07/2022";"2022/07/06 00:00:00";"2023/07/05 00:00:00"
12206306;4;"LUCIANO RICARDO VIANA COSTA";"76103170630";"18/10/1962";"CONTRATO TEMPORARIO";"HJK";"COORDENACAO CIRURGICA";"MED";"MEDICO ANESTESIOLOGISTA";"III";"A";"19/04/2018";"2021/02/01 00:00:00";"2023/01/31 00:00:00"
12864526;2;"LUCIENE DE SOUZA CARVALHO";"04475924677";"26/02/1981";"CONTRATO TEMPORARIO";"HEM";"COORDENACAO DA UNIDADE DE PACIENTES EXTERNOS";"PENF";"ENFERMEIRO";"IV";"A";"04/07/2022";"2022/07/04 00:00:00";"2023/07/03 00:00:00"
12865622;3;"LUCIENE PAULA DA SILVA";"00498476600";"19/12/1975";"CONTRATO TEMPORARIO";"HIJPII";"COORDENACAO DE DIAGNOSTICO POR IMAGEM";"TOS";"AUXILIAR ADMINISTRATIVO";"I";"A";"01/02/2022";"2022/02/01 00:00:00";"2023/01/31 00:00:00"
14668040;1;"LUCIENE SETTE MORAIS";"58309926634";"20/12/1966";"CONTRATO TEMPORARIO";"CSSI";"COORDENACAO DA UNIDADE DE CUIDADO AO ADULTO";"AGAS";"TERAPEUTA OCUPACIONAL";"I";"A";"01/02/2022";"2022/02/01 00:00:00";"2023/01/31 00:00:00"
14045116;2;"LUCIENI REGINA DE AMORIM";"95569987649";"03/11/1973";"CONTRATO TEMPORARIO";"JXXIII";"COORDENACAO DAS UNIDADES DE INTERNACAO ADULTO";"PENF";"TECNICO DE ENFERMAGEM";"II";"A";"13/03/2022";"2022/03/13 00:00:00";"2023/03/12 00:00:00"
14661334;2;"LUCILENE ANTONIA DE ARAUJO";"04189516678";"09/04/1978";"CONTRATO TEMPORARIO";"HEM";"COORDENACAO DAS UNIDADES DE INTERNACAO";"PENF";"TECNICO DE ENFERMAGEM";"II";"A";"03/07/2022";"2022/07/06 00:00:00";"2023/07/05 00:00:00"
11326345;3;"LUCILENE DE JESUS SOUZA";"73777579653";"28/11/1966";"CONTRATO TEMPORARIO";"JXXIII";"COORDENACAO DO BLOCO CIRURGICO";"PENF";"TECNICO DE ENFERMAGEM";"II";"A";"22/06/2018";"2021/02/01 00:00:00";"2023/01/31 00:00:00"
14627293;1;"LUCILIO AMORELLI PEREIRA";"03852663679";"13/08/1978";"CONTRATO TEMPORARIO";"CSSFE";"COORDENACAO DA UNIDADE DE PACIENTES EXTERNOS";"MED";"MEDICO ORTOPEDISTA E TRAUMATOLOGISTA";"III";"A";"01/02/2022";"2022/02/01 00:00:00";"2023/01/31 00:00:00"
14958383;3;"LUCIMAR CECILIA DE ARAUJO COELHO";"87092638615";"07/04/1976";"CONTRATO TEMPORARIO";"HJK";"COORDENACAO MEDICA DA URGENCIA E EMERGENCIA";"PENF";"TECNICO DE ENFERMAGEM";"II";"A";"11/10/2022";"2022/10/11 00:00:00";"2023/10/10 00:00:00"
14889489;2;"LUCIMAR DE FATIMA LIMA";"04628770603";"16/10/1980";"CONTRATO TEMPORARIO";"HRAD";"COORDENACAO DAS UNIDADES DE INTERNACAO";"PENF";"TECNICO DE ENFERMAGEM";"II";"A";"0000-00-00";"2022/04/01 00:00:00";"2023/03/31 00:00:00"
11251824;5;"LUCIMAR MARIA PROFETA SILVA";"86390961634";"23/03/1973";"CONTRATO TEMPORARIO";"HEM";"COORDENACAO DAS UNIDADES CRITICAS";"PENF";"TECNICO DE ENFERMAGEM";"II";"A";"02/07/2022";"2022/07/02 00:00:00";"2023/07/01 00:00:00"
14627251;3;"LUCIMARA CARMO DE MOURA";"08867904680";"09/03/1987";"CONTRATO TEMPORARIO";"HEM";"COORDENACAO DE APOIO DIAGNOSTICO E TERAPEUTICO";"TOS";"TECNICO EM PATOLOGIA CLINICA";"II";"A";"08/04/2021";"2021/04/08 00:00:00";"2023/06/30 00:00:00"
14627251;2;"LUCIMARA CARMO DE MOURA";"08867904680";"09/03/1987";"CONTRATO TEMPORARIO";"HEM";"COORDENACAO DE APOIO DIAGNOSTICO E TERAPEUTICO";"TOS";"TECNICO EM PATOLOGIA CLINICA";"II";"A";"02/04/2018";"2022/02/11 00:00:00";"2023/02/10 00:00:00"
14614168;2;"LUCIMARA DOS SANTOS MOREIRA";"00643628681";"29/06/1974";"CONTRATO TEMPORARIO";"HAC";"COORDENACAO DA UNIDADE DE TERAPIA INTENSIVA ADULTO";"TOS";"AUXILIAR ADMINISTRATIVO";"I";"A";"01/02/2022";"2022/02/01 00:00:00";"2023/01/31 00:00:00"
13805163;1;"LUCIMEIRE AUXILIADORA FURTADO E SILVA";"06343131698";"04/01/1981";"CONTRATO TEMPORARIO";"HGB-JA";"COORDENACAO DA UNIDADE DE CLINICA MEDICA";"PENF";"TECNICO DE ENFERMAGEM";"II";"A";"02/02/2022";"2022/02/02 00:00:00";"2023/02/01 00:00:00"
13414917;5;"LUCINEIDE DA SILVA BRITO";"03701487545";"10/02/1988";"CONTRATO TEMPORARIO";"HEM";"COORDENACAO DE GESTAO DE PESSOAS";"TOS";"AUXILIAR ADMINISTRATIVO";"I";"A";"11/01/2022";"2022/01/11 00:00:00";"2023/01/10 00:00:00"
10917326;4;"LUCIO LOBO LEITE VITARELLI";"71522808604";"19/11/1963";"CONTRATO TEMPORARIO";"HJK";"COORDENACAO DE INTERNACAO - ADULTO";"MED";"MEDICO CLINICO";"III";"A";"13/05/2021";"2021/05/13 00:00:00";"2023/05/12 00:00:00"
10903490;5;"LUCIUS CLAUDIUS LOPES DA SILVA";"90521676649";"08/02/1972";"CONTRATO TEMPORARIO";"HGB-JA";"COORDENACAO DA UNIDADE CIRURGICA";"MED";"MEDICO ANESTESIOLOGISTA";"III";"A";"02/12/2021";"2021/12/02 00:00:00";"2023/06/30 00:00:00"
14898886;2;"LUDIANE CONCEICAO DOS SANTOS OLIVEIRA MA";"05322831630";"08/04/1981";"CONTRATO TEMPORARIO";"HIJPII";"COORDENACAO DA UNIDADE DE TERAPIA INTENSIVA ADULTO";"PENF";"TECNICO DE ENFERMAGEM";"II";"A";"01/02/2022";"2022/02/01 00:00:00";"2023/01/31 00:00:00"
14898886;1;"LUDIANE CONCEICAO DOS SANTOS OLIVEIRA MA";"05322831630";"08/04/1981";"CONTRATO TEMPORARIO";"MOV";"COORDENACAO DA GINECOLOGIA E OBSTETRICIA";"PENF";"TECNICO DE ENFERMAGEM";"II";"A";"07/07/2022";"2022/07/07 00:00:00";"2023/07/06 00:00:00"
14650105;1;"LUDMILA QUEIROZ CABRAL COSTA";"08959878642";"25/06/1987";"CONTRATO TEMPORARIO";"JXXIII";"COORDENACAO DE URGENCIA E EMERGENCIA ADULTO";"MED";"MEDICO PEDIATRA";"III";"A";"06/03/2022";"2022/03/06 00:00:00";"2023/03/05 00:00:00"
14932719;2;"LUDMILA RUSSO SALGADO";"08642037644";NA;"CONTRATO TEMPORARIO";"HIJPII";NA;"MEDRE";"MEDICO";"I";"A";NA;"2021/03/01 00:00:00";"2023/02/28 00:00:00"
13954771;2;"LUDMILA SILVA LEAL";"06480253655";"28/04/1984";"CONTRATO TEMPORARIO";"JXXIII";"COORDENACAO DA UNIDADE DE TERAPIA INTENSIVA PEDIATRICA";"AGAS";"FISIOTERAPEUTA RESPIRATORIA";"III";"A";"03/02/2022";"2022/02/03 00:00:00";"2023/02/02 00:00:00"
13278031;3;"LUDMILLA BARBOSA ANGHINETTI LIMA";"06615890640";"07/11/1987";"CONTRATO TEMPORARIO";"HEM";"COORDENACAO DAS UNIDADES DE INTERNACAO";"MED";"MEDICO CIRURGIAO GERAL";"III";"A";"01/02/2022";"2022/02/01 00:00:00";"2023/01/31 00:00:00"
13437686;2;"LUDMILLA DA COSTA LACERDA";"00175364648";"21/04/1970";"CONTRATO TEMPORARIO";"HRJP";"COORDENACAO DE GESTAO DE PESSOAS";"TOS";"AUXILIAR ADMINISTRATIVO";"I";"A";"01/02/2022";"2022/02/01 00:00:00";"2023/01/31 00:00:00"
13646369;3;"LUIS CARLOS PEREIRA PACHECO";"05656151654";"27/07/1983";"CONTRATO TEMPORARIO";"HRAD";"COORDENACAO DAS UNIDADES CRITICAS";"MED";"MEDICO CLINICO";"III";"A";"0000-00-00";"2021/04/10 00:00:00";"2023/04/09 00:00:00"
14931117;1;"LUIS EDUARDO MELO LACERDA";"07767690652";NA;"CONTRATO TEMPORARIO";"HMAL";NA;"MEDRE";"MEDICO";"I";"A";NA;"2021/03/01 00:00:00";"2023/02/28 00:00:00"
15245467;1;"LUIS EDUARDO VASCONCELOS SILVA";"11889610631";"13/02/1993";"CONTRATO TEMPORARIO";"HGB-JA";"COORDENACAO DA UNIDADE CIRURGICA";"MED";"MEDICO CIRURGIAO GERAL";"III";"A";"04/06/2022";"2022/06/04 00:00:00";"2023/06/03 00:00:00"
14934277;1;"LUIS FELIPE DE OLIVEIRA SOARES";"11680076663";NA;"CONTRATO TEMPORARIO";"HJK";NA;"MEDRE";"MEDICO";"I";"A";NA;"2021/03/01 00:00:00";"2023/02/28 00:00:00"
15077555;1;"LUIS HENRIQUE FONSECA";"12718411694";"28/11/1995";"CONTRATO TEMPORARIO";"HRAD";"COORDENACAO DAS UNIDADES DE INTERNACAO";"PENF";"TECNICO DE ENFERMAGEM";"II";"A";"0000-00-00";"2022/02/02 00:00:00";"2023/02/01 00:00:00"
13755327;3;"LUIS PAULO AGUIAR BAIAO";"03052925601";"08/06/1978";"CONTRATO TEMPORARIO";"HGB-JA";"COORDENACAO DA UNIDADE DE PACIENTES CRITICOS";"MED";"MEDICO CLINICO";"III";"A";"28/11/2021";"2021/11/28 00:00:00";"2023/06/30 00:00:00"
14892293;1;"LUIS PAULO RAMOS MATEUS";"07060826645";"27/03/1989";"CONTRATO TEMPORARIO";"HRAD";"COORDENACAO DA UNIDADE DE PACIENTES EXTERNOS";"MED";"MEDICO ORTOPEDISTA E TRAUMATOLOGISTA";"III";"A";"01/02/2022";"2022/02/02 00:00:00";"2023/02/01 00:00:00"
14934285;1;"LUISA ANDRADE CARDINI";"10012541630";NA;"CONTRATO TEMPORARIO";"HJK";NA;"MEDRE";"MEDICO";"I";"A";NA;"2021/03/05 00:00:00";"2023/03/04 00:00:00"
15162092;1;"LUISA CINQUE DE MELO";"09271281608";"23/01/1992";"CONTRATO TEMPORARIO";"JXXIII";"COORDENACAO DAS UNIDADES DE INTERNACAO ADULTO";"MED";"MEDICO CLINICO";"III";"A";"21/03/2022";"2022/03/21 00:00:00";"2023/03/20 00:00:00"
14978043;1;"LUISA COUTINHO TEIXEIRA";"07006823684";"05/05/1990";"CONTRATO TEMPORARIO";"CSSFA";"COORDENACAO TECNICA DE ENFERMAGEM";"MED";"MEDICO DERMATOLOGISTA";"III";"A";"14/07/2021";"2021/07/14 00:00:00";"2023/06/30 00:00:00"
13308259;4;"LUISA DE ANDRADE GOMES";"07984158606";"29/04/1988";"CONTRATO TEMPORARIO";"MOV";"COORDENACAO DA UNIDADE DE NEONATOLOGIA";"MED";"MEDICO PEDIATRA";"III";"A";"26/06/2021";"2021/06/26 00:00:00";"2023/06/25 00:00:00"
15278740;1;"LUISA LEAL BARBOSA CORREIA DE ANDRADE";"13191905618";"29/10/1996";"CONTRATO TEMPORARIO";"HIJPII";"COORDENACAO DE URGENCIA E EMERGENCIA PEDIATRICA";"MED";"MEDICO PEDIATRA";"I";"A";"01/07/2022";"2022/07/01 00:00:00";"2022/12/27 00:00:00"
14485635;3;"LUIZ ANTONIO DE ARAUJO JUNIOR";"90779380100";"19/09/1980";"CONTRATO TEMPORARIO";"HRAD";"COORDENACAO DA UNIDADE DE PACIENTES EXTERNOS";"MED";"MEDICO CIRURGIAO GERAL";"III";"A";"0000-00-00";"2021/11/29 00:00:00";"2023/06/30 00:00:00"
90018038;0;"LUIZ ANTONIO RIBEIRO";"00146836600";"0000-00-00";NA;"HJK";"COORDENACAO MEDICA DA URGENCIA E EMERGENCIA";NA;"";NA;NA;"26/12/2022";NA;NA
14668065;3;"LUIZ CARLOS JARDIM";"50077031687";"19/04/1961";"CONTRATO TEMPORARIO";"JXXIII";"COORDENACAO DE LABORATORIO E AGENCIA TRANSFUSIONAL";"TOS";"TECNICO EM PATOLOGIA CLINICA";"II";"A";"11/02/2022";"2022/02/11 00:00:00";"2023/02/10 00:00:00"
14614184;1;"LUIZ CARLOS MOREIRA";"53409086668";"11/04/1961";"CONTRATO TEMPORARIO";"HJK";"COORDENACAO DA ENGENHARIA CLINICA";"TOS";"AUXILIAR ADMINISTRATIVO";"I";"A";"02/02/2022";"2022/02/02 00:00:00";"2023/02/01 00:00:00"
10900322;5;"LUIZ CARLOS TEIXEIRA";"97423157600";"16/03/1973";"CONTRATO TEMPORARIO";"HJK";"COORDENACAO CIRURGICA";"MED";"MEDICO CIRURGIAO GERAL";"III";"A";"04/02/2022";"2022/02/04 00:00:00";"2023/02/03 00:00:00"
14053953;2;"LUIZ CESAR COUTINHO";"41023560615";"26/03/1963";"CONTRATO TEMPORARIO";"HGB-JA";"COORDENACAO DE SAUDE E SEGURANCA DO TRABALHADOR";"TOS";"TECNICO DE SEGURANCA DO TRABALHO";"II";"A";"27/12/2021";"2021/12/27 00:00:00";"2023/06/30 00:00:00"
15125909;1;"LUIZ CLAUDIO TEIXEIRA GOMES";"01581121644";"24/06/1987";"CONTRATO TEMPORARIO";"JXXIII";"COORDENACAO DE DIAGNOSTICO POR IMAGEM";"TOS";"TECNICO EM RADIOLOGIA";"II";"A";"03/02/2022";"2022/02/03 00:00:00";"2023/02/02 00:00:00"
14831119;1;"LUIZ DIONEI DE ASSIS";"09676012661";"27/05/1989";"CONTRATO TEMPORARIO";"HGB-JA";"COORDENACAO DA UNIDADE DE CLINICA MEDICA";"PENF";"TECNICO DE ENFERMAGEM";"II";"A";"26/10/2019";"2022/02/01 00:00:00";"2023/01/31 00:00:00"
14946305;1;"LUIZ EDUARDO DA ROCHA GONZAGA";"13110197669";NA;"CONTRATO TEMPORARIO";"CHPB";NA;"MEDRE";"MEDICO";"I";"A";NA;"2021/03/01 00:00:00";"2023/02/28 00:00:00"
14928980;1;"LUIZ EDUARDO DE FREITAS XAVIER";"09401332614";NA;"CONTRATO TEMPORARIO";"IRS";NA;"MEDRE";"MEDICO";"I";"A";NA;"2021/03/01 00:00:00";"2023/02/28 00:00:00"
15031677;1;"LUIZ ESTEVAO VASCONCELOS TEXEIRA DE MELO";"01596046643";"28/10/1987";"CONTRATO TEMPORARIO";"JXXIII";"COORDENACAO DO BLOCO CIRURGICO";"MED";"MEDICO ANESTESIOLOGISTA";"III";"A";"18/10/2021";"2021/10/18 00:00:00";"2023/06/30 00:00:00"
15189814;1;"LUIZ FELIPE GONCALVES DE FIGUEIREDO";"13937937625";NA;"CONTRATO TEMPORARIO";"HMAL";NA;"MEDRE";"MEDICO";"I";"A";NA;"2022/03/01 00:00:00";"2023/02/28 00:00:00"
14884043;1;"LUIZ FELIPE OLIVEIRA GONDIM";"11176176455";NA;"CONTRATO TEMPORARIO";"HJK";NA;"MEDRE";"MEDICO";"I";"A";NA;"2020/03/01 00:00:00";"2023/02/28 00:00:00"
13488770;2;"LUIZ FILLIPPE DE SOUSA SANTOS";"08790997638";"17/11/1990";"CONTRATO TEMPORARIO";"HJK";"COORDENACAO DE ARQUIVO MEDICO E ESTATISTICA";"TOS";"TECNICO EM INFORMATICA";"II";"A";"30/06/2021";"2021/06/30 00:00:00";"2023/06/29 00:00:00"
12458188;2;"LUIZ HENRIQUE RODRIGUES DA SILVA";"05568876622";"02/07/1981";"CONTRATO TEMPORARIO";"HGB-JA";"COORDENACAO DA UNIDADE CIRURGICA";"PENF";"TECNICO DE ENFERMAGEM";"II";"A";"01/02/2022";"2022/02/01 00:00:00";"2023/01/31 00:00:00"
14937932;2;"LUIZ LIMA";"10374374627";"30/11/1992";"CONTRATO TEMPORARIO";"JXXIII";"COORDENACAO DE URGENCIA E EMERGENCIA ADULTO";"MED";"MEDICO GENERALISTA";"I";"A";"01/07/2022";"2022/07/01 00:00:00";"2022/12/27 00:00:00"
14937932;1;"LUIZ LIMA";"10374374627";NA;"CONTRATO TEMPORARIO";"JXXIII";NA;"MEDRE";"MEDICO";"I";"A";NA;"2021/03/01 00:00:00";"2023/02/28 00:00:00"
15128572;1;"LUIZA BARBOSA DOS SANTOS";"07609170607";"06/03/1991";"CONTRATO TEMPORARIO";"HMAL";"COORDENACAO DE ASSISTENCIA FARMACEUTICA";"AGAS";"FARMACEUTICO";"I";"A";"03/03/2022";"2022/03/03 00:00:00";"2023/03/02 00:00:00"
14884456;1;"LUIZA COSTA SOUTO";"12927114692";NA;"CONTRATO TEMPORARIO";"HJK";NA;"MEDRE";"MEDICO";"I";"A";NA;"2020/03/01 00:00:00";"2023/02/28 00:00:00"
11948049;4;"LUIZA DE MELO MONTEIRO";"07401834600";"06/04/1984";"CONTRATO TEMPORARIO";"JXXIII";"COORDENACAO DAS UNIDADES DE INTERNACAO ADULTO";"PENF";"TECNICO DE ENFERMAGEM";"II";"A";"02/02/2022";"2022/02/02 00:00:00";"2023/02/01 00:00:00"
13804729;1;"LUIZA DE SOUZA MENDES";"05956559632";"09/12/1981";"CONTRATO TEMPORARIO";"HGB-JA";"COORDENACAO DE APOIO DIAGNOSTICO E TERAPEUTICO";"TOS";"TECNICO EM PATOLOGIA CLINICA";"II";"A";"29/06/2022";"2022/06/29 00:00:00";"2023/06/28 00:00:00"
11254596;4;"LUIZA MARIA CARNEIRO";"76458725604";"03/01/1967";"CONTRATO TEMPORARIO";"JXXIII";"COORDENACAO DE URGENCIA E EMERGENCIA ADULTO";"PENF";"TECNICO DE ENFERMAGEM";"II";"A";"23/06/2022";"2022/06/23 00:00:00";"2023/06/22 00:00:00"
14418826;2;"LUIZA ROGERIO";"08404071659";"20/11/1989";"CONTRATO TEMPORARIO";"HEM";"COORDENACAO DAS UNIDADES DE INTERNACAO";"MED";"MEDICO CIRURGIAO GERAL";"III";"A";"07/07/2022";"2022/07/11 00:00:00";"2023/07/10 00:00:00"
14937668;1;"LUIZA VALE COELHO";"07882832600";NA;"CONTRATO TEMPORARIO";"JXXIII";NA;"MEDRE";"MEDICO";"I";"A";NA;"2021/03/01 00:00:00";"2023/02/28 00:00:00"
14888978;3;"LUIZA VASCONCELOS CAMPOLINA";"07361896618";"17/11/1983";"CONTRATO TEMPORARIO";"MOV";"COORDENACAO DA UNIDADE DE TERAPIA INTENSIVA";"AGAS";"FISIOTERAPEUTA RESPIRATORIA";"III";"A";"29/09/2021";"2021/09/29 00:00:00";"2023/06/30 00:00:00"
14756696;3;"LUMA BARBOSA CAPANEMA";"12299313680";"23/09/1993";"CONTRATO TEMPORARIO";"JXXIII";"COORDENACAO DE URGENCIA E EMERGENCIA ADULTO";"MED";"MEDICO CLINICO";"III";"A";"24/05/2021";"2021/05/24 00:00:00";"2023/05/23 00:00:00"
14561856;3;"LURIA JUNIA PEREIRA COSTA";"08626382677";"24/10/1992";"CONTRATO TEMPORARIO";"DIRASS";"(DESAT.)COORDENACAO DE ENGENHARIA CLINICA";"AGAS";"ENGENHEIRO";"III";"A";"05/04/2021";"2021/04/05 00:00:00";"2023/06/30 00:00:00"
11861887;3;"LUZIA BARBOSA GOMES";"11890254851";"17/02/1970";"CONTRATO TEMPORARIO";"HJK";"COORDENACAO DE ASSISTENCIA FARMACEUTICA";"PENF";"TECNICO DE ENFERMAGEM";"II";"A";"05/02/2022";"2022/02/05 00:00:00";"2023/02/04 00:00:00"
12569638;3;"LUZIA CAETANO DE ASEVEDO";"03676335660";"16/08/1979";"CONTRATO TEMPORARIO";"HEM";"COORDENACAO DAS UNIDADES CRITICAS";"PENF";"TECNICO DE ENFERMAGEM";"II";"A";"01/02/2022";"2022/02/01 00:00:00";"2023/01/31 00:00:00"
14668081;1;"LUZIA CLERIA DIAS";"00316827665";"15/11/1978";"CONTRATO TEMPORARIO";"MOV";"COORDENACAO DA UNIDADE DE NEONATOLOGIA";"PENF";"ENFERMEIRO";"VI";"A";"28/06/2022";"2022/06/28 00:00:00";"2023/06/27 00:00:00"
11618345;3;"LUZIA MARIA DA SILVA VENTURA";"03572877628";"19/04/1979";"CONTRATO TEMPORARIO";"MOV";"COORDENACAO DA GINECOLOGIA E OBSTETRICIA";"PENF";"ENFERMEIRO OBSTETRICO";"VI";"A";"01/07/2022";"2022/07/01 00:00:00";"2023/06/30 00:00:00"
14052898;2;"LUZINETE FERNANDES MACIEL";"86414070653";"22/02/1972";"CONTRATO TEMPORARIO";"JXXIII";"COORDENACAO DAS UNIDADES DE INTERNACAO ADULTO";"PENF";"TECNICO DE ENFERMAGEM";"II";"A";"01/04/2022";"2022/04/01 00:00:00";"2023/03/31 00:00:00"
14314751;2;"LYDIANE LARA CAIXETA";"07961859640";NA;"CONTRATO TEMPORARIO";"HRAD";NA;"AGAS";"FARMACEUTICO";"I";"A";NA;"2021/06/01 00:00:00";"2023/05/31 00:00:00"
14939086;1;"LYZA ALCENCAR SIQUEIRA";"06283005659";NA;"CONTRATO TEMPORARIO";"HRAD";NA;"MEDRE";"MEDICO";"I";"A";NA;"2021/03/01 00:00:00";"2023/02/28 00:00:00"
14958375;2;"MACIRLENE SOARES DA SILVA XAVIER";"07318127608";"11/11/1986";"CONTRATO TEMPORARIO";"HJK";"COORDENACAO DE INTERNACAO - ADULTO";"TOS";"AUXILIAR ADMINISTRATIVO";"I";"A";"01/02/2022";"2022/02/02 00:00:00";"2023/02/01 00:00:00"
13805213;2;"MAGDA CRISTINA VIDAL VIVEIROS";"08531924642";"15/05/1987";"CONTRATO TEMPORARIO";"HGB-JA";"COORDENACAO DA UNIDADE DE URGENCIA E EMERGENCIA";"PENF";"TECNICO DE ENFERMAGEM";"II";"A";"01/02/2022";"2022/02/01 00:00:00";"2023/01/31 00:00:00"
10740348;3;"MAGDA DE ABREU FARIA";"65831659615";"13/07/1969";"CONTRATO TEMPORARIO";"CSSI";"COORDENACAO DA UNIDADE DE PACIENTES EXTERNOS";"MED";"MEDICO DERMATOLOGISTA";"III";"A";"02/02/2022";"2022/02/02 00:00:00";"2023/02/01 00:00:00"
14900708;2;"MAICON DOUGLAS DA SILVA";"10568003640";"13/09/1990";"CONTRATO TEMPORARIO";"HRAD";"COORDENACAO DAS UNIDADES DE INTERNACAO";"PENF";"TECNICO DE ENFERMAGEM";"II";"A";"0000-00-00";"2022/02/02 00:00:00";"2023/02/01 00:00:00"
14668354;2;"MAIRA CARDOSO ASPAHAN";"07790425650";"25/10/1987";"CONTRATO TEMPORARIO";"HEM";"COORDENACAO DAS UNIDADES DE INTERNACAO";"MED";"MEDICO NEUROLOGISTA";"III";"A";"01/02/2022";"2022/02/01 00:00:00";"2023/01/31 00:00:00"
14880538;2;"MAIRA MAGALHAES GOMES";"10526680628";"17/07/1989";"CONTRATO TEMPORARIO";"MOV";"COORDENACAO DA UNIDADE DE NEONATOLOGIA";"MED";"MEDICO PEDIATRA";"III";"A";"03/12/2021";"2021/12/03 00:00:00";"2023/06/30 00:00:00"
15123797;1;"MAIRA MARTINS PRATES MATOS";"10580129675";NA;"CONTRATO TEMPORARIO";"JXXIII";NA;"MEDRE";"MEDICO";"I";"A";NA;"2022/03/01 00:00:00";"2023/02/28 00:00:00"
14177018;4;"MAIRA RODRIGUES PEREIRA";"10378663631";"23/01/1992";"CONTRATO TEMPORARIO";"HRAD";"COORDENACAO DAS UNIDADES CRITICAS";"MED";"MEDICO CLINICO";"III";"A";"0000-00-00";"2022/07/05 00:00:00";"2023/07/04 00:00:00"
14925556;1;"MAISA ALVES RETTORE";"02960106180";NA;"CONTRATO TEMPORARIO";"MOV";NA;"MEDRE";"MEDICO";"I";"A";NA;"2021/03/01 00:00:00";"2023/02/28 00:00:00"
14638910;1;"MAIZA CAMPOS DA PAZ";"09176356639";"20/08/1988";"CONTRATO TEMPORARIO";"HRJP";"GERENCIA ASSISTENCIAL";"TOS";"AUXILIAR ADMINISTRATIVO";"I";"A";"01/02/2022";"2022/02/01 00:00:00";"2023/01/31 00:00:00"
13190269;2;"MAIZA MARTA DE LIMA DA SILVA";"02834493650";"28/04/1970";"CONTRATO TEMPORARIO";"MOV";"COORDENACAO DA UNIDADE DE TERAPIA INTENSIVA";"PENF";"TECNICO DE ENFERMAGEM";"II";"A";"14/02/2022";"2022/02/14 00:00:00";"2023/02/13 00:00:00"
15137821;1;"MAKELLY KEZIA BRUM RIBEIRO";"01617056693";"27/11/1987";"CONTRATO TEMPORARIO";"JXXIII";"COORDENACAO DAS UNIDADES DE INTERNACAO PEDIATRICA";"PENF";"TECNICO DE ENFERMAGEM";"II";"A";"11/03/2022";"2022/03/11 00:00:00";"2023/03/10 00:00:00"
14937957;1;"MANOEL BRUNO PEREIRA LIMA";"13499338645";NA;"CONTRATO TEMPORARIO";"JXXIII";NA;"MEDRE";"MEDICO";"I";"A";NA;"2021/03/01 00:00:00";"2023/02/28 00:00:00"
14661417;2;"MANOELA CRISTINA DOS SANTOS";"01499354630";"21/10/1983";"CONTRATO TEMPORARIO";"DIGEPE";"(DESAT.)GERENCIA DE SAUDE E SEGURANCA DO TRABALHADOR";"TOS";"AUXILIAR ADMINISTRATIVO";"I";"A";"22/06/2022";"2022/06/22 00:00:00";"2023/06/21 00:00:00"
13999842;5;"MANON CAMPOS DE OLIVEIRA ZOCRATO";"06032690601";"22/03/1983";"CONTRATO TEMPORARIO";"HJK";"COORDENACAO DA UNIDADE DE TERAPIA INTENSIVA ADULTO";"MED";"MEDICO CLINICO";"III";"A";"07/10/2021";"2021/10/07 00:00:00";"2023/06/30 00:00:00"
15123540;1;"MANUELA LOPES DE ARAUJO PINHEIRO";"06650290637";NA;"CONTRATO TEMPORARIO";"MOV";NA;"MEDRE";"MEDICO";"I";"A";NA;"2022/03/03 00:00:00";"2023/03/02 00:00:00"
11305505;4;"MANUELA MOLLER MALHEIROS";"01210257645";NA;"CONTRATO TEMPORARIO";"IRS";NA;"MEDRE";"MEDICO";"I";"A";NA;"2022/03/01 00:00:00";"2023/02/28 00:00:00"
14934418;1;"MANUELA PIEROTTE LUZ GONDIM";"04743506573";NA;"CONTRATO TEMPORARIO";"HJK";NA;"MEDRE";"MEDICO";"I";"A";NA;"2021/03/01 00:00:00";"2023/02/28 00:00:00"
14930614;1;"MARA DE FATIMA DOS SANTOS";"05473202640";"08/04/1976";"CONTRATO TEMPORARIO";"MOV";"COORDENACAO DA GINECOLOGIA E OBSTETRICIA";"PENF";"TECNICO DE ENFERMAGEM";"II";"A";"08/03/2021";"2021/03/08 00:00:00";"2023/03/07 00:00:00"
12536173;2;"MARCELA ABREU MENEZES";"01248632648";"02/05/1986";"CONTRATO TEMPORARIO";"JXXIII";"COORDENACAO DE LABORATORIO E AGENCIA TRANSFUSIONAL";"AGAS";"FARMACEUTICO BIOQUIMICO";"I";"A";"27/07/2021";"2021/07/27 00:00:00";"2023/06/30 00:00:00"
14668230;3;"MARCELA BRITO VIANA";"01470245604";"20/05/1981";"CONTRATO TEMPORARIO";"HIJPII";"COORDENACAO DE DIAGNOSTICO POR IMAGEM";"TOS";"TECNICO EM RADIOLOGIA";"II";"A";"14/01/2022";"2022/01/12 00:00:00";"2023/01/11 00:00:00"
14888820;2;"MARCELA CAMPOS DOS REIS";"11270581694";NA;"CONTRATO TEMPORARIO";"HIJPII";NA;"MEDRE";"MEDICO";"I";"A";NA;"2021/03/01 00:00:00";"2023/02/28 00:00:00"
12795969;2;"MARCELA DE SOUZA CARNEIRO";"63839865620";"23/08/1966";"CONTRATO TEMPORARIO";"DPGF";"(DESAT.)COORDENACAO DE EXECUCAO ORCAMENTARIA E FINANCEIRA";"TOS";"AUXILIAR ADMINISTRATIVO";"I";"A";"01/02/2022";"2022/02/01 00:00:00";"2023/01/31 00:00:00"
15023187;1;"MARCELA FERNANDA LEMKE";"00946636613";"17/01/1977";"CONTRATO TEMPORARIO";"CMT";"GERENCIA ASSISTENCIAL";"PENF";"ENFERMEIRO";"IV";"A";"01/10/2021";"2021/10/01 00:00:00";"2023/06/30 00:00:00"
15164924;1;"MARCELA FERREIRA CORREA";"08715257630";"26/12/1986";"CONTRATO TEMPORARIO";"CMT";"GERENCIA ASSISTENCIAL";"PENF";"ENFERMEIRO";"IV";"A";"04/04/2022";"2022/04/04 00:00:00";"2023/04/03 00:00:00"
15090566;1;"MARCELA REGINA DE FREITAS";"06027502614";"23/12/1980";"CONTRATO TEMPORARIO";"HGB-JA";"COORDENACAO DE SAUDE MENTAL";"PENF";"TECNICO DE ENFERMAGEM";"II";"A";"01/02/2022";"2022/02/01 00:00:00";"2023/01/31 00:00:00"
14459374;1;"MARCELA SCARATO MARTINS COSTA";"05743901627";"07/03/1982";"CONTRATO TEMPORARIO";"HRJP";"COORDENACAO DAS UNIDADES DE INTERNACAO";"PENF";"TECNICO DE ENFERMAGEM";"II";"A";"01/02/2022";"2022/02/01 00:00:00";"2023/01/31 00:00:00"
14902993;2;"MARCELLA MENDES FRANCA";"09428250635";"11/05/1987";"CONTRATO TEMPORARIO";"HRJP";"COORDENACAO DAS UNIDADES DE INTERNACAO";"PENF";"TECNICO DE ENFERMAGEM";"II";"A";"01/02/2022";"2022/02/01 00:00:00";"2023/01/31 00:00:00"
15052285;2;"MARCELLE STEPHANE NUNES DE OLIVEIRA";"11070268658";"05/06/1992";"CONTRATO TEMPORARIO";"HIJPII";"COORDENACAO DE URGENCIA E EMERGENCIA PEDIATRICA";"PENF";"ENFERMEIRO";"IV";"A";"30/12/2021";"2021/12/30 00:00:00";"2023/06/30 00:00:00"
14661391;3;"MARCELO DOS SANTOS OLIVEIRA";"06235574606";"09/09/1981";"CONTRATO TEMPORARIO";"JXXIII";"COORDENACAO DAS UNIDADES DE INTERNACAO ADULTO";"PENF";"TECNICO DE ENFERMAGEM";"II";"A";"03/03/2022";"2022/03/03 00:00:00";"2023/03/02 00:00:00"
10863850;3;"MARCELO EDUARDO ZACCARO FERREIRA";"32542674604";"03/06/1952";"CONTRATO TEMPORARIO";"HCM";"COORDENACAO DAS UNIDADES DE INTERNACAO";"MED";"ESPECIALISTA EM CLINICA MEDICA";"III";"A";"17/03/2022";"2022/03/17 00:00:00";"2023/03/16 00:00:00"
10902716;2;"MARCELO FERNANDES CUNHA";"83088920600";"24/08/1972";"CONTRATO TEMPORARIO";"HRJP";"COORDENACAO DAS UNIDADES CRITICAS";"MED";"MEDICO PEDIATRA";"III";"A";"28/02/2018";"2021/02/01 00:00:00";"2023/01/31 00:00:00"
13705405;3;"MARCELO FERREIRA";"96652195615";"23/04/1972";"CONTRATO TEMPORARIO";"HRAD";"COORDENACAO DAS UNIDADES DE INTERNACAO";"PENF";"TECNICO DE ENFERMAGEM";"II";"A";"0000-00-00";"2022/04/01 00:00:00";"2023/03/31 00:00:00"
14890305;1;"MARCELO GONCALVES";"06130227698";"14/06/1984";"CONTRATO TEMPORARIO";"HRJP";"COORDENACAO DAS UNIDADES DE INTERNACAO";"PENF";"TECNICO DE ENFERMAGEM";"II";"A";"02/07/2022";"2022/07/02 00:00:00";"2023/07/01 00:00:00"
14963359;1;"MARCELO HENRIQUE MELO SILVA";"07343423657";"23/01/1985";"CONTRATO TEMPORARIO";"JXXIII";"COORDENACAO DE URGENCIA E EMERGENCIA ADULTO";"MED";"MEDICO ORTOPEDISTA E TRAUMATOLOGISTA";"III";"A";"22/05/2021";"2021/05/22 00:00:00";"2023/05/21 00:00:00"
14757413;1;"MARCELO HENRIQUES DE CARMARGOS";"10384891640";NA;"CONTRATO TEMPORARIO";"JXXIII";NA;"MEDRE";"MEDICO";"I";"A";NA;"2019/03/01 00:00:00";"2023/02/28 00:00:00"
14615215;1;"MARCELO THADEU FORTES";"04093354600";"06/10/1977";"CONTRATO TEMPORARIO";"CEPAI";"COORDENACAO DE INTERNACAO E AMBULATORIO";"PENF";"TECNICO DE ENFERMAGEM";"II";"A";"01/02/2022";"2022/02/01 00:00:00";"2023/01/31 00:00:00"
15271604;1;"MARCELO TOLOMELLI CURY CABRAL";"01346505659";"27/02/1981";"CONTRATO TEMPORARIO";"HGB-JA";"COORDENACAO DA UNIDADE CIRURGICA";"MED";"MEDICO CIRURGIAO GERAL";"III";"A";"29/06/2022";"2022/06/29 00:00:00";"2023/06/28 00:00:00"
14946362;1;"MARCELO VIEIRA GISSONI DE CARVALHO";"08835696631";NA;"CONTRATO TEMPORARIO";"HAC";NA;"MEDRE";"MEDICO";"I";"A";NA;"2021/03/16 00:00:00";"2023/03/15 00:00:00"
14514137;3;"MARCELO VITOR LEITE ALBUQUERQUE";"06579951699";"07/01/1984";"CONTRATO TEMPORARIO";"JXXIII";"COORDENACAO DE URGENCIA E EMERGENCIA ADULTO";"MED";"MEDICO ORTOPEDISTA E TRAUMATOLOGISTA";"III";"A";"03/03/2022";"2022/03/03 00:00:00";"2023/03/02 00:00:00"
14929442;2;"MARCIA AMELIA VIGIANI";"05933212601";"06/10/1977";"CONTRATO TEMPORARIO";"CHPB";"COORDENACAO DA UNIDADE DE CUIDADOS CONTINUADOS INTEGRADOS";"PENF";"TECNICO DE ENFERMAGEM";"II";"A";"09/03/2021";"2022/02/02 00:00:00";"2023/02/01 00:00:00"
11237641;4;"MARCIA CHAVES DA CONCEICAO";"02616309629";"16/01/1974";"CONTRATO TEMPORARIO";"HGB-JA";"COORDENACAO DA UNIDADE DE CLINICA MEDICA";"PENF";"TECNICO DE ENFERMAGEM";"II";"A";"10/01/2022";"2022/01/10 00:00:00";"2023/01/09 00:00:00"
14834642;1;"MARCIA CRISTINA LOPES RODRIGUES";"04476488617";"14/11/1981";"CONTRATO TEMPORARIO";"IRS";"COORDENACAO TECNICA DE ENFERMAGEM";"PENF";"TECNICO DE ENFERMAGEM";"II";"A";"25/11/2022";"2022/11/25 00:00:00";"2023/11/24 00:00:00"
15348915;1;"MARCIA CRISTINA MARANGON";"06160073613";NA;"CONTRATO TEMPORARIO";"HRJP";NA;"TOS";"TECNICO EM PATOLOGIA CLINICA";"II";"A";NA;"2022/11/29 00:00:00";"2023/11/28 00:00:00"
20971215;1;"MARCIA CRISTINA MARANGON";"06160073613";"30/12/1983";NA;"HRJP";"COORDENACAO DE APOIO DIAGNOSTICO E TERAPEUTICO";NA;"TECNICO EM PATOLOGIA CLINICA";NA;NA;"29/11/2022";NA;NA
14887681;1;"MARCIA DA SILVA DE SOUZA";"04771022631";"19/03/1981";"CONTRATO TEMPORARIO";"HJK";"COORDENACAO DE INTERNACAO - ADULTO";"PENF";"TECNICO DE ENFERMAGEM";"II";"A";"02/02/2022";"2022/02/05 00:00:00";"2023/02/04 00:00:00"
11072444;6;"MARCIA FATIMA PINHEIRO RAMOS";"58488103620";"30/05/1965";"CONTRATO TEMPORARIO";"MOV";"COORDENACAO DA UNIDADE CIRURGICA";"PENF";"TECNICO DE ENFERMAGEM";"II";"A";"02/02/2022";"2022/02/02 00:00:00";"2023/02/01 00:00:00"
14459408;1;"MARCIA LOPES BORGES";"02834729603";"15/10/1975";"CONTRATO TEMPORARIO";"HRAD";"COORDENACAO DA UNIDADE CIRURGICA";"PENF";"TECNICO DE ENFERMAGEM";"II";"A";"0000-00-00";"2022/02/01 00:00:00";"2023/01/31 00:00:00"
15182835;1;"MARCIA MARIA DE AVELAR COSTA";"88236692604";"24/05/1971";"CONTRATO TEMPORARIO";"HAC";"COORDENACAO DE ASSISTENCIA FARMACEUTICA";"TOS";"TECNICO EM FARMACIA";"II";"A";"12/04/2022";"2022/04/12 00:00:00";"2023/04/11 00:00:00"
14757405;4;"MARCIA MICHELLE SOUZA DA SILVA";"11081291702";"19/03/1994";"CONTRATO TEMPORARIO";"JXXIII";"COORDENACAO DA UNIDADE DE TERAPIA INTENSIVA ADULTO";"MED";"MEDICO CLINICO";"III";"A";"04/03/2022";"2022/03/04 00:00:00";"2023/03/03 00:00:00"
14930432;1;"MARCIA PAULLINY SOARES BAHIA";"10411513656";NA;"CONTRATO TEMPORARIO";"HEM";NA;"MEDRE";"MEDICO";"I";"A";NA;"2021/03/01 00:00:00";"2023/02/28 00:00:00"
12044913;3;"MARCIA REGINA PEREIRA DE SOUZA";"78375150134";"10/01/1973";"CONTRATO TEMPORARIO";"HRJP";"COORDENACAO DAS UNIDADES DE INTERNACAO";"PENF";"TECNICO DE ENFERMAGEM";"II";"A";"23/06/2022";"2022/06/23 00:00:00";"2023/06/22 00:00:00"
15102189;1;"MARCIEL ANTONIO DOS SANTOS";"11728023602";"11/03/1993";"CONTRATO TEMPORARIO";"HGB-JA";"COORDENACAO DA UNIDADE DE PACIENTES CRITICOS";"PENF";"TECNICO DE ENFERMAGEM";"II";"A";"01/02/2022";"2022/02/01 00:00:00";"2023/01/31 00:00:00"
11230505;3;"MARCILEA DA SILVA PEREIRA";"72296062687";"25/12/1968";"CONTRATO TEMPORARIO";"HGB-JA";"COORDENACAO DA UNIDADE CIRURGICA";"PENF";"ENFERMEIRO";"IV";"A";"01/02/2022";"2022/02/01 00:00:00";"2023/01/31 00:00:00"
14847792;3;"MARCILEA SILVA SANTOS";"06376107680";"08/09/1984";"CONTRATO TEMPORARIO";"JXXIII";"COORDENACAO DE URGENCIA E EMERGENCIA ADULTO";"MED";"MEDICO NEUROCIRURGIAO";"III";"A";"06/03/2022";"2022/03/06 00:00:00";"2023/03/05 00:00:00"
14052732;2;"MARCILENE EUSTAQUIA DO CARMO";"04257659629";"21/09/1980";"CONTRATO TEMPORARIO";"HIJPII";"COORDENACAO DA CENTRAL DE MATERIAL E ESTERILIZACAO";"PENF";"TECNICO DE ENFERMAGEM";"II";"A";"01/03/2022";"2022/03/01 00:00:00";"2023/02/28 00:00:00"
14701700;1;"MARCILIA DE CASSIA DORNELAS";"75668041620";"10/04/1970";"CONTRATO TEMPORARIO";"HGB-JA";"COORDENACAO DA UNIDADE CIRURGICA";"MED";"MEDICO CIRURGIAO PLASTICO";"III";"A";"11/02/2022";"2022/02/11 00:00:00";"2023/02/10 00:00:00"
15274566;1;"MARCIO ADRIANO DE ANDRADE";"02708375407";NA;"CONTRATO TEMPORARIO";"HRJP";NA;"MED";"MEDICO ANESTESIOLOGISTA";"III";"A";NA;"2022/07/01 00:00:00";"2022/12/27 00:00:00"
90018032;0;"MARCIO CAMPOS CRUZ - DOIS";"06284448694";"0000-00-00";NA;"HJK";"COORDENACAO MEDICA DA URGENCIA E EMERGENCIA";NA;"";NA;NA;"01/12/2022";NA;NA
14791925;1;"MARCIO CAMPOS DA CRUZ";"06284448694";"20/07/1983";"CONTRATO TEMPORARIO";"HJK";"COORDENACAO DE INTERNACAO - ADULTO";"PENF";"ENFERMEIRO";"IV";"A";"01/02/2022";"2022/02/01 00:00:00";"2023/01/31 00:00:00"
14823629;1;"MARCIO EDUARDO VICTER MATIAS RAMOS DE AZ";"96014253734";"13/11/1970";"CONTRATO TEMPORARIO";"CSSFE";"COORDENACAO DA UNIDADE DE PACIENTES EXTERNOS";"MED";"MEDICO DO TRABALHO";"III";"A";"01/02/2022";"2022/02/01 00:00:00";"2023/01/31 00:00:00"
13872510;3;"MARCIO FLAVIO DE SOUZA";"04182420624";"03/08/1979";"CONTRATO TEMPORARIO";"HJK";"COORDENACAO DE INTERNACAO - ADULTO";"PENF";"TECNICO DE ENFERMAGEM";"II";"A";"13/11/2022";"2022/11/13 00:00:00";"2023/11/12 00:00:00"
13872510;2;"MARCIO FLAVIO DE SOUZA";"04182420624";"03/08/1979";"CONTRATO TEMPORARIO";"HEM";"COORDENACAO DAS UNIDADES DE INTERNACAO";"PENF";"TECNICO DE ENFERMAGEM";"II";"A";"01/07/2022";"2022/07/01 00:00:00";"2023/06/30 00:00:00"
15082464;1;"MARCIO ROGERIO DE SOUZA";"00847686655";"28/02/1975";"CONTRATO TEMPORARIO";"HGB-JA";"COORDENACAO DA UNIDADE DE URGENCIA E EMERGENCIA";"PENF";"ENFERMEIRO";"IV";"A";"02/02/2022";"2022/02/02 00:00:00";"2023/02/01 00:00:00"
10906436;5;"MARCO CICERO TERRA DE DEUS";"84475153620";"06/09/1968";"CONTRATO TEMPORARIO";"JXXIII";"COORDENACAO DE URGENCIA E EMERGENCIA PEDIATRICA";"PENF";"ENFERMEIRO";"IV";"A";"05/02/2022";"2022/02/05 00:00:00";"2023/02/04 00:00:00"
15122492;1;"MARCO EDOARDO ANSANI";"06065301507";NA;"CONTRATO TEMPORARIO";"HGB-JA";NA;"MEDRE";"MEDICO";"I";"A";NA;"2022/03/01 00:00:00";"2023/02/28 00:00:00"
14419121;2;"MARCO TULIO DE ANDRADE SUCENA";"10890767629";"26/07/1989";"CONTRATO TEMPORARIO";"JXXIII";"COORDENACAO DE URGENCIA E EMERGENCIA ADULTO";"MED";"MEDICO NEUROCIRURGIAO";"III";"A";"02/04/2022";"2022/04/02 00:00:00";"2023/04/01 00:00:00"
11263829;4;"MARCO TULIO SANTOS SALIM";"32606877691";"22/05/1959";"CONTRATO TEMPORARIO";"HGB-JA";"COORDENACAO DA UNIDADE CIRURGICA";"MED";"MEDICO";"I";"A";"12/04/2021";"2021/04/12 00:00:00";"2023/04/11 00:00:00"
14314959;2;"MARCOS AFRANIO PEREIRA";"86988611649";"11/07/1973";"CONTRATO TEMPORARIO";"DIEST";"(DESAT.)GERENCIA DE TECNOLOGIA E GESTAO DA INFORMACAO";"TOS";"TECNICO EM INFORMATICA";"II";"A";"0000-00-00";"2022/03/30 00:00:00";"2023/03/29 00:00:00"
11266640;3;"MARCOS AURELIO DIAS BARBOSA";"69265321687";"26/08/1969";"CONTRATO TEMPORARIO";"DIEST";"(DESAT.)COORDENACAO DE ENGENHARIA CLINICA";"AGAS";"ENGENHEIRO";"III";"A";"27/03/2022";"2022/03/22 00:00:00";"2023/03/21 00:00:00"
14946560;1;"MARCOS CESAR MAGALHAES MOREIRA";"11288405618";"10/06/1991";"CONTRATO TEMPORARIO";"HGB-JA";"COORDENACAO DA UNIDADE CIRURGICA";"PENF";"TECNICO DE ENFERMAGEM";"II";"A";"29/03/2021";"2021/03/29 00:00:00";"2023/03/28 00:00:00"
14668438;2;"MARCOS NUNES DA SILVA";"32909179672";"05/06/1959";"CONTRATO TEMPORARIO";"HRJP";"COORDENACAO DE INFRAESTRUTURA";"TOS";"TECNICO EM ELETRONICA";"II";"A";"16/12/2021";"2021/12/16 00:00:00";"2023/06/30 00:00:00"
14888986;1;"MARCOS PAULO ARAUJO";"11843633663";"27/12/1995";"CONTRATO TEMPORARIO";"JXXIII";"COORDENACAO DAS UNIDADES DE INTERNACAO ADULTO";"PENF";"TECNICO DE ENFERMAGEM";"II";"A";"02/02/2022";"2022/02/01 00:00:00";"2023/01/31 00:00:00"
15085566;1;"MARCOS PAULO AVILA DE ALMEIDA";"01993094695";NA;"CONTRATO TEMPORARIO";"JXXIII";NA;"PENF";"TECNICO DE ENFERMAGEM";"II";"A";NA;"2022/02/02 00:00:00";"2023/02/01 00:00:00"
14459424;4;"MARCOS PAULO FERREIRA CORREA ALVES REIS";"08513415600";"01/10/1987";"CONTRATO TEMPORARIO";"JXXIII";"COORDENACAO DE URGENCIA E EMERGENCIA ADULTO";"MED";"MEDICO CIRURGIAO GERAL";"III";"A";"05/03/2022";"2022/03/05 00:00:00";"2023/03/04 00:00:00"
15067044;1;"MARCOS SOARES SILVA";"12422199607";"05/11/1992";"CONTRATO TEMPORARIO";"JXXIII";"COORDENACAO DE DIAGNOSTICO POR IMAGEM";"TOS";"TECNICO EM RADIOLOGIA";"II";"A";"13/01/2022";"2022/01/13 00:00:00";"2023/01/12 00:00:00"
15142557;1;"MARCUS VINICIUS MENESES DA SILVA";"05594402195";NA;"CONTRATO TEMPORARIO";"HRAD";NA;"MEDRE";"MEDICO";"I";"A";NA;"2022/03/01 00:00:00";"2023/02/28 00:00:00"
14668263;1;"MARGARETE APARECIDA DAS CHAGAS";"84127660678";"02/07/1969";"CONTRATO TEMPORARIO";"CSSFA";"COORDENACAO DA UNIDADE DE INTERNACAO E PACIENTES EXTERNOS";"PENF";"TECNICO DE ENFERMAGEM";"II";"A";"18/07/2018";"2022/02/01 00:00:00";"2023/01/31 00:00:00"
14514178;1;"MARGARETE CESARIO DE ANDRADE";"04185288611";"04/12/1977";"CONTRATO TEMPORARIO";"CSSFA";"COORDENACAO DA UNIDADE DE INTERNACAO E PACIENTES EXTERNOS";"PENF";"TECNICO DE ENFERMAGEM";"II";"A";"01/08/2017";"2022/02/01 00:00:00";"2023/01/31 00:00:00"
13801766;2;"MARGARETH APARECIDA DE MELO";"03125702607";"26/11/1976";"CONTRATO TEMPORARIO";"HGB-JA";"COORDENACAO DA UNIDADE DE URGENCIA E EMERGENCIA";"PENF";"TECNICO DE ENFERMAGEM";"II";"A";"27/11/2022";"2022/11/27 00:00:00";"2023/11/26 00:00:00"
13608948;2;"MARGARETH ROSY VILASBOAS DE MEDEIROS";"00061088650";"17/04/1972";"CONTRATO TEMPORARIO";"HJK";"COORDENACAO DA UNIDADE DE TERAPIA INTENSIVA NEONATAL";"AGAS";"FISIOTERAPEUTA RESPIRATORIA";"III";"A";"28/06/2022";"2022/06/28 00:00:00";"2023/06/27 00:00:00"
14638746;1;"MARGARIDA LIMA DOS SANTOS";"04315023663";"17/08/1981";"CONTRATO TEMPORARIO";"HJK";"COORDENACAO DO LABORATORIO";"TOS";"AUXILIAR ADMINISTRATIVO";"I";"A";"01/02/2022";"2022/02/01 00:00:00";"2023/01/31 00:00:00"
11489135;2;"MARIA ABADIA FERREIRA MACHADO";"62514547687";"12/04/1966";"CONTRATO TEMPORARIO";"HRAD";"COORDENACAO DAS UNIDADES DE INTERNACAO";"PENF";"TECNICO DE ENFERMAGEM";"II";"A";"01/07/2022";"2022/09/01 00:00:00";"2023/08/31 00:00:00"
10866465;3;"MARIA ALICE MOREIRA";"84470607649";"02/12/1965";"CONTRATO TEMPORARIO";"JXXIII";"COORDENACAO DO BLOCO CIRURGICO";"MED";"MEDICO ANESTESIOLOGISTA";"III";"A";"07/10/2021";"2021/10/07 00:00:00";"2023/06/30 00:00:00"
14896922;1;"MARIA ALVES DOS SANTOS";"07043134641";"15/03/1984";"CONTRATO TEMPORARIO";"HEM";"COORDENACAO DAS UNIDADES CRITICAS";"PENF";"TECNICO DE ENFERMAGEM";"II";"A";"05/07/2022";"2022/07/05 00:00:00";"2023/07/04 00:00:00"
14774731;1;"MARIA AMALIA DE LIMA MOREIRA";"59489480649";"17/07/1966";"CONTRATO TEMPORARIO";"HEM";"COORDENACAO DAS UNIDADES CRITICAS";"PENF";"TECNICO DE ENFERMAGEM";"II";"A";"08/07/2022";"2022/07/08 00:00:00";"2023/07/07 00:00:00"
14610968;3;"MARIA ANGELICA RIOS";"09622255680";"01/01/1989";"CONTRATO TEMPORARIO";"CEPAI";"COORDENACAO DE INTERNACAO E AMBULATORIO";"MED";"MEDICO PSIQUIATRA";"III";"A";"08/02/2022";"2022/02/08 00:00:00";"2023/02/07 00:00:00"
14679955;2;"MARIA APARECIDA DA ASSUMPCAO";"05714768647";"30/01/1966";"CONTRATO TEMPORARIO";"CMT";"GERENCIA ASSISTENCIAL";"PENF";"TECNICO DE ENFERMAGEM";"II";"A";"01/02/2022";"2022/02/01 00:00:00";"2023/01/31 00:00:00"
15106008;1;"MARIA APARECIDA DE SOUZA ABDALLA";"97820954604";"09/12/1972";"CONTRATO TEMPORARIO";"IRS";"COORDENACAO DAS UNIDADES DE INTERNACAO";"AGAS";"ASSISTENTE SOCIAL";"I";"A";"07/03/2022";"2022/03/07 00:00:00";"2023/03/06 00:00:00"
15070642;1;"MARIA APARECIDA DO NASCIMENTO";"83429050634";"11/12/1967";"CONTRATO TEMPORARIO";"HJK";"COORDENACAO DE INTERNACAO - ADULTO";"PENF";"ENFERMEIRO";"IV";"A";"02/02/2022";"2022/02/02 00:00:00";"2023/02/01 00:00:00"
12169223;4;"MARIA APARECIDA DOS SANTOS";"03081082722";"02/06/1972";"CONTRATO TEMPORARIO";"HJK";"COORDENACAO MEDICA DA URGENCIA E EMERGENCIA";"PENF";"ENFERMEIRO";"IV";"A";"11/03/2022";"2022/03/11 00:00:00";"2023/03/10 00:00:00"
15349038;1;"MARIA APARECIDA FERREIRA DE ANDRADE FONT";"00822279690";NA;"CONTRATO TEMPORARIO";"JXXIII";NA;"PENF";"TECNICO DE ENFERMAGEM";"II";"A";NA;"2022/10/03 00:00:00";"2023/10/02 00:00:00"
90001961;9;"MARIA APARECIDA FERREIRA DE ANDRADE FONTE";"00822279690";"0000-00-00";NA;"HJXXIII";"COORDENACAO DAS UNIDADES DE INTERNACAO CIRURGICA";NA;"";NA;NA;"03/10/2022";NA;NA
14931000;1;"MARIA APARECIDA GOMES MENDES";"03969361648";"05/04/1974";"CONTRATO TEMPORARIO";"CSSI";"COORDENACAO DA UNIDADE DE CUIDADO AO ADULTO";"PENF";"TECNICO DE ENFERMAGEM";"II";"A";"05/03/2021";"2021/03/05 00:00:00";"2023/03/04 00:00:00"
13801964;2;"MARIA APARECIDA PUREZA BARROS";"06210932622";"11/08/1978";"CONTRATO TEMPORARIO";"HGB-JA";"COORDENACAO DA UNIDADE DE CLINICA MEDICA";"PENF";"TECNICO DE ENFERMAGEM";"II";"A";"05/03/2021";"2021/03/05 00:00:00";"2023/03/04 00:00:00"
15203516;1;"MARIA APARECIDA TEIXEIRA";"12759652882";"08/06/1968";"CONTRATO TEMPORARIO";"CSSFE";"COORDENACAO DA UNIDADE DE CUIDADO AO ADULTO";"MED";"MEDICO GENERALISTA";"I";"A";"08/05/2022";"2022/05/08 00:00:00";"2023/05/07 00:00:00"
13679295;3;"MARIA AUXILIADORA GUEDES COSTA DE SOUZA";"04902563681";"10/11/1979";"CONTRATO TEMPORARIO";"HEM";"COORDENACAO DAS UNIDADES DE INTERNACAO";"PENF";"ENFERMEIRO";"IV";"A";"02/02/2022";"2022/02/02 00:00:00";"2023/02/01 00:00:00"
13679295;2;"MARIA AUXILIADORA GUEDES COSTA DE SOUZA";"04902563681";"10/11/1979";"CONTRATO TEMPORARIO";"HJK";"COORDENACAO MEDICA DA URGENCIA E EMERGENCIA";"PENF";"ENFERMEIRO";"IV";"A";"15/10/2022";"2022/10/19 00:00:00";"2023/10/18 00:00:00"
14926976;2;"MARIA BERNARDES LUZ";"11875078657";NA;"CONTRATO TEMPORARIO";"JXXIII";NA;"MEDRE";"MEDICO";"I";"A";NA;"2022/03/01 00:00:00";"2023/02/28 00:00:00"
14850069;1;"MARIA CAROLINA GOMES DE ARAUJO";"10921436610";"11/01/1992";"CONTRATO TEMPORARIO";"HGB-JA";"COORDENACAO DA UNIDADE DE CLINICA MEDICA";"PENF";"ENFERMEIRO";"IV";"A";"02/02/2022";"2022/02/02 00:00:00";"2023/02/01 00:00:00"
12082533;4;"MARIA CAROLINA SCARPELLI RODRIGUES FONSE";"04940289630";"29/03/1981";"CONTRATO TEMPORARIO";"JXXIII";"COORDENACAO DE URGENCIA E EMERGENCIA ADULTO";"PENF";"ENFERMEIRO";"IV";"A";"23/09/2022";"2022/09/23 00:00:00";"2023/09/22 00:00:00"
13801998;4;"MARIA CECILIA DE MATOS GROSSI";"06405743608";NA;"CONTRATO TEMPORARIO";"HGB-JA";NA;"PENF";"ENFERMEIRO";"IV";"A";NA;"2022/07/01 00:00:00";"2022/12/27 00:00:00"
10885200;6;"MARIA CECILIA PEREIRA COSTA";"97742449668";"16/05/1976";"CONTRATO TEMPORARIO";"HJK";"COORDENACAO DE INTERNACAO - ADULTO";"PENF";"TECNICO DE ENFERMAGEM";"II";"A";"04/04/2022";"2022/04/04 00:00:00";"2023/04/03 00:00:00"
15288772;1;"MARIA CILENE RODRIGUES LOPES";"04663761623";"11/04/1979";"CONTRATO TEMPORARIO";"HEM";"COORDENACAO DAS UNIDADES DE INTERNACAO";"PENF";"TECNICO DE ENFERMAGEM";"II";"A";"06/07/2022";"2022/07/06 00:00:00";"2023/07/05 00:00:00"
14418669;2;"MARIA CLARA DE FREITAS COELHO";"03821147601";"02/09/1980";"CONTRATO TEMPORARIO";"JXXIII";"COORDENACAO DO AMBULATORIO ADULTO";"MED";"MEDICO CLINICO";"III";"A";"01/07/2022";"2022/07/01 00:00:00";"2023/06/30 00:00:00"
12119228;3;"MARIA CLARA MARQUES BRAGA";"04461987655";"20/06/1977";"CONTRATO TEMPORARIO";"JXXIII";"COORDENACAO DAS UNIDADES DE INTERNACAO ADULTO";"AGAS";"ASSISTENTE SOCIAL";"I";"A";"05/10/2022";"2022/10/05 00:00:00";"2023/10/04 00:00:00"
12990164;2;"MARIA CLEIDE DE OLIVEIRA BISPO";"03317639660";"22/06/1976";"CONTRATO TEMPORARIO";"JXXIII";"COORDENACAO DE ASSISTENCIA FARMACEUTICA";"TOS";"TECNICO EM FARMACIA";"II";"A";"01/02/2022";"2022/02/01 00:00:00";"2023/01/31 00:00:00"
9070103;4;"MARIA CRISTINA COSTA DE ALMEIDA";"53315715653";"12/02/1960";"CONTRATO TEMPORARIO";"JXXIII";"COORDENACAO DE DIAGNOSTICO POR IMAGEM";"MED";"MEDICO CARDIOLOGISTA";"III";"A";"27/01/2022";"2022/01/27 00:00:00";"2023/01/26 00:00:00"
14638845;4;"MARIA CRISTINA MACHADO";"03929128640";"05/02/1979";"CONTRATO TEMPORARIO";"MOV";"COORDENACAO DA UNIDADE DE NEONATOLOGIA";"PENF";"TECNICO DE ENFERMAGEM";"II";"A";"16/03/2021";"2021/03/16 00:00:00";"2023/03/15 00:00:00"
14638845;2;"MARIA CRISTINA MACHADO";"03929128640";"05/02/1979";"CONTRATO TEMPORARIO";"HIJPII";"COORDENACAO DAS UNIDADES DE INTERNACAO PEDIATRICA";"PENF";"TECNICO DE ENFERMAGEM";"II";"A";"03/07/2022";"2022/07/03 00:00:00";"2023/07/02 00:00:00"
15265655;1;"MARIA DA APARECIDA ANACLETO";"87033658672";"02/05/1967";"CONTRATO TEMPORARIO";"DPGF";"(DESAT.)COORDENACAO DE CONTABILIDADE GOVERNAMENTAL";"TOS";"AUXILIAR ADMINISTRATIVO";"I";"A";"01/07/2022";"2022/07/01 00:00:00";"2023/06/30 00:00:00"
13803556;2;"MARIA DA CONCEICAO APARECIDA PUREZA";"06210930689";"05/11/1981";"CONTRATO TEMPORARIO";"HGB-JA";"COORDENACAO DA UNIDADE DE URGENCIA E EMERGENCIA";"PENF";"TECNICO DE ENFERMAGEM";"II";"A";"23/10/2020";"2022/02/01 00:00:00";"2023/01/31 00:00:00"
13425095;2;"MARIA DA CONCEICAO VIEGAS";"45514097668";"05/12/1958";"CONTRATO TEMPORARIO";"CEPAI";"COORDENACAO DE INTERNACAO E AMBULATORIO";"AGAS";"ASSISTENTE SOCIAL";"I";"A";"10/02/2022";"2022/02/10 00:00:00";"2023/02/09 00:00:00"
10870277;4;"MARIA DA GLORIA GOMES ESTEVES";"43259391649";"06/04/1955";"CONTRATO TEMPORARIO";"HJK";"COORDENACAO DE INTERNACAO - ADULTO";"PENF";"TECNICO DE ENFERMAGEM";"II";"A";"06/02/2022";"2022/02/06 00:00:00";"2023/02/05 00:00:00"
14052906;2;"MARIA DA GLORIA VIDAL CASTRO";"51783428600";"18/04/1964";"CONTRATO TEMPORARIO";"HJK";"COORDENACAO DA MATERNIDADE";"PENF";"TECNICO DE ENFERMAGEM";"II";"A";"05/07/2022";"2022/07/05 00:00:00";"2023/07/04 00:00:00"
14334338;3;"MARIA DA PENHA BARCELOS NASCIMENTO";"88707946791";"18/04/1966";"CONTRATO TEMPORARIO";"JXXIII";"COORDENACAO DAS UNIDADES DE INTERNACAO PEDIATRICA";"AGAS";"PEDAGOGO";"I";"A";"08/02/2022";"2022/02/08 00:00:00";"2023/02/07 00:00:00"
15106800;1;"MARIA DAS GRACAS PACHECO";"46355707620";"08/02/1962";"CONTRATO TEMPORARIO";"HCM";"GERENCIA ADMINISTRATIVA";"TOS";"AUXILIAR ADMINISTRATIVO";"I";"A";"01/02/2022";"2022/02/10 00:00:00";"2023/02/09 00:00:00"
8763419;4;"MARIA DAS MERCES PEREIRA";"55672973604";"24/09/1965";"CONTRATO TEMPORARIO";"CEPAI";"COORDENACAO DE INTERNACAO E AMBULATORIO";"PENF";"ENFERMEIRO";"IV";"A";"01/02/2022";"2022/02/01 00:00:00";"2023/01/31 00:00:00"
14900740;2;"MARIA DAS NEVES CORREA PEREIRA";"55145701691";"29/11/1968";"CONTRATO TEMPORARIO";"JXXIII";"COORDENACAO DAS UNIDADES DE INTERNACAO CIRURGICA";"PENF";"ENFERMEIRO";"IV";"A";"02/02/2022";"2022/02/02 00:00:00";"2023/02/01 00:00:00"
14899926;5;"MARIA DE FATIMA ALVES VERTELO";"03027207660";"06/08/1970";"CONTRATO TEMPORARIO";"HJK";"COORDENACAO DE INTERNACAO - ADULTO";"PENF";"ENFERMEIRO";"IV";"A";"02/02/2022";"2022/02/02 00:00:00";"2023/02/01 00:00:00"
14899926;4;"MARIA DE FATIMA ALVES VERTELO";"03027207660";"06/08/1970";"CONTRATO TEMPORARIO";"HJK";"COORDENACAO MEDICA DA URGENCIA E EMERGENCIA";"PENF";"ENFERMEIRO";"IV";"A";"28/01/2022";"2022/01/28 00:00:00";"2023/01/27 00:00:00"
3495769;3;"MARIA DE FATIMA DIAS DE SOUSA BRITO";"60492066604";"24/03/1963";"CONTRATO TEMPORARIO";"MOV";"COORDENACAO DA UNIDADE AMBULATORIAL";"MED";"MEDICO OBSTETRA";"III";"A";"01/02/2022";"2022/02/01 00:00:00";"2023/01/31 00:00:00"
13805072;1;"MARIA DE FATIMA DO NASCIMENTO";"04361533601";"07/10/1978";"CONTRATO TEMPORARIO";"HGB-JA";"COORDENACAO DE SAUDE MENTAL";"PENF";"TECNICO DE ENFERMAGEM";"II";"A";"02/02/2022";"2022/02/02 00:00:00";"2023/02/01 00:00:00"
12814778;3;"MARIA DE FATIMA ROCHA TURCI REIS";"15662470634";"21/01/1957";"CONTRATO TEMPORARIO";"HIJPII";"COORDENACAO DO AMBULATORIO ADULTO";"TOS";"AUXILIAR ADMINISTRATIVO";"I";"A";"09/02/2022";"2022/02/09 00:00:00";"2023/02/08 00:00:00"
11574993;2;"MARIA DE FATIMA SILVA";"43725341672";"12/04/1963";"CONTRATO TEMPORARIO";"HRJP";"COORDENACAO DAS UNIDADES DE INTERNACAO";"PENF";"TECNICO DE ENFERMAGEM";"II";"A";"02/07/2022";"2022/07/02 00:00:00";"2023/07/01 00:00:00"
14274310;2;"MARIA DE FATIMA TEIXEIRA";"34857265168";"15/11/1965";"CONTRATO TEMPORARIO";"HRAD";"COORDENACAO DA UNIDADE CIRURGICA";"PENF";"TECNICO DE ENFERMAGEM";"II";"A";"0000-00-00";"2022/02/01 00:00:00";"2023/01/31 00:00:00"
14638654;4;"MARIA DE LOURDES DUARTE";"79513565653";NA;"CONTRATO TEMPORARIO";"HEM";NA;"PENF";"TECNICO DE ENFERMAGEM";"II";"A";NA;"2022/12/02 00:00:00";"2023/12/01 00:00:00"
14638654;3;"MARIA DE LOURDES DUARTE";"79513565653";"08/03/1967";"CONTRATO TEMPORARIO";"HEM";"COORDENACAO DAS UNIDADES DE INTERNACAO";"PENF";"TECNICO DE ENFERMAGEM";"II";"A";"25/04/2018";"2021/02/01 00:00:00";"2023/01/31 00:00:00"
94638654;4;"MARIA DE LOURDES DUARTE (QUATRO)";"79513565653";"08/03/1967";NA;"HEM";"COORDENACAO DAS UNIDADES DE INTERNACAO";NA;"TECNICO DE ENFERMAGEM";NA;NA;"05/12/2022";NA;NA
14593313;2;"MARIA DE LOURDES SOBRINHA";"36894060649";"22/08/1959";"CONTRATO TEMPORARIO";"MOV";"COORDENACAO DA UNIDADE CIRURGICA";"TOS";"AUXILIAR ADMINISTRATIVO";"I";"A";"04/07/2022";"2022/07/04 00:00:00";"2023/07/03 00:00:00"
12044962;2;"MARIA DO CARMO NOGUEIRA DE CASTRO";"03691547621";"01/10/1969";"CONTRATO TEMPORARIO";"HRJP";"COORDENACAO DAS UNIDADES CRITICAS";"MED";"MEDICO PEDIATRA";"III";"A";"06/05/2021";"2021/05/06 00:00:00";"2023/05/04 00:00:00"
14638852;1;"MARIA DO CARMO VIEIRA SENRA";"38145871620";"16/07/1960";"CONTRATO TEMPORARIO";"CSPD";"DIRETORIA GERAL";"TOS";"AUXILIAR ADMINISTRATIVO";"I";"A";"16/04/2018";"2022/02/01 00:00:00";"2023/01/31 00:00:00"
14882146;1;"MARIA EDUARDA CANCADO SCHUTTENBERG";"08674358608";NA;"CONTRATO TEMPORARIO";"MOV";NA;"MEDRE";"MEDICO";"I";"A";NA;"2020/03/01 00:00:00";"2023/02/28 00:00:00"
14638704;1;"MARIA EDUARDA COSTA";"11373354674";"29/07/1993";"CONTRATO TEMPORARIO";"HGB-JA";"COORDENACAO DE GESTAO DE PESSOAS";"TOS";"AUXILIAR ADMINISTRATIVO";"I";"A";"03/02/2022";"2022/02/03 00:00:00";"2023/02/02 00:00:00"
12122727;5;"MARIA EMILIA CARVALHO E CARVALHO";"05597624610";"15/09/1982";"CONTRATO TEMPORARIO";"HEM";"COORDENACAO DAS UNIDADES DE INTERNACAO";"MED";"MEDICO PROCTOLOGISTA";"III";"A";"08/11/2018";"2022/02/01 00:00:00";"2023/01/31 00:00:00"
12536215;2;"MARIA EMILIA PEREIRA LISBOA";"86413120649";"13/08/1972";"CONTRATO TEMPORARIO";"HIJPII";"COORDENACAO DA UNIDADE DE TERAPIA INTENSIVA ADULTO";"PENF";"TECNICO DE ENFERMAGEM";"II";"A";"03/02/2022";"2022/02/03 00:00:00";"2023/02/02 00:00:00"
12967931;4;"MARIA EVA SOUSA COSTA";"48549495620";"01/06/1962";"CONTRATO TEMPORARIO";"HJK";"COORDENACAO DE INTERNACAO - ADULTO";"PENF";"TECNICO DE ENFERMAGEM";"II";"A";"02/02/2022";"2022/02/02 00:00:00";"2023/02/01 00:00:00"
14459481;3;"MARIA HELENA PEREIRA DOS SANTOS";"01204875600";"15/07/1974";"CONTRATO TEMPORARIO";"JXXIII";"COORDENACAO DA UNIDADE DE TERAPIA INTENSIVA ADULTO";"PENF";"TECNICO DE ENFERMAGEM";"II";"A";"03/03/2022";"2022/03/03 00:00:00";"2023/03/02 00:00:00"
12663951;3;"MARIA HELENA RODRIGUES DE OLIVEIRA";"05176896699";"06/04/1976";"CONTRATO TEMPORARIO";"HRAD";"COORDENACAO DAS UNIDADES DE INTERNACAO";"PENF";"TECNICO DE ENFERMAGEM";"II";"A";"0000-00-00";"2022/02/02 00:00:00";"2023/02/01 00:00:00"
14802151;2;"MARIA HELOIZA GOMES PIMENTEL";"80864910649";"27/01/1964";"CONTRATO TEMPORARIO";"HEM";"COORDENACAO DE ASSISTENCIA FARMACEUTICA";"AGAS";"FARMACEUTICO";"I";"A";"17/07/2019";"2022/02/01 00:00:00";"2023/01/31 00:00:00"
14558324;2;"MARIA JOSE CLARO PAIVA";"57171190625";"08/03/1966";"CONTRATO TEMPORARIO";"CHPB";"COORDENACAO DE ENFERMAGEM E EQUIPE MULTIDISCIPLINAR";"AGAS";"PSICOLOGO";"I";"A";"01/05/2021";"2021/05/01 00:00:00";"2023/04/30 00:00:00"
14913073;1;"MARIA JOSE MARCIA CARNEIRO FERREIRA";"04910131671";"13/06/1979";"CONTRATO TEMPORARIO";"HGB-JA";"COORDENACAO DA UNIDADE DE CUIDADOS CONTINUADOS INTEGRADOS";"PENF";"TECNICO DE ENFERMAGEM";"II";"A";"02/02/2022";"2022/02/02 00:00:00";"2023/02/01 00:00:00"
13955042;2;"MARIA JOSETE DA COSTA FREITAS PAIXAO";"72451653353";"16/07/1976";"CONTRATO TEMPORARIO";"HIJPII";"COORDENACAO DE LABORATORIO E AGENCIA TRANSFUSIONAL";"AGAS";"FARMACEUTICO BIOQUIMICO";"I";"A";"01/06/2021";"2021/06/01 00:00:00";"2023/05/31 00:00:00"
12752168;2;"MARIA KARLA DE ARAUJO SILVA";"03343414697";"14/06/1977";"CONTRATO TEMPORARIO";"JXXIII";"COORDENACAO DA UNIDADE DE TERAPIA INTENSIVA ADULTO";"PENF";"TECNICO DE ENFERMAGEM";"II";"A";"01/02/2022";"2022/02/01 00:00:00";"2023/01/31 00:00:00"
14616312;3;"MARIA KAROLINE SOUZA CHAGAS";"11061761622";"03/10/1993";"CONTRATO TEMPORARIO";"HRAD";"COORDENACAO DA UNIDADE DE PACIENTES EXTERNOS";"MED";"MEDICO CIRURGIAO GERAL";"III";"A";"01/02/2022";"2022/02/05 00:00:00";"2023/02/04 00:00:00"
14616312;2;"MARIA KAROLINE SOUZA CHAGAS";"11061761622";"03/10/1993";"CONTRATO TEMPORARIO";"HRAD";"COORDENACAO DA UNIDADE DE PACIENTES EXTERNOS";"MED";"MEDICO CIRURGIAO GERAL";"III";"A";"0000-00-00";"2022/02/01 00:00:00";"2023/01/31 00:00:00"
14934350;1;"MARIA LAURA DE SOUSA CARDOSO";"12890428613";NA;"CONTRATO TEMPORARIO";"HJK";NA;"MEDRE";"MEDICO";"I";"A";NA;"2021/03/01 00:00:00";"2023/02/28 00:00:00"
15030943;2;"MARIA LAURA RIBEIRO MARTINS FURTADO";"13593373696";"11/10/1994";"CONTRATO TEMPORARIO";"HRAD";"COORDENACAO DAS UNIDADES DE INTERNACAO";"PENF";"TECNICO DE ENFERMAGEM";"II";"A";"0000-00-00";"2022/07/05 00:00:00";"2023/07/04 00:00:00"
13804414;3;"MARIA LENIR IZABEL DA SILVA";"04723601678";"12/06/1981";"CONTRATO TEMPORARIO";"HGB-JA";"COORDENACAO DA UNIDADE DE URGENCIA E EMERGENCIA";"PENF";"TECNICO DE ENFERMAGEM";"II";"A";"28/12/2021";"2021/12/28 00:00:00";"2023/06/30 00:00:00"
14045280;3;"MARIA LUCIA DE MIRANDA GUIMARAES";"23451823691";"07/07/1955";"CONTRATO TEMPORARIO";"HIJPII";"COORDENACAO DAS UNIDADES DE INTERNACAO ADULTO";"PENF";"TECNICO DE ENFERMAGEM";"II";"A";"02/02/2022";"2022/02/02 00:00:00";"2023/02/01 00:00:00"
14045280;2;"MARIA LUCIA DE MIRANDA GUIMARAES";"23451823691";"07/07/1955";"CONTRATO TEMPORARIO";"JXXIII";"COORDENACAO DO CENTRO DE TRATAMENTO DE QUEIMADOS";"PENF";"TECNICO DE ENFERMAGEM";"II";"A";"24/09/2022";"2022/09/24 00:00:00";"2023/09/23 00:00:00"
14499438;1;"MARIA LUCIA MARCELINO DA SILVA";"92723179672";"15/08/1968";"CONTRATO TEMPORARIO";"HRJP";"COORDENACAO DAS UNIDADES DE INTERNACAO";"PENF";"TECNICO DE ENFERMAGEM";"II";"A";"07/09/2022";"2022/09/07 00:00:00";"2023/03/05 00:00:00"
12999702;3;"MARIA LUCIA SOUZA OLIVEIRA";"94181195600";"25/06/1963";"CONTRATO TEMPORARIO";"IRS";"COORDENACAO TECNICA DE ENFERMAGEM";"PENF";"TECNICO DE ENFERMAGEM";"II";"A";"16/06/2022";"2022/06/16 00:00:00";"2023/06/15 00:00:00"
14917132;1;"MARIA LUIZA CUSTODIO SOARES";"07169276674";"23/10/1984";"CONTRATO TEMPORARIO";"HIJPII";"COORDENACAO DE URGENCIA E EMERGENCIA PEDIATRICA";"MED";"MEDICO ORTOPEDISTA E TRAUMATOLOGISTA";"III";"A";"13/04/2022";"2022/04/13 00:00:00";"2023/04/12 00:00:00"
14879282;1;"MARIA LUIZA SANTOS PACHECO";"10612993680";NA;"CONTRATO TEMPORARIO";"HEM";NA;"MEDRE";"MEDICO";"I";"A";NA;"2020/03/01 00:00:00";"2023/02/28 00:00:00"
10885390;4;"MARIA LUZIA MAIA";"67953425653";"26/06/1968";"CONTRATO TEMPORARIO";"HAC";"COORDENACAO MEDICA DA URGENCIA E EMERGENCIA";"MED";"MEDICO GENERALISTA";"I";"A";"08/07/2022";"2022/07/07 00:00:00";"2023/07/06 00:00:00"
11948882;4;"MARIA MADALENA DE OLIVEIRA";"26711198875";"10/01/1979";"CONTRATO TEMPORARIO";"HEM";"COORDENACAO DAS UNIDADES DE INTERNACAO";"PENF";"TECNICO DE ENFERMAGEM";"II";"A";"10/09/2022";"2022/09/10 00:00:00";"2023/09/09 00:00:00"
14514293;2;"MARIA MADALENA DOS SANTOS ANACLETO";"61432954687";"29/05/1965";"CONTRATO TEMPORARIO";"HJK";"COORDENACAO DO LABORATORIO";"TOS";"TECNICO EM PATOLOGIA CLINICA";"II";"A";"04/04/2022";"2022/04/04 00:00:00";"2023/04/03 00:00:00"
9135617;3;"MARIA MARCIA COUTO E SILVA";"24770310668";"11/01/1958";"CONTRATO TEMPORARIO";"CSSFE";"COORDENACAO DA UNIDADE DE PACIENTES EXTERNOS";"MED";"MEDICO DERMATOLOGISTA";"III";"A";"01/02/2022";"2022/02/01 00:00:00";"2023/01/31 00:00:00"
14614606;3;"MARIA MARLUCIA MARQUES DE LIMA";"72897104600";"15/03/1969";"CONTRATO TEMPORARIO";"JXXIII";"COORDENACAO DE URGENCIA E EMERGENCIA ADULTO";"PENF";"TECNICO DE ENFERMAGEM";"II";"A";"11/03/2022";"2022/03/11 00:00:00";"2023/03/10 00:00:00"
14874432;1;"MARIA MARTINS BARBOSA";"84169729668";"02/01/1971";"CONTRATO TEMPORARIO";"HJK";"COORDENACAO MEDICA DA URGENCIA E EMERGENCIA";"PENF";"TECNICO DE ENFERMAGEM";"II";"A";"06/07/2022";"2022/07/06 00:00:00";"2023/07/05 00:00:00"
15131154;1;"MARIA NATALINA GOMES SANTOS";"10635207621";NA;"CONTRATO TEMPORARIO";"JXXIII";NA;"PENF";"TECNICO DE ENFERMAGEM";"II";"A";NA;"2022/02/02 00:00:00";"2023/02/01 00:00:00"
14925549;1;"MARIA RITA ALVES BARBOSA DE PAIVA";"08460461645";NA;"CONTRATO TEMPORARIO";"MOV";NA;"MEDRE";"MEDICO";"I";"A";NA;"2021/03/01 00:00:00";"2023/02/28 00:00:00"
14638720;1;"MARIA THERESA DE MELO FRANCISCO";"07104531670";"21/03/1985";"CONTRATO TEMPORARIO";"AJUR";"(DESAT.)PROCURADORIA";"AGAS";"ADVOGADO";"I";"A";"10/05/2022";"2022/05/11 00:00:00";"2023/05/10 00:00:00"
14882328;1;"MARIA THEREZA MAGONLIM TEIXEIRA";"33854569831";NA;"CONTRATO TEMPORARIO";"HAC";NA;"MEDRE";"MEDICO";"I";"A";NA;"2020/03/01 00:00:00";"2023/02/28 00:00:00"
14928972;1;"MARIA VIRGINIA GOMES RIBEIRO";"01660524695";NA;"CONTRATO TEMPORARIO";"IRS";NA;"MEDRE";"MEDICO";"I";"A";NA;"2021/03/01 00:00:00";"2023/02/28 00:00:00"
15124712;1;"MARIANA ALCANTARA NASCIMENTO";"01865012696";NA;"CONTRATO TEMPORARIO";"HEM";NA;"MEDRE";"MEDICO";"I";"A";NA;"2022/03/01 00:00:00";"2023/02/28 00:00:00"
14887707;1;"MARIANA ALVARENGA SILVA";"11934544680";"20/11/1991";"CONTRATO TEMPORARIO";"HJK";"COORDENACAO DA EQUIPE MULTIDISCIPLINAR";"AGAS";"PSICOLOGO";"I";"A";"03/02/2022";"2022/02/03 00:00:00";"2023/02/02 00:00:00"
15123672;1;"MARIANA ALVES GOMES";"09994155652";NA;"CONTRATO TEMPORARIO";"MOV";NA;"MEDRE";"MEDICO";"I";"A";NA;"2022/03/01 00:00:00";"2023/02/28 00:00:00"
14691562;2;"MARIANA ANTUNES HENRIQUES";"08697066670";"03/02/1988";"CONTRATO TEMPORARIO";"CMT";"GERENCIA ASSISTENCIAL";"AGAS";"PSICOLOGO";"I";"A";"26/08/2021";"2021/08/26 00:00:00";"2023/06/30 00:00:00"
14934368;1;"MARIANA CAMPOS BELO MOREIRA";"11190189607";NA;"CONTRATO TEMPORARIO";"HJK";NA;"MEDRE";"MEDICO";"I";"A";NA;"2021/03/01 00:00:00";"2023/02/28 00:00:00"
14580583;1;"MARIANA CARDOSO LEAL";"10054290651";"17/11/1988";"CONTRATO TEMPORARIO";"MOV";"COORDENACAO DE INFRAESTRUTURA";"TOS";"AUXILIAR ADMINISTRATIVO";"I";"A";"23/02/2022";"2022/02/23 00:00:00";"2023/02/22 00:00:00"
14643969;1;"MARIANA CAROLINA VIEIRA PEREIRA";"09984955656";"03/08/1991";"CONTRATO TEMPORARIO";"MGT";"DIRETORIA GERAL";"MED";"MEDICO CIRURGIAO GERAL REGULADOR CNCDO";"III";"A";"13/04/2018";"2022/02/01 00:00:00";"2023/01/31 00:00:00"
